post_id,comment_id,post_title,post_selftext,post_author_flairs,comment_author_flairs,comment_body
15gi1h4,juj2u8o,anyone happy,fans perspective anyone happy cfb direction going general reading community would say one happy maybe im wrong could fans something ncaa power anymore politicians interested reelection power lies conferences beholden collective universities fans routinely cause change university level different measures end coaches ads getting fired know kumbaya pie sky feels like fans dont anything complicit death want cfb,"['kentucky', 'chaos']","['oregon', 'acadia']",friend said years ago wouldnt surprise goes path boxing money corruption health effects keeping new comers generally changing trends 30 years wont gone wont attraction currently im starting believe want best hate cost preservation coming
1781y0u,k4wtqr7,postgame washington defeats 3633,box score provided team 1 2 3 4 made rcfb,['rcfb'],"['oregon', 'acadia']",first time recall posting online within oh 8 days loss credit world washington penix heisman frontrunner hope hes well enough play stretch boy would like extra 56 points lefton end live aggression die aggression yes went 03 third two 2pt conversations always playing win mean something congrats huskies hope see vegas
16e3yqv,jztiluw,espn college gameday show,want little ting tang tang discuss post anything related show signs screencaps videos etc,['rcfb'],"['oregon', 'acadia']",oh man dreading first interception subpar bo puts season bodacious signs gonna come hometo roost
18v96sf,kfrezmt,im bit surprised subs response fsu optout situation team robbed chance win title burden continue entertaining system,awful know personally believe wins either way larger principle matters far tell bunch kids owe us additional entertainment physical sacrifice entire system told even perfection wasnt enough blows ass us love sport cannot fault kids cannot fault nil transfer portal fsus culture also wont compare years teams fewer optouts never situation like cfp era p5 team gone undefeated shafted weve heardargued month kids everything supposed cant pull rug surprised dont care,[],"['alabama', 'acadia']",teamlike going 50 yearsthere literally first every single year next year get first two loss team burden teammatesit wasnt dukes mayo bowl fucking orange bowl screw little bitches hope sees another ny6 sometime around 2035
17myplv,k7o543c,team watchcheer zero connection,dad tennessee alum thats obviously main team talking day mentioned surfs rice message boards fun kind surprising know rice message boards also watches service academies whenever served personally love kansas even leipold liked logo uniforms liked rooting underdog white helmet favorite,"['mississippistate', 'santamonica']","['oregon', 'acadia']",ive pulling james madison since made jump last year thats fun story follow besides ive maintained candles teams fun seasonsteams past auburn 2003 2004 teams yes spite history tech leachcrabtree teams wvu pate whitesteve slaton teams vatech fun run also night lane looks like much fun
16eospn,jzwqpbv,postgame defeats tech 3830,box score provided team 1 2 3 4 made rcfb,['rcfb'],"['oregon', 'acadia']",scared shit season certainly lived expectations
16aczkc,jz6wtdq,postgame duke defeats clemson 287,box score provided team 1 2 3 4 made rcfb,"['stanford', 'presscorps']","['oregon', 'acadia']",see 5 straight days piano fingerbanging sub
18alqyr,kc0a0z7,would take stop watchcaring college,something ive thinking years sport grew watching basically gone continuing evolve ways could seen detrimental im curious people considered breaking points isnt much oh team bad structure sport examples transfer portal currently functions means players like incoming could well gone time juniors leaving little get know player see grow element existed sport nil means players often go highest bidder things like tvd miami threatened transfer nil folks didnt give money know players paid behind scenes removes former appearance players chose school school like alumnus might arent students like p5 soon 4 probably making upwards 7 figures attend school continued consolidation conferences continues ruin regional rivalries create massive power brokers basically dictate sport everyone else yesterday surmise means everyone else basically fucked moving forward unless join one two conferences wonder college moves worse version nfl point think go far stop caringwatching point would happen bleed team colors always,['miami'],"['oregon', 'acadia']",odd one got invested college year years past special ducks season became things like added commercials realignment selection silliness definitely felt like blight otherwise deserving season many deserving teams top good teams kept winning top 10 teams playoff ranking arent materially different first week final week years trend watching team games im sure much limited time commitments opposed earlier life college remains fun dont know change coming years
