post_id,comment_id,post_title,post_selftext,post_author_flairs,comment_author_flairs,comment_body
18wbuu4,kfx75kz,sugar bowl washington 845,location caesars superdome time 845 watch tv espnlespn odds spread tex 35 overunder 625 rcfb made rcfb please keep trash talk civil report comments violate lets talk,['rcfb'],"['texas', 'amherst']",rb room insane last years
169aftq,jz0tgpz,florida lsu 730,florida lsuflsulsu location camping world time 730 watch tv abclabc odds spread lsu 25 overunder 580 rcfb made rcfb please keep trash talk civil report comments violate lets talk,['rcfb'],"['georgia', 'amherst']",theres reason put thick white line back end zone even refs confused sec
16a716p,jz69m8x,clemson duke 800,dukefdukeduke location dukefduke wallace wade time 800 watch tv espnlespn odds spread clem 13 overunder 555 rcfb made rcfb please keep trash talk civil report comments violate lets talk,"['stanford', 'presscorps']","['georgia', 'amherst']",think yes im watching swift commercial 1000th time think
166pzdt,jyloxlr,florida utah 800,utahfutahutah location utahfutah riceeccles time 800 watch tv espnlespn odds spread utah 65 overunder 455 rcfb made rcfb please keep trash talk civil report comments violate lets talk,"['medal', 'oklahomastate2']","['georgia', 'amherst']",gotta use extra time first clock stop feed us ads
166pzdt,jylrr3b,florida utah 800,utahfutahutah location utahfutah riceeccles time 800 watch tv espnlespn odds spread utah 65 overunder 455 rcfb made rcfb please keep trash talk civil report comments violate lets talk,"['medal', 'oklahomastate2']","['georgia', 'amherst']",tried justify head taking timeout id great half dont wanna give ball back something dumb
