post_id,comment_id,post_title,post_selftext,post_author_flairs,comment_author_flairs,comment_body
16ei5hq,jzvz7kr,700,location alabamafalabama bryantdenny time 700 watch tv espnlespn odds spread ala 7 overunder na rcfb made rcfb please keep trash talk civil report comments violate lets talk,['rcfb'],"['ohiostate2', 'battleofi75']",swear yall watch complain commercials
16q6omx,k1vns2s,florida clemson 1200,florida location clemsonfclemson memorial clemson sc time 1200 watch tv abclabc rcfb made rcfb please keep trash talk civil report comments violate lets talk,['rcfb'],"['ohiostate2', 'battleofi75']",second half lsu fsu show second half boston college fsu show
16lxpu3,k19kfvj,tank job week week 3,tank job week award fbs team best job humiliating weekend whether blew large lead choked away spot limelight lost absolutely right losing completely screwed everything last second blunder tjotw winner sets gold standard college misery previous winners 1 baylor bears lost 4231 2 nevada wolfpack lost idaho 336 last week ill honest thought going win going ton schadenfreudy posters ready kick didnt give guys enough credit yall went gave award group five team first time since started reddit houston got lot attention faceplant rice overwhelming number votes nevada absolute housing hands idaho say though funny see lot cant lose fcs team badly win posts given previous games like ignored especially hope colorado fans decency look slightly sheepish considering totally got away stealing nevadas coach getting blasted 31 sac last year fair week mtsu flattening miami mizzouauburn onto week ill confess im bummed florida colorado kansas wisconsin wake forest probably others put performances put line surefire nominations winners escaped weeks crop definitely solid including several teams escaped could much note ease counting please use carats vote like team thank thanks participating honorable mentions announcers rocky mountain showdown blatant homering buffs aside believe goes books worst end soundbytes since time alive nominees week 3 arizona sun devils lost fresno 290 dont get wrong fresnos good team id pick win mountain west right absolutely blanking anyone much less pac12 squad like lets honest bulldogs left ton points board sun devils never even close ended 250 yards eight turnovers thats right dreaded turnover spider returned boston college eagles lost florida 3129 gotta put eagles played hell took heavily favored seminoles even came back going 3116 eighteen penalties including awful facemask gave noles last first needed ice ripped flaming spear right chief osceolas hands promptly plunged foot cincinnati bearcats lost miamioh 3124 turning bad year big 12 teams dealing instate rivals lesser conferences cincy favored two touchdowns 127th playing victory bell rivalry despite outgaining redhawks nearly 200 yards bearcats playing behind entire caught tied even chance win regulation miami blocked goal miami got touchdown overtime cincy didnt redhawks snapped 16game losing streak rival colorado rams lost colorado 4335 like boston college gotta nominate csu absolutely played lives heavily favored colorado squad chance make statement win assert instate dominance rams completely bottled punting 4th two measley yards would iced away going soft prevent defense still giving 45 yard touchdown tie going two first overtime personal fouls penalties took rams right win column cowboys lost south 337 hell happened cowboys werent exactly dominant favorites heading nothing indicated going absolutely shredded jaguars usa roared 230 halftime lead nearly doubled osus yardage would shut single cowboy touchdown early fourth quarter south alabamas pulled upsets scares never dominant old dominion monarchs lost wake forest 2724 monarchs exploded second quarter going 170 half even 247 picksix third quarter buckled wake forest worked way back pulling within four early fourth quarter complete disaster 3rd 11 35 turned monster sack fumble set deacons 6 winning touchdown odu couldnt respond let deacs escape norfolk stanford cardinal lost sacramento 3023 boy must awkward troy taylor coach sac four seasons departing palo alto replace david shaw year fate dealt match old team third despite 143 lead early hornets gave cardinal could handle minute left hornets bomb one 49 yards make life bit miserable bay area tennessee volunteers lost florida 2916 tenth time row swamp claimed vols tennessee came ranked eleventh nearly touchdown favorite promptly went 267 half florida suffocated thirtyseven minutes possession two turnovers let vols get back least tennessee able save one last timeout could deck quarterback fourth five seconds left good job guys vanderbilt commodores lost unlv 4037 maybe home home rebels wasnt bestest idea unlv took first leg nashville way back 2019 3410 vandy looked well way revenge vegas saturday night going 170 early second quarter unlv rattled 30 consecutive points vandy come back tied 37 minute left unlv kinda sorta dropped 48 yard pass heads set winning goal ouch,"['washington', 'centralwashington']","['ohiostate2', 'battleofi75']",even close loved time alive call though
17deytd,k5x19c0,utah usc 800,utahfutahutah uscfuscusc location uscfusc los angeles memorial coliseum time 800 watch tv foxlfox rcfb made rcfb please keep trash talk civil report comments violate lets talk,['rcfb'],"['ohiostate2', 'battleofi75']",commentators acting like thinking going right crazy imply might enough possessions left stupid
189ycsz,kbw3gt9,thamel college playoff 1 2 washington 3 4 5 florida 6georgia,nan,"['texas', 'williammary']","['ohiostate3', 'battleofi75']",want fsu pull ucf 2017 hang banner make shirts everything buy fsu national championship merch wife child wear completely trash
189go15,kbr5hwa,800,iowafiowaiowa location lucas oil time 800 watch tv foxlfox odds spread mich 22 overunder 345 rcfb made rcfb please keep trash talk civil report comments violate lets talk,['rcfb'],"['ohiostate2', 'battleofi75']",undefeated fsu gets left good riddance stupid 4 team playoff bcs championship dont care anyone says 12 teams better means every undefeated team gets
183mtar,kaq180e,ohio 1200,ohio location time 1200 watch tv foxlfox rcfb made rcfb please keep trash talk civil report comments violate lets talk,['rcfb'],"['ohiostate3', 'battleofi75']",mccord either hero receive many death threats delete social media transfer terrible reality
183mtar,kaq1q8c,ohio 1200,ohio location time 1200 watch tv foxlfox rcfb made rcfb please keep trash talk civil report comments violate lets talk,['rcfb'],"['ohiostate3', 'battleofi75']",ive seen movie dont like
172p8o7,k3y0ow9,postgame tech defeats miami 2320,box score provided team 1 2 3 4 made rcfb,['rcfb'],"['ohiostate2', 'battleofi75']",funniest thing ive ever seen life
16rv5xx,k25d3tm,tank job week week four,tank job week award fbs team best job humiliating weekend whether blew large lead choked away spot limelight lost absolutely right losing completely screwed everything last second blunder tjotw winner sets gold standard college misery x200b previous winners 1 baylor bears lost 4231 2 nevada wolf pack lost idaho 336 3 cowboys lost south 337 x200b last week wasnt lopsided tjotw vote ever still pretty easy win inexplicable blowout south team got significant number votes cincy losing miamioh doesnt compare getting utterly flattened sun belt team oh well maybe particular sun belt team going win go 121 single week 1 loss tulane make new years six spoiler alert go 121 x200b onto week thing dont cosmic earthshattering level upset blown leads shocking turnof misfortunes defensive staffing issues huge games veritable feast nominees x200b note ease counting please use carats vote like team thank thanks participating x200b honorable mentions indiana needing four overtimes akron nebraska tied louisiana tech 77 entering fourth quarter jimbo fisher auburns best blocker scoop score denver broncos x200b nominees week 3 x200b appalachian mountaineers lost wyoming 2219 12 minutes go mountaineers picked andrew peasley pass returned touchdown go 197 cowboys instantly responded going 75 yards first play scrimmage thats fine said app proceeded go epic tenminute clock killing drive sputter kick goal go 8 wyoming blocked goal returned winning touchdown app one last chance already goal range got picked wyoming 6 eleven seconds go ice brutal crazy x200b clemson tigers lost florida 3124 oh tigers brought looooooooooowly scoop score finish blowing ten point lead check playing goal kicker drag back miss 29yard winner playcall 3rd 1 overtime hell way lose tigers x200b colorado buffaloes lost 426 okay maybe lot us saw coming dont think us thought colorados reality check going brutal one thing something like 5932 350 first half massacre plus holding buffs less 200 yards hype x200b hawkeyes lost penn 310 76 yards four turnovers 1433 possession nothing else need said x200b minnesota golden gophers lost northwestern 3734 3110 start fourth quarter team favored beat two touchdowns team whos claim worst power conference team heading virginia stanford exist northwestern rips 174 yards 21 straight points fourth quarter responded gophers fg firstplay touchdown overtime minnesota rowed boat right waterfall x200b nevada wolf pack lost 3524 pack something prove tjotwwinning domination idaho coming short plucky effort kansas came swinging san marcos seventeenpoint favored bobcats first half scored five times twenty minutes plunge unr 04 x200b notre dame fighting irish lost ohio 1714 didnt think id nominating irish instant classic saw notre dame rally ten ohio sneak across goal line literal last second take victory comes one biggest games year critical moment marcus freeman kindasorta forgot put eleventh defender two plays coaching staff fully aware x200b south jaguars lost central 3430 jaguars respond massive program elevating tjotwworthy win last week ripping early 140 lead chips cmu went 273 run south come back take lead fourth quarter central snapped final touchdown fourteen seconds left pull 17point upset,"['washington', 'centralwashington']","['ohiostate2', 'battleofi75']",minnesota right answer opinion coming rare pj fleck fan
183jc7m,kapmec2,espn college gameday show,want little ting tang tang discuss post anything related show signs screencaps videos etc,['rcfb'],"['ohiostate3', 'battleofi75']",regardless result today team wins loses im comforted know theres badass games tonight bet months rent
17d4h6j,k5v8lpf,penn ohio 1200,penn ohio location ohio statefohiostate ohio time 1200 watch tv foxlfox rcfb made rcfb please keep trash talk civil report comments violate lets talk,['rcfb'],"['ohiostate2', 'battleofi75']",bundle commercial hilarious goes wayyyy long
