post_id,comment_id,post_title,post_selftext,post_author_flairs,comment_author_flairs,comment_body
16ktcfe,k0y4yzu,postgame colorado defeats colorado 4335 2ot,box score provided team 1 2 3 4 ot colorado made rcfb,['rcfb'],"['lsu', 'belfast']",worst thing ever happened anyone ever
177ix9d,k4t8f3s,postgame stanford defeats colorado 4643 2ot,box score provided team 1 2 3 4 ot made rcfb,['rcfb'],"['lsu', 'belfast']",work 5 hours dad called woke thought gonna stupid meaningless bullshit like call ambulance im infarction thank goodness tell prime time choked goddamn love college ball
16l21qy,k0zxy75,deion sanders asked son shilo forced two turnovers moving kids rankings deion im one thats honest ranking kids guys act like love dont,,"['michigan', 'fau']","['lsu', 'belfast']",really dont understand many people like guy screams grifter
17yj88b,k9uf9bv,washington 730,location reser time 730 watch tv abclabc rcfb made rcfb please keep trash talk civil report comments violate lets talk,['rcfb'],"['washington', 'belfast']",damien martinez like beastmode derrick henry baby
17yj88b,k9ugol0,washington 730,location reser time 730 watch tv abclabc rcfb made rcfb please keep trash talk civil report comments violate lets talk,['rcfb'],"['washington', 'belfast']",wait went osu coulda swore saw uw guy smash head
