post_id,comment_id,post_title,post_selftext,post_author_flairs,comment_author_flairs,comment_body
17tqfr3,ka6121t,coaching carousel carousel opens first bloody sunday year,jimbo fisher 76 million richer andy avalos boise else next daily threads space speculate coach coach new coach might etc welcome back coaching carousel,['rcfb'],"['georgia', 'berry']",update fbs searches case anyone missed mississippi allegedly prioritizing jamey chadwell next head coach chadwell leading liberty perfect season long track record success financials bit difficult chadwell expected offered around 62million coach mississippi bulldogs owe liberty 4million theres arnett still owed 475million expensive business candidates contacted include jacksonville coach rich rodriguez unlv coach barry odom oc jeff lebby unsurprisingly boise seem looking kellen moore oc los angeles chargers moore deep ties program may issues timing wants finish nfl season candidates vetted include kellens brother kirby moore oc missouri former boise head coach bryan harsin though harsin currently paid auburn coach reportedly wants get back interviewed long list candidates according reports whittled four finalists get second round interviews mike elko hc duke jedd fisch hc arizona jason candle hc toledo jonathan smith hc however fisch denied ever interviewing first time yesterday interim head coach harlon barnett announced interviewed week appears lance leipold chris klieman rejected spartans hate negative program need dont good feeling search
18uiqbe,kfkubki,peach bowl penn ole miss 1200,penn ole missfolemissole miss location mercedesbenz time 1200 watch tv espnlespn espnlespn odds spread psu 45 overunder 515 rcfb made rcfb please keep trash talk civil report comments violate lets talk,['rcfb'],"['olemiss2', 'berry']",fucking joke blow two plays row like
18uiqbe,kflo4qv,peach bowl penn ole miss 1200,penn ole missfolemissole miss location mercedesbenz time 1200 watch tv espnlespn espnlespn odds spread psu 45 overunder 515 rcfb made rcfb please keep trash talk civil report comments violate lets talk,['rcfb'],"['olemiss2', 'berry']",franklin trying damnedest put allar back overthrow receivers
15u6nal,jwp04y5,nothing say would ever change opinion cfb opinion,opinion ironclad immovable collaboration worlds top minds say otherwise couldnt get move opinion god could appear irrefutable evidence stating otherwise still wouldnt change opinion,['georgia'],"['texas', 'berry']",would beat breaks bama colt got hurt
17nng9r,k7t6cy8,ole miss 1200,amftexasamtexas ole missfolemissole miss location ole missfolemiss vaughthemingway time 1200 watch tv espnlespn rcfb made rcfb please keep trash talk civil report comments violate lets talk,['rcfb'],"['olemiss2', 'berry']",love beef tbh makes cfb fun
17nng9r,k7t6ith,ole miss 1200,amftexasamtexas ole missfolemissole miss location ole missfolemiss vaughthemingway time 1200 watch tv espnlespn rcfb made rcfb please keep trash talk civil report comments violate lets talk,['rcfb'],"['olemiss2', 'berry']",dont breaker play well unit kinda reminds 2014 ole miss defense
17nng9r,k7t72s8,ole miss 1200,amftexasamtexas ole missfolemissole miss location ole missfolemiss vaughthemingway time 1200 watch tv espnlespn rcfb made rcfb please keep trash talk civil report comments violate lets talk,['rcfb'],"['olemiss2', 'berry']",damn good run bentley get hit tricky tack holding call
17nng9r,k7t7e04,ole miss 1200,amftexasamtexas ole missfolemissole miss location ole missfolemiss vaughthemingway time 1200 watch tv espnlespn rcfb made rcfb please keep trash talk civil report comments violate lets talk,['rcfb'],"['olemiss2', 'berry']",docile offense would loud
17nng9r,k7tjrpe,ole miss 1200,amftexasamtexas ole missfolemissole miss location ole missfolemiss vaughthemingway time 1200 watch tv espnlespn rcfb made rcfb please keep trash talk civil report comments violate lets talk,['rcfb'],"['olemiss2', 'berry']",even criticize pete golding great hire us
168dp3a,jyvatum,ut martin 600,ut martin location georgiafgeorgia sanford time 600 watch tv espnlespn sec networklsecn rcfb made rcfb please keep trash talk civil report comments violate lets talk,"['georgia2', 'sickos']","['georgia', 'berry']",feels like bobo picking plays ncaa 14 days threatening offense
168dp3a,jyvk7zn,ut martin 600,ut martin location georgiafgeorgia sanford time 600 watch tv espnlespn sec networklsecn rcfb made rcfb please keep trash talk civil report comments violate lets talk,"['georgia2', 'sickos']","['georgia', 'berry']",think bobo condition call run inside every 6 plays stops breathing
18taa8w,kfdc26k,alamo bowl arizona 915,location alamodome time 915 watch tv espnlespn espnlespn odds spread ariz 25 overunder 595 rcfb made rcfb please keep trash talk civil report comments violate lets talk,['rcfb'],"['olemiss2', 'berry']",gotta say watching physical team rileymike stoops years kinda nice
16we4hf,k2xclzh,auburn 330,location auburnfauburn jordanhare time 330 watch tv cbslcbs rcfb made rcfb please keep trash talk civil report comments violate lets talk,['rcfb'],"['georgia', 'berry']",receivers made difference today qbs target today receivers able make adjustments catch offtarget balls auburns didnt pick wasnt thorne decent throw circumstances receiver couldnt make grab
165rm7h,jyhh6do,honest still mentally team,go 2019 fiesta bowl clemson top controversial targeting fumble call wont even go one dagger probably took 10 years life arguably best osu team talent wise ive seen lifetime even make championship make argument 2015 team well dont know could beat insane lsu team hoping would play season barely came short however definitely made mistakes well shout trevor lawrence insane 67 yard run td,['ohiostate3'],"['texas', 'berry']",09 one biggest ifs fans recent memory
189brft,kbqpxcu,400,location mercedesbenz time 400 watch tv cbslcbs odds spread uga 5 overunder 555 rcfb made rcfb please keep trash talk civil report comments violate lets talk,['rcfb'],"['olemiss2', 'berry']",theres something sexy defense blowing play edge like
189brft,kbqt8ty,400,location mercedesbenz time 400 watch tv cbslcbs odds spread uga 5 overunder 555 rcfb made rcfb please keep trash talk civil report comments violate lets talk,['rcfb'],"['olemiss2', 'berry']",doesnt top jersey count pull like
189brft,kbqx2to,400,location mercedesbenz time 400 watch tv cbslcbs odds spread uga 5 overunder 555 rcfb made rcfb please keep trash talk civil report comments violate lets talk,['rcfb'],"['olemiss2', 'berry']",insane much talent two teams make seem like nfl opposed usual college
17ijw7o,k6vevpd,florida 330,location everbank time 330 watch tv cbslcbs rcfb made rcfb please keep trash talk civil report comments violate lets talk,['rcfb'],"['olemiss2', 'berry']",florida wasted almost 2 quarters running screens mertz throw
166pzdt,jylpceh,florida utah 800,utahfutahutah location utahfutah riceeccles time 800 watch tv espnlespn odds spread utah 65 overunder 455 rcfb made rcfb please keep trash talk civil report comments violate lets talk,"['medal', 'oklahomastate2']","['florida3', 'berry']",havent paid attention season hoping didnt put together entire offense around etn
172jjnd,k3x0l1z,postgame defeats 2620,box score provided team 1 2 3 4 made rcfb,['rcfb'],"['georgia', 'berry']",theres bad refereeing today ref blocking tamu making wideopen open catch early 4th absolutely brutal
1840t56,kauyuqn,coaching carousel ii get holiday shopping,coach want christmas boys girls coaching market open daily threads space speculate coach coach new coach might etc welcome back coaching carousel,['rcfb'],"['georgia', 'berry']",jonathan smiths staff look like smiths main connections chris petersen coaching tree may also see ties dennis erickson mike riley also likes recruiting coaching talent northwest well staff candidates respective positions ocqb brian lindgren favorite oc also contender head coach beavers dclb trent bray could dc head coach db blue adams st jake cookus wrpgc kefense hynson cb anthony perkins dl legi suiaunoa terc brian wozniak contenders respective positions edit wozniak already announced ahcrb keith bhonapha smith three different schools ahcolrgc jim michalczik coached smith player playcallers pete kwiatkowski dcolb apparently hearing offers solo coordinator gig jimmy lake ahc los angeles rams peter sirmon dc cal could also dc former mississippi head coach zach arnett former boise head coach andy avalos could also possible dc offense kirby moore ocqb missouri heavy contender oc lindgren doesnt follow smith paul chryst sp asst smiths old playcaller could occupy role offense shannon dawson ocqb miami junior adams coocwr could another oc contender offense smiths advisor jon boyer osu alum ryan gunderson qb ucla could qb coach aj steward ahcrb baylor aristotle thompson rb cal james montgomery rbrc boise could candidates rb coach matt lubick analyst kansas joel filani wr washington eric kiesau analyst florida tyler osborne wrasst qb stanford could coach wrs scott huff ol washington mike bloesch olrgc cal robert kugler asst ol carolina panthers may attainable ol coach jordan paopao stte arizona derham cato te washington nate potter tergc boise marques tuiasosopo ocqb rice could te coach bush hamdan ocqb boise luke schleusner ocqb idaho could coach offense defense brandon huppert qc andrew browning dl cal ikaika malloe dl ucla could coach line rob aurich dclb idaho zac alley dc jacksonville brandon moore hc san diego could possibility linebackers greg burns analyst ucla could return db coach terrence brown db cal demetrice martin cbpgc tre watson db cal harris asst db los angeles chargers gerald alexander asst db pittsburgh steelers could also options bob gregory sts stanford kane ioane codcs boise keith hayward qc las vegas raiders could coach variety positions defense michael frisina qc jamie christian strb new mexico could st coach outside options assistants include jeff choate codcilb nick charlton ocqb uconn brent pease ahcwr montana winston delattiboudere iii dl minnesota cody von appen codcs cal poly nick alaimalo iwr idaho pat mccann oc fresno kendrick van ackeren dcdb arkansas tech david lose dl idaho michael pitre rb atlanta falcons marcel yates dbpgc tech robin pflugrad ahcte northern arizona robb akey dc central tim rattay qb lou spanos analyst ole miss brett maxie db houston gamblers donte williams db usc joe salavea ahcdlrgc miami tim deruyter dc tech nick edwards wr washington darian thompson asst lb dallas cowboys julius brown cb washington jeff schmedding dc washington jimmy brumbaugh dl coastal carolina nick toth air force mike johnson wr syracuse siriki diabate lb uconn saga tuitele olrgc arizona kevin mcgiven ocqb san jose lee hill hc delaware analysts qc coaches could include torrey gill ga avery roberts ga brian michalowski analyst jeff smart analyst purdue austin brown oc southern henry fernandez analyst taylor richards db valdosta james rodgers wr new jersey generals daniel segal analyst ucla jody owens ihcdc st augustines jeff crosby analyst aric williams dc montana tech mark criner olb southern miss eric yarber wr los angeles rams noel mazzone oc pittsburgh maulers danny langsdorf ocqb temple rod chance david gilbertson wrcopgc akron marcus arroyo support staff candidates include mike mcdonald sc marco candido asst sc dustyn baethke asst sc bryan klobucar sc colgate tim socha sc old dominion olympic sports mason baggett sc nevada shaud williams asst sc dan van de riet chief staff darrick yray gm florida joshua taufalele asst dir grad recruitment boise mike mchugh chief staff fresno marshall malchow chief staff brittney johnson ops ben thienes ops san jose cole moore dpp taylor tharp dpp boise michael doctor dir recruiting austin darmond asst dir recruiting lou major external relations boise
1840t56,kav2krf,coaching carousel ii get holiday shopping,coach want christmas boys girls coaching market open daily threads space speculate coach coach new coach might etc welcome back coaching carousel,['rcfb'],"['georgia', 'berry']",tim brewster resigning colorado veteran assistant recruiter tight ends coach
1840t56,kavhg28,coaching carousel ii get holiday shopping,coach want christmas boys girls coaching market open daily threads space speculate coach coach new coach might etc welcome back coaching carousel,['rcfb'],"['georgia', 'berry']",staff changes jonathan smith already brought lot staff east lansing oc brian lindgren rb keith bhonapha ol jim michalczik te brian wozniak db blue adams dpp cole moore likely occupy roles spartans interim head coach harlon barnett retained likely safeties coach dc trent bray also courted smith hes also contention replace smith corvallis pitt oc frank cignetti jr fired two seasons hall announced return fourth season southern miss staff overhauled dc dan obrien dl brandon lacy te cayden cochran let go season charles huff marshall also overhauling staff oc clint trickett wrpgc jovon bouknight ol bill legg lb shannon morrison fired
168z6rx,jyz8xa7,complain team,vent friendly place,['rcfb'],"['georgia', 'berry']",think mike bobo believes keeping great ones asleep calling inside run every six plays beck still looks like needs work little concerned run offense transported back 2010 means defense going even
17vtjqa,k9cx1mu,players team year believe would belong schools alltime roster,something think going every season player good could one best school history south carolina year dont believe though many fans willwould say rattler talented qb weve ever hes still ways accomplishing achieving connor shaw wr xavier legette talented enough already put top 5 receiving season career compared great wrs lacking instance though brock bowers may te1 alltime roster,"['southcarolina', 'sec']","['olemiss2', 'berry']",judkins definitely one best best running back ever
17nk56m,k7sen2n,espn college gameday show,want little ting tang tang discuss post anything related show signs screencaps videos etc,['rcfb'],"['olemiss2', 'berry']",dabo great teams year regressed since covid without generational qbs deserves criticism
17nk56m,k7sf7zp,espn college gameday show,want little ting tang tang discuss post anything related show signs screencaps videos etc,['rcfb'],"['olemiss2', 'berry']",baldie fucking crack dont fix broken offense week 10
17nk56m,k7sr2sb,espn college gameday show,want little ting tang tang discuss post anything related show signs screencaps videos etc,['rcfb'],"['olemiss2', 'berry']",honesty one best single season turnarounds ive seen past years
18alqyr,kbza3to,would take stop watchcaring college,something ive thinking years sport grew watching basically gone continuing evolve ways could seen detrimental im curious people considered breaking points isnt much oh team bad structure sport examples transfer portal currently functions means players like incoming could well gone time juniors leaving little get know player see grow element existed sport nil means players often go highest bidder things like tvd miami threatened transfer nil folks didnt give money know players paid behind scenes removes former appearance players chose school school like alumnus might arent students like p5 soon 4 probably making upwards 7 figures attend school continued consolidation conferences continues ruin regional rivalries create massive power brokers basically dictate sport everyone else yesterday surmise means everyone else basically fucked moving forward unless join one two conferences wonder college moves worse version nfl point think go far stop caringwatching point would happen bleed team colors always,['miami'],"['olemiss2', 'berry']",whats ruining sport thought everyone deserves equal shot winning national championship talking fsu robbed thought team isnt elite powerhouse would bother watching cancerous sport since playoff never equal playing thats bad thing makes sport unique think expect ole miss compete national title college community spends long blaming espn constant coverage cfp turn around thing think care ohio title 2014 didnt even get playoffs dont year still amazing memorable even heartbreaks 130 teams fbs think many able compete title cares love college way biggest issue reactionaries ones see trend dont like immediately cry whole system ripped apart
