post_id,comment_id,post_title,post_selftext,post_author_flairs,comment_author_flairs,comment_body
177vtvk,k4vu4bj,illinois maryland 330,location secu time 330 watch tv nbclnbc odds spread md 14 overunder 510 rcfb made rcfb please keep trash talk civil report comments violate lets talk,['rcfb'],"['maryland', 'butler']",im asking start 14 points
16ecyt5,jzv0bst,330,iowafiowaiowa location statefiowastate jack trice time 330 watch tv foxlfox rcfb made rcfb please keep trash talk civil report comments violate lets talk,['rcfb'],"['maryland', 'butler']",less contact last play utahbaylor lmao
166pzdt,jyllryx,florida utah 800,utahfutahutah location utahfutah riceeccles time 800 watch tv espnlespn odds spread utah 65 overunder 455 rcfb made rcfb please keep trash talk civil report comments violate lets talk,"['medal', 'oklahomastate2']","['notredame', 'butler']",tulsa 70 arkansaspine bluff end q1 lol
166pzdt,jym1yvd,florida utah 800,utahfutahutah location utahfutah riceeccles time 800 watch tv espnlespn odds spread utah 65 overunder 455 rcfb made rcfb please keep trash talk civil report comments violate lets talk,"['medal', 'oklahomastate2']","['notredame', 'butler']",mertz really hasnt horrible hasnt really impacted meaningful way either
166pzdt,jym3t8b,florida utah 800,utahfutahutah location utahfutah riceeccles time 800 watch tv espnlespn odds spread utah 65 overunder 455 rcfb made rcfb please keep trash talk civil report comments violate lets talk,"['medal', 'oklahomastate2']","['notredame', 'butler']",big brain billy going 2 turn 2score deficit 2score deficit
16e7v1g,jzu9a6r,nebraska colorado 1200,location folsom time 1200 watch tv foxlfox odds spread neb 95 overunder na rcfb made rcfb please keep trash talk civil report comments violate lets talk,"['nebraska2', 'santamonica']","['notredame', 'butler']",sims fucking clown never get stink geoff collins
18brobp,kc6fg6e,dodd college playoff selection committee member tells cbs sports florida could win national championship current thats seminoles didnt deserve person said,nan,['texasam'],"['notredame', 'butler']",could fucking know whos say jared verse doesnt make life hell jj mccarthy
189go22,kbryvk8,florida louisville 800,florida location bank america time 800 watch tv abclabc odds spread fsu 15 overunder 465 rcfb made rcfb please keep trash talk civil report comments violate lets talk,['rcfb'],"['notredame', 'butler']",1 2 washington 3 fsutexas 4 fsutexas bama fans noflair casuals malding seething
167kgks,jyqre2k,central 700,central location spartan time 700 watch tv fox sports 1lfs1 odds spread msu 145 overunder 475 rcfb made rcfb please keep trash talk civil report comments violate lets talk,"['umass', 'michiganstate']","['michigan', 'butler']",b1g really going fun year isnt
167kgks,jyqxel8,central 700,central location spartan time 700 watch tv fox sports 1lfs1 odds spread msu 145 overunder 475 rcfb made rcfb please keep trash talk civil report comments violate lets talk,"['umass', 'michiganstate']","['notredame', 'butler']",get brando plays like jayden daniels shut fuck
167kgks,jyr260r,central 700,central location spartan time 700 watch tv fox sports 1lfs1 odds spread msu 145 overunder 475 rcfb made rcfb please keep trash talk civil report comments violate lets talk,"['umass', 'michiganstate']","['notredame', 'butler']",still end covering despite looking like shit first 3 qtrs
16f704d,k009tnx,ap poll september 10 2023,nan,"['syracuse', 'wakeforest']","['notredame', 'butler']",g5 teams 1 even receiving 2 votes
15oro41,jvvd6rk,kinda feel like last season college anyone else,like year implosion pac expanded playoff feel anyone else like sport 2024 gonna completely foreign like im still gonna watch completely different product,"['hateful8', 'utahstate']","['notredame', 'butler']",long g5 team access playoff stops im done
1728eb3,k3w7tzh,1200,location cotton bowl time 1200 watch tv abclabc rcfb made rcfb please keep trash talk civil report comments violate lets talk,['rcfb'],"['notredame', 'butler']",wow dumb fuck sark use
17yelmp,k9tnp3g,new mexico auburn 400,new mexico mexico location auburnfauburn jordanhare time 400 watch tv sec networklsecn rcfb made rcfb please keep trash talk civil report comments violate lets talk,['rcfb'],"['notredame', 'butler']",would much darker auburn 55 right
