post_id,comment_id,post_title,post_selftext,post_author_flairs,comment_author_flairs,comment_body
16ei5hq,jzvyii4,700,location alabamafalabama bryantdenny time 700 watch tv espnlespn odds spread ala 7 overunder na rcfb made rcfb please keep trash talk civil report comments violate lets talk,['rcfb'],"['notredame', 'butler']",really mean anything beats bama know theyll turn around inexplicably lay turd baylor couple weeks
16ei5hq,jzw2sm2,700,location alabamafalabama bryantdenny time 700 watch tv espnlespn odds spread ala 7 overunder na rcfb made rcfb please keep trash talk civil report comments violate lets talk,['rcfb'],"['notredame', 'butler']",feels like bamas streak 10 regular season wins real trouble
16ei5hq,jzw9mcz,700,location alabamafalabama bryantdenny time 700 watch tv espnlespn odds spread ala 7 overunder na rcfb made rcfb please keep trash talk civil report comments violate lets talk,['rcfb'],"['notredame', 'butler']",would slaughter bama even hint competence qb like even jacob coker level
16ei5hq,jzwb7q7,700,location alabamafalabama bryantdenny time 700 watch tv espnlespn odds spread ala 7 overunder na rcfb made rcfb please keep trash talk civil report comments violate lets talk,['rcfb'],"['notredame', 'butler']",holy fuck buchner isnt great hes better milroes shown tonight
16ei5hq,jzwe7nm,700,location alabamafalabama bryantdenny time 700 watch tv espnlespn odds spread ala 7 overunder na rcfb made rcfb please keep trash talk civil report comments violate lets talk,['rcfb'],"['notredame', 'butler']",ordinarily would obviously root bama knows much time left saban kinda want win one national title
16ei5hq,jzwjc1z,700,location alabamafalabama bryantdenny time 700 watch tv espnlespn odds spread ala 7 overunder na rcfb made rcfb please keep trash talk civil report comments violate lets talk,['rcfb'],"['notredame', 'butler']",sark becomes third different former saban assistant beat kirby jimbo
16ei5hq,jzwk9q6,700,location alabamafalabama bryantdenny time 700 watch tv espnlespn odds spread ala 7 overunder na rcfb made rcfb please keep trash talk civil report comments violate lets talk,['rcfb'],"['notredame', 'butler']",going laugh ass loses baylor couple weeks
18wbuu4,kfx7asy,sugar bowl washington 845,location caesars superdome time 845 watch tv espnlespn odds spread tex 35 overunder 625 rcfb made rcfb please keep trash talk civil report comments violate lets talk,['rcfb'],"['notredame', 'butler']",itll interesting see deboer fares future without penix chris petersen jimmy lake
18wbuu4,kfx8aos,sugar bowl washington 845,location caesars superdome time 845 watch tv espnlespn odds spread tex 35 overunder 625 rcfb made rcfb please keep trash talk civil report comments violate lets talk,['rcfb'],"['maryland', 'butler']",anyone else seeing kinda black particle floating front camera sometimes
16ecz62,jzuxu5z,unlv 330,unlvfunlvunlv location time 330 watch tv cbslcbs rcfb made rcfb please keep trash talk civil report comments violate lets talk,"['michigan2', 'cfp']","['michigan', 'butler']",starting wr caught pass opening series
183rfxa,karfjq0,auburn 330,location auburnfauburn jordanhare time 330 watch tv cbslcbs odds spread ala 105 overunder na rcfb made rcfb please keep trash talk civil report comments violate lets talk,['rcfb'],"['notredame', 'butler']",jordanhare chaos meter fully recharged new mexico st
17deytd,k5wig3f,utah usc 800,utahfutahutah uscfuscusc location uscfusc los angeles memorial coliseum time 800 watch tv foxlfox rcfb made rcfb please keep trash talk civil report comments violate lets talk,['rcfb'],"['notredame', 'butler']",damn shame probably last time usc utah play becoming really fun rivalry
17d9q9a,k5wbs5k,houston 400,location houstonfhouston tdecu time 400 watch tv foxlfox rcfb made rcfb please keep trash talk civil report comments violate lets talk,['rcfb'],"['kentucky', 'butler']",fourth inches roll pass shotgun
18uo86j,kfm47tw,orange bowl florida 400,florida location hard rock time 400 watch tv espnlespn espnlespn odds spread uga 20 overunder 455 rcfb made rcfb please keep trash talk civil report comments violate lets talk,['rcfb'],"['notredame', 'butler']",ny6 games 4 quarterfinals 2 semifinals next year
18uo86j,kfm8swo,orange bowl florida 400,florida location hard rock time 400 watch tv espnlespn espnlespn odds spread uga 20 overunder 455 rcfb made rcfb please keep trash talk civil report comments violate lets talk,['rcfb'],"['notredame', 'butler']",reminds mel tugger getting obliterated ohio kenneth walker season
17nng69,k7tx8w5,kansas 1200,kansas location texasftexas dkrtexas memorial time 1200 watch tv foxlfox odds spread tex 4 overunder 505 rcfb made rcfb please keep trash talk civil report comments violate lets talk,['rcfb'],"['notredame', 'butler']",ole miss beats theyre 81 go next week
17iov6h,k6w62gv,ohio wisconsin 730,ohio location camp randall time 730 watch tv nbclnbc rcfb made rcfb please keep trash talk civil report comments violate lets talk,['rcfb'],"['notredame', 'butler']",49 tickets dont think even know 49 people even half
17iov6h,k6w7cl8,ohio wisconsin 730,ohio location camp randall time 730 watch tv nbclnbc rcfb made rcfb please keep trash talk civil report comments violate lets talk,['rcfb'],"['notredame', 'butler']",wisconsin loses 4way tie atop west minnesota nebraska northwestern one back shitshow
17iov6h,k6wicpu,ohio wisconsin 730,ohio location camp randall time 730 watch tv nbclnbc rcfb made rcfb please keep trash talk civil report comments violate lets talk,['rcfb'],"['notredame', 'butler']",tristan gebbia age older 17 starting nfl qbs
17iov6h,k6wlvit,ohio wisconsin 730,ohio location camp randall time 730 watch tv nbclnbc rcfb made rcfb please keep trash talk civil report comments violate lets talk,['rcfb'],"['notredame', 'butler']",would go watch end idk stand listening tim brando long
15g88fl,juhk7a8,happens big brand schools start suck,power 2 great happens schools used winningare longer winning everyone cant winner zero sum every winner therr id loser usc ou struggle new conferences decision move going look incredibly short sighted cares admin making money get 5th practice youre losing maryland road trip side country happens 75 program slugging minnesota front 40k apathetic fans dont care happens youve sec 5 years even come close winning conference even expanded playoff going less conference championships less meaningful bowl games degrade fan enthusiasm sports ironically lead less money long term interesting see plays,['washington'],"['michigan', 'butler']",competition bad certainly interesting take x200b fact teams might worse records better teams new conference added resources fans would rather watch 93 usc team competent expanded playoff 111 usc gets embarrassed anytime play sec b1g people dont take pac12 seriously imagine even larger talentresources gap know personally miss good ole days college direction sport going fine
189wh00,kbu2qx8,cfp rankings final,tv espnlespn follow along selection show full results come two threads posted results serious discussion jokes memes offtopic comments removed rankteamrecord 1 2 3 4 5 6 7 8 9 10 11 12 13 14 15 16 17 18 19 20 21 22 23 24 25,['rcfb'],"['notredame', 'butler']",using eye test instead resume even bother playing games give playoff spots ap preseason top 4
189wh00,kbus4pi,cfp rankings final,tv espnlespn follow along selection show full results come two threads posted results serious discussion jokes memes offtopic comments removed rankteamrecord 1 2 3 4 5 6 7 8 9 10 11 12 13 14 15 16 17 18 19 20 21 22 23 24 25,['rcfb'],"['notredame', 'butler']",fucking wild zombified version worst g5 conference gets ny6 bid lol
189wh00,kbusrvr,cfp rankings final,tv espnlespn follow along selection show full results come two threads posted results serious discussion jokes memes offtopic comments removed rankteamrecord 1 2 3 4 5 6 7 8 9 10 11 12 13 14 15 16 17 18 19 20 21 22 23 24 25,['rcfb'],"['notredame', 'butler']",liberty continued win lmfaooooooo hmm else continued win
18w6kt1,kfw53fi,rose bowl 500,location rose bowl time 500 watch tv espnlespn odds spread mich 2 overunder 455 rcfb made rcfb please keep trash talk civil report comments violate lets talk,['rcfb'],"['maryland', 'butler']",michigans defense part team showed
18w6kt1,kfwinhr,rose bowl 500,location rose bowl time 500 watch tv espnlespn odds spread mich 2 overunder 455 rcfb made rcfb please keep trash talk civil report comments violate lets talk,['rcfb'],"['maryland', 'butler']",nice see marching bands tv change makes happy band alum
183w2c9,kashr58,florida florida 700,florida location floridafflorida ben hill griffin time 700 watch tv espnlespn rcfb made rcfb please keep trash talk civil report comments violate lets talk,['rcfb'],"['notredame', 'butler']",imagine hadnt lost would still chance undefeated p5 left playoff
1621ag8,jxvfrbl,notre dame navy 230,notre dame navyfnavynavy location aviva time 230 watch tv nbclnbc odds spread nd 205 overunder 490 rcfb made rcfb please keep trash talk civil report comments violate lets talk,['usc'],"['notredame', 'butler']",damn really thought bob barker gonna make 100
16qmmcf,k1xz8wt,postgame ohio defeats notre dame 1714,box score provided team 1 2 3 4 ohio notre made rcfb,['rcfb'],"['michigan', 'butler']",alright ill bite lou holtz say get ryan day worked
17ifk69,k6v8aob,kansas 1200,location kansasfkansas david booth kansas memorial time 1200 watch tv foxlfox rcfb made rcfb please keep trash talk civil report comments violate lets talk,['rcfb'],"['notredame', 'butler']",fuck let score youre obvious going end
17ifk69,k6v8xtd,kansas 1200,location kansasfkansas david booth kansas memorial time 1200 watch tv foxlfox rcfb made rcfb please keep trash talk civil report comments violate lets talk,['rcfb'],"['notredame', 'butler']",whats sooner flairs bitching venables would rather riley grinch back yeah didnt think
17ifk69,k6v9ckd,kansas 1200,location kansasfkansas david booth kansas memorial time 1200 watch tv foxlfox rcfb made rcfb please keep trash talk civil report comments violate lets talk,['rcfb'],"['notredame', 'butler']",last chance ever undefeated p5 able play national title slipping away
169aftq,jz19ckx,florida lsu 730,florida lsuflsulsu location camping world time 730 watch tv abclabc odds spread lsu 25 overunder 580 rcfb made rcfb please keep trash talk civil report comments violate lets talk,['rcfb'],"['notredame', 'butler']",golden bachelor would lot entertaining women gold diggers 20s
169aftq,jz1da06,florida lsu 730,florida lsuflsulsu location camping world time 730 watch tv abclabc odds spread lsu 25 overunder 580 rcfb made rcfb please keep trash talk civil report comments violate lets talk,['rcfb'],"['notredame', 'butler']",say jordan travis passed jameis career passing tds damn
16eb4h6,jzuphac,charleston southern clemson 215,charleston southern location clemsonfclemson memorial clemson sc time 215 watch tv acc networklaccn rcfb made rcfb please keep trash talk civil report comments violate lets talk,"['clemson2', 'orange']","['notredame', 'butler']",theres line means like clemson 60
17nrxeu,k7u0jg8,missouri 330,location georgiafgeorgia sanford time 330 watch tv cbslcbs rcfb made rcfb please keep trash talk civil report comments violate lets talk,['rcfb'],"['notredame', 'butler']",holy shit florida might lose miss bowl lol
1754xes,k4etj9m,washington somehow hyped enough,cfb fans back east understand biggest history series dates 1900 430 first time teams ranked ap 10 victor arguably significant win fbs season far whats problem theres actual trophy generally accepted name applied contest,"['oregon', 'willamette']","['michigan', 'butler']",hyped weekend even casual fans looking forward expecting
1896p8u,kbprsxd,1200,location att time 1200 watch tv abclabc odds spread tex 15 overunder 555 rcfb made rcfb please keep trash talk civil report comments violate lets talk,['rcfb'],"['notredame', 'butler']",say every year chest pass illegal
1896p8u,kbpy3rx,1200,location att time 1200 watch tv abclabc odds spread tex 15 overunder 555 rcfb made rcfb please keep trash talk civil report comments violate lets talk,['rcfb'],"['notredame', 'butler']",feeling fsu kicks louisvilles ass tonight even glenn
183xb4n,kas8mwf,kansas 800,kansas location kansas bill snyder family time 800 watch tv foxlfox rcfb made rcfb please keep trash talk civil report comments violate lets talk,['rcfb'],"['iowastate', 'butler']",oooof bacon misses two easy picks special teams mishap leads legs taken rip
183xb4n,kascmx5,kansas 800,kansas location kansas bill snyder family time 800 watch tv foxlfox rcfb made rcfb please keep trash talk civil report comments violate lets talk,['rcfb'],"['iowastate', 'butler']",shot every almost picked want death
183xb4n,kasfwdc,kansas 800,kansas location kansas bill snyder family time 800 watch tv foxlfox rcfb made rcfb please keep trash talk civil report comments violate lets talk,['rcfb'],"['iowastate', 'butler']",peak comedy long tds defensive mishaps special team flops missed picks line drive goal
183xb4n,kasimnt,kansas 800,kansas location kansas bill snyder family time 800 watch tv foxlfox rcfb made rcfb please keep trash talk civil report comments violate lets talk,['rcfb'],"['iowastate', 'butler']",wild snowstorm isnt slog fest
183xb4n,kask415,kansas 800,kansas location kansas bill snyder family time 800 watch tv foxlfox rcfb made rcfb please keep trash talk civil report comments violate lets talk,['rcfb'],"['iowastate', 'butler']",bruuuuh talk trash us longer big play magic
16wjz1a,k2xrg0a,notre dame duke 730,notre dame dukefdukeduke location dukefduke wallace wade time 730 watch tv abclabc rcfb made rcfb please keep trash talk civil report comments violate lets talk,['rcfb'],"['notredame', 'butler']",taco bell commercial makes want stab eardrums
177rgng,k4uzxlu,indiana 1200,location time 1200 watch tv foxlfox odds spread mich 335 overunder 465 rcfb made rcfb please keep trash talk civil report comments violate lets talk,['rcfb'],"['notredame', 'butler']",ive decided root different form chaos last year 4team format im rooting every p5 champ finish 130 ensuing shitshow
17sxef4,k8tcnq5,penn 1200,penn location penn statefpennstate beaver time 1200 watch tv foxlfox rcfb made rcfb please keep trash talk civil report comments violate lets talk,['rcfb'],"['notredame', 'butler']",one benefit abandoning divisions james franklin
17sxef4,k8tl9ys,penn 1200,penn location penn statefpennstate beaver time 1200 watch tv foxlfox rcfb made rcfb please keep trash talk civil report comments violate lets talk,['rcfb'],"['notredame', 'butler']",laugh hard penn misses tying 2point conversion stupid 2point attempt halftime
17d4h7c,k5vevkr,ucf 1200,ucffucfucf location memorial norman ok time 1200 watch tv abclabc rcfb made rcfb please keep trash talk civil report comments violate lets talk,['rcfb'],"['notredame', 'butler']",occur dillon gabriel ucf
1684osx,jytr9sh,colorado tcu 1200,tcuftcutcu location tcuftcu amon g carter time 1200 watch tv foxlfox odds spread tcu 205 overunder 645 rcfb made rcfb please keep trash talk civil report comments violate lets talk,"['texasam', 'ucla']","['notredame', 'butler']",morris shits tcu might actually real trouble
18w0xqp,kfuyo7y,fiesta bowl liberty 100,location farm time 100 watch tv espnlespn odds spread ore 18 overunder 685 rcfb made rcfb please keep trash talk civil report comments violate lets talk,['rcfb'],"['notredame', 'butler']",cant wait playoff next year
15u1x06,jwpxekz,usc ohio biggest brand b1g,ive seen conversation online among usc fans usc brand bigger nationally globally idea something like even calculated get wondering obviously ohio usc among successful cfb programs history terms relevance brand three schools carries title opinion ohio usc order one man,"['oregon', 'byu']","['michigan', 'butler']",talking viewership think osu pretty clear ive heard fans everywhere country maybe diverse fanbase idea though know ive never met usc fan person shoot think might pushing usc point
175wmqx,k4k2pc5,new rivalries developed near future college,app coastal carolina heating rivalry sun belt could develop really interesting rivalry games next 510 years jmumarshall southernjmu southerncoastal carolina south alabamasouthern miss come mind potential hate filled rivalries near future already budding heated matchups rivalries developed opinion,"['georgiasouthern', 'sunbelt']","['michigan', 'butler']",would say penn try starting rivalry one new b1g members lets real penn isnt allowed rivals
171pswl,k3sd2wt,kansas 730,kansas location boone pickens time 730 watch tv espnlespn rcfb made rcfb please keep trash talk civil report comments violate lets talk,['rcfb'],"['maryland', 'butler']",black cowboys unis look really similar black terps script unis
188qre7,kbmtxpm,washington 800,location allegiant time 800 watch tv abclabc odds spread ore 95 overunder 655 rcfb made rcfb please keep trash talk civil report comments violate lets talk,['rcfb'],"['notredame', 'butler']",fuck jayden daniels frontrunner washington could 130 spite 93rd total defense thanks michael penix
188qre7,kbn2684,washington 800,location allegiant time 800 watch tv abclabc odds spread ore 95 overunder 655 rcfb made rcfb please keep trash talk civil report comments violate lets talk,['rcfb'],"['notredame', 'butler']",get probably deserves feels bit icky jayden daniels could win heisman played one fewer
188qre7,kbn4xf9,washington 800,location allegiant time 800 watch tv abclabc odds spread ore 95 overunder 655 rcfb made rcfb please keep trash talk civil report comments violate lets talk,['rcfb'],"['notredame', 'butler']",mightve given hunger games movie chance rachel zegler wasnt
168fxb4,jywaik1,toledo illinois 730,location memorial champaign il time 730 watch tv big ten networklbtn odds spread ill 9 overunder 460 rcfb made rcfb please keep trash talk civil report comments violate lets talk,"['ohiostate2', 'toledo']","['notredame', 'butler']",really hope toledo p5 doesnt steal finn next year
168fxb4,jywc82e,toledo illinois 730,location memorial champaign il time 730 watch tv big ten networklbtn odds spread ill 9 overunder 460 rcfb made rcfb please keep trash talk civil report comments violate lets talk,"['ohiostate2', 'toledo']","['notredame', 'butler']",bert take timeout 8 seconds left stupid
191zla4,kgzfbxy,cfp final washington 730,location nrg time 730 watch tv espnlespn odds spread mich 55 overunder 555 rcfb made rcfb please keep trash talk civil report comments violate lets talk,['rcfb'],"['maryland', 'butler']",surprised washington running ball much
183wpji,kascdfu,tech 730,tech location bobby dodd time 730 watch tv abclabc rcfb made rcfb please keep trash talk civil report comments violate lets talk,['rcfb'],"['notredame', 'butler']",well least like 523 like always seemed geoff collins
16doerv,jzr7fjf,illinois kansas 730,location kansasfkansas david booth kansas memorial time 730 watch tv espn2lespn2 rcfb made rcfb please keep trash talk civil report comments violate lets talk,"['kansas', 'washington']","['notredame', 'butler']",kansas come long way home underdog fcs team
166pzeu,jylr8nj,nebraska minnesota 800,location huntington bank time 800 watch tv foxlfox odds spread minn 7 overunder 435 rcfb made rcfb please keep trash talk civil report comments violate lets talk,"['minnesota', 'delaware']","['notredame', 'butler']",nebraskas going really good without drunk holding back
183mtar,kaqfqyy,ohio 1200,ohio location time 1200 watch tv foxlfox rcfb made rcfb please keep trash talk civil report comments violate lets talk,['rcfb'],"['notredame', 'butler']",gus ever nicknames ohio players
183mtar,kaqfvag,ohio 1200,ohio location time 1200 watch tv foxlfox rcfb made rcfb please keep trash talk civil report comments violate lets talk,['rcfb'],"['notredame', 'butler']",smoking crack number font score change
183mtar,kaqqhmh,ohio 1200,ohio location time 1200 watch tv foxlfox rcfb made rcfb please keep trash talk civil report comments violate lets talk,['rcfb'],"['notredame', 'butler']",fuck think know going end
16t3pxm,k2faj6v,ohio hate hates ohio,ive heard stories osu giving away 21 coupons bookstore tours simply gives away 20 ive heard xichigan ttun none direction ohio hate hates osu,"['charlotte', 'northcarolina']","['notredame', 'butler']",45 years ago would see converse asked
16t3pxm,k2fgfvj,ohio hate hates ohio,ive heard stories osu giving away 21 coupons bookstore tours simply gives away 20 ive heard xichigan ttun none direction ohio hate hates osu,"['charlotte', 'northcarolina']","['ohiostate2', 'butler']",ohios hate tempered get rec marijuana legalized
16qbmz1,k1w8tsp,colorado 330,location oregonforegon autzen time 330 watch tv abclabc rcfb made rcfb please keep trash talk civil report comments violate lets talk,['rcfb'],"['notredame', 'butler']",glad jesse palmer calling games always enjoyed pollack rece davis thursday night games
16qbmz1,k1waral,colorado 330,location oregonforegon autzen time 330 watch tv abclabc rcfb made rcfb please keep trash talk civil report comments violate lets talk,['rcfb'],"['notredame', 'butler']",every week many noflairs colorado threads
16qbmz1,k1wo5jt,colorado 330,location oregonforegon autzen time 330 watch tv abclabc rcfb made rcfb please keep trash talk civil report comments violate lets talk,['rcfb'],"['notredame', 'butler']",theres way colorado gets bowl might get arizona stanford theyre going get skullfucked everyone else
17d0yj8,k5u7279,espn college gameday show,want little ting tang tang discuss post anything related show signs screencaps videos etc,['rcfb'],"['notredame', 'butler']",watching gameday shitty magic show trutv
15u6nal,jwpwq3l,nothing say would ever change opinion cfb opinion,opinion ironclad immovable collaboration worlds top minds say otherwise couldnt get move opinion god could appear irrefutable evidence stating otherwise still wouldnt change opinion,['georgia'],"['michigan', 'butler']",tim tebow florida teams coached urban meyer best college qb past 30 years saying talented anything perfect fit perfect place perfect coach
16a716p,jz6mn4o,clemson duke 800,dukefdukeduke location dukefduke wallace wade time 800 watch tv espnlespn odds spread clem 13 overunder 555 rcfb made rcfb please keep trash talk civil report comments violate lets talk,"['stanford', 'presscorps']","['notredame', 'butler']",notre dame duke mike elko amazing fucking coach
16a716p,jz6p8mp,clemson duke 800,dukefdukeduke location dukefduke wallace wade time 800 watch tv espnlespn odds spread clem 13 overunder 555 rcfb made rcfb please keep trash talk civil report comments violate lets talk,"['stanford', 'presscorps']","['notredame', 'butler']",mfw nd play ohio duke usc three games fourgame stretch
16keh8t,k0wjaae,usf 330,usffusfusf location usffusf raymond james time 330 watch tv abclabc rcfb made rcfb please keep trash talk civil report comments violate lets talk,['rcfb'],"['notredame', 'butler']",put byrum brown bama usf slaughter lol
16keh8t,k0wmi92,usf 330,usffusfusf location usffusf raymond james time 330 watch tv abclabc rcfb made rcfb please keep trash talk civil report comments violate lets talk,['rcfb'],"['notredame', 'butler']",point even win would argue worse ulm loss
177vtsq,k4w962p,washington 330,location husky time 330 watch tv abclabc odds spread wash 3 overunder 670 rcfb made rcfb please keep trash talk civil report comments violate lets talk,['rcfb'],"['notredame', 'butler']",feels like theres lot ncaa 14 management recently
177vtsq,k4wfn0s,washington 330,location husky time 330 watch tv abclabc odds spread wash 3 overunder 670 rcfb made rcfb please keep trash talk civil report comments violate lets talk,['rcfb'],"['notredame', 'butler']",lanning kicked fg end half would 5 point
177vtsq,k4wou6l,washington 330,location husky time 330 watch tv abclabc odds spread wash 3 overunder 670 rcfb made rcfb please keep trash talk civil report comments violate lets talk,['rcfb'],"['michigan', 'butler']",play 4 quarters instead ndusc
16w91ub,k2wjkld,usc colorado 1200,uscfuscusc location folsom time 1200 watch tv foxlfox rcfb made rcfb please keep trash talk civil report comments violate lets talk,['rcfb'],"['notredame', 'butler']",deion dumbass wasting timeouts
16q6opo,k1vp63u,cincinnati 1200,location nippert time 1200 watch tv rcfb made rcfb please keep trash talk civil report comments violate lets talk,['rcfb'],"['notredame', 'butler']",didnt even take one full season satterfield destroy fickells work
16q6opo,k1w39mu,cincinnati 1200,location nippert time 1200 watch tv rcfb made rcfb please keep trash talk civil report comments violate lets talk,['rcfb'],"['notredame', 'butler']",fuck lebby ou 145 work pool
16q6opo,k1w3zqy,cincinnati 1200,location nippert time 1200 watch tv rcfb made rcfb please keep trash talk civil report comments violate lets talk,['rcfb'],"['notredame', 'butler']",satterfield gives major neal brown vibes embodiment milquetoast mediocrity
16x7xkv,k317ewx,ap poll week 6 october 1 2023,nan,"['michigan', 'thegame']","['maryland', 'butler']",probably gonna stomp everyone named osu psu gonna go whole season unranked wont enough quality wins well lose votes losing osu week
1629jdu,jxwpvj9,san jos usc 800,san jos jos uscfuscusc location uscfusc los angeles memorial coliseum time 800 watch tv pac12 networklp12n odds spread usc 31 overunder 665 rcfb made rcfb please keep trash talk civil report comments violate lets talk,"['sanjosestate', 'mwc']","['notredame', 'butler']",dumb fucking waste timeout might well need near end
1629jdu,jxwqhzd,san jos usc 800,san jos jos uscfuscusc location uscfusc los angeles memorial coliseum time 800 watch tv pac12 networklp12n odds spread usc 31 overunder 665 rcfb made rcfb please keep trash talk civil report comments violate lets talk,"['sanjosestate', 'mwc']","['notredame', 'butler']",fuck travis hunter preseason first team allpac 12 selection got cooked fairly often swac competition
