post_id,comment_id,post_title,post_selftext,post_author_flairs,comment_author_flairs,comment_body
172dawp,k3wbzfk,purdue 330,iowafiowaiowa location iowafiowa kinnick time 330 watch tv peacocklpeacock rcfb made rcfb please keep trash talk civil report comments violate lets talk,['rcfb'],"['iowa', 'calgary']",disgusting far aside kaleb johnson run td
172i5sr,k3ws4tm,kentucky 700,location georgiafgeorgia sanford time 700 watch tv espnlespn rcfb made rcfb please keep trash talk civil report comments violate lets talk,['rcfb'],['calgary'],fell going folks jonesing another upset im thinking uga hold never know
183rfxa,karf3e8,auburn 330,location auburnfauburn jordanhare time 330 watch tv cbslcbs odds spread ala 105 overunder na rcfb made rcfb please keep trash talk civil report comments violate lets talk,['rcfb'],"['michiganstate', 'calgary']",think reichard knew kick woulda made alltime point holder
183rfxa,karj1v4,auburn 330,location auburnfauburn jordanhare time 330 watch tv cbslcbs odds spread ala 105 overunder na rcfb made rcfb please keep trash talk civil report comments violate lets talk,['rcfb'],"['michiganstate', 'calgary']",hitting punter like gotta fake tough guy thing ever
183rfxa,karl9bv,auburn 330,location auburnfauburn jordanhare time 330 watch tv cbslcbs odds spread ala 105 overunder na rcfb made rcfb please keep trash talk civil report comments violate lets talk,['rcfb'],"['michiganstate', 'calgary']",like said milroes got kj jeffersons body jayden daniels legs
181eq61,kac7r6c,week 13 matchup preview 2 ohio buckeyes 4 wolverines,2 ohio statefohiostate 4 saturday november 25 1200 eastern ann arbor watch foxlfox odds 35 pts total points 475 alltime series ohio statefohiostate ohio statefohiostate met 117 times since 10161897 teams last met 361 days ago 11262022 series wins ohio statefohiostate 51660 longest streak continuous meetings 102 19182019 last 2 meetings 20212022 series last 5 meetings oh2345 arbor mi2742 ohio arbor mi5627 ohio oh6239 ohio arbor mi3120 series comparison data via week 12 weekohio statefohiostate 11080result 3817w 233ecufecu 2916w 303 2youngstown 7453w 357unlvfunlv 9261w 357 3wkufwku 6543w 6310bowling 6543w 316 4notre 8300w 6535w 317 5635w 457 6535w 5635w 5210 7purduefpurdue 3826w 3817w 527 8penn 9262w 2012michigan 4726w 490 6544w 2410byena 6535w 3826w 4113 11michigan 4726w 383penn 9262w 2415 5635w 6535w 3124 rankings reflect current rcfb ohio statefohiostate injury report data scraped 20231122 100012 devin brownqbearly dec ankletue nov 21brown sidelined right ankle sprain projected remain beginning december michael hall jrdtques sat undisclosedmon nov 20hall held previous due unknown issue air take saturday versus tommy sat undisclosedmon nov 20eichenberg missed past two contests undefined ailment unclear play saturdays tilt versus lathan ransomsques sat legmon nov 20ransom sat last three games due leg injury unknown suit saturday miyan williamsrbout season undisclosedtue oct 31williams sit remainder season unknown injury nolan baudowrout indefinitely undisclosedsat nov 4baudo idle undefined issue timetable recovery joop mitchellwrout indefinitely undisclosedsun oct 8mitchell commission due unrevealed ailment yet confirmed return kyion grayeswrout indefinitely undisclosedsun oct 8grayes sidelined due unspecified issue miss extended period jayden bonsusout indefinitely undisclosedsun oct 8bonsu lineup undefined issue unclear make season debut reis stocksdalewrout season kneetue oct 3stocksdale commission knee injury likely miss remainder season zak herbstreitteout season undisclosedthu sep 21herbstreit shut entire 2023 season unknown injury bennett christianteout season suspensionsun aug 27christian suspended entire 2023 season due violation ncaa rules tc caffeyrbout indefinitely kneesun oct 15caffey idle due knee injury unclear return injury data lifted injury report data scraped 20231122 100012 logan forbeswrout indefinitely undisclosedmon oct 2forbes away team due undivulged reasons without definitive timetable recovery cj stokesrbout indefinitely undisclosedsun oct 15stokes idle undefined injury timetable return karmello englishwrques sat undisclosedmon nov 20english held previous four games due unlisted issue unknown dress saturdays showdown ohio danny hughesrbques sat undisclosedmon nov 20hughes missed previous two contests due unknown injury undetermined face ohio saturday ladarius hendersonolques sat undisclosedmon nov 20henderson absent lineup last unreported ailment uncertain suit saturday versus ohio roman wilsonwrprob sat undisclosedmon nov 20wilson exited previous contest unreported injury expected impact status saturdays battle ohio davis warrenqbques sat undisclosedmon nov 20warren sat last three matches due unspecified ailment unclear line saturday versus ohio injury data lifted keys think wins think favorite cover spread players interested watch lets talk vote matchup win poll simply include name team think win enclosed part top level comment discussing matchup change vote edit initial comment bracket team change vote often like posted full listing accepted fbs team aliases found fcs teams need use full name appears post title listing links live vote totals matchup preview threads current week found like format generate matchup discussion matchup discussion please dm udupreesdiamond regarding template,"['oregonstate', 'cascadeclash']","['oregon', 'calgary']",neutrals lurk ohio subreddit click couple posts read comments exact thing subreddit let reddits algorithm thing pop popcorn enjoy scrolling beautiful app
185xz7e,kb4u72b,ohio fan want actually bad season near future,think ohio fans average maybe worst spoiled grew watching west virginia might worst 84 team power 5 conference year 84 im actually pretty hype meanwhile seems like orange bowl appearance rose bowl win 2 years ago disappointing buckeye fans shit absolutely insane anyone else roots team consistent success like ohio etc ever wished team would losing season went minnesota every time mccord threw incompletion thousands college students grownass adults yelling fuck touchdown celebrations shoe lame year everyone way high expectation team id legitimately fine went 39 next year meant osu fans could shut enjoy 102 season like rest college fans,"['ohiostate', 'westvirginia2']","['ohiostate', 'calgary']",think insane take thats like rooting economic recession neighbors make risky purchases healthy viewpoint think better maintain healthy perspective worry others think dont care ohio fans act spoiled blue bloods programs problem several good seasons always want wildly successful buckeye team every year fun great season come
172s434,k3ygkuh,postgame usc defeats arizona 4341 3ot,box score provided team 1 2 3 4 ot made rcfb,['rcfb'],['calgary'],never doubt kidding doubt doubt someone hold
16ql0u1,k1yj2pt,usc arizona 1030,uscfuscusc arizona location arizona mountain america time 1030 watch tv foxlfox odds spread usc 34 overunder 615 rcfb made rcfb please keep trash talk civil report comments violate lets talk,['rcfb'],['calgary'],ugly ever miss arizona
16qh8i7,k1xu7dl,penn 730,iowafiowaiowa penn location penn statefpennstate beaver time 730 watch tv cbslcbs odds spread psu 105 overunder na rcfb made rcfb please keep trash talk civil report comments violate lets talk,['rcfb'],"['iowa', 'calgary']",think im ready head bed lets see deacon anything
16qh8i7,k1xwsk5,penn 730,iowafiowaiowa penn location penn statefpennstate beaver time 730 watch tv cbslcbs odds spread psu 105 overunder na rcfb made rcfb please keep trash talk civil report comments violate lets talk,['rcfb'],"['iowa', 'calgary']",said going bed like 15 minutes im still watching damn reason
16kehcu,k0w4z3y,western 330,western iowafiowaiowa location iowafiowa kinnick time 330 watch tv big ten networklbtn rcfb made rcfb please keep trash talk civil report comments violate lets talk,['rcfb'],"['iowa', 'calgary']",cade isnt 100 healthy dont think
16egmpb,jzv81u2,smu 600,smufsmusmu location memorial norman ok time 600 watch tv espnlespn rcfb made rcfb please keep trash talk civil report comments violate lets talk,"['oklahoma', 'cfp']",['calgary'],interested final results arkansas basket case butch jones smu hopefully better gauge
182v9ux,kalwayc,nebraska 1200,iowafiowaiowa location memorial lincoln ne time 1200 watch tv cbslcbs rcfb made rcfb please keep trash talk civil report comments violate lets talk,['rcfb'],"['iowa', 'calgary']",back kicker either way made
182v9tz,kal8knm,tcu 1200,tcuftcutcu location memorial norman ok time 1200 watch tv foxlfox rcfb made rcfb please keep trash talk civil report comments violate lets talk,['rcfb'],"['oklahoma', 'calgary']",whats pokes watching ref highlights
182v9tz,kaln9tn,tcu 1200,tcuftcutcu location memorial norman ok time 1200 watch tv foxlfox rcfb made rcfb please keep trash talk civil report comments violate lets talk,['rcfb'],"['oklahoma', 'calgary']",wish back make someone miss 1 1
182v9tz,kalq10d,tcu 1200,tcuftcutcu location memorial norman ok time 1200 watch tv foxlfox rcfb made rcfb please keep trash talk civil report comments violate lets talk,['rcfb'],"['oklahoma', 'calgary']",swear curse program point top 5 defense halfway season get 3rd string qbd death
177wgao,k4w0grx,wisconsin 400,iowafiowaiowa location camp randall time 400 watch tv foxlfox odds spread wis 10 overunder 360 rcfb made rcfb please keep trash talk civil report comments violate lets talk,['rcfb'],"['iowa', 'calgary']",last thing needed wanted form passing season without tes idk even function
177wgao,k4wfuuj,wisconsin 400,iowafiowaiowa location camp randall time 400 watch tv foxlfox odds spread wis 10 overunder 360 rcfb made rcfb please keep trash talk civil report comments violate lets talk,['rcfb'],"['iowa', 'calgary']",ive missed bit defense getting gassed already
172mpmi,k3xmwe3,arizona usc 1030,uscfuscusc location uscfusc los angeles memorial coliseum time 1030 watch tv espnlespn rcfb made rcfb please keep trash talk civil report comments violate lets talk,['rcfb'],['calgary'],fellow trojans dont forget led departures hate pac deserved moreand finally go elsewhere get paid rest busy enabling larry scott weve always villains others national respect west coast peaks usc still good sure washington good years get initial invite big ten nope conference expansion equation longer tv markets anymore although us lesser extent ucla lynchpins enormous market rather teams brand name bring national ratings thats us always us blue blood let hate keeps watching pac12 died couldnt value 1 brand win lose fight
15qyphi,jw5tsvw,2023 ap top 25 preseason poll,overreactions,['rcfb'],"['iowa', 'calgary']",like preseason top 25 rings superstition bells lol
17y5zcv,k9rx6mg,espn college gameday show,want little ting tang tang discuss post anything related show signs screencaps videos etc,['rcfb'],"['iowa', 'calgary']",dont think kicking segment thing next year
15ifj30,jutw768,say something nice washington,embarrassed florida washington took jg hands,['tennessee'],"['oregon', 'calgary']",washington st sweet logo beautiful unis great day atmosphere st best coach west coast
17t6f94,k8v3r7e,west virginia 700,west virginia location memorial norman ok time 700 watch tv foxlfox odds spread ou 125 overunder 585 rcfb made rcfb please keep trash talk civil report comments violate lets talk,['rcfb'],"['oklahoma', 'calgary']",coaches blew loads ut brent rand adderall 3 weeks ago
189go15,kbrbmdp,800,iowafiowaiowa location lucas oil time 800 watch tv foxlfox odds spread mich 22 overunder 345 rcfb made rcfb please keep trash talk civil report comments violate lets talk,['rcfb'],"['iowa', 'calgary']",im sure running middle every time gonna work
16e3yqv,jztke0q,espn college gameday show,want little ting tang tang discuss post anything related show signs screencaps videos etc,['rcfb'],"['iowa', 'calgary']",big rich bear big nude kickoff weird
18ykzmx,kgbgc3k,ama im greg mcelroy college commentator espn ama rcfb january 5th 8pm get ready cfp national championship espn ask anything,removed,['rcfb'],['calgary'],thanks joining us im big fan always college since getsin getsout pretty efficiently though ive interested hitting road custom mercedes benz sprinter youve certainly got words stuck mind two northern teams playing college title first time since 2014 didnt happen frequently much attributed shifts teams built via nilportal aberration see teams get shots moving forward especially 12team playoff
18ykzmx,kgbgl25,ama im greg mcelroy college commentator espn ama rcfb january 5th 8pm get ready cfp national championship espn ask anything,removed,['rcfb'],['calgary'],reminder ask questions answers begin 8pm friday 15
18ykzmx,kgbgycf,ama im greg mcelroy college commentator espn ama rcfb january 5th 8pm get ready cfp national championship espn ask anything,removed,['rcfb'],['calgary'],thanks joining us im big fan always college since getsin getsout pretty efficiently though ive interested hitting road custom mercedes benz sprinter youve certainly got words stuck mind two northern teams playing college title first time since 2014 didnt happen frequently much attributed shifts teams built via nilportal aberration see teams get shots moving forward especially 12team playoff
18ut4k7,kfn6ue0,last year bama didnt make playoffs play k sugar bowl bryce young anderson top 3 picks draft played excuses healthy fsu guys sitting new years six bowl thats feel,,"['michigan', 'fau']",['calgary'],players sat didnt want let bowls profit understand support done dirty protest way flip bird system power
191zla4,kgzaho3,cfp final washington 730,location nrg time 730 watch tv espnlespn odds spread mich 55 overunder 555 rcfb made rcfb please keep trash talk civil report comments violate lets talk,['rcfb'],"['oklahoma', 'calgary']",bad tbh thought gonna draw 3 mins ooh ooohs
183te17,kaqvm4k,former ohio rb maurice clarett ryan day love bro gotta go youre paid millions cant get paid 9ms lose 3 straight,,"['michigan', 'fau']","['oregon', 'calgary']",personally think takes reserved next year lose hasnt lost big10 single team know rivalry big mean something
17ydytm,k9tn3r2,illinois 330,iowafiowaiowa location iowafiowa kinnick time 330 watch tv fox sports 1lfs1 odds spread 35 overunder 305 rcfb made rcfb please keep trash talk civil report comments violate lets talk,['rcfb'],"['iowa', 'calgary']",williams looking like trying get piggy back ride lol
17ydytm,k9toe6h,illinois 330,iowafiowaiowa location iowafiowa kinnick time 330 watch tv fox sports 1lfs1 odds spread 35 overunder 305 rcfb made rcfb please keep trash talk civil report comments violate lets talk,['rcfb'],"['iowa', 'calgary']",really need stay awhile least defense needs breather
183mtar,kaplytn,ohio 1200,ohio location time 1200 watch tv foxlfox rcfb made rcfb please keep trash talk civil report comments violate lets talk,['rcfb'],['calgary'],people care much teams sorry fuck
183mtar,kapxtqz,ohio 1200,ohio location time 1200 watch tv foxlfox rcfb made rcfb please keep trash talk civil report comments violate lets talk,['rcfb'],['calgary'],next week people think
183mtar,kapxygr,ohio 1200,ohio location time 1200 watch tv foxlfox rcfb made rcfb please keep trash talk civil report comments violate lets talk,['rcfb'],['calgary'],jenny taft one three hottest humans walk earth
183mtar,kaq67ps,ohio 1200,ohio location time 1200 watch tv foxlfox rcfb made rcfb please keep trash talk civil report comments violate lets talk,['rcfb'],['calgary'],joel klatt towards ohio people think gary danielson towards
183mtar,kaq7scm,ohio 1200,ohio location time 1200 watch tv foxlfox rcfb made rcfb please keep trash talk civil report comments violate lets talk,['rcfb'],"['ohiostate', 'calgary']",damn punt catch johnson earlier
183mtar,kaqfo3r,ohio 1200,ohio location time 1200 watch tv foxlfox rcfb made rcfb please keep trash talk civil report comments violate lets talk,['rcfb'],['calgary'],wonder team sacrificed virgins half time jk know jim going since kickoff
183mtar,kaqodu7,ohio 1200,ohio location time 1200 watch tv foxlfox rcfb made rcfb please keep trash talk civil report comments violate lets talk,['rcfb'],['calgary'],gonna end anticlimactic way isnt
183mtar,kaqplk8,ohio 1200,ohio location time 1200 watch tv foxlfox rcfb made rcfb please keep trash talk civil report comments violate lets talk,['rcfb'],['calgary'],throw ball even risk saving timeout try get first play win avoid losing
183mtar,kaqrvvc,ohio 1200,ohio location time 1200 watch tv foxlfox rcfb made rcfb please keep trash talk civil report comments violate lets talk,['rcfb'],['calgary'],wonder ends 02 l osu
16t3pxm,k2d7zor,ohio hate hates ohio,ive heard stories osu giving away 21 coupons bookstore tours simply gives away 20 ive heard xichigan ttun none direction ohio hate hates osu,"['charlotte', 'northcarolina']","['ohiostate', 'calgary']",seems equal experience ohio larger fan base general part population ohio larger osu larger student bodyalumni base larger proportion instate students might explain overall loudness osu hate friends hate ohio feeling distinctly mutual
18uiqbe,kflmn2e,peach bowl penn ole miss 1200,penn ole missfolemissole miss location mercedesbenz time 1200 watch tv espnlespn espnlespn odds spread psu 45 overunder 515 rcfb made rcfb please keep trash talk civil report comments violate lets talk,['rcfb'],"['calgary', 'alabama2']",3rd golding defense incoming going give trash time td
16a716p,jz6g5kl,clemson duke 800,dukefdukeduke location dukefduke wallace wade time 800 watch tv espnlespn odds spread clem 13 overunder 555 rcfb made rcfb please keep trash talk civil report comments violate lets talk,"['stanford', 'presscorps']","['iowa', 'calgary']",coming watching bit cfl one looks like first glance
16a716p,jz6ghmv,clemson duke 800,dukefdukeduke location dukefduke wallace wade time 800 watch tv espnlespn odds spread clem 13 overunder 555 rcfb made rcfb please keep trash talk civil report comments violate lets talk,"['stanford', 'presscorps']","['iowa', 'calgary']",saw someone mention earlier dabo doesnt believe kickers seems true lol
16vornr,k2srk37,louisville nc 700,nc statefncstatenc location nc statefncstate carterfinley time 700 watch tv espnlespn odds spread ncsu 1 overunder na rcfb made rcfb please keep trash talk civil report comments violate lets talk,['rcfb'],"['oklahoma', 'calgary']",ad breaks sucks qbs mom hot fuck lol
168z6sg,jyyhm2s,northwestern rutgers 1200,location rutgersfrutgers shi time 1200 watch tv cbslcbs odds spread rutg 65 overunder 405 rcfb made rcfb please keep trash talk civil report comments violate lets talk,"['minnesota', 'delaware']",['calgary'],chicagos big ten team new yorks big ten team cant wait las 2 big ten teams join fray next season
172hgqo,k3wp8ob,colorado arizona 630,arizona location arizona mountain america time 630 watch tv pac12 networklp12n rcfb made rcfb please keep trash talk civil report comments violate lets talk,['rcfb'],['calgary'],good luck new colorado fans finding theres pac12 network find
16en3ol,jzwcbng,auburn california 1030,location california memorial time 1030 watch tv espnlespn rcfb made rcfb please keep trash talk civil report comments violate lets talk,"['paperbag', 'navy']",['calgary'],cal showed pulse north road im less confident auburns lose
16q6opo,k1vcgg9,cincinnati 1200,location nippert time 1200 watch tv rcfb made rcfb please keep trash talk civil report comments violate lets talk,['rcfb'],"['oklahoma', 'calgary']",throw fade us get free 15 everytime
16q6opo,k1vf3cf,cincinnati 1200,location nippert time 1200 watch tv rcfb made rcfb please keep trash talk civil report comments violate lets talk,['rcfb'],"['oklahoma', 'calgary']",shit happens offense looks good 3 gimmes cincy call pi iron defense looks great meh pi call
16q6opo,k1vjyk2,cincinnati 1200,location nippert time 1200 watch tv rcfb made rcfb please keep trash talk civil report comments violate lets talk,['rcfb'],"['oklahoma', 'calgary']",dg great mid short 4 misses separates heisman b1g qb
16q6opo,k1vp736,cincinnati 1200,location nippert time 1200 watch tv rcfb made rcfb please keep trash talk civil report comments violate lets talk,['rcfb'],"['oklahoma', 'calgary']",poor cincy dude putting sunglasses weve
18u1f6v,kfhko0n,cotton bowl ohio missouri 800,ohio location att time 800 watch tv espnlespn espnlespn odds spread osu 5 overunder 495 rcfb made rcfb please keep trash talk civil report comments violate lets talk,['rcfb'],"['calgary', 'alabama2']",friendly reminder tennessee hasnt east since 2007 mizzou twice since 2013
18u1f6v,kfi3kpm,cotton bowl ohio missouri 800,ohio location att time 800 watch tv espnlespn espnlespn odds spread osu 5 overunder 495 rcfb made rcfb please keep trash talk civil report comments violate lets talk,['rcfb'],"['calgary', 'alabama2']",im gonna need mizzou score safety join auburnmsu infamy
165rm7h,jyg5yep,honest still mentally team,go 2019 fiesta bowl clemson top controversial targeting fumble call wont even go one dagger probably took 10 years life arguably best osu team talent wise ive seen lifetime even make championship make argument 2015 team well dont know could beat insane lsu team hoping would play season barely came short however definitely made mistakes well shout trevor lawrence insane 67 yard run td,['ohiostate3'],"['oregon', 'calgary']",honestly think one per year watch
189brft,kbqleqq,400,location mercedesbenz time 400 watch tv cbslcbs odds spread uga 5 overunder 555 rcfb made rcfb please keep trash talk civil report comments violate lets talk,['rcfb'],"['michiganstate', 'calgary']",alabamas top 588763 wrs werent hurt 2022 saban would 50 kirby
189brft,kbqlhu0,400,location mercedesbenz time 400 watch tv cbslcbs odds spread uga 5 overunder 555 rcfb made rcfb please keep trash talk civil report comments violate lets talk,['rcfb'],"['michiganstate', 'calgary']",downvote want washington four best teams country
166w2i8,jym9hc6,postgame minnesota defeats nebraska 1310,box score provided team 1 2 3 4 made rcfb,"['minnesota', 'delaware']","['oregon', 'calgary']",think nebraska fan born 2000 might worst existence known man
166pzdt,jyl9pof,florida utah 800,utahfutahutah location utahfutah riceeccles time 800 watch tv espnlespn odds spread utah 65 overunder 455 rcfb made rcfb please keep trash talk civil report comments violate lets talk,"['medal', 'oklahomastate2']","['oklahoma', 'calgary']",anyone take tomorrow 4 day weekend cfb binging lfg
16eiwrx,jzvuwxx,temple rutgers 730,location rutgersfrutgers shi time 730 watch tv big ten networklbtn rcfb made rcfb please keep trash talk civil report comments violate lets talk,"['rutgers', 'medal']",['calgary'],okay saw comment confused chop rutgers quite swoop threads comments clip twitter account decided pop set record straight since remember introduced watching cfb grad school heres good summary found online started university miami yet never used schiano said turning btn television interview dinardo kevin elko become really wellknown sports psychologist told story guy woods really deep thick woods axe could either lay die could pick tree start chopping away would focus one tree time knew would forest schiano took massive rebuild rutgers 2001 started turn corner four years later something little extra needed help propel scarlet knights postseason first time schiano didnt use 2005 287 illinois rutgers road schiano said came back beat us overtime bowl yet done anything real significance first time got bus said wife little kids didnt travel us much said may run time time ever doubted could get done plane flying home watching tape like coaches running thinking going get team back meeting kevin elko gods grace came back talking six years meeting took place past suddenly became primary part schianos present told gas graduate assistants landed go hardware store buy axe take machine shop guys paint red schiano said two oclock sunday walked team meeting axe still wet red paint held axe told story players funny next week go playing 1aa team villanova scared death said lose thing starting tackle jumps offsides first play guard gets face goes like chopping motion said know got chance baby became mantra point forward
16e7v1g,jztvvuj,nebraska colorado 1200,location folsom time 1200 watch tv foxlfox odds spread neb 95 overunder na rcfb made rcfb please keep trash talk civil report comments violate lets talk,"['nebraska2', 'santamonica']","['oklahoma', 'calgary']",damn awesome seeing colorado alive love
16e7v1g,jzuaopd,nebraska colorado 1200,location folsom time 1200 watch tv foxlfox odds spread neb 95 overunder na rcfb made rcfb please keep trash talk civil report comments violate lets talk,"['nebraska2', 'santamonica']","['oklahoma', 'calgary']",maybe nebraska would actually pretty good team qb wasnt regarded
16e7v1g,jzubpmx,nebraska colorado 1200,location folsom time 1200 watch tv foxlfox odds spread neb 95 overunder na rcfb made rcfb please keep trash talk civil report comments violate lets talk,"['nebraska2', 'santamonica']","['oklahoma', 'calgary']",kind ugly first half definitely looks like 2 first year coaching staffs figuring teams nebraska needs run rock like mad man 3rd colorado doesnt dline depth keep makes 1st half performance impressive
17o30hq,k7vqbmd,postgame washington defeats usc 5242,box score provided team 1 2 3 4 made rcfb,['rcfb'],"['oregon', 'calgary']",penix johnson trying hardest like knew going easy hilarious
183jc7m,kapl9b8,espn college gameday show,want little ting tang tang discuss post anything related show signs screencaps videos etc,['rcfb'],"['iowa', 'calgary']",im realizing moved outside inside need coffee lol
