post_id,comment_id,post_title,post_selftext,post_author_flairs,comment_author_flairs,comment_body
16qd8l6,k1wbyy7,postgame florida defeats clemson 3124 ot,box score provided team 1 2 3 4 ot florida made rcfb,['rcfb'],"['clemson', 'charlestonsouthern']",think acc going two damn good teams fighting clemson showed theyre pushover rivalry acc needs gain national respect well kickoffs wake forest stanford 1030 eastern
16q6omx,k1vwpil,florida clemson 1200,florida location clemsonfclemson memorial clemson sc time 1200 watch tv abclabc rcfb made rcfb please keep trash talk civil report comments violate lets talk,['rcfb'],"['clemson', 'charlestonsouthern']",matter ends theyll tell us acc sucks
16q6omx,k1vygdp,florida clemson 1200,florida location clemsonfclemson memorial clemson sc time 1200 watch tv abclabc rcfb made rcfb please keep trash talk civil report comments violate lets talk,['rcfb'],"['clemson', 'charlestonsouthern']",anyone ripping klubnik one play hasnt watch
16ktcfe,k0y201n,postgame colorado defeats colorado 4335 2ot,box score provided team 1 2 3 4 ot colorado made rcfb,['rcfb'],"['duke', 'charlestonsouthern']",wrong feel fucking salty cu ranked duke
16qadvo,k1vrglf,deal historically mediocre program,wondering always purdue fan hope could start build momentum last couple years nope back square one ryan walters deal fan mediocre program got people around ohio alabamamichigan etc fans,"['purdue', 'easttennesseestate']","['charlestonsouthern', 'southcarolina']",gamecock stuck sec learn enjoy smaller victories rivalry wins bowl games conference title always pipe dream
18uo86j,kfm8fy5,orange bowl florida 400,florida location hard rock time 400 watch tv espnlespn espnlespn odds spread uga 20 overunder 455 rcfb made rcfb please keep trash talk civil report comments violate lets talk,['rcfb'],"['southcarolina2', 'charlestonsouthern']",tuned fsu playing dudes
189wh00,kbu1pqr,cfp rankings final,tv espnlespn follow along selection show full results come two threads posted results serious discussion jokes memes offtopic comments removed rankteamrecord 1 2 3 4 5 6 7 8 9 10 11 12 13 14 15 16 17 18 19 20 21 22 23 24 25,['rcfb'],"['duke', 'charlestonsouthern']",best 4 teams thats parameter gonna use case example
16keh7j,k0w4s5i,south carolina 330,south carolina location georgiafgeorgia sanford time 330 watch tv cbslcbs rcfb made rcfb please keep trash talk civil report comments violate lets talk,['rcfb'],"['duke', 'charlestonsouthern']",usc defense decided take nap start half
16wq174,k2yd6jk,postgame notre dame defeats duke 2114,box score provided team 1 2 3 4 notre dukefduke007714 made rcfb,['rcfb'],"['duke', 'charlestonsouthern']",literally fuck entire sport every time get hood something bullshit happens boot always stupid shit causes teams root lose
16ecyqt,jzv3ua2,ole miss tulane 330,ole missfolemissole miss location tulaneftulane yulman time 330 watch tv espn2lespn2 odds spread miss 75 overunder na rcfb made rcfb please keep trash talk civil report comments violate lets talk,"['tulane', 'tophat']","['olemiss', 'charlestonsouthern']",dad never abused beat make ole miss fan think thats almost bad
1621ag8,jxv6km0,notre dame navy 230,notre dame navyfnavynavy location aviva time 230 watch tv nbclnbc odds spread nd 205 overunder 490 rcfb made rcfb please keep trash talk civil report comments violate lets talk,['usc'],"['alabama2', 'charlestonsouthern']",jason garrett smiles like serial killer seriously creeps
18sx6e0,kfaeg81,ever one favorite college players end least favorite nfl team conversely ever college player couldnt stand end favorite nfl team go,fan kansas jayhawks kansas city chiefs ive seen missouri tigers kstate wildcats end chiefs roster cant say dramatic way chiefs draft kstate player felix anudikeuzomah first round earlier year cant say stood player disliked college nick bolton mizzou drafted chiefs second round back 2021,['kansas'],"['clemson', 'charlestonsouthern']",im panthers fan nfl team never draft clemson player isthe panthers
16eb4h6,jzunoxf,charleston southern clemson 215,charleston southern location clemsonfclemson memorial clemson sc time 215 watch tv acc networklaccn rcfb made rcfb please keep trash talk civil report comments violate lets talk,"['clemson2', 'orange']","['duke', 'charlestonsouthern']",guys guys csu wins itll best 5 days lifeeeee
16eb4h6,jzupis5,charleston southern clemson 215,charleston southern location clemsonfclemson memorial clemson sc time 215 watch tv acc networklaccn rcfb made rcfb please keep trash talk civil report comments violate lets talk,"['clemson2', 'orange']","['duke', 'charlestonsouthern']",yall saying csu wont win completely ignoring thoughts prayers went
17o0i1u,k7vxm7n,colorado 1000,location folsom time 1000 watch tv espnlespn rcfb made rcfb please keep trash talk civil report comments violate lets talk,['rcfb'],"['alabama2', 'charlestonsouthern']",huh didnt know dj u transferred seems better without dabo
1896p8u,kbpfr4b,1200,location att time 1200 watch tv abclabc odds spread tex 15 overunder 555 rcfb made rcfb please keep trash talk civil report comments violate lets talk,['rcfb'],"['alabama2', 'charlestonsouthern']",even letting defenses take throw wacky waving inflatable arm dudes let team run would thing
1896p8u,kbpg95j,1200,location att time 1200 watch tv abclabc odds spread tex 15 overunder 555 rcfb made rcfb please keep trash talk civil report comments violate lets talk,['rcfb'],"['alabama2', 'charlestonsouthern']",fat man tiny jerseyfat man tiny jersey
1896p8u,kbpxho3,1200,location att time 1200 watch tv abclabc odds spread tex 15 overunder 555 rcfb made rcfb please keep trash talk civil report comments violate lets talk,['rcfb'],"['alabama2', 'charlestonsouthern']",tacky wrestling belts everything else embarrassment god man
189ycsz,kbu8af4,thamel college playoff 1 2 washington 3 4 5 florida 6georgia,nan,"['texas', 'williammary']","['clemson', 'charlestonsouthern']",milroe broke leg last night still bama still get
16wjz1a,k2yb1hn,notre dame duke 730,notre dame dukefdukeduke location dukefduke wallace wade time 730 watch tv abclabc rcfb made rcfb please keep trash talk civil report comments violate lets talk,['rcfb'],"['duke', 'charlestonsouthern']",duke stupid fuck hell would go prevent defense fuck youre stupid ass defensive strategy
17ic9fj,k6tkp91,espn college gameday show,want little ting tang tang discuss post anything related show signs screencaps videos etc,['rcfb'],"['alabama2', 'charlestonsouthern']",cheerleader bros gonna sore hot moist necks
1684osx,jyu14e2,colorado tcu 1200,tcuftcutcu location tcuftcu amon g carter time 1200 watch tv foxlfox odds spread tcu 205 overunder 645 rcfb made rcfb please keep trash talk civil report comments violate lets talk,"['texasam', 'ucla']","['alabama2', 'charlestonsouthern']",last saw moneyline colorado 757 meaning 100 bet would get 857 payout original bet 757
188qre7,kbmp3vk,washington 800,location allegiant time 800 watch tv abclabc odds spread ore 95 overunder 655 rcfb made rcfb please keep trash talk civil report comments violate lets talk,['rcfb'],"['alabama2', 'charlestonsouthern']",whos staypuft man keep showing washington sideline
17nngcm,k7tk1a9,jacksonville south carolina 1200,jacksonville south carolina location south williamsbrice time 1200 watch tv espnulespnu rcfb made rcfb please keep trash talk civil report comments violate lets talk,['rcfb'],"['southcarolina2', 'charlestonsouthern']",bc punter led lot questionable fakes today lmao
17nngcm,k7tles5,jacksonville south carolina 1200,jacksonville south carolina location south williamsbrice time 1200 watch tv espnulespnu rcfb made rcfb please keep trash talk civil report comments violate lets talk,['rcfb'],"['southcarolina2', 'charlestonsouthern']",went one best wins school history one worse losses reaaaaal quick fandom like choosing chronic medical condition
17nngcm,k7tlzv9,jacksonville south carolina 1200,jacksonville south carolina location south williamsbrice time 1200 watch tv espnulespnu rcfb made rcfb please keep trash talk civil report comments violate lets talk,['rcfb'],"['southcarolina', 'charlestonsouthern']",wildcat ever worked joyner every time see line qb know stack box
191zla4,kgzjz4k,cfp final washington 730,location nrg time 730 watch tv espnlespn odds spread mich 55 overunder 555 rcfb made rcfb please keep trash talk civil report comments violate lets talk,['rcfb'],"['alabama2', 'charlestonsouthern']",anyone elses voice assistant get triggered play commercials va commands fucking hate theres one heavy rotation makes alexa play music
168fx9s,jyvr1xh,south carolina north carolina 730,south carolina north carolina location bank america time 730 watch tv abclabc odds spread unc 25 overunder 645 rcfb made rcfb please keep trash talk civil report comments violate lets talk,['southcarolina'],"['southcarolina', 'charlestonsouthern']",last 3 seasons never seen dakereon joyner read option get positive yards
16qh8h1,k1xqhch,ohio notre dame 730,ohio notre dame location notre damefnotredame notre dame time 730 watch tv nbclnbc odds spread osu 75 overunder na rcfb made rcfb please keep trash talk civil report comments violate lets talk,['rcfb'],"['alabama2', 'charlestonsouthern']",like separate parts notre dames kit put em together look like bunch christmas tree ornaments running around
16eiwte,jzvva7h,furman south carolina 730,south carolina location south williamsbrice time 730 watch tv espnlespn sec networklsecn rcfb made rcfb please keep trash talk civil report comments violate lets talk,"['southcarolina2', 'corndog']","['southcarolina', 'charlestonsouthern']",jesus christ might well went 4th
16eiwte,jzvwi84,furman south carolina 730,south carolina location south williamsbrice time 730 watch tv espnlespn sec networklsecn rcfb made rcfb please keep trash talk civil report comments violate lets talk,"['southcarolina2', 'corndog']","['southcarolina', 'charlestonsouthern']",better note havent much ads last week
17t1su5,k8u1bj0,utah washington 330,utahfutahutah location husky time 330 watch tv foxlfox odds spread wash 9 overunder 545 rcfb made rcfb please keep trash talk civil report comments violate lets talk,['rcfb'],"['alabama2', 'charlestonsouthern']",announcers look like comedy duo 1957
17t1su5,k8u37nf,utah washington 330,utahfutahutah location husky time 330 watch tv foxlfox odds spread wash 9 overunder 545 rcfb made rcfb please keep trash talk civil report comments violate lets talk,['rcfb'],"['alabama2', 'charlestonsouthern']",utah looks hungry hungry action hungry blood hell look plain ol hungry
16a716p,jz6gl18,clemson duke 800,dukefdukeduke location dukefduke wallace wade time 800 watch tv espnlespn odds spread clem 13 overunder 555 rcfb made rcfb please keep trash talk civil report comments violate lets talk,"['stanford', 'presscorps']","['alabama2', 'charlestonsouthern']",monday night duke showing lights whens last time two blocked fgs one
16keh8t,k0wckq3,usf 330,usffusfusf location usffusf raymond james time 330 watch tv abclabc rcfb made rcfb please keep trash talk civil report comments violate lets talk,['rcfb'],"['alabama2', 'charlestonsouthern']",one wrinkle boogers forehead big looks like hes wearing bald cap
183wpk5,karuldb,clemson south carolina 730,south carolina location south williamsbrice time 730 watch tv sec networklsecn rcfb made rcfb please keep trash talk civil report comments violate lets talk,['rcfb'],"['southcarolina', 'charlestonsouthern']",45 seconds might time turn
16wjz00,k2xom49,south carolina tennessee 730,south carolina location neyland time 730 watch tv sec networklsecn rcfb made rcfb please keep trash talk civil report comments violate lets talk,['rcfb'],"['southcarolina2', 'charlestonsouthern']",gods green earth catch shit man
16wjz00,k2xp6fm,south carolina tennessee 730,south carolina location neyland time 730 watch tv sec networklsecn rcfb made rcfb please keep trash talk civil report comments violate lets talk,['rcfb'],"['southcarolina2', 'charlestonsouthern']",well last time like 280 end first take day
16wjz00,k2xqf9v,south carolina tennessee 730,south carolina location neyland time 730 watch tv sec networklsecn rcfb made rcfb please keep trash talk civil report comments violate lets talk,['rcfb'],"['southcarolina2', 'charlestonsouthern']",juju 3rd 1 want fucking lose
16wjz00,k2xsucu,south carolina tennessee 730,south carolina location neyland time 730 watch tv sec networklsecn rcfb made rcfb please keep trash talk civil report comments violate lets talk,['rcfb'],"['southcarolina2', 'charlestonsouthern']",gonna lose line isnt good enough rattler find anything downfield
16wjz00,k2xwald,south carolina tennessee 730,south carolina location neyland time 730 watch tv sec networklsecn rcfb made rcfb please keep trash talk civil report comments violate lets talk,['rcfb'],"['southcarolina2', 'charlestonsouthern']",tree gettting fucking demolished left side every single play thats caused pick 6
16wjz00,k2xxl2v,south carolina tennessee 730,south carolina location neyland time 730 watch tv sec networklsecn rcfb made rcfb please keep trash talk civil report comments violate lets talk,['rcfb'],"['southcarolina2', 'charlestonsouthern']",man oh man need ol croots get campus cus gonna make put fucking head window
16f2dqp,jzzapgw,complain team,vent friendly place,['rcfb'],"['clemson', 'charlestonsouthern']",gave 66 points 45 second half alone also gave 17 points fcs team went 28 last year
16ikom7,k0k9q5d,trash talk thursday,know meteor ballbmeteorball order ballborderball within reasonable bounds rules still nbsp troll ballbtrollball enough talk nbsp chaos ballbchaosball rock caps lock,['rcfb'],"['clemson', 'charlestonsouthern']",ask temple owl play mighty clemson tigers bring fau
16e7v1g,jztxfd1,nebraska colorado 1200,location folsom time 1200 watch tv foxlfox odds spread neb 95 overunder na rcfb made rcfb please keep trash talk civil report comments violate lets talk,"['nebraska2', 'santamonica']","['florida2', 'charlestonsouthern']",tribal shamans running commentary good omen bad omen
178l3mf,k50aka4,ap poll 10152023,nan,"['minnesota', 'delaware']","['clemson', 'charlestonsouthern']",james madison fans sounding like maryland fans two weeks ago except jmu doesnt ohio schedule
18uug1x,kfmqjdp,postgame defeats florida 633,box score provided team 1 2 3 4 florida made rcfb,['rcfb'],"['duke', 'charlestonsouthern']",alright someone saying fsu chance prove didnt show winning prove anyone win still dont get chance national belonged cares still wouldnt get chance playoffs anyway theyre better cares lost bama guarantee loss wouldve used say wasnt good year winning wouldve changed nothing
17ifk70,k6u5jn0,south carolina 1200,south carolina amftexasamtexas location amftexasam kyle time 1200 watch tv espnlespn rcfb made rcfb please keep trash talk civil report comments violate lets talk,['rcfb'],"['southcarolina2', 'charlestonsouthern']",im sure fucker 200 yds 3 td grabs end
17ifk70,k6uqey5,south carolina 1200,south carolina amftexasamtexas location amftexasam kyle time 1200 watch tv espnlespn rcfb made rcfb please keep trash talk civil report comments violate lets talk,['rcfb'],"['southcarolina2', 'charlestonsouthern']",sold souls devil tenn clem last season holy shit
