post_id,comment_id,post_title,post_selftext,post_author_flairs,comment_author_flairs,comment_body
16e7uwk,jzu9k4q,notre dame nc 1200,notre dame nc statefncstatenc location nc statefncstate carterfinley time 1200 watch tv abclabc rcfb made rcfb please keep trash talk civil report comments violate lets talk,"['notredame', 'karlsruhe']","['notredame', 'colby']",presently pnc arena across street yall think theres chance gets cancelled
17e697j,k61rr23,employee suspended trustees outraged display adolf hitler,nan,"['sanjosestate', 'michigan']","['washington2', 'colby']",trivia question causing much grief people need real issues
15o9ni8,jvsru6o,else ended attending college whose team hated growing end,grew fan dad went uo gave fullride scholarship ended attending took one year stubbornly refusing switch allegiances realized lame college would couldnt root school attending softened started rooting teams play usually find hoping good things happen beavers since rarely totally fine ducks win often anyone else experience,"['oregon', 'oregonstate']","['washington2', 'colby']",grew coug since family went went school back east bit dulled passion rivalry transferred back near home uw instantly reinvigorated since whole extended family except sister laws went wsu talked mad shit hardened resolve first apple cup got see person also first one cougs since 2012 losing side since 2013 probably explains matters much rivalry uo
15ifj30,juu9zbn,say something nice washington,embarrassed florida washington took jg hands,['tennessee'],"['washington2', 'colby']",folks met guys damn fine kids honesty ferdinands rules grizzlies super cool made 9 year old excited visited family lives around corvallis even went ive always loved osu rowing team recruited decent look set going back east
1781y0u,k4wqdb9,postgame washington defeats 3633,box score provided team 1 2 3 4 made rcfb,['rcfb'],"['ohiostate3', 'colby']",moment washington stopped playing prevent bo nix couldnt find receivers coincidence think
