post_id,comment_id,post_title,post_selftext,post_author_flairs,comment_author_flairs,comment_body
16fvde3,k04rzn8,footage surfaces fans shouting racist homophobic insults players,,['michigan'],"['fiu', 'miami']",cool players emotionally detached kind stuff hope least someone able id anyone saying could get escorted permanently banned coming back
1785w9p,k4xhr1b,postgame notre dame defeats usc 4820,box score provided team 1 2 3 4 uscfusc337720 notre made rcfb,['rcfb'],"['miami', 'fiu']",times like im really glad playoff expanding definitely think notre dame compelling enough team still national title contention especially actually scheduling great teams
177ix9d,k4t7eau,postgame stanford defeats colorado 4643 2ot,box score provided team 1 2 3 4 ot made rcfb,['rcfb'],"['miami', 'fiu']",cant wait skip bayless segment stanford driven elitist racist hatred sanders due black coach ever win 4 games head coach ever hate successful
1728e91,k3vgmsw,maryland ohio 1200,ohio location ohio statefohiostate ohio time 1200 watch tv foxlfox rcfb made rcfb please keep trash talk civil report comments violate lets talk,['rcfb'],"['miami', 'fiu']",lol ohio end 1stq 70 win 667
1728e91,k3vpkc2,maryland ohio 1200,ohio location ohio statefohiostate ohio time 1200 watch tv foxlfox rcfb made rcfb please keep trash talk civil report comments violate lets talk,['rcfb'],"['fiu', 'cooperunion']",feel like wouldve better getting fouled going fg 40 late yards
15wqekf,jx2kuf7,top 5 popular college teams cityarea,1 north carolina 2 nc 3 appalachian 4 wake forest 5 duke x200b,"['floridastate', 'northcarolinaat']","['miami', 'fiu']",south florida complex ill try im mostly basing amount license plates see 1 miami local team even though fans didnt attend region fl miami popular 2 florida ton grads sfl make sure know 3 florida uf feels like bit less numbers much though 4 ucf ucf lot grads increased lot last 5 years unlike miami uf pretty likely ucf fans sfl bandwagon fans likely grads ucf doesnt storied although pretty good imo history 5 wanted include northern school many fans non fl schools south fl id say numerous although ohio st also many faufiu schools obviously tons grads athletic histories significant enough gain following basically feels like presence athletically even though many graduates
18uo86j,kfmdct0,orange bowl florida 400,florida location hard rock time 400 watch tv espnlespn espnlespn odds spread uga 20 overunder 455 rcfb made rcfb please keep trash talk civil report comments violate lets talk,['rcfb'],"['miami', 'fiu']",fuck even games portal era shame man
18uo86j,kfmphg4,orange bowl florida 400,florida location hard rock time 400 watch tv espnlespn espnlespn odds spread uga 20 overunder 455 rcfb made rcfb please keep trash talk civil report comments violate lets talk,['rcfb'],"['florida2', 'fiu']",awesome way end season overrated team rightfully gets left forfeits bowl squad sore soft show miserable ass school team fans lmfao
16k9n25,k0uyd5r,florida boston college 1200,florida boston college location boston alumni chestnut hill time 1200 watch tv abclabc rcfb made rcfb please keep trash talk civil report comments violate lets talk,['rcfb'],"['florida2', 'fiu']",lmfao even cream puff schedule still need refball typical criminoles
16kk458,k0xcqdo,syracuse purdue 730,location purduefpurdue rossade time 730 watch tv nbclnbc rcfb made rcfb please keep trash talk civil report comments violate lets talk,['rcfb'],"['purdue', 'fiu']",purdue drives gets td 2pt conversion much time left syracuse wins time left fg written
16apjlo,jzbofye,realize magic ran,remember like yesterday first clemson 2015 wake forest way national championship enrolled clemson next year seeing us win two national championships 4 years life changing always thought life would like run denial 2021 season still 10 games think clemson fans knew coming worse national tv thing cfb world talking question knew program longer top anymore know clemson death thousand cuts last night really puts perspective,[],"['fiu', 'cooperunion']",went 2 years winless last win miami
167kgm7,jyqn38a,miami oh miami 700,miami ohfmiamiohmiami oh location miamifmiami hard rock time 700 watch tv acc networklaccn odds spread mia 17 overunder 450 rcfb made rcfb please keep trash talk civil report comments violate lets talk,"['miamioh', 'ohiostate2']","['miami', 'fiu']",dont live miami rained every single fucking day god forsaken city legit like 3 months entire city hadnt collapsed sinkhole beyond logic lol
167kgm7,jyr6h1r,miami oh miami 700,miami ohfmiamiohmiami oh location miamifmiami hard rock time 700 watch tv acc networklaccn odds spread mia 17 overunder 450 rcfb made rcfb please keep trash talk civil report comments violate lets talk,"['miamioh', 'ohiostate2']","['miami', 'fiu']",really loved performance definitely looks like 180 last year idk much real acc threat theyll year win 89 games bowl im elated still faith build monster cristobal
189wh00,kbv5t2k,cfp rankings final,tv espnlespn follow along selection show full results come two threads posted results serious discussion jokes memes offtopic comments removed rankteamrecord 1 2 3 4 5 6 7 8 9 10 11 12 13 14 15 16 17 18 19 20 21 22 23 24 25,['rcfb'],"['florida2', 'fiu']",dont understand shock fsu markedly worse 4 teams playoff plus osu least easy schedule unconvincing wins shitty opponents starter qb runs show theyre playoff team simple cry way salt bowl losers youre dont deserve
18w6kt1,kfwwy0h,rose bowl 500,location rose bowl time 500 watch tv espnlespn odds spread mich 2 overunder 455 rcfb made rcfb please keep trash talk civil report comments violate lets talk,['rcfb'],"['northernarizona', 'fiu']",wonder harbaugh puts legacy line goes two
183w2c9,kasf9e9,florida florida 700,florida location floridafflorida ben hill griffin time 700 watch tv espnlespn rcfb made rcfb please keep trash talk civil report comments violate lets talk,['rcfb'],"['florida', 'fiu']",year 2153 fsu fans reddit still crying roughing passer call 2023
183w2c9,kasfknz,florida florida 700,florida location floridafflorida ben hill griffin time 700 watch tv espnlespn rcfb made rcfb please keep trash talk civil report comments violate lets talk,['rcfb'],"['florida', 'fiu']",mid air defending first marker want
1621ag8,jxv46c2,notre dame navy 230,notre dame navyfnavynavy location aviva time 230 watch tv nbclnbc odds spread nd 205 overunder 490 rcfb made rcfb please keep trash talk civil report comments violate lets talk,['usc'],"['miami', 'fiu']",bro really broke pass wr lmao get happened literally looked like great hustle play cb
16e7v2e,jzvz1ej,purdue virginia tech 1200,virginia tech location virginia lane time 1200 watch tv espn2lespn2 rcfb made rcfb please keep trash talk civil report comments violate lets talk,['virginiatech'],"['purdue', 'fiu']",man really wish fancy yellow line
17ny0o9,k7vcwcj,miami nc 800,nc statefncstatenc location nc statefncstate carterfinley time 800 watch tv acc networklaccn rcfb made rcfb please keep trash talk civil report comments violate lets talk,['rcfb'],"['miami', 'fiu']",words tyler van dyke heisman dark horse one time mentioned sentence together literally looks like cant play college period man playing borderline crippled otherwise spectacular drop ive ever seen
17ny0o9,k7vmypy,miami nc 800,nc statefncstatenc location nc statefncstate carterfinley time 800 watch tv acc networklaccn rcfb made rcfb please keep trash talk civil report comments violate lets talk,['rcfb'],"['fiu', 'cooperunion']",4th goal shotguns automatic firing dont get
169aftq,jz0ywle,florida lsu 730,florida lsuflsulsu location camping world time 730 watch tv abclabc odds spread lsu 25 overunder 580 rcfb made rcfb please keep trash talk civil report comments violate lets talk,['rcfb'],"['miami', 'fiu']",man hope lsu protect qb thats small looking dude sure lol
169aftq,jz0zinc,florida lsu 730,florida lsuflsulsu location camping world time 730 watch tv abclabc odds spread lsu 25 overunder 580 rcfb made rcfb please keep trash talk civil report comments violate lets talk,['rcfb'],"['miami', 'fiu']",long developing qb keeper 135 lb qb mouth fsu defense bold strategy brian bold strategy
169aftq,jz12lh6,florida lsu 730,florida lsuflsulsu location camping world time 730 watch tv abclabc odds spread lsu 25 overunder 580 rcfb made rcfb please keep trash talk civil report comments violate lets talk,['rcfb'],"['miami', 'fiu']",god commercials man im gonna end getting annoyed turning games often issue continues
169aftq,jz12wrd,florida lsu 730,florida lsuflsulsu location camping world time 730 watch tv abclabc odds spread lsu 25 overunder 580 rcfb made rcfb please keep trash talk civil report comments violate lets talk,['rcfb'],"['miami', 'fiu']",brain kelly rubbing hands together assure drive still results 0 points
169aftq,jz13lvu,florida lsu 730,florida lsuflsulsu location camping world time 730 watch tv abclabc odds spread lsu 25 overunder 580 rcfb made rcfb please keep trash talk civil report comments violate lets talk,['rcfb'],"['miami', 'fiu']",unrelated news boy love sunday night dont work monday wish nfl tonight lol
169aftq,jz14oll,florida lsu 730,florida lsuflsulsu location camping world time 730 watch tv abclabc odds spread lsu 25 overunder 580 rcfb made rcfb please keep trash talk civil report comments violate lets talk,['rcfb'],"['miami', 'fiu']",jordan travis gonna shred acc pieces man kid slippery accurate fuck
169aftq,jz15a6s,florida lsu 730,florida lsuflsulsu location camping world time 730 watch tv abclabc odds spread lsu 25 overunder 580 rcfb made rcfb please keep trash talk civil report comments violate lets talk,['rcfb'],"['miami', 'fiu']",fsu wrs look 67 240 lbs fsu general looks much bigger miami lol
169aftq,jz1d6mi,florida lsu 730,florida lsuflsulsu location camping world time 730 watch tv abclabc odds spread lsu 25 overunder 580 rcfb made rcfb please keep trash talk civil report comments violate lets talk,['rcfb'],"['miami', 'fiu']",every jordan travis play looks exactly always patrick mahomes type shit every play kid whole cheat code real
16ac19x,jz9m39r,really going clemson,win lose clearly issues go beyond new qb lots busts offense culture poor coaching stale program recruiting ok elite need high hit rate really special imo need take serious look program looked rated sp even close championship team looks 3 years row,[],"['miami', 'fiu']",said clemson going handful duke anyone would listen bringing back 89 win team usually solid formula pretty good team
17ijw3d,k6va2vd,virginia miami 330,location miamifmiami hard rock time 330 watch tv acc networklaccn rcfb made rcfb please keep trash talk civil report comments violate lets talk,['rcfb'],"['miami', 'fiu']",defense still tackle like theyre afraid break nail years
16s9nct,k28a1n5,honest scale one 10 satisfied teams current logo,penn 5 logo forever brand wish would branch experiment alternates except paw print dont talk paw print 8 love tigerhawk im fan variation gold tigerhawk black circle,"['pennstate2', 'iowa']","['florida2', 'fiu']",9 love logo 1955 power posing gator hilarious
17w30ir,k9gaus3,classes athletes school like,sorry distract coaching drama offseason style discussion go ive seen plenty stories players goofy parties dorms around campus im curious acted classes specifically studious never show treated like gods among men normal students happened great shape,"['michigan3', 'american']","['oklahomastate', 'fiu']",sat next brandon weeden semester starter already complete tool also project teammate time one biggest basketball recruits ever signed one dumbest laziest people ive ever met professor gave us im sure felt bad gave important athletes
177dn6h,k4t6sr2,stanford colorado 1000,location folsom time 1000 watch tv espnlespn odds spread colo 115 overunder 590 rcfb made rcfb please keep trash talk civil report comments violate lets talk,['rcfb'],"['northernarizona', 'fiu']",goodness thrown need
16knfug,k0xwged,colorado colorado 1000,colorado location folsom time 1000 watch tv espnlespn rcfb made rcfb please keep trash talk civil report comments violate lets talk,['rcfb'],"['miami', 'fiu']",didnt call colorado losing figure would throttle like 5620 anyways would stifle hype train real good never hater keeping real 75 squad think thats totally fine year
16knfug,k0xzijj,colorado colorado 1000,colorado location folsom time 1000 watch tv espnlespn rcfb made rcfb please keep trash talk civil report comments violate lets talk,['rcfb'],"['miami', 'fiu']",bro agree late hit commentator acting like slit throat lmao agh ohugh oh theres need show yeah oh
189go15,kbryhtv,800,iowafiowaiowa location lucas oil time 800 watch tv foxlfox odds spread mich 22 overunder 345 rcfb made rcfb please keep trash talk civil report comments violate lets talk,['rcfb'],"['miami', 'fiu']",said reach 30 gf laughed thinking joking
18w0xqp,kfvcu7p,fiesta bowl liberty 100,location farm time 100 watch tv espnlespn odds spread ore 18 overunder 685 rcfb made rcfb please keep trash talk civil report comments violate lets talk,['rcfb'],"['florida2', 'fiu']",one worst officiated games ive seen minute holy christ
17io8xk,k6w6j4i,tennessee kentucky 700,location kroger time 700 watch tv espnlespn rcfb made rcfb please keep trash talk civil report comments violate lets talk,['rcfb'],"['tennessee', 'fiu']",gonna stressful 2nd half guys time get refill
17b2mwh,k5h0jsq,fiu sam houston 700,fiuffiufiu sam houston location sam elliott bowers time 700 watch tv cbs sports networklcbssn rcfb made rcfb please keep trash talk civil report comments violate lets talk,['rcfb'],"['fiu', 'northwestern2']",good thing punted side 50 sam houston gain yards back 3 plays
17b2mwh,k5h126r,fiu sam houston 700,fiuffiufiu sam houston location sam elliott bowers time 700 watch tv cbs sports networklcbssn rcfb made rcfb please keep trash talk civil report comments violate lets talk,['rcfb'],"['fiu', 'northwestern2']",drive turnover missed fg written
17b2mwh,k5hkaqi,fiu sam houston 700,fiuffiufiu sam houston location sam elliott bowers time 700 watch tv cbs sports networklcbssn rcfb made rcfb please keep trash talk civil report comments violate lets talk,['rcfb'],"['fiu', 'massachusettslowell']",wish fiu would adopt black light blue pink wore last week full time
17b2mwh,k5hlvk6,fiu sam houston 700,fiuffiufiu sam houston location sam elliott bowers time 700 watch tv cbs sports networklcbssn rcfb made rcfb please keep trash talk civil report comments violate lets talk,['rcfb'],"['fiu', 'massachusettslowell']",next week fiu going get demolished jacksonville
17b2mwh,k5ho2eq,fiu sam houston 700,fiuffiufiu sam houston location sam elliott bowers time 700 watch tv cbs sports networklcbssn rcfb made rcfb please keep trash talk civil report comments violate lets talk,['rcfb'],"['fiu', 'northwestern2']",man earlier season legitimately terrified fiu might lose jenkins transfer portal
17b2mwh,k5hp4jj,fiu sam houston 700,fiuffiufiu sam houston location sam elliott bowers time 700 watch tv cbs sports networklcbssn rcfb made rcfb please keep trash talk civil report comments violate lets talk,['rcfb'],"['fiu', 'northwestern2']",fiu opportunity kick chip shot goal earlier could tied surely wouldnt try bootleg run kicker instead
17b2mwh,k5hrg9d,fiu sam houston 700,fiuffiufiu sam houston location sam elliott bowers time 700 watch tv cbs sports networklcbssn rcfb made rcfb please keep trash talk civil report comments violate lets talk,['rcfb'],"['fiu', 'northwestern2']",crazy thinking shouldve reviewed see long completion td looked like mitchell mightve reached across goal line stepped
17b2mwh,k5hs785,fiu sam houston 700,fiuffiufiu sam houston location sam elliott bowers time 700 watch tv cbs sports networklcbssn rcfb made rcfb please keep trash talk civil report comments violate lets talk,['rcfb'],"['fiu', 'massachusettslowell']",hey malik fius entire existence lull winning games
17b2mwh,k5ht4mr,fiu sam houston 700,fiuffiufiu sam houston location sam elliott bowers time 700 watch tv cbs sports networklcbssn rcfb made rcfb please keep trash talk civil report comments violate lets talk,['rcfb'],"['fiu', 'northwestern2']",pleasure sweating full house sickos also incredibly jealous yall got enjoy shit show rooting interest meanwhile sat verge heart attack past hour lmfao
15i4lvq,juulr3x,whatever heck going today,even sure anymore location everywhere time odds spread pac12lpac12 14 made rcfb please keep trash talk civil report comments violate lets talk,['rcfb'],"['fiu', 'miami']",feel bad golftrack tennis travel coordinators bad swapping road trips la arizona stillwater nebraska
18ut4k7,kfmprua,last year bama didnt make playoffs play k sugar bowl bryce young anderson top 3 picks draft played excuses healthy fsu guys sitting new years six bowl thats feel,,"['michigan', 'fau']","['florida2', 'fiu']",bitch ass school bitch ass players else say lmao
189yt3v,kbunmvz,sportscenter florida reacting missing cfbplayoff,nan,"['ballstate', 'colorado']","['florida2', 'fiu']",lmao get fucked posers team fake year without jt putting playoff waste spot time enjoy toilet bowl criminoles
162sdp4,jxyszkp,week 1 result loss could cause complete meltdown fanbase,regarding ucf kent st something like 1610 defensive battle erratic jrp play would create insanity within knight fanbase,"['ucf', 'westchester']","['florida2', 'fiu']",failures third defense might actually perish
191zla4,kgzaosf,cfp final washington 730,location nrg time 730 watch tv espnlespn odds spread mich 55 overunder 555 rcfb made rcfb please keep trash talk civil report comments violate lets talk,['rcfb'],"['northernarizona', 'fiu']",really dont care wins uw rejected four times undergrad masters phd go blue
191zla4,kgzeqyw,cfp final washington 730,location nrg time 730 watch tv espnlespn odds spread mich 55 overunder 555 rcfb made rcfb please keep trash talk civil report comments violate lets talk,['rcfb'],"['northernarizona', 'fiu']",damni feel gutted dillon johnson miracle able play first place
17t727w,k8vsybe,florida lsu 730,lsuflsulsu location lsuflsu tiger la time 730 watch tv sec networklsecn odds spread lsu 135 overunder 635 rcfb made rcfb please keep trash talk civil report comments violate lets talk,['rcfb'],"['fiu', 'cooperunion']",lsu acting tough could put entire sideline still wouldnt stop team bum defense
16x7vat,k31ua2k,pat mcafee doesnt get college gameday,wonder long going espn finally realizes something ive known since first joined show since constant need upstage everyone incredibly offputting especially guest going wazzu flag claiming merely hopping bandwagon team good right thats whole different level pure ignorance pats part ill admit one personal ive one many wazzu flagwavers 15 years first time 2008 season wazzu incredibly lucky finish 211 year even sixth year waving flag biggest celebrities crowd fans every single school wanted meet us hear story tell us finding flag crowd part saturday morning routine could enthusiastic accommodating every time ive flagwaving duty youll hear tune pretty much wazzu flagwavers one person ever tried give grief waving flag gameday happened fans host school opponent dozen schools told guy get lost staying anything meaning wazzu flag college gameday visible symbol program becoming celebration host site college general see fans around country every gameday site welcome partake celebration college pat mcafee doesnt get,"['washingtonstate', 'floridastate']","['miami', 'fiu']",want herbie much less mcafee mcafee top forced wants turn gameday frat boy hype show instead focusing makes cfb great tradition rivalries atmosphere family
172jjmy,k3xfox8,tech miami 800,tech location miamifmiami hard rock time 800 watch tv acc networklaccn rcfb made rcfb please keep trash talk civil report comments violate lets talk,['rcfb'],"['miami', 'fiu']",man boner killer far lol hyped initially
172jjmy,k3xhibv,tech miami 800,tech location miamifmiami hard rock time 800 watch tv acc networklaccn rcfb made rcfb please keep trash talk civil report comments violate lets talk,['rcfb'],"['miami', 'fiu']",commercial fucking fever dream way real lol
172jjmy,k3xidua,tech miami 800,tech location miamifmiami hard rock time 800 watch tv acc networklaccn rcfb made rcfb please keep trash talk civil report comments violate lets talk,['rcfb'],"['miami', 'fiu']",whats bojangles dont think like less depressing boston market
172jjmy,k3xjzar,tech miami 800,tech location miamifmiami hard rock time 800 watch tv acc networklaccn rcfb made rcfb please keep trash talk civil report comments violate lets talk,['rcfb'],"['miami', 'fiu']",ask bowling green shut miami today key success gt
172jjmy,k3xr4iz,tech miami 800,tech location miamifmiami hard rock time 800 watch tv acc networklaccn rcfb made rcfb please keep trash talk civil report comments violate lets talk,['rcfb'],"['miami', 'fiu']",acc title perhaps orange bowl bowling green miami
172jjmy,k3xsx0b,tech miami 800,tech location miamifmiami hard rock time 800 watch tv acc networklaccn rcfb made rcfb please keep trash talk civil report comments violate lets talk,['rcfb'],"['miami', 'fiu']",unc cover spread x4 next week lol like easily see 6614 type deal
172jjmy,k3xtbe9,tech miami 800,tech location miamifmiami hard rock time 800 watch tv acc networklaccn rcfb made rcfb please keep trash talk civil report comments violate lets talk,['rcfb'],"['miami', 'fiu']",fuck im getting ps5 050 like realistic commercial says get
172jjmy,k3xz3vk,tech miami 800,tech location miamifmiami hard rock time 800 watch tv acc networklaccn rcfb made rcfb please keep trash talk civil report comments violate lets talk,['rcfb'],"['miami', 'fiu']",hes much officiating crew fuck knows
172jjmy,k3y0824,tech miami 800,tech location miamifmiami hard rock time 800 watch tv acc networklaccn rcfb made rcfb please keep trash talk civil report comments violate lets talk,['rcfb'],"['miami', 'fiu']",rcfb needs soley focus clowning miami rest night close downban threads lmao oh god unfathomable
172p8o7,k3y15jj,postgame tech defeats miami 2320,box score provided team 1 2 3 4 made rcfb,['rcfb'],"['miami', 'fiu']",im even mad im legit still laughing lol cristobal may lost locker room permanently one blunder absolutely unprecedented
189ygiv,kbul92l,booger mcfarlands live reaction complete travesty sport go play regardless whether win offense defense name win thats reason never done 130 p5 champ,continued understand style points best matchups one team loss one doesnt florida kids went every week busted behinds moment,"['michigan', 'fau']","['florida2', 'fiu']",fsu gonna skip bowl protest know get throat fucked prove putting playoff wouldve waste spot time 4 teams better osu posers even admitted moved acc easier path natty turns scraping past jv teams year doesnt quite get fun toilet bowl frauds lmfao
16ecys3,jzuyu03,miami 330,amftexasamtexas location miamifmiami hard rock time 330 watch tv abclabc odds spread tam 7 overunder na rcfb made rcfb please keep trash talk civil report comments violate lets talk,"['texasam', 'alabama']","['miami', 'fiu']",special teams horrific long genuinely cannot wrap mind around cannot get right seems hard bad
16ecys3,jzv099j,miami 330,amftexasamtexas location miamifmiami hard rock time 330 watch tv abclabc odds spread tam 7 overunder na rcfb made rcfb please keep trash talk civil report comments violate lets talk,"['texasam', 'alabama']","['miami', 'fiu']",always get false impression nebraska hated clowned teams cfb jump miami especially home lol
16ecys3,jzv5wvq,miami 330,amftexasamtexas location miamifmiami hard rock time 330 watch tv abclabc odds spread tam 7 overunder na rcfb made rcfb please keep trash talk civil report comments violate lets talk,"['texasam', 'alabama']","['miami', 'fiu']",ill say special teams nightmare forever boggles mind
16ecys3,jzv6eer,miami 330,amftexasamtexas location miamifmiami hard rock time 330 watch tv abclabc odds spread tam 7 overunder na rcfb made rcfb please keep trash talk civil report comments violate lets talk,"['texasam', 'alabama']","['miami', 'fiu']",imagine gifting kid college education expensive university see drop ball 8 year old likely wouldve caught lol college man miami fuck
16ecys3,jzv84uc,miami 330,amftexasamtexas location miamifmiami hard rock time 330 watch tv abclabc odds spread tam 7 overunder na rcfb made rcfb please keep trash talk civil report comments violate lets talk,"['texasam', 'alabama']","['miami', 'fiu']",peeped miami special teams coach scrolling indeed sideline
16ecys3,jzvak0n,miami 330,amftexasamtexas location miamifmiami hard rock time 330 watch tv abclabc odds spread tam 7 overunder na rcfb made rcfb please keep trash talk civil report comments violate lets talk,"['texasam', 'alabama']","['miami', 'fiu']",sports bar switched end nd right lining kick fg
16ecys3,jzvotue,miami 330,amftexasamtexas location miamifmiami hard rock time 330 watch tv abclabc odds spread tam 7 overunder na rcfb made rcfb please keep trash talk civil report comments violate lets talk,"['texasam', 'alabama']","['miami', 'fiu']",goes beyond lead shows national recruits theres serious shift offensive capability
16ecys3,jzvotyy,miami 330,amftexasamtexas location miamifmiami hard rock time 330 watch tv abclabc odds spread tam 7 overunder na rcfb made rcfb please keep trash talk civil report comments violate lets talk,"['texasam', 'alabama']","['fiu', 'miami']",buying home starting family millennial economy
16ecys3,jzvvyvy,miami 330,amftexasamtexas location miamifmiami hard rock time 330 watch tv abclabc odds spread tam 7 overunder na rcfb made rcfb please keep trash talk civil report comments violate lets talk,"['texasam', 'alabama']","['fiu', 'miami']",even damar hamlin incident espn fucks bad injury
16qbmz1,k1wdiah,colorado 330,location oregonforegon autzen time 330 watch tv abclabc rcfb made rcfb please keep trash talk civil report comments violate lets talk,['rcfb'],['fiu'],colorados defense awful three weeks team finally taking advantage
