post_id,comment_id,post_title,post_selftext,post_author_flairs,comment_author_flairs,comment_body
177ix9d,k4t7uff,postgame stanford defeats colorado 4643 2ot,box score provided team 1 2 3 4 ot made rcfb,['rcfb'],"['nebraska', 'hastings']",want see tree wearing cowboy hat pit vipers stat
173vhag,k468hwv,tank job week week six,tank job week award fbs team best job humiliating weekend whether blew large lead choked away spot limelight lost absolutely right losing completely screwed everything last second blunder tjotw winner sets gold standard college misery x200b previous winners 1 baylor bears lost 4231 2 nevada wolf pack lost idaho 336 3 cowboys lost south 337 4 minnesota golden gophers lost northwestern 3734 5 ucf knights lost baylor 3635 x200b last week thought going two horse race ucf tech knights hoo boy knights fact calling declare meltdown baylor ultimate tank job year done probably want take back x200b onto week yes still gonna vote yes theres nominees yes completely formality yes happened exactly 831 pacific saturday night kind moment tjotw normally dream fact could say knelt reverence gods hath delivered glorious bounty x200b note ease counting please use carats vote like miamifl thank thanks participating x200b honorable mentions saw usc everybody saw also jimbo fishers intestinal fortitude x200b nominees week 6 x200b arizona wildcats lost usc 4341 hate zona followed plucky finish washington even pluckier effort usc 170 guys steve kerr skipping press conference watch drink margaritas couldnt hang also shoulda gone two first overtime burned colorado burned x200b fresno bulldogs lost wyoming 2419 50 two power 5 scalps belt bulldogs rolled laramie clear frontrunner race coveted group five ny6 berth leave teeth broken limping back california last minute interception halted desperate comeback big boy bowl hopes dashed yet took major hit x200b miamifl hurricanes lost tech 2320 youve least heard canes didnt kneel fumbled gave winning touchdown two seconds left incredible might sound description doesnt even begin justice theres absolutely nothing type havent seen yet need probably need see many times mind youre going watching every college youtube compilation rest life moderation key x200b notre dame fighting irish lost louisville 3320 1713 cards entering fourth quarter notre dames fourth quarter drive chart turnover downs 35 first play interception fumble 26 gonna turnover downs anyways touchdown recovered onside kick ending interception considering offensive meltdown absolute gifts position handed louisville miracle cards got 16 points x200b rice owls lost connecticut 3831 owls 10 point home faves winless huskies outgained uconn 160 yards one two three turnovers put owls 2814 claw back 3128 huskies ripped 59 yard td attempted rice counter resulted turnover 4 rice manage goal pull one score onside kick recovered huskies walk houston first win year x200b san jose spartans lost boise 3527 277 one point smurf voodoo kicked broncos rallied 28 straight could kickstarted sjsus floundering season probably beginning end bowl hopes x200b ucf knights lost kansas 5122 one overused terms sports boatraced people dont use correctly proper boatracing team racing insurmountable lead even though team gets going theres hope possibly catch since actual boat racing lose lane need make pass said ucf got boatraced jayhawks maybe busraced whatever fact end baylor first 31 minutes kansas knights outscored 670 yeesh,"['washington', 'centralwashington']","['nebraska', 'hastings']",might well end whole thing bc nothing ever top miami gt
15zjqpr,jxhjkpj,rivalries seem fake forced,nebraskaiowa really nebraskas big10 games matter grew husker fan border states omaha carter lake ia remember interacting hawkeye fans daily basis loved trash talk nebraska seemed relish programs downward spiral dont like losing otherwise dont negative feelings towards program dont rise level historic adversary like feel hatred towards like colorado anything id interested mizzou id probably put even less stock trophy wisconsin partially onesided also theres even less natural inclination meaning two programs examples forced fake even onesided rivalries yalls favorite programs,"['ncstate', 'nebraska']","['nebraska', 'hastings']",think red purple nu battle real games wild part two crazy westerkamp catches sealed ia gamestupid fuck b1g even trying make thing share border
17cbawx,k5pxr06,like teams subreddit,sign stealing stuff wondering feel teams subs love rcfb despite rivalries pretty good natured collegial lots humor self awareness even around potentially ruinous stuff like whats happening ann arbor right subscribe szd listen fullcast feel like communities dovetail nicely community however bunch conspiracy theories halfjoking halfnot vacating wins back 2021 hmm general sense stereotypical idiot fan behavior want give spencer material work really like sub team news analysis discussion editorial devolves dumbest shit unfortunately rallhail quiet even pitt loss look teams subs belong 2 duds,"['louisville', 'ohiostate']","['nebraska', 'hastings']",really seem piss moan alot another shit ive hearing decades
16uibb2,k2lagks,trash talk thursday,know meteor ballbmeteorball order ballborderball within reasonable bounds rules still nbsp troll ballbtrollball enough talk nbsp chaos ballbchaosball rock caps lock,['rcfb'],"['nebraska', 'hastings']",jim harbaugh good coach respect much
16x9pgh,k31gy3n,feeling rest season week 5,speaking think likely drop two likely figure activate death machine mode first loss could come soon weekend certainly 20 kentucky rolling florida ole miss tennessee also shouldnt counted beck rallying first road test jhs less encouraging inexperience qb defense injuries threepeat hinge long takes team synthesize starting get critical pieces back ladd javon mykel could matter time,['georgia3'],"['nebraska', 'hastings']",meh think might get bahamas bowl something cu
177dn6h,k4t1ugl,stanford colorado 1000,location folsom time 1000 watch tv espnlespn odds spread colo 115 overunder 590 rcfb made rcfb please keep trash talk civil report comments violate lets talk,['rcfb'],"['nebraska', 'hastings']",colorado lost went scoreless 2nd half would 2nd worse choke job far season
189cl2c,kbqdjji,postgame defeats 4921,box score provided team 1 2 3 4 made rcfb,['rcfb'],"['nebraska', 'hastings']",still time playoffs washington fsu
193kpui,kh9w9ho,chris low clowespn x nick saban retiring sources tell espn six national titles,nan,"['rutgers', 'oregon']","['nebraska', 'hastings']",learn us fuck next hire take granted success youve
17yj89b,k9u2qgx,nebraska wisconsin 730,location camp randall time 730 watch tv odds spread wis 6 overunder 365 rcfb made rcfb please keep trash talk civil report comments violate lets talk,['rcfb'],"['nebraska', 'hastings']",wiscy could get want ground fickle let happen
17yj89b,k9u42pq,nebraska wisconsin 730,location camp randall time 730 watch tv odds spread wis 6 overunder 365 rcfb made rcfb please keep trash talk civil report comments violate lets talk,['rcfb'],"['nebraska', 'hastings']",touched wisconsin great job staying away okay fellas lmao
17yj89b,k9u6ghh,nebraska wisconsin 730,location camp randall time 730 watch tv odds spread wis 6 overunder 365 rcfb made rcfb please keep trash talk civil report comments violate lets talk,['rcfb'],"['nebraska', 'hastings']",winning half cannot upset gotta find consistency
17yj89b,k9ub747,nebraska wisconsin 730,location camp randall time 730 watch tv odds spread wis 6 overunder 365 rcfb made rcfb please keep trash talk civil report comments violate lets talk,['rcfb'],"['nebraska', 'hastings']",someone help oline guy tackles dline guy ground holding got called wiscy didnt mordecais big run wanna know future sake confusing obvious play called differently
17yj89b,k9uclvx,nebraska wisconsin 730,location camp randall time 730 watch tv odds spread wis 6 overunder 365 rcfb made rcfb please keep trash talk civil report comments violate lets talk,['rcfb'],"['nebraska', 'hastings']",come crashing back reality unless force turnovers gotta get bowl eligibility next week least need score 13 one
17yj89b,k9ufd1m,nebraska wisconsin 730,location camp randall time 730 watch tv odds spread wis 6 overunder 365 rcfb made rcfb please keep trash talk civil report comments violate lets talk,['rcfb'],"['nebraska', 'hastings']",shout hc sanford yes tommy went yes named
17yj89b,k9ug2ju,nebraska wisconsin 730,location camp randall time 730 watch tv odds spread wis 6 overunder 365 rcfb made rcfb please keep trash talk civil report comments violate lets talk,['rcfb'],"['nebraska', 'hastings']",announcer continuously say things didnt happen goddamn painful listen
17yj89b,k9ujtuk,nebraska wisconsin 730,location camp randall time 730 watch tv odds spread wis 6 overunder 365 rcfb made rcfb please keep trash talk civil report comments violate lets talk,['rcfb'],"['nebraska', 'hastings']",yeah tripping thing isnt thats kind fucked
175wmqx,k4iml5o,new rivalries developed near future college,app coastal carolina heating rivalry sun belt could develop really interesting rivalry games next 510 years jmumarshall southernjmu southerncoastal carolina south alabamasouthern miss come mind potential hate filled rivalries near future already budding heated matchups rivalries developed opinion,"['georgiasouthern', 'sunbelt']","['nebraska', 'hastings']",battle nus nebraska northwestern always good even total chaos
16ielg0,k0jdp82,whats one thing love rival,live sw virginia im much closer blacksburg charlottesville drive whenever hoos tech playing im decked hoo gear help jump goobers enter sandman comes justtoo good,"['virginia', 'virginiawise']","['nebraska', 'hastings']",one good weed mutual love smiles every aisle doesnt corpo plugged manufactured feel shout go big red games youll get cheers home visiting team fans doesnt matter
191zla4,kgzlgji,cfp final washington 730,location nrg time 730 watch tv espnlespn odds spread mich 55 overunder 555 rcfb made rcfb please keep trash talk civil report comments violate lets talk,['rcfb'],"['nebraska', 'hastings']",like ive saying west coast teams arent going come b1g start lighting shit offensively like think
17j3xdt,k6yidl8,deion sanders colorados offensive line struggling protect shedeur big picture go get new lineman thats picture ima paint perfectly,nan,[],"['nebraska', 'hastings']",deion absolute clown im looking forward watching colorado scramble cover contract hes actively destroying program inside couldnt happen deserving fanbase program
17ijw1m,k6ve8e7,purdue nebraska 330,location memorial lincoln ne time 330 watch tv fox sports 1lfs1 rcfb made rcfb please keep trash talk civil report comments violate lets talk,['rcfb'],"['nebraska', 'hastings']",oh thats straight helmet helmet gentle one lol thats shitty
17ijw1m,k6vk3i7,purdue nebraska 330,location memorial lincoln ne time 330 watch tv fox sports 1lfs1 rcfb made rcfb please keep trash talk civil report comments violate lets talk,['rcfb'],"['nebraska', 'hastings']",yall offense get anything going given chance win rest year like almost entire offense wtf
17ijw1m,k6vsthh,purdue nebraska 330,location memorial lincoln ne time 330 watch tv fox sports 1lfs1 rcfb made rcfb please keep trash talk civil report comments violate lets talk,['rcfb'],"['nebraska', 'hastings']",thats answer sims unfortunately wont guy wtf fumbling bullshit
16tjo8a,k2ff9v9,swinney says team literally three plays away top 5 nationally,nan,['southcarolina'],"['nebraska', 'hastings']",like nebraska greatest 39 team time
16kjdqm,k0x28tf,northern illinois nebraska 700,northern illinois location memorial lincoln ne time 700 watch tv fox sports 1lfs1 rcfb made rcfb please keep trash talk civil report comments violate lets talk,['rcfb'],"['nebraska', 'hastings']",hh making strong case qb1 rest season
16hxs91,k0gq56t,unpopular opinion team,whats opinion team fan base fans team would disagree mine id like keep playing land feet think hatred thats increased offseason would make games fun watch,['oregonstate'],"['nebraska', 'hastings']",tom osborne still alive exerting power ad part reason woes
17vtjqa,k9d0y7c,players team year believe would belong schools alltime roster,something think going every season player good could one best school history south carolina year dont believe though many fans willwould say rattler talented qb weve ever hes still ways accomplishing achieving connor shaw wr xavier legette talented enough already put top 5 receiving season career compared great wrs lacking instance though brock bowers may te1 alltime roster,"['southcarolina', 'sec']","['nebraska', 'hastings']",entire offense turnovers last fbs 27 turnovers someone math jeff sims turns ball every 9 snaps qbs arent better
18hglre,kd6kzce,nonconference matchup dont happen often played often,thinking recently weird team illinois rarely ever plays nonconference fbs team northern illinois guys nonconference games either never happen dont happen commonly played often feel free leave reason well,"['illinois', 'auburn2']","['nebraska', 'hastings']",would love home home miami every 5 years games always juiced heres little history rivalry
1728eb3,k3v7912,1200,location cotton bowl time 1200 watch tv abclabc rcfb made rcfb please keep trash talk civil report comments violate lets talk,['rcfb'],"['nebraska', 'hastings']",uh oh corso done made personal someone get prime durn theme music
16754si,jyol2ai,thamel sources acc presidents chancellors voted morning extend invitations stanford california smu push league 18 teams,,"['collegecharleston', 'southcarolina']","['nebraska', 'hastings']",know think acc cal stanford always come mind dumb
16o2a6c,k1i56k8,whats painful loss teams history,2018 national championship rutgers every saturday,"['georgia', 'rutgers']","['nebraska', 'hastings']",name 1982 penn st catch complete three feet side white 1984 real men go 2 2009 got second 2012 b1g wiskywho beat earlier year get blown fucking water indy pretty much everything since 2014
18alqyr,kbzuvib,would take stop watchcaring college,something ive thinking years sport grew watching basically gone continuing evolve ways could seen detrimental im curious people considered breaking points isnt much oh team bad structure sport examples transfer portal currently functions means players like incoming could well gone time juniors leaving little get know player see grow element existed sport nil means players often go highest bidder things like tvd miami threatened transfer nil folks didnt give money know players paid behind scenes removes former appearance players chose school school like alumnus might arent students like p5 soon 4 probably making upwards 7 figures attend school continued consolidation conferences continues ruin regional rivalries create massive power brokers basically dictate sport everyone else yesterday surmise means everyone else basically fucked moving forward unless join one two conferences wonder college moves worse version nfl point think go far stop caringwatching point would happen bleed team colors always,['miami'],"['nebraska', 'hastings']",cfb current form bubble hope pops
