post_id,comment_id,post_title,post_selftext,post_author_flairs,comment_author_flairs,comment_body
17t729f,k8vfq7b,mississippi 730,mississippi amftexasamtexas location amftexasam kyle time 730 watch tv espn2lespn2 rcfb made rcfb please keep trash talk civil report comments violate lets talk,['rcfb'],"['mississippistate', 'holmes']",dont want zach arnett fired want launched sun
18yljpf,kgdwaq0,biggest favorite teams history,fan think 2 wed beaten 2012 sec championship came final play bama lead notre dame 30 halftime pretty much forgone conclusion uga would championship theyd beaten mark richt gets championship isnt fired 3 years later never hires kirby smart maybe isnt nearly dominant herschel walker gone clemson 2 schools chose uga clemson already title 1981 walker good would clemson many championships many records would herschel still heisman would even chance championship 80 82 say,[],"['belhaven', 'holmes']",mississippi successful 2001 season wearing two sets helmets would sped adoption multiple alternate helmets seasons msu successful enough fans accept helmets still mediocre overall would alternate helmets labeled uncool gimmick nearly thirty years maroon helmets msu ended 2000 wearing white helmets independence bowl msu wore white uniforms contrast maroon wellremembered shocking amount snow fell louisiana msus whiteclad players would disappear snow weather would still remembered surprising reveal new uniform changes rare never happened season next season big news msu didnt pick maroon white helmets next season instead wore speculation helmets would chosen contrast opponents helping qb spot receivers choices dont completely support importantly season stinker everything gets scrutinized youre loosing helmets seemed like distracting gimmick would appear twice next two seasons msu would traditional helmets next decade joining alternate trend become norm msu put together winning seasons might changed look uniforms era
15y76an,jxaiy77,whats schools embarrassing record,ugas zeke bratowski threw 68 interceptions 734 pass attempts 19511953 honestly feels like unbreakable bad record,[],"['belhaven', 'holmes']",mississippi states coach wins went exactly 500 jackie sherrill finished 75752 couple longterm coaches better percentages mullen finished 69 wins also noteworthy darrell royal bernie bierman two year stints starkville winning national championships minnesota
15h25pp,jum8zd1,yall im little depressed wanted rant little bit,love college ever since kid college saturday favorite day centered washington growing remember watching every dad games werent tv going drive listen bob robertson call radio even went school suffer paul wulff teams among worst country still found way enjoy sometimes always hope things would turn around money whims espn fox going destroy team athletic department wsu team tiny remote city much tradition going left best tv ratings pac12 famous passionate fanbase matter bad team see paul wulff era none matters middle nowhere small group executives board room somewhere dont think big enough name yeah know team still around mountain west welcome us open arms still martin 2024 paper wsu mwc seem like pretty good fit make mistake move cripple washington athletics know wsu visionary leadership bill moos bet big big money pac12 tv contract little decade ago basically took loans build expensive new complex buildings bet big expensive big name coaches like mike leach shiver ernie kent spent money like going style larry scott told would know turned despite major cost cutting measures past years wsu still pretty major debt staring idea going making 35 million tv money little 4 million practically night consequences going devastating dont know theyre going going ugly long time top im depressed sport whole wsu fans going beaver friends likely right us plenty around corner big money schools continue consolidate little little passion tradition makes college special whittled away left cheaper younger worse version nfl month away kickoff enthusiasm time low care sport obviously doesnt care school could miracle year win national championship none would matter fate 2024 beyond sealed years ago nothing could sucks sorry rambling wanted voice feeling people might sympathize level thanks reading,"['washingtonstate', 'easternwashington']","['mississippistate', 'holmes']",sucks man mississippi small market team thats lucky sec historywe easily could boat ive got soft spot cougs gardner minshew mike leach ill rooting yall succeed
17zyhsl,ka2r5hn,nonosuum flairs rooting,cfbs top drama reach crescendo week 2 osu 3 um country want see ohio win americas team pulling even youre holding nose,['ohiostate'],"['mississippistate', 'holmes']",want win osu fans absolutely lose minds think need fire day
17d4h8p,k5uthgd,mississippi arkansas 1200,mississippi location razorback time 1200 watch tv espnlespn rcfb made rcfb please keep trash talk civil report comments violate lets talk,['rcfb'],"['belhaven', 'holmes']",trivia question revealed razorbacks cardinals assume thats referring color cardinal red fun note long ago bulldogs maroons
17d4h8p,k5v4p0i,mississippi arkansas 1200,mississippi location razorback time 1200 watch tv espnlespn rcfb made rcfb please keep trash talk civil report comments violate lets talk,['rcfb'],"['belhaven', 'holmes']",would love try hermans ribhouse feel destined burger king advertised time
17d4h8p,k5v8ed3,mississippi arkansas 1200,mississippi location razorback time 1200 watch tv espnlespn rcfb made rcfb please keep trash talk civil report comments violate lets talk,['rcfb'],"['belhaven', 'holmes']",arkansas fans left early still pretty well justified
