post_id,comment_id,post_title,post_selftext,post_author_flairs,comment_author_flairs,comment_body
16ptc9b,k1t1for,postgame nc defeats virginia 2421,box score provided team 1 2 3 4 nc made rcfb,['rcfb'],"['virginia', 'jeffersoneppes']",thats far lamest unsportsmanlike penalty ive ever seen little white dude staring bench
16ptc9b,k1t3fa0,postgame nc defeats virginia 2421,box score provided team 1 2 3 4 nc made rcfb,['rcfb'],"['virginia', 'jeffersoneppes']",tony elliott killing love even mike london 20072021 jaguars could
17adji1,k5cbvxp,fit schools fanbase stereotypes,involved greek life never done cocaine religious im certainly minority among tcu alumsfans fan doesnt golf fan doesnt love world war ii history duke fan doesnt care basketball stanford fan bad math wisconsin fan doesnt drink alcohol,['tcu'],"['virginia', 'jeffersoneppes']",looks closet comprised entirely vineyard vines rhoback brooks brothers branded pfgs patagonia uh yeah im southern side
16jq8ru,k0rvk08,virginia maryland 700,location secu time 700 watch tv fox sports 1lfs1 rcfb made rcfb please keep trash talk civil report comments violate lets talk,['rcfb'],"['virginia', 'jeffersoneppes']",yeah guys arent actually calling
16wbxrj,k2wkiuy,virginia boston college 200,boston college location boston alumni chestnut hill time 200 watch tv cwlcw rcfb made rcfb please keep trash talk civil report comments violate lets talk,['rcfb'],"['virginia', 'jeffersoneppes']",talent uva team matter whether coaches anything line talent doesnt blow weird uva good wr school since bronco came cville
18sfbqf,kf7wg83,holiday bowl usc louisville 800,uscfuscusc location petco park time 800 watch tv foxlfox odds spread lou 65 overunder 585 rcfb made rcfb please keep trash talk civil report comments violate lets talk,['rcfb'],"['virginia', 'jeffersoneppes']",gus joel acknowledged louisville present tonight
18sfbqf,kf7x5bq,holiday bowl usc louisville 800,uscfuscusc location petco park time 800 watch tv foxlfox odds spread lou 65 overunder 585 rcfb made rcfb please keep trash talk civil report comments violate lets talk,['rcfb'],"['virginia', 'jeffersoneppes']",make sense anyone doesnt watch acc chaos louisville may second games dont think second best team conference
18sfbqf,kf7z06m,holiday bowl usc louisville 800,uscfuscusc location petco park time 800 watch tv foxlfox odds spread lou 65 overunder 585 rcfb made rcfb please keep trash talk civil report comments violate lets talk,['rcfb'],"['virginia', 'jeffersoneppes']",lol ignoring jersey pull prevent change direction huh
17ijw3d,k6vjk3n,virginia miami 330,location miamifmiami hard rock time 330 watch tv acc networklaccn rcfb made rcfb please keep trash talk civil report comments violate lets talk,['rcfb'],"['virginia', 'jeffersoneppes']",team muskett hollins fields washington willing anything positive
17ijw3d,k6vr11a,virginia miami 330,location miamifmiami hard rock time 330 watch tv acc networklaccn rcfb made rcfb please keep trash talk civil report comments violate lets talk,['rcfb'],"['virginia', 'jeffersoneppes']",losing hope uva ever score red zone td miami
16jjzlz,k0qpfmp,trap worried teams schedule,basically youre superior opponent likely favored 10 people pick win internally youre little adamant,[],"['virginia', 'jeffersoneppes']",im pretty sure william mary would come close qualifying point im sure well favored let alone 10
15vkpiz,jwvxbc4,worst best case scenario favorite team,ill start worst case scenario louisville finishing season 85 due playing ranked notre dame nc pitt miami road acc ends competitive sec leads us outmatched kentucky however get another bowl end season win means basically end record last season 85 highly doubt record could worse since seem talent compared last season jeff brohm seems confident passionate coaching team best growing louisville best case scenario louisville finishes season 94 due upsetting ranked notre dame home advantage feel like louisville still prone lose nc pitt miami teams road sec still competitive acc kentucky still competitive team louisville would still stack one top tier acc teams home advantage year could give ability beat kentucky first time 6 years since lamar jackson left fall short eligible acc championship get competitive bowl ending loss 94 jeff brohm reflects great season works improving team even next year,['louisville'],"['virginia', 'jeffersoneppes']",worst 012 best coastal chaos still around go 66 75 note would impossible without coastal chaos
16lv8qd,k15arc5,6 ranked matchups weekend,6 ohio 9 notre dame 7 penn 24 10 19 colorado 11 utah 22 ucla 13 ole miss 15 14 21 washington gonna wild weekend college thoughts predictions im taking notre dame psu utah ole miss wsu,"['notredame', 'tennessee']","['virginia', 'jeffersoneppes']",little ole clemson going pull upset feels like dabo shocks world kind
1684ork,jytqfdg,tennessee virginia 1200,location nissan time 1200 watch tv abclabc odds spread tenn 28 overunder 575 rcfb made rcfb please keep trash talk civil report comments violate lets talk,"['virginia', 'southsoldestrivalry']","['virginia', 'jeffersoneppes']",strength team punter youre gonna good time impressive hes good australian though
17dcyzd,k5wi2uw,virginia north carolina 630,north carolina location north kenan time 630 watch tv cwlcw rcfb made rcfb please keep trash talk civil report comments violate lets talk,['rcfb'],"['virginia', 'jeffersoneppes']",love play unc close decide quit thanksgiving
17dcyzd,k5woszx,virginia north carolina 630,north carolina location north kenan time 630 watch tv cwlcw rcfb made rcfb please keep trash talk civil report comments violate lets talk,['rcfb'],"['virginia', 'jeffersoneppes']",theres way mike hollins doesnt win man year right
1659z6r,jydgulw,whats hardest hit youve ever seen person,title says whats hardest hit youve ever seen person includes dirty hits targeting ejections ill start baylor 2013 blackout thursday night kj morton sterling shepard,"['baylor', 'sickos']","['virginia', 'jeffersoneppes']",jacory harris looked like went straight feet back like glitch matrix skipped actual tackle
15wdhb6,jx08qrs,whats worst conference p5 g5 fcs want,celebration end offseason im asking offseasony question think,"['georgia', 'iowastate']","['virginia', 'jeffersoneppes']",id say acc doesnt really bad stadiums rank probably duke bc back
162sdp4,jy1nk2a,week 1 result loss could cause complete meltdown fanbase,regarding ucf kent st something like 1610 defensive battle erratic jrp play would create insanity within knight fanbase,"['ucf', 'westchester']","['virginia', 'jeffersoneppes']",win trick pass play left tackle
177218h,k4r4x0p,rodak sec yet officially decide 8game schedule 7 rotating 1 permanent 9game 6 rotating 3 permanent 2025 beyond,nick saban radio show thursday night spoke solely 8game model saying way gonna 7 team rotation 1 team fixed think youre gonna play everybody every four years almost every guy school going play every team conference think great well link sabans comments around 59 minute mark,"['nebraska', 'northerniowa']","['virginia', 'jeffersoneppes']",alternate headline espn negotiating sec add 9th conference league members way happens without espn adding money tv rights
16ddi8y,jztb4vo,whats weirdest crowd atmosphere youve ever,2017 stanford beat biblical proportions cardinal ducks biggest cheer home crowd fucking rabbit took ran around 20 minutes bryce love ran 147 yards 2 scores stanford crowd barely made peep rabbit comes 30 everyone goes wild,"['michigan2', 'bowlinggreen']","['virginia', 'jeffersoneppes']",2007 virginia tech virginia coastal division two rivals back rivalry still relevant uva led chris long first tragic mass shooting vt april 2007 story begins amazing pregame atmosphere probably 8020 split uva vt fans fanbases hyped ready rivalry decide division back day uva pregame hype video showed cav man vanquishing cartoon opponent team ran particular video cav man refused slaughter hokie bird instead two mascots shook hands team ran onto entire crowd went flat branded virginia pride celebrating schools reached crescendo uva honored vt legend bruce smith halftime inducted college hall fame 2006 yes uva honored legendary player primary rival halftime acc coastal division championship fully understand decision made honor schools dont even necessarily disagree recognize every vt fan alum would give every win history bring back 31 people killed blacksburg april 2007 virginia pride day one weirdest surreal games ever attended
176fwua,k4n4a5g,else eats rivals mascot tailgate,removed,['washington'],"['virginia', 'jeffersoneppes']",play virginia tech thanksgiving weekend tailor made even tailgating scene exactly abundant
17rqa42,k8lol28,virginia louisville 730,location cardinal time 730 watch tv espnlespn rcfb made rcfb please keep trash talk civil report comments violate lets talk,['rcfb'],"['virginia', 'jeffersoneppes']",refs know quasi tobacco road school right
16pnixi,k1sbsz5,nc virginia 730,nc statefncstatenc location scott time 730 watch tv espnlespn rcfb made rcfb please keep trash talk civil report comments violate lets talk,['rcfb'],"['virginia', 'jeffersoneppes']",man colandrea figures put touch passes course hell probably transfer something
16pnixi,k1syb54,nc virginia 730,nc statefncstatenc location scott time 730 watch tv espnlespn rcfb made rcfb please keep trash talk civil report comments violate lets talk,['rcfb'],"['virginia', 'jeffersoneppes']",ill say exact team 22 year old colandrea probably wins jmu maybe maryland games spite coaching
16e7v55,jztwwnm,james madison virginia 1200,james madison location scott time 1200 watch tv espnulespnu rcfb made rcfb please keep trash talk civil report comments violate lets talk,['virginia'],"['virginia', 'jeffersoneppes']",jmu students already throwing shit team praying end zone yeah
16e7v55,jzv06oi,james madison virginia 1200,james madison location scott time 1200 watch tv espnulespnu rcfb made rcfb please keep trash talk civil report comments violate lets talk,['virginia'],"['virginia', 'jeffersoneppes']",bold choice shush crowd 3 tbh itll probably work
15vjto8,jwvnua1,favorite goto cfb memories witnessed live person,two barry sanders breaking first 300 yard tulsa 88 knew good hadnt even broken 200 yards yet one anticipation hype around exploded tennessee beating miami orange bowl 03 tennessee fans sitting bottom miami student section obnoxious drunk expecting chance drive take lead miami fumbled punt return two minutes left could literally hear air let entire student section glorious,"['oklahomastate', 'big12']","['virginia', 'jeffersoneppes']",vividly remember tebow jump pass lsu entire lost recently defensive td seal win vt 2019 also crazy sitting near opposite end zone remember everyone going nuts saw sack remember seeing stands side getting way wild realized must fumbled
18a1czt,kbuxfnk,liberty play fiesta bowl,,"['brockport', 'checkbox']","['virginia', 'jeffersoneppes']",please play everyone full throttle beat liberty core earth
