post_id,comment_id,post_title,post_selftext,post_author_flairs,comment_author_flairs,comment_body
17q3a8o,k8bjd3r,big tens tony petiti informed today two programs fed purdue michigans signals 2022 bt title rutgers osu clear rules broken doesnt directly affect ums situation raises question relative competitive advantage,nan,['michigan'],"['oregonstate', 'lasvegas']",read big tony think thats called going forward
1728e91,k3v68df,maryland ohio 1200,ohio location ohio statefohiostate ohio time 1200 watch tv foxlfox rcfb made rcfb please keep trash talk civil report comments violate lets talk,['rcfb'],"['maryland', 'lasvegas']",spread went ohio 20 days ago ohio 17 morning progress
1728e91,k3vn5cf,maryland ohio 1200,ohio location ohio statefohiostate ohio time 1200 watch tv foxlfox rcfb made rcfb please keep trash talk civil report comments violate lets talk,['rcfb'],"['maryland', 'lasvegas']",holding 3 feels like huge win
15rxzeo,jwd2xvh,whats goto name referring favorite school conversation,go abbreviation mascot full name maybe something else keep simple wvu curious fanbases say,"['westvirginia2', 'hateful8']","['oregonstate', 'lasvegas']",either beavs osu yet talk anyone ohio confusion
189wh00,kbu0qj8,cfp rankings final,tv espnlespn follow along selection show full results come two threads posted results serious discussion jokes memes offtopic comments removed rankteamrecord 1 2 3 4 5 6 7 8 9 10 11 12 13 14 15 16 17 18 19 20 21 22 23 24 25,['rcfb'],"['maryland', 'lasvegas']",washington florida honestly kinda great lot regional variation
189wh00,kbu4y5s,cfp rankings final,tv espnlespn follow along selection show full results come two threads posted results serious discussion jokes memes offtopic comments removed rankteamrecord 1 2 3 4 5 6 7 8 9 10 11 12 13 14 15 16 17 18 19 20 21 22 23 24 25,['rcfb'],"['maryland', 'lasvegas']",storied wins middle tennessee usf arkansas fucking goal chattanooga l joke
1836rhr,kandk8h,830,location oregonforegon autzen time 830 watch tv foxlfox rcfb made rcfb please keep trash talk civil report comments violate lets talk,['rcfb'],"['oregonstate', 'lasvegas']",really really really smart boot touchback
1836rhr,kaniava,830,location oregonforegon autzen time 830 watch tv foxlfox rcfb made rcfb please keep trash talk civil report comments violate lets talk,['rcfb'],"['oregonstate', 'lasvegas']",smith refuse run qb sneak understand
1836rhr,kanmiaj,830,location oregonforegon autzen time 830 watch tv foxlfox rcfb made rcfb please keep trash talk civil report comments violate lets talk,['rcfb'],"['oregonstate', 'lasvegas']",right playcall low plays chance bye bye pac12
182v9ux,kal25ie,nebraska 1200,iowafiowaiowa location memorial lincoln ne time 1200 watch tv cbslcbs rcfb made rcfb please keep trash talk civil report comments violate lets talk,['rcfb'],"['maryland', 'lasvegas']",every point scored one pushup
15zjqpr,jxjid21,rivalries seem fake forced,nebraskaiowa really nebraskas big10 games matter grew husker fan border states omaha carter lake ia remember interacting hawkeye fans daily basis loved trash talk nebraska seemed relish programs downward spiral dont like losing otherwise dont negative feelings towards program dont rise level historic adversary like feel hatred towards like colorado anything id interested mizzou id probably put even less stock trophy wisconsin partially onesided also theres even less natural inclination meaning two programs examples forced fake even onesided rivalries yalls favorite programs,"['ncstate', 'nebraska']","['wisconsin', 'lasvegas']",lot people tried hype wests version hilarious tbh
15o68ro,jvqast6,would 10year ago think told last decade gone favorite team,id shocked butch jones left bowl 2012 dantonio kelly done prior big east collapsed joined american conference 2013 season tell new head coach tommy tuberville would start backtoback 94 seasons go 1114 last two seasons manage piss entire fanbase way id confidence things would turn around soon tell next head coach luke fickell went 48 first season id dejected would absolutely lose mind think im lied hearing wed rattle seasons 112 113 91 131 94 going 48 2016 2017 backtoback ny6 bowls including first ever g5 team make cfp wouldve sounded impossible id certain lied tell 2013 first year american conference decade wed big 12,"['cincinnati', 'ohiostate']","['oregonstate', 'lasvegas']",wait gonna lose many games wait whats gonna happen pac12
16npqrq,k1j8qvc,week 4 matchup preview pac2 championship 14 beavers 21 washington cougars,14 21 washington saturday september 23 0700 eastern martin pullman watch foxlfox odds 30 pts total points 575 alltime series washington washington met 107 times since 11111903 teams last met 340 days ago 10152022 series wins 48356 washington longest streak continuous meetings 42 19451986 recent meeting 2022 series last 5 meetings or2410 washington wa2431 washington or2838 washington wa5354 washington or3756 series comparison data via week 3 weekoregon 3000result 1san jose 1300w 4217colorado 0200w 5024 2uc davisfucdavis 2100w 2100w 3122 3san diego 2200w 269northern 0300w 6421 rankings reflect current rcfb injury report data scraped 20230920 100014 jesiah irishwrques sat undisclosedmon sep 18irish absent previous matchup unknown ailment remains seen face washington saturday tastean reddickswrques sat undisclosedmon sep 18reddicks missed last three contests due injury unlisted location leaving availability saturday washington air injury data lifted washington injury report data scraped 20230920 100014 lawrence falateadeout season kneemon aug 21falatea suffered torn acl miss entire 2023 season quinn roffdeout indefinitely armwed sep 13roff idle due arm injury unclear long debilitated leyton smithsonwrques sat undisclosedmon sep 18smithson sat past three games due unknown ailment status tilt saturday clouded injury data lifted keys think wins think favorite cover spread players interested watch lets talk vote matchup win poll simply include name team think win enclosed part top level comment discussing matchup change vote edit initial comment bracket team change vote often like posted full listing accepted fbs team aliases found fcs teams need use full name appears post title listing links live vote totals matchup preview threads current week found like format generate matchup discussion matchup discussion please dm udupreesdiamond regarding template,"['oregonstate', 'summertimelover']","['oregonstate', 'lasvegas']",wont close think people understanding osu run oline know im biased would honestly beyond shocked osu doesnt cover one mustwins season
15qyphi,jw6a75z,2023 ap top 25 preseason poll,overreactions,['rcfb'],"['maryland', 'lasvegas']",must kind error dont see maryland anywhere
15ifj30,juuejx3,say something nice washington,embarrassed florida washington took jg hands,['tennessee'],"['oregonstate', 'lasvegas']",campus absolutely gorgeous wsu makes good drinking buddies
188qre7,kbmkzs2,washington 800,location allegiant time 800 watch tv abclabc odds spread ore 95 overunder 655 rcfb made rcfb please keep trash talk civil report comments violate lets talk,['rcfb'],"['maryland', 'lasvegas']",know put husky duck room together friends
188qre7,kbmuv61,washington 800,location allegiant time 800 watch tv abclabc odds spread ore 95 overunder 655 rcfb made rcfb please keep trash talk civil report comments violate lets talk,['rcfb'],"['oregonstate', 'lasvegas']",news flash checkdown passes dont work defense actually cares fuck isnt bo throwing
15i4lvq,jus4vr6,whatever heck going today,even sure anymore location everywhere time odds spread pac12lpac12 14 made rcfb please keep trash talk civil report comments violate lets talk,['rcfb'],"['maryland', 'lasvegas']",looking back marylands jump big 10 controversial time looked like better decision time gone
15i4lvq,jus9ba1,whatever heck going today,even sure anymore location everywhere time odds spread pac12lpac12 14 made rcfb please keep trash talk civil report comments violate lets talk,['rcfb'],"['maryland', 'lasvegas']",picturing fsu announcing new arabic major get mohammad bin salmans good side
16l7fxs,k11ttza,week 4 ap top 25 91723,nan,"['minnesota', 'delaware']","['oregonstate', 'lasvegas']",saying win next week ranked day comes youd best believe im framing screenshot
16w91zf,k2vv84o,florida kentucky 1200,location kroger time 1200 watch tv rcfb made rcfb please keep trash talk civil report comments violate lets talk,['rcfb'],"['oregonstate', 'lasvegas']",kentucky please failed make boosters cry
189ahqr,kbq4vv9,boise unlv 300,boise unlvfunlvunlv location unlvfunlv allegiant time 300 watch tv foxlfox odds spread bois 25 overunder 605 rcfb made rcfb please keep trash talk civil report comments violate lets talk,['rcfb'],"['boisestate', 'lasvegas']",cant believe play call 3rd 1 worked guess lol
189ahqr,kbqc2t0,boise unlv 300,boise unlvfunlvunlv location unlvfunlv allegiant time 300 watch tv foxlfox odds spread bois 25 overunder 605 rcfb made rcfb please keep trash talk civil report comments violate lets talk,['rcfb'],"['boisestate', 'lasvegas']",big man kicker baby bro could probably kick million yards
189ahqr,kbqcpee,boise unlv 300,boise unlvfunlvunlv location unlvfunlv allegiant time 300 watch tv foxlfox odds spread bois 25 overunder 605 rcfb made rcfb please keep trash talk civil report comments violate lets talk,['rcfb'],"['boisestate', 'lasvegas']",thats rb wr lol
169wt91,jz4p2v0,gus johnson best cfb commentator,guy seems like hes genuinely fun enjoying envy seems like hes living dream job happy energy rubs watch calling ill never forget losing mind finally scored touchdown big ten championship,"['iowa', 'southdakota']","['oregonstate', 'lasvegas']",love gus ill always fowler fanatic better way knowing games great hearing herbstreit
17xw6oo,k9qdj32,colorado washington 1030,washington location washington gesa time 1030 watch tv fox sports 1lfs1 rcfb made rcfb please keep trash talk civil report comments violate lets talk,['rcfb'],"['oregonstate', 'lasvegas']",wsu beat us way pac crazy deep year
17is9rl,k6wrm2x,arizona 1030,location arizonafarizona arizona time 1030 watch tv espnlespn rcfb made rcfb please keep trash talk civil report comments violate lets talk,['rcfb'],"['oregonstate', 'lasvegas']",oh shit forgot colorado next week oh jesus
17is9rl,k6wrtmj,arizona 1030,location arizonafarizona arizona time 1030 watch tv espnlespn rcfb made rcfb please keep trash talk civil report comments violate lets talk,['rcfb'],"['oregonstate', 'lasvegas']",ah thank aaron rodgers tom brady roughing passer bullshit really appreciated cheers
17sxeaj,k8tuti4,maryland nebraska 1200,location memorial lincoln ne time 1200 watch tv peacocklpeacock rcfb made rcfb please keep trash talk civil report comments violate lets talk,['rcfb'],"['maryland', 'lasvegas']",10 minutes left due 4 5 turnovers least
16jq8tf,k0rwt2l,army utsa 700,armyfarmyarmy utsafutsautsa location utsafutsa alamodome time 700 watch tv espnlespn rcfb made rcfb please keep trash talk civil report comments violate lets talk,['rcfb'],"['oregonstate', 'lasvegas']",oh man watching pass rush fucked bad never gotten
16jq8tf,k0ryxm6,army utsa 700,armyfarmyarmy utsafutsautsa location utsafutsa alamodome time 700 watch tv espnlespn rcfb made rcfb please keep trash talk civil report comments violate lets talk,['rcfb'],"['oregonstate', 'lasvegas']",finally espn guy spine crapping realignment cheers pal
16jq8tf,k0s49c8,army utsa 700,armyfarmyarmy utsafutsautsa location utsafutsa alamodome time 700 watch tv espnlespn rcfb made rcfb please keep trash talk civil report comments violate lets talk,['rcfb'],"['oregonstate', 'lasvegas']",comes bangbang play thursday night nonsense bad nocall right imo
16jq8tf,k0s6poa,army utsa 700,armyfarmyarmy utsafutsautsa location utsafutsa alamodome time 700 watch tv espnlespn rcfb made rcfb please keep trash talk civil report comments violate lets talk,['rcfb'],"['oregonstate', 'lasvegas']",goes expect nocall opi probably prevented one best games weekend instant classic potential sure
17sxe9k,k8u2tmj,indiana illinois 1200,location memorial champaign il time 1200 watch tv big ten networklbtn odds spread ill 65 overunder 435 rcfb made rcfb please keep trash talk civil report comments violate lets talk,['rcfb'],"['maryland', 'lasvegas']",stake butthole puckered
17yj88b,k9ulog6,washington 730,location reser time 730 watch tv abclabc rcfb made rcfb please keep trash talk civil report comments violate lets talk,['rcfb'],"['oregonstate', 'lasvegas']",god fucking dammit jonathan smith youve gotta joking two three losses season
1694dym,jz026cc,san jos 330,san jos jos location san jos cefcu time 330 watch tv cbslcbs odds spread orst 165 overunder 545 rcfb made rcfb please keep trash talk civil report comments violate lets talk,"['oregonstate', 'summertimelover']","['oregonstate', 'lasvegas']",holy make call looks like mw refs aint upgrade
177vtvk,k4wjslc,illinois maryland 330,location secu time 330 watch tv nbclnbc odds spread md 14 overunder 510 rcfb made rcfb please keep trash talk civil report comments violate lets talk,['rcfb'],"['maryland', 'lasvegas']",kinda cool kicker served australian army wonder fought emu great emu war
17d92h6,k5vmpks,washington 330,washington location oregonforegon autzen time 330 watch tv abclabc rcfb made rcfb please keep trash talk civil report comments violate lets talk,['rcfb'],"['oregonstate', 'lasvegas']",ah yes carabao cup truly forefront sports entertainment
17d92h6,k5vnvxu,washington 330,washington location oregonforegon autzen time 330 watch tv abclabc rcfb made rcfb please keep trash talk civil report comments violate lets talk,['rcfb'],"['oregonstate', 'lasvegas']",look hes punting balls hes fun might lose back back weeks
17d92h6,k5voii3,washington 330,washington location oregonforegon autzen time 330 watch tv abclabc rcfb made rcfb please keep trash talk civil report comments violate lets talk,['rcfb'],"['oregonstate', 'lasvegas']",dude receiver nuts hangs one arm every time scoops air
15hhp9o,juoy6mn,team impacted realignment affect experience fan,obviously winner recruitment pitch travel opportunities appealing downside ticket prices going get insane,"['texas', 'caa']","['maryland', 'lasvegas']",seattle based terp would love uw join big 10 go maryland games without fly
16hxs91,k0ikvrh,unpopular opinion team,whats opinion team fan base fans team would disagree mine id like keep playing land feet think hatred thats increased offseason would make games fun watch,['oregonstate'],"['oregonstate', 'lasvegas']",unpopular opinion unpopular opinion isnt actually unpopular opinion
162rw9j,jxyznz8,college gameday discussion whats consensus pat mcafee,hes getting torched social media people seem frustrated david pollack got cut whats consensus,['oklahomastate'],"['oregonstate', 'lasvegas']",seem much minority say like show personality said prefer gameday earth discussion rather bombastic type show hosts hes permanent member basically inevitable transformation
15vd1bk,jwv9sp2,predictions favorite team,prediction 11 1 losing gets back order kicks crap everybody rest year right number two playoffs goes win probably big 10 school,[],"['oregonstate', 'lasvegas']",going improve massively dju center wont win pac12 well least beat usc make new years bowl
167pwk2,jyrvzcr,stanford hawaii 1100,location hawaiifhawaii clarence tc ching athletics complex time 1100 watch tv cbs sports networklcbssn odds spread stan 35 overunder 605 rcfb made rcfb please keep trash talk civil report comments violate lets talk,"['stanford', 'medal']","['maryland', 'lasvegas']",1137am hotel india found youtube stream indian mans desktop showing choppy version see moving mouse everything qualify sicko
183jc7m,kapil7g,espn college gameday show,want little ting tang tang discuss post anything related show signs screencaps videos etc,['rcfb'],"['maryland', 'lasvegas']",seattle based terp one excited uw join finally drive maryland games next year uw 2027
16qh8bv,k1y00rn,akron indiana 730,location indianafindiana memorial bloomington time 730 watch tv rcfb made rcfb please keep trash talk civil report comments violate lets talk,['rcfb'],"['maryland', 'lasvegas']",well feel lot comfortable next weeks
15oro41,jvuorie,kinda feel like last season college anyone else,like year implosion pac expanded playoff feel anyone else like sport 2024 gonna completely foreign like im still gonna watch completely different product,"['hateful8', 'utahstate']","['oregonstate', 'lasvegas']",agree herbstreit said pat mcafee much lameduck year compared next year dont think college athletics let alone year course im going keep watching love school sport want support growth even conferences dont want see us grow
15z8uel,jxfq7qo,hypothetical bet life one 10 schools reaching cfb national championship within next 10 years one would choose,assume life stake need one 10 schools reach cfb national championship within next 10 years continue living school going arizona kansas missouri north carolina purdue south carolina tech virginia tech wisconsin,['georgia'],"['oregonstate', 'lasvegas']",ranked least likely kstate osu sc uw nc vt tt purdue asu missouri
16o2a6c,k1iggxl,whats painful loss teams history,2018 national championship rutgers every saturday,"['georgia', 'rutgers']","['wisconsin', 'lasvegas']",probably 2011 though personal pick would 2012 rose bowl
16wnezr,k2yprch,washington arizona 1000,location arizonafarizona arizona time 1000 watch tv pac12 networklp12n rcfb made rcfb please keep trash talk civil report comments violate lets talk,['rcfb'],"['maryland', 'lasvegas']",thank god one big 10 desert huskies
