post_id,comment_id,post_title,post_selftext,post_author_flairs,comment_author_flairs,comment_body
17myplv,k7q4pr0,team watchcheer zero connection,dad tennessee alum thats obviously main team talking day mentioned surfs rice message boards fun kind surprising know rice message boards also watches service academies whenever served personally love kansas even leipold liked logo uniforms liked rooting underdog white helmet favorite,"['mississippistate', 'santamonica']","['oregon', 'linfield']",uncanny pull towards west virginia going almost 20 years absolutely loved offense pat white steve slaton owen schmitt fullback entertaining level batshit crazy smashing head helmet hes pariah morgantown richrods offenses fun couch burning singing pop country song memorized day whenever win lined im still dreaming day ducks schedule home home id absolutely love see
177vtsq,k4w4ypo,washington 330,location husky time 330 watch tv abclabc odds spread wash 3 overunder 670 rcfb made rcfb please keep trash talk civil report comments violate lets talk,['rcfb'],"['oregon', 'linfield']",really come full circle tosh players fake injuries cal washington us back day us hate shit
177vtsq,k4wlhck,washington 330,location husky time 330 watch tv abclabc odds spread wash 3 overunder 670 rcfb made rcfb please keep trash talk civil report comments violate lets talk,['rcfb'],"['oregon', 'linfield']",immortal words nature boy ric flair sterling archer
177vtsq,k4wqa9y,washington 330,location husky time 330 watch tv abclabc odds spread wash 3 overunder 670 rcfb made rcfb please keep trash talk civil report comments violate lets talk,['rcfb'],"['oregon', 'linfield']",sucks objectively hell good chance wont last time see season
177vtsq,k4wqddh,washington 330,location husky time 330 watch tv abclabc odds spread wash 3 overunder 670 rcfb made rcfb please keep trash talk civil report comments violate lets talk,['rcfb'],"['oregon', 'linfield']",hate week good win huskies hate
16w91ub,k2vw0kq,usc colorado 1200,uscfuscusc location folsom time 1200 watch tv foxlfox rcfb made rcfb please keep trash talk civil report comments violate lets talk,['rcfb'],"['linfield', 'oregon']",think cu fans going rush cover spread
16w91ub,k2w0isz,usc colorado 1200,uscfuscusc location folsom time 1200 watch tv foxlfox rcfb made rcfb please keep trash talk civil report comments violate lets talk,['rcfb'],"['linfield', 'oregon']",cant believe usc mean letting cu win makes wonder racist
16w91ub,k2w27q8,usc colorado 1200,uscfuscusc location folsom time 1200 watch tv foxlfox rcfb made rcfb please keep trash talk civil report comments violate lets talk,['rcfb'],"['oregon', 'linfield']",uh oh usc allowed brady mode activated first half things could get interesting
17nxe14,k7v50qf,washington usc 730,uscfuscusc location uscfusc los angeles memorial coliseum time 730 watch tv abclabc rcfb made rcfb please keep trash talk civil report comments violate lets talk,['rcfb'],"['oregon', 'linfield']",holy shit im still pulling jaw floor catch
17iov84,k6wfsd9,colorado ucla 730,uclafuclaucla location uclafucla rose bowl time 730 watch tv abclabc rcfb made rcfb please keep trash talk civil report comments violate lets talk,['rcfb'],"['linfield', 'oregon']",really like sanders went get first
17iov84,k6wqqnh,colorado ucla 730,uclafuclaucla location uclafucla rose bowl time 730 watch tv abclabc rcfb made rcfb please keep trash talk civil report comments violate lets talk,['rcfb'],"['linfield', 'oregon']",30 one minute left better scoring garbage time touchdowns better sanders
1840c06,kasi01v,california ucla 1030,uclafuclaucla location uclafucla rose bowl time 1030 watch tv espnlespn rcfb made rcfb please keep trash talk civil report comments violate lets talk,['rcfb'],"['oregon', 'linfield']",chaps final sendoff hell run
17dhxtg,k5xhccx,arizona washington 1030,arizona location husky time 1030 watch tv fox sports 1lfs1 rcfb made rcfb please keep trash talk civil report comments violate lets talk,['rcfb'],"['oregon', 'linfield']",bigger forces play talent letdown last week washingtons general cursed nature asu historically top normal dark hijinx thing makes sense big ol voodoo orgy
17dhxtg,k5xl0v7,arizona washington 1030,arizona location husky time 1030 watch tv fox sports 1lfs1 rcfb made rcfb please keep trash talk civil report comments violate lets talk,['rcfb'],"['oregon', 'linfield']",theres dillingham know hate thats dude outsmart like
17dhxtg,k5xmxip,arizona washington 1030,arizona location husky time 1030 watch tv fox sports 1lfs1 rcfb made rcfb please keep trash talk civil report comments violate lets talk,['rcfb'],"['linfield', 'oregon']",huskies lack run going really blow face qb knee falls apart
16k8ivo,k0uyn7i,danny kanell get boat raced usc networks try milk colorado story winnable asu analysts afraid criticize deion personal business,,"['michigan', 'fau']","['oregon', 'linfield']",fan need see better secondary play say theyre gonna boat race colorado lock colorado receivers could get ugly tech indicator shootout usc utah better chance stomping colorado right
17yj88b,k9tyo4i,washington 730,location reser time 730 watch tv abclabc rcfb made rcfb please keep trash talk civil report comments violate lets talk,['rcfb'],"['washington', 'linfield']",huskies first drive rain run dj run dj pass westover 1st pass odunze 1st run odunze run dj run dj 1st run dj pass mcmillian incomplete pass odunze u c h w n
17yj88b,k9u06w4,washington 730,location reser time 730 watch tv abclabc rcfb made rcfb please keep trash talk civil report comments violate lets talk,['rcfb'],"['washington', 'linfield']",states first series rain run 4yds pass incomplete pass incomplete wash offsides 3rd 1 run qb 1st run 1st wash missed tackle pass incomplete wash broke pass 1st run 1st run 5 yds run td damnit osu nicely balanced offense expected
17yj88b,k9u7nyx,washington 730,location reser time 730 watch tv abclabc rcfb made rcfb please keep trash talk civil report comments violate lets talk,['rcfb'],"['washington', 'linfield']",f r w n r u n
17yj88b,k9u7qeh,washington 730,location reser time 730 watch tv abclabc rcfb made rcfb please keep trash talk civil report comments violate lets talk,['rcfb'],"['washington', 'linfield']",e p 1 1 r f r w n
17yj88b,k9u88xa,washington 730,location reser time 730 watch tv abclabc rcfb made rcfb please keep trash talk civil report comments violate lets talk,['rcfb'],"['washington', 'linfield']",u n z e u c h w n
17yj88b,k9uf5jq,washington 730,location reser time 730 watch tv abclabc rcfb made rcfb please keep trash talk civil report comments violate lets talk,['rcfb'],"['linfield', 'oregon']",osu figuring running ball might key
17ijvxl,k6vtexk,byu 330,byufbyubyu location texasftexas dkrtexas memorial time 330 watch tv rcfb made rcfb please keep trash talk civil report comments violate lets talk,['rcfb'],"['oregon', 'linfield']",sark headed matrix shades
17lfys0,k7gyk8p,honest question nonmichigan fans expect punishment umichharbaugh based know right,ive seen lot different answers people expecting different threads curious consensus among fanbases moment simplicity lets also assume harbaugh stays least years hell around sanctions course theres real chance leaves faces punishment lets assume doesnt discussion,['michigan'],"['oregon', 'linfield']",harbaugh go nfl punishment handed previous wins question vacated probably cfp bowl ban years
17yellt,k9t84t5,arizona 400,arizona location arizona mountain america time 400 watch tv foxlfox odds spread ore 24 overunder 535 rcfb made rcfb please keep trash talk civil report comments violate lets talk,['rcfb'],"['linfield', 'oregon']",anyone else hoping 32 final
17yellt,k9trvg3,arizona 400,arizona location arizona mountain america time 400 watch tv foxlfox odds spread ore 24 overunder 535 rcfb made rcfb please keep trash talk civil report comments violate lets talk,['rcfb'],"['linfield', 'oregon']",still hasnt made yet offenses really need start playing
17d92h6,k5vfgcc,washington 330,washington location oregonforegon autzen time 330 watch tv abclabc rcfb made rcfb please keep trash talk civil report comments violate lets talk,['rcfb'],"['oregon', 'linfield']",gonna start gofundme whatever buy espn rg3 never announces opposite gamed
16qht7n,k1x73xs,postgame defeats colorado 426,box score provided team 1 2 3 4 made rcfb,['rcfb'],"['oregon', 'linfield']",would like let buffalo fans know fully support hope prime co figure stuff take usc ill get back prime train means usc goes
17o30hq,k7vwwq9,postgame washington defeats usc 5242,box score provided team 1 2 3 4 made rcfb,['rcfb'],"['washington', 'linfield']",according usc fans twitter least one recruit sitting right behind usc bench rooting washington usc seems mad
189go22,kbrq7bo,florida louisville 800,florida location bank america time 800 watch tv abclabc odds spread fsu 15 overunder 465 rcfb made rcfb please keep trash talk civil report comments violate lets talk,['rcfb'],"['oregon', 'linfield']",mike reminds overly athletic age uncle
15z2rv0,jxfc3yl,teams embarrassing miserable worst result time,want answers,"['wichitastate', 'applecup']","['oregon', 'linfield']",got listed follows personal order theyre pretty damn close 1 washington 70 21 autzen 2016 2 tcu 47 41 3ot 2016 alamo bowl 3 indiana 30 24 autzen 2004
16h8pal,k0ckp5y,tier would rank coaching job,clearly offer lot money theres tier think falls would considered destination job coaches think would leave current job go msu,"['floridastate', 'lsu']","['oregon', 'linfield']",top 2025 job upper crust huge gap either
18wi2m2,kfxzjtu,postgame washington defeats 3731,box score provided team 1 2 3 4 made rcfb,['rcfb'],"['oregon', 'linfield']",lot fun watching chaos involving washington team isnt receiving end x2
16eei9r,jzv3syx,postgame colorado defeats nebraska 3614,box score provided team 1 2 3 4 made rcfb,"['nebraska2', 'santamonica']","['oregon', 'linfield']",colorado needs figure run want win consistently every pac12 defense gonna put serious pressure sanders non stop far havent seen real run threat keep linebackers line place
17yhx27,k9tvxsv,north florida 630,north florida location florida doak campbell time 630 watch tv cwlcw rcfb made rcfb please keep trash talk civil report comments violate lets talk,['rcfb'],"['linfield', 'oregon']",think norvell calls tamu job halftime
17yhx27,k9u3ecc,north florida 630,north florida location florida doak campbell time 630 watch tv cwlcw rcfb made rcfb please keep trash talk civil report comments violate lets talk,['rcfb'],"['linfield', 'oregon']",11 bad fcs team fsu overrated
17taiot,k8w52hp,usc 1030,uscfuscusc location oregonforegon autzen time 1030 watch tv foxlfox odds spread ore 15 overunder 735 rcfb made rcfb please keep trash talk civil report comments violate lets talk,['rcfb'],"['oregon', 'linfield']",22 7 still playing sloppy dan going kick ass halftime
17taiot,k8wafqv,usc 1030,uscfuscusc location oregonforegon autzen time 1030 watch tv foxlfox odds spread ore 15 overunder 735 rcfb made rcfb please keep trash talk civil report comments violate lets talk,['rcfb'],"['oregon', 'linfield']",milky way loving bumper music tonight
17taiot,k8wagz1,usc 1030,uscfuscusc location oregonforegon autzen time 1030 watch tv foxlfox odds spread ore 15 overunder 735 rcfb made rcfb please keep trash talk civil report comments violate lets talk,['rcfb'],"['linfield', 'oregon']",fun usc giving td every play
17taiot,k8wbg2f,usc 1030,uscfuscusc location oregonforegon autzen time 1030 watch tv foxlfox odds spread ore 15 overunder 735 rcfb made rcfb please keep trash talk civil report comments violate lets talk,['rcfb'],"['oregon', 'linfield']",bucky back even doesnt anything back makes better
16eiux6,jzwcamj,tech 700,tech location techftexastech jones att time 700 watch tv foxlfox odds spread ore 3 overunder na rcfb made rcfb please keep trash talk civil report comments violate lets talk,['rcfb'],"['oregon', 'linfield']",glad see cute 4th downs didnt get left last year
