post_id,comment_id,post_title,post_selftext,post_author_flairs,comment_author_flairs,comment_body
18wbuu4,kfxbv4b,sugar bowl washington 845,location caesars superdome time 845 watch tv espnlespn odds spread tex 35 overunder 625 rcfb made rcfb please keep trash talk civil report comments violate lets talk,['rcfb'],['montclairstate'],could see coming
18wbuu4,kfxy081,sugar bowl washington 845,location caesars superdome time 845 watch tv espnlespn odds spread tex 35 overunder 625 rcfb made rcfb please keep trash talk civil report comments violate lets talk,['rcfb'],['montclairstate'],ah ol catch discussion see sides insane
16q6omx,k1w6d00,florida clemson 1200,florida location clemsonfclemson memorial clemson sc time 1200 watch tv abclabc rcfb made rcfb please keep trash talk civil report comments violate lets talk,['rcfb'],['montclairstate'],real question noles dont kicker 50 long theyre national championship challenger kicker big leg tbh
18w6kt1,kfw6rqo,rose bowl 500,location rose bowl time 500 watch tv espnlespn odds spread mich 2 overunder 455 rcfb made rcfb please keep trash talk civil report comments violate lets talk,['rcfb'],"['montclairstate', 'michigan']",coaches worse time prepare harbaugh team always much cleaner week prepare month long break
18w6kt1,kfw7ag7,rose bowl 500,location rose bowl time 500 watch tv espnlespn odds spread mich 2 overunder 455 rcfb made rcfb please keep trash talk civil report comments violate lets talk,['rcfb'],['montclairstate'],8 left first give trophy
17ifk69,k6uz7zj,kansas 1200,location kansasfkansas david booth kansas memorial time 1200 watch tv foxlfox rcfb made rcfb please keep trash talk civil report comments violate lets talk,['rcfb'],['montclairstate'],people talk lincoln riley jumping nfl lance leipold always amazed play designs every week
189ycsz,kbu6kie,thamel college playoff 1 2 washington 3 4 5 florida 6georgia,nan,"['texas', 'williammary']",['montclairstate'],integrity knew format discontinued said f really bad look even means competitive games
16vrr41,k2tcnif,utah 900,utahfutahutah location reser time 900 watch tv fox sports 1lfs1 odds spread utah 25 overunder na rcfb made rcfb please keep trash talk civil report comments violate lets talk,['rcfb'],['montclairstate'],utah fans acting like catch lol hes rb throw brutal
16vrr41,k2td41j,utah 900,utahfutahutah location reser time 900 watch tv fox sports 1lfs1 odds spread utah 25 overunder na rcfb made rcfb please keep trash talk civil report comments violate lets talk,['rcfb'],['montclairstate'],know barnes brutal baylor maybe give shot johnson looking like
17glplv,k6hqk76,walker via footballscoop michigans cheating top helped teams cheat might dirtiest team college history,,"['ohiostate2', 'ncaa']","['missouri', 'montclairstate']",ahh fuck knew drinks resurgence good true
17d92kt,k5vorvf,south carolina missouri 330,south carolina location memorial stadiumfaurot time 330 watch tv sec networklsecn rcfb made rcfb please keep trash talk civil report comments violate lets talk,['rcfb'],"['missouri', 'montclairstate']",wasnt sure season brady cook absolutely capable carrying grand tradition qbs holding clipboard sundays
16ei5o7,jzwdo3n,middle tennessee missouri 700,middle tennessee location memorial stadiumfaurot time 700 watch tv espnlespn sec networklsecn rcfb made rcfb please keep trash talk civil report comments violate lets talk,"['illinois', 'missouri']","['missouri', 'montclairstate']",saw someone new york license plate tiger tail trunki feel especially bad drove way see
16ei5o7,jzweyib,middle tennessee missouri 700,middle tennessee location memorial stadiumfaurot time 700 watch tv espnlespn sec networklsecn rcfb made rcfb please keep trash talk civil report comments violate lets talk,"['illinois', 'missouri']","['missouri', 'montclairstate']",ends mizzou going 3 mtsu scoring last second td
191zla4,kgze49d,cfp final washington 730,location nrg time 730 watch tv espnlespn odds spread mich 55 overunder 555 rcfb made rcfb please keep trash talk civil report comments violate lets talk,['rcfb'],['montclairstate'],idk bursitis sack doesnt sound good
191zla4,kgzpwou,cfp final washington 730,location nrg time 730 watch tv espnlespn odds spread mich 55 overunder 555 rcfb made rcfb please keep trash talk civil report comments violate lets talk,['rcfb'],"['syracuse', 'montclairstate']",penix didnt fuck pass tied going half
191zla4,kgztu4f,cfp final washington 730,location nrg time 730 watch tv espnlespn odds spread mich 55 overunder 555 rcfb made rcfb please keep trash talk civil report comments violate lets talk,['rcfb'],"['montclairstate', 'michigan']",bottom line 04 3rd 01 4th wont get done like last week could built bigger lead failed capitalize
191zla4,kh02i7p,cfp final washington 730,location nrg time 730 watch tv espnlespn odds spread mich 55 overunder 555 rcfb made rcfb please keep trash talk civil report comments violate lets talk,['rcfb'],['montclairstate'],feet caused trip replay shows foot getting hit
191zla4,kh067c1,cfp final washington 730,location nrg time 730 watch tv espnlespn odds spread mich 55 overunder 555 rcfb made rcfb please keep trash talk civil report comments violate lets talk,['rcfb'],"['syracuse', 'montclairstate']",penix lost washington hell time come small
191zla4,kh08kh8,cfp final washington 730,location nrg time 730 watch tv espnlespn odds spread mich 55 overunder 555 rcfb made rcfb please keep trash talk civil report comments violate lets talk,['rcfb'],['montclairstate'],really dog fight salt crazy got caught cheating way worse programs cheating getting away w
176it07,k4mtye6,west virginia houston 700,west virginia location houstonfhouston tdecu time 700 watch tv fox sports 1lfs1 odds spread wvu 25 overunder 515 rcfb made rcfb please keep trash talk civil report comments violate lets talk,['rcfb'],['montclairstate'],drink every time someone houston misses tackle hospital alcohol poisoning half
176it07,k4n25qz,west virginia houston 700,west virginia location houstonfhouston tdecu time 700 watch tv fox sports 1lfs1 odds spread wvu 25 overunder 515 rcfb made rcfb please keep trash talk civil report comments violate lets talk,['rcfb'],['montclairstate'],houston leading half hilarious played bad lol
176it07,k4n77gi,west virginia houston 700,west virginia location houstonfhouston tdecu time 700 watch tv fox sports 1lfs1 odds spread wvu 25 overunder 515 rcfb made rcfb please keep trash talk civil report comments violate lets talk,['rcfb'],['montclairstate'],worst call cfb slate thats awful
176it07,k4n7kk9,west virginia houston 700,west virginia location houstonfhouston tdecu time 700 watch tv fox sports 1lfs1 odds spread wvu 25 overunder 515 rcfb made rcfb please keep trash talk civil report comments violate lets talk,['rcfb'],['montclairstate'],houstons defense shit begin refs fucking doesnt help
17j3xdt,k6ypbar,deion sanders colorados offensive line struggling protect shedeur big picture go get new lineman thats picture ima paint perfectly,nan,[],['montclairstate'],honestly deion performing well colorado really share lot similar qualities trump thats really bad thing lol
18vzm3k,kfuoff3,reliaquest bowl lsu wisconsin 1200,lsuflsulsu location raymond james time 1200 watch tv espn2lespn2 odds spread lsu 85 overunder 575 rcfb made rcfb please keep trash talk civil report comments violate lets talk,['rcfb'],['montclairstate'],gosh today great day love college
18risi1,kf1y98c,first responder bowl rice 530,ricefricerice location gerald j ford time 530 watch tv espnlespn espnlespn odds spread txst 35 overunder 595 rcfb made rcfb please keep trash talk civil report comments violate lets talk,['rcfb'],['montclairstate'],horrible whole changed cause bullshit
16w91ub,k2wktsn,usc colorado 1200,uscfuscusc location folsom time 1200 watch tv foxlfox rcfb made rcfb please keep trash talk civil report comments violate lets talk,['rcfb'],['montclairstate'],bruh announcers colorado 0 timeouts regardless lol always gonna onside
17iov84,k6wgcef,colorado ucla 730,uclafuclaucla location uclafucla rose bowl time 730 watch tv abclabc rcfb made rcfb please keep trash talk civil report comments violate lets talk,['rcfb'],"['missouri', 'montclairstate']",shocking final golden bachelor decides marry three dramatic rose ceremony bachelor history
18taa8w,kfdkojd,alamo bowl arizona 915,location alamodome time 915 watch tv espnlespn espnlespn odds spread ariz 25 overunder 595 rcfb made rcfb please keep trash talk civil report comments violate lets talk,['rcfb'],['montclairstate'],gonna watch creator way better completely impartial enjoying good ass college
18u1f6v,kfih5bg,cotton bowl ohio missouri 800,ohio location att time 800 watch tv espnlespn espnlespn odds spread osu 5 overunder 495 rcfb made rcfb please keep trash talk civil report comments violate lets talk,['rcfb'],['montclairstate'],hot take ohio adding qb portal
1780tdz,k4wzhby,usc notre dame 730,uscfuscusc notre dame location notre damefnotredame notre dame time 730 watch tv nbclnbc peacocklpeacock odds spread nd 3 overunder 630 rcfb made rcfb please keep trash talk civil report comments violate lets talk,['rcfb'],['montclairstate'],yeah sneak extremely slow developing run 5 yards behind line trick
172das0,k3wr8w6,330,amftexasamtexas location amftexasam kyle time 330 watch tv cbslcbs rcfb made rcfb please keep trash talk civil report comments violate lets talk,['rcfb'],['montclairstate'],burton incredible im ignorant knowing
17ifk98,k6umhb5,maryland northwestern 1200,location ryan time 1200 watch tv big ten networklbtn rcfb made rcfb please keep trash talk civil report comments violate lets talk,['rcfb'],['montclairstate'],northwestern 15 card theyre quietly competitive sleepy terps
16qbmxz,k1wbp6p,ucla utah 330,uclafuclaucla utahfutahutah location utahfutah riceeccles time 330 watch tv rcfb made rcfb please keep trash talk civil report comments violate lets talk,['rcfb'],['montclairstate'],watching utah seems dominating defense still think moore uclas best option though
17d4h6j,k5ujyer,penn ohio 1200,penn ohio location ohio statefohiostate ohio time 1200 watch tv foxlfox rcfb made rcfb please keep trash talk civil report comments violate lets talk,['rcfb'],"['missouri', 'montclairstate']",kid thought called nifty lions also thought lions nifty
17d4h6j,k5ukf4r,penn ohio 1200,penn ohio location ohio statefohiostate ohio time 1200 watch tv foxlfox rcfb made rcfb please keep trash talk civil report comments violate lets talk,['rcfb'],"['missouri', 'montclairstate']",fun fact gus johnson developed voice foxs international soccer coverage wed calling maserati messi
17d4h6j,k5umuw1,penn ohio 1200,penn ohio location ohio statefohiostate ohio time 1200 watch tv foxlfox rcfb made rcfb please keep trash talk civil report comments violate lets talk,['rcfb'],"['missouri', 'montclairstate']",wasnt watching thought bill parcels balfour ad
17d4h6j,k5v8ws9,penn ohio 1200,penn ohio location ohio statefohiostate ohio time 1200 watch tv foxlfox rcfb made rcfb please keep trash talk civil report comments violate lets talk,['rcfb'],"['montclairstate', 'michigan']",bottom line far ohio st talented outside penn st osu recievers able get separation penn st recievers cant also ohio sts dline winning penn st oline
