post_id,comment_id,post_title,post_selftext,post_author_flairs,comment_author_flairs,comment_body
18wbuu4,kfxfxww,sugar bowl washington 845,location caesars superdome time 845 watch tv espnlespn odds spread tex 35 overunder 625 rcfb made rcfb please keep trash talk civil report comments violate lets talk,['rcfb'],"['arizona', 'northernarizona']",im neutral known huskies paid refs woulda thrown money
18wbuu4,kfxi8a5,sugar bowl washington 845,location caesars superdome time 845 watch tv espnlespn odds spread tex 35 overunder 625 rcfb made rcfb please keep trash talk civil report comments violate lets talk,['rcfb'],"['arizona', 'northernarizona']",cleaner played bama earlier
18wbuu4,kfxx51d,sugar bowl washington 845,location caesars superdome time 845 watch tv espnlespn odds spread tex 35 overunder 625 rcfb made rcfb please keep trash talk civil report comments violate lets talk,['rcfb'],"['northernarizona', 'stanford']",man get wanting first sucks didnt take knee
16qzss2,k21zuce,complain team,vent friendly place,['rcfb'],"['ucla', 'northernarizona']",surely utahs defense cant good oline must trash
16npqej,k1fzkme,week 4 matchup preview 20 colorado buffaloes 10 ducks,20 10 oregonforegon saturday september 23 0330 eastern autzen eugene watch abclabc odds oregonforegon 210 pts total points 705 alltime series oregonforegon oregonforegon met 24 times since 10151949 teams last met 319 days ago 11052022 series wins 9015 oregonforegon longest streak continuous meetings 6 20112016 oregonforegon last 3 meetings 20192022 series last 5 meetings co1049 or2952 or345 or4138 co2441 series comparison data via week 3 3000result 1tcuftcu 2110w 4542portland 1200w 817 1201w 3614texas techftexastech 1200w 3830 3colorado 0200w 1300w 5510 rankings reflect current rcfb injury report data scraped 20230920 100014 alton mccaskill ivrbques sat kneemon sep 18mccaskill sat previous three games recovering acl tear availability saturday known javon antoniowrques sat shouldermon sep 18antonio sat last two contests shoulder injury unclear lace saturday myles slushersques sat undisclosedmon sep 18slusher missed last two matches undefined injury yet determined face saturday louis passarelloteout indefinitely kneethu aug 17passarello sidelined knee injury timetable return yet established van wellscques sat legmon sep 18wells sat previous contest leg injury status saturdays battle versus known travis huntercbmid oct undisclosedmon sep 18hunter idle unspecified injury expected remain shut sometime october earliest cormani mcclaincbques sat undisclosedmon sep 18mcclain held last three games unspecified ailment remains seen take saturdays matchup injury data lifted oregonforegon injury report data scraped 20230920 100014 josh delgadowrques sat undisclosedmon sep 18delgado missed last three contests unknown injury unknown play colorado saturday injury data lifted keys think wins think favorite cover spread players interested watch lets talk vote matchup win poll simply include name team think win enclosed part top level comment discussing matchup change vote edit initial comment bracket team change vote often like posted full listing accepted fbs team aliases found fcs teams need use full name appears post title listing links live vote totals matchup preview threads current week found like format generate matchup discussion matchup discussion please dm udupreesdiamond regarding template,"['oregonstate', 'summertimelover']","['northernarizona', 'texas']",closer people think still pac
17j4q9q,k6yp7e8,complain team,vent friendly place,['rcfb'],"['arizona', 'northernarizona']",last week get pnw team home dark
166ov2x,jylbw3g,kent ucf 700,kent ucffucfucf location ucffucf fbc mortgage time 700 watch tv fox sports 1lfs1 odds spread ucf 36 overunder 560 rcfb made rcfb please keep trash talk civil report comments violate lets talk,"['iowastate', 'southdakotastate']","['northernarizona', 'floridastate2']",isnt penalty wear short pants dont cover knees wheres zebra friend
17deytd,k5wzr30,utah usc 800,utahfutahutah uscfuscusc location uscfusc los angeles memorial coliseum time 800 watch tv foxlfox rcfb made rcfb please keep trash talk civil report comments violate lets talk,['rcfb'],"['northernarizona', 'stanford']",wouldve thought utah backup qb season would stay natty contention longer usc
16jq8ru,k0rn4y3,virginia maryland 700,location secu time 700 watch tv fox sports 1lfs1 rcfb made rcfb please keep trash talk civil report comments violate lets talk,['rcfb'],"['northernarizona', 'floridastate2']",holy shit goal looked like playing golf know im going slice shit aim 30 yards side
17nng69,k7t7ry1,kansas 1200,kansas location texasftexas dkrtexas memorial time 1200 watch tv foxlfox odds spread tex 4 overunder 505 rcfb made rcfb please keep trash talk civil report comments violate lets talk,['rcfb'],"['northernarizona', 'texas']",keep trying honest god kick fg
17nng69,k7tam3o,kansas 1200,kansas location texasftexas dkrtexas memorial time 1200 watch tv foxlfox odds spread tex 4 overunder 505 rcfb made rcfb please keep trash talk civil report comments violate lets talk,['rcfb'],"['northernarizona', 'texas']",expectable thing playing like shit big lead dont understand consistently issue us years
17nng69,k7tojjx,kansas 1200,kansas location texasftexas dkrtexas memorial time 1200 watch tv foxlfox odds spread tex 4 overunder 505 rcfb made rcfb please keep trash talk civil report comments violate lets talk,['rcfb'],"['northernarizona', 'texas']",theyre nothing dangerous us big lead well probably get dominant god team stressful
16e7uxq,jzusysw,utah baylor 1200,utahfutahutah location baylorfbaylor mclane time 1200 watch tv espnlespn rcfb made rcfb please keep trash talk civil report comments violate lets talk,['rcfb'],"['arizonastate', 'northernarizona']",first time ive ever seen one team let score player purposely scoring top
16yz0x3,k3f4oev,whose talent team waste school,knew utilizing nico collins enough watching pros proves whose talent school waste,"['michigan', 'littlebrownjug']","['ucla', 'northernarizona']",arian foster 4th string back tennessee kiffin
18w6kt1,kfwwy0h,rose bowl 500,location rose bowl time 500 watch tv espnlespn odds spread mich 2 overunder 455 rcfb made rcfb please keep trash talk civil report comments violate lets talk,['rcfb'],"['northernarizona', 'fiu']",wonder harbaugh puts legacy line goes two
183w2c9,kasfq50,florida florida 700,florida location floridafflorida ben hill griffin time 700 watch tv espnlespn rcfb made rcfb please keep trash talk civil report comments violate lets talk,['rcfb'],"['michigan', 'northernarizona']",kirk herbstreit comment year guy writhing pain
172s434,k3ygkp5,postgame usc defeats arizona 4341 3ot,box score provided team 1 2 3 4 ot made rcfb,['rcfb'],"['northernarizona', 'pac12']",could almost excuse tucson caleb williams also incredible
17szvco,k8tpqqw,arizona colorado 200,location folsom time 200 watch tv pac12 networklp12n odds spread ariz 10 overunder 555 rcfb made rcfb please keep trash talk civil report comments violate lets talk,['rcfb'],"['arizona', 'northernarizona']",jedd cmon shouldnt using two timeouts first quarter
17szvco,k8u0k7z,arizona colorado 200,location folsom time 200 watch tv pac12 networklp12n odds spread ariz 10 overunder 555 rcfb made rcfb please keep trash talk civil report comments violate lets talk,['rcfb'],"['arizona', 'northernarizona']",noah late throws lot today
17szvco,k8u1235,arizona colorado 200,location folsom time 200 watch tv pac12 networklp12n odds spread ariz 10 overunder 555 rcfb made rcfb please keep trash talk civil report comments violate lets talk,['rcfb'],"['arizona', 'northernarizona']",cant handle us zendejas dont deserve us loop
17szvco,k8ujkf6,arizona colorado 200,location folsom time 200 watch tv pac12 networklp12n odds spread ariz 10 overunder 555 rcfb made rcfb please keep trash talk civil report comments violate lets talk,['rcfb'],"['arizona', 'northernarizona']",prime portal speak looking new kicker
18sx6e0,kfb7on1,ever one favorite college players end least favorite nfl team conversely ever college player couldnt stand end favorite nfl team go,fan kansas jayhawks kansas city chiefs ive seen missouri tigers kstate wildcats end chiefs roster cant say dramatic way chiefs draft kstate player felix anudikeuzomah first round earlier year cant say stood player disliked college nick bolton mizzou drafted chiefs second round back 2021,['kansas'],"['georgia3', 'northernarizona']",lemme see brock bowers ends ill get back far inverse kyle pitts probably closest ive falcons excited getting kind talent roster course still learning use thats neither
169aftq,jz1j1d8,florida lsu 730,florida lsuflsulsu location camping world time 730 watch tv abclabc odds spread lsu 25 overunder 580 rcfb made rcfb please keep trash talk civil report comments violate lets talk,['rcfb'],"['oregonstate', 'northernarizona']",love god lsu deserve 5 preseason ranking anyone fill sec buff guess
17vd5mj,k9a8xv7,washington pac 12,know billable hours going win media rights cover spread 2pac secure bag departing schools take control keys,"['oregonstate', 'sickos']","['ucla', 'northernarizona']",imagine waving half billion dollars faces ucla uw uofa
168fxcn,jywlrbx,tech wyoming 730,tech location wyomingfwyoming jonah war memorial time 730 watch tv cbslcbs odds spread ttu 14 overunder 520 rcfb made rcfb please keep trash talk civil report comments violate lets talk,"['texastech2', 'saddle']","['arizonastate', 'northernarizona']",never seen coin land askew like coin didnt flip ref flipped aaron rodgers complained didnt get call headstails 2nd flip
1735e54,k40pa64,ap poll 1082023,nan,"['minnesota', 'delaware']","['northernarizona', 'pac12']",utah gained 2 spots loss pac12 quality losses confirmed
17nrxjh,k7uo0cz,northwestern 330,iowafiowaiowa location wrigley time 330 watch tv peacocklpeacock rcfb made rcfb please keep trash talk civil report comments violate lets talk,['rcfb'],"['iowa', 'northernarizona']",dont think ive ever seen timeout kickoff
17o0i1u,k7vzr3e,colorado 1000,location folsom time 1000 watch tv espnlespn rcfb made rcfb please keep trash talk civil report comments violate lets talk,['rcfb'],"['oregonstate', 'northernarizona']",momentum back colorado naw team still trash despite bad decisions might make
17v67wr,k98qrsa,jimbos buyout disgrace,think lot coaching carousel coverage missing obvious point outrageous public university pay 78 million someone coach team understand boosters come cash side doesnt come literally general budget people need understand cash fungible dollars donated could donated university outright b could used literally worthwhile purpose paying jimbo fisher strong suspicion boosters donation papered give tax deduction well effectively americans subsidizing 40 shitshow understand college sports headed insane direction decades really ripped overton window wide open point inflated broadcast money going start dry lot universities public private going find investing fbs cfb expense rest institution huge mistake,"['notredame', 'indiana']","['northernarizona', 'valleycitystate']",honestly biggest argument players say pay us
17w30ir,k9ewyf5,classes athletes school like,sorry distract coaching drama offseason style discussion go ive seen plenty stories players goofy parties dorms around campus im curious acted classes specifically studious never show treated like gods among men normal students happened great shape,"['michigan3', 'american']","['georgia2', 'northernarizona']",class kicker last fall redshirted go nau saw got kick blocked arizona like wouldve beaten either way lol tbh different type disappointment know guy personally
16z2cw9,k3d44d1,people 12 team playoff,maybe im biased penn fan whose team would made 59 12 team playoffs far existed great way let teams get redeeming shot one two closequality losses youre best 4 teams still get bye road 4 team nfl less fun playoffs college basketball absolutely sport dont see downsides gives clear path 8 good compete still lets top 4 teams better chance getting championship,"['maryland', 'pennstate']","['georgia2', 'northernarizona']",think great may somewhat devalue regular season top 67 teams suddenly week 11 11 15 massive stakes going good product yea may get far thing good team peaking right time genuinely never know g5 possibility yea none ever win damn thing thrill chase chance see good team get knocked
172mpmi,k3yc5vu,arizona usc 1030,uscfuscusc location uscfusc los angeles memorial coliseum time 1030 watch tv espnlespn rcfb made rcfb please keep trash talk civil report comments violate lets talk,['rcfb'],"['michigan', 'northernarizona']",refs called penalty illegal watching
183rg1p,kaqzbem,arizona arizona 330,arizona location arizona mountain america time 330 watch tv espnlespn rcfb made rcfb please keep trash talk civil report comments violate lets talk,['rcfb'],"['arizona', 'northernarizona']",espn gotta tell riddick inxay lignmentre point right
183rg1p,kar1ztb,arizona arizona 330,arizona location arizona mountain america time 330 watch tv espnlespn rcfb made rcfb please keep trash talk civil report comments violate lets talk,['rcfb'],"['arizona', 'northernarizona']",happy mike wiley got tud dude looks like hes finally feeling healthy cowing tbh
183rg1p,kar31gy,arizona arizona 330,arizona location arizona mountain america time 330 watch tv espnlespn rcfb made rcfb please keep trash talk civil report comments violate lets talk,['rcfb'],"['arizona', 'northernarizona']",god announcers garbage dude pronunciation guide
183rg1p,kar33xg,arizona arizona 330,arizona location arizona mountain america time 330 watch tv espnlespn rcfb made rcfb please keep trash talk civil report comments violate lets talk,['rcfb'],"['arizona', 'northernarizona']",ahh man sure would strip sack
16vrr41,k2tgf1q,utah 900,utahfutahutah location reser time 900 watch tv fox sports 1lfs1 odds spread utah 25 overunder na rcfb made rcfb please keep trash talk civil report comments violate lets talk,['rcfb'],"['northernarizona', 'stanford']",gonna rough season utes standards assuming cam isnt coming back theyll virtually chance washington usc risk dropping another go like 75 84 best cam
16vrr41,k2thigx,utah 900,utahfutahutah location reser time 900 watch tv fox sports 1lfs1 odds spread utah 25 overunder na rcfb made rcfb please keep trash talk civil report comments violate lets talk,['rcfb'],"['northernarizona', 'stanford']",announcer nuts saying cam wont help utah team offensively hes long like bro watching josh rosen could help team
194hc7d,khhdnvs,sources ncaa levy significant penalties florida nil recruiting violations,nan,"['miami', 'tft']","['arizonastate', 'northernarizona']",really rules anymore point enforcement feels selective
1783iuf,k4xyodn,boise colorado 945,boise colorado location colorado canvas time 945 watch tv fox sports 1lfs1 odds spread bois 75 overunder 605 rcfb made rcfb please keep trash talk civil report comments violate lets talk,['rcfb'],"['boisestate', 'northernarizona']",green looking like knows back qb
1797hob,k57v2aq,tank job week week seven,tank job week award fbs team best job humiliating weekend whether blew large lead choked away spot limelight lost absolutely right losing completely screwed everything last second blunder tjotw winner sets gold standard college misery x200b previous winners 1 baylor bears lost 4231 2 nevada wolf pack lost idaho 336 3 cowboys lost south 337 4 minnesota golden gophers lost northwestern 3734 5 ucf knights lost baylor 3635 6 miamifl hurricanes lost tech 2320 x200b last week still feels kinda weird start every year figure red river shootout winner going take week 6 vote didnt even merit nomination anyways wasnt unanimous people guy vote notre dame ucf kentucky anyways miami full stop greatest tjotw time got argument never ever topped maybe doesnt mean going stop trying x200b onto week reminder wanted give ucf ultimate week 5 thats never going stop funny anyways glorious bountiful feast laid us lets get x200b note ease counting please use carats vote like team thank thanks participating x200b honorable mentions south carolinas donut dogs fact south carolina general georgias defense giving 20 vandy navy charlotte memphis nut punch ohios lemon niu byu nc south florida got shelled games much closer ulm couldnt hold late 209 lead x200b nominees week 7 x200b boise broncos lost colorado 3130 blown leads theme week boise went turbomode spectacular 21point meltdown evoked memories legendary 43 years ago 1980 holiday bowl quite egregious byu needed 233 make comeback smu winning hail mary 416 still impressive meltdown team 3010 bag raises question broncos 34 still play wyoming fresno air force year boise finally misses bowl x200b colorado buffaloes lost stanford 4643 290 half 1100 east coast cfb nation went bed even bothered one first place stanford whod already lost sacramento beaten hawaii magically turned mid2010s stanford roared back 367 second half force overtime colorado decides play offense completely negating advantage going second backfires hard stanford picks shadeur sanders heroball sets goal end shocker x200b louisville cardinals lost pittsburgh 3821 lousvilles time theyd pummeled notre dame favorable schedule charlotte perhaps destiny side even led 2114 half course 14 pitt rattles 24 consecutive points whatever popular saying cards eating guess blue vase feelings worked x200b maryland terrapins lost illinois 2724 yup october x200b miamifl hurricanes lost north carolina 4131 one big questions entering week miami would respond previously mentioned alltimer tech answer pretty well half tar heels went 240 run miami offense sputtered two turnovers negativeyardage threeandout canes claw back couple late tds damage done x200b spartans lost rutgers 2724 start fourth quarter 246 lead ball eight minute mark 2724 thanks scoop score 12play 73 yard td drive 4 minutes botched kickoff immediately led another scarlet knight touchdown nine seconds later rain pouring piscataway washed hopes sparty turning season around drain x200b usc trojans lost notre dame 4820 hey credit much maligned trojan defense held irish 251 yards course still couldnt stop notre dame hanging nearly half hundred aided abetted offensive meltdown included three caleb williams picks scoop score oh 99 yard kickoff return blow back open looked like usc getting together make run x200b washington cougars lost arizona 446 desert voodoo coming north x200b west virginia mountaineers lost houston 4139 imagine 51 wvu loss penn would sit rankings right unfortunately imagining miracle 50 yard 4th 9 touchdown give eers lead 12 seconds left promptly nullified houston hail mary could probably argued chaos happened thursday egregious started let purgers house wvu theres blood everywhere,"['washington', 'centralwashington']","['iowa', 'northernarizona']",colorado giving nearly 300 yards one receiver single half deserves vote regardless factors
17sxef4,k8t3a0z,penn 1200,penn location penn statefpennstate beaver time 1200 watch tv foxlfox rcfb made rcfb please keep trash talk civil report comments violate lets talk,['rcfb'],"['michigan', 'northernarizona']",put little pressure allar guy wilts
17sxef4,k8tbc6f,penn 1200,penn location penn statefpennstate beaver time 1200 watch tv foxlfox rcfb made rcfb please keep trash talk civil report comments violate lets talk,['rcfb'],"['michigan', 'northernarizona']",side note unrelated theres chance maryland starting season 50 could miss bowl
17sxef4,k8tu8tj,penn 1200,penn location penn statefpennstate beaver time 1200 watch tv foxlfox rcfb made rcfb please keep trash talk civil report comments violate lets talk,['rcfb'],"['northernarizona', 'floridastate2']",love god penn please offense 1893 drive
17sxef4,k8tuneu,penn 1200,penn location penn statefpennstate beaver time 1200 watch tv foxlfox rcfb made rcfb please keep trash talk civil report comments violate lets talk,['rcfb'],"['michigan', 'northernarizona']",im huge james franklin supporter keep forever penn st
177dn6h,k4t3ahm,stanford colorado 1000,location folsom time 1000 watch tv espnlespn odds spread colo 115 overunder 590 rcfb made rcfb please keep trash talk civil report comments violate lets talk,['rcfb'],"['arizonastate', 'northernarizona']",cu know set lb drop hook curl zone keep slot cb take away slant
177dn6h,k4t6sr2,stanford colorado 1000,location folsom time 1000 watch tv espnlespn odds spread colo 115 overunder 590 rcfb made rcfb please keep trash talk civil report comments violate lets talk,['rcfb'],"['northernarizona', 'fiu']",goodness thrown need
16knfug,k0xxgl2,colorado colorado 1000,colorado location folsom time 1000 watch tv espnlespn rcfb made rcfb please keep trash talk civil report comments violate lets talk,['rcfb'],"['louisville', 'northernarizona']",whoever bet house csu must shitting bricks rn
16knfug,k0y1x25,colorado colorado 1000,colorado location folsom time 1000 watch tv espnlespn rcfb made rcfb please keep trash talk civil report comments violate lets talk,['rcfb'],"['wisconsin', 'northernarizona']",acting like fans excited ranked team beat unranked opponentno cu going go crazy beating csu point history instate rivalry
16bowze,jzexoj2,mcmurphy usc qb caleb williams could return next year caleb doesnt like nfl team wno 1 pick dad carl told gq magazine,usc qb caleb williams could return next year caleb doesnt like nfl team wno 1 pick dad carl told gqmagazine funky thing nfl draft process hed almost better drafted drafted 1st carl said system completely backwards way system constructed go worst possible situation worst possible team worst organization league desire parity gets 1st pick gift curse,['georgia2'],"['georgia', 'northernarizona']",someone knows lot goofy ass cardinals homers
189go15,kbr8jq6,800,iowafiowaiowa location lucas oil time 800 watch tv foxlfox odds spread mich 22 overunder 345 rcfb made rcfb please keep trash talk civil report comments violate lets talk,['rcfb'],"['arizonastate', 'northernarizona']",interesting color choice dark green outfit big10 title
189go15,kbr8y66,800,iowafiowaiowa location lucas oil time 800 watch tv foxlfox odds spread mich 22 overunder 345 rcfb made rcfb please keep trash talk civil report comments violate lets talk,['rcfb'],"['arizonastate', 'northernarizona']",find title games played domes boring sterile kansas stateiowa snow fun watch put ann arbor
189go15,kbrci74,800,iowafiowaiowa location lucas oil time 800 watch tv foxlfox odds spread mich 22 overunder 345 rcfb made rcfb please keep trash talk civil report comments violate lets talk,['rcfb'],"['arizonastate', 'northernarizona']",cheese commercial joke thats pretty much much cheese put skyline chili
189go15,kbrqn7c,800,iowafiowaiowa location lucas oil time 800 watch tv foxlfox odds spread mich 22 overunder 345 rcfb made rcfb please keep trash talk civil report comments violate lets talk,['rcfb'],"['arizonastate', 'northernarizona']",pick ball run first play dead
189go15,kbrwg38,800,iowafiowaiowa location lucas oil time 800 watch tv foxlfox odds spread mich 22 overunder 345 rcfb made rcfb please keep trash talk civil report comments violate lets talk,['rcfb'],"['arizonastate', 'northernarizona']",promised commercial break fan get one
183195k,kamrj1f,postgame defeats nebraska 1310,box score provided team 1 2 3 4 made rcfb,['rcfb'],"['iowa', 'northernarizona']",flew phoenix sat front row 50 yard line watched 100 sober ama
193kpui,kh9wl1k,chris low clowespn x nick saban retiring sources tell espn six national titles,nan,"['rutgers', 'oregon']","['northernarizona', 'texas']",fuck witness one greatest runs sports history saban goat cfb fan missed fan new sec team lol
18w0xqp,kfvqb2q,fiesta bowl liberty 100,location farm time 100 watch tv espnlespn odds spread ore 18 overunder 685 rcfb made rcfb please keep trash talk civil report comments violate lets talk,['rcfb'],"['northernarizona', 'stanford']",genuine chance finish top 5 since ohio lost theyll behind still pass florida one loses
188qre7,kbn8hif,washington 800,location allegiant time 800 watch tv abclabc odds spread ore 95 overunder 655 rcfb made rcfb please keep trash talk civil report comments violate lets talk,['rcfb'],"['northernarizona', 'texas']",fuck teams run prevent never works
188qre7,kbn8vjo,washington 800,location allegiant time 800 watch tv abclabc odds spread ore 95 overunder 655 rcfb made rcfb please keep trash talk civil report comments violate lets talk,['rcfb'],"['arizona', 'northernarizona']",fucking seen good officiating year lmfao
17t1swl,k8uf8wj,rutgers 330,iowafiowaiowa location iowafiowa kinnick time 330 watch tv big ten networklbtn odds spread 15 overunder 285 rcfb made rcfb please keep trash talk civil report comments violate lets talk,['rcfb'],"['michigan', 'northernarizona']",yes selected years annual sacrifice b1g east winner congratulations
15i50ve,jus5ekl,washington join big ten leave pac12,nan,['georgia2'],"['northernarizona', 'texas']",fuck stoked morning miss pac
17z2era,k9wuqmj,washington lowest ranked unbeaten team playing conference best nonconference record beating highest ranked 1loss team top 25 wins top 2 strength record biases die hard,nan,['washington'],"['northernarizona', 'valleycitystate']",dont take playoffs seriously tv event actual title tournament
15i4lvq,jus31rz,whatever heck going today,even sure anymore location everywhere time odds spread pac12lpac12 14 made rcfb please keep trash talk civil report comments violate lets talk,['rcfb'],"['northernarizona', 'pac12']",whole thing sucks thoroughly enjoyed arizona center college universe week
15i4lvq,jus75pf,whatever heck going today,even sure anymore location everywhere time odds spread pac12lpac12 14 made rcfb please keep trash talk civil report comments violate lets talk,['rcfb'],"['northernarizona', 'texas']",front page rcfb absolutely hilarious right hadnt looked awhile hanging new funny seeing chaos mixed together
