post_id,comment_id,post_title,post_selftext,post_author_flairs,comment_author_flairs,comment_body
17dhxtg,k5xi960,arizona washington 1030,arizona location husky time 1030 watch tv fox sports 1lfs1 rcfb made rcfb please keep trash talk civil report comments violate lets talk,['rcfb'],"['northernarizona', 'arizonastate']",dbacks needed reactions every play great
17dhxtg,k5xifdg,arizona washington 1030,arizona location husky time 1030 watch tv fox sports 1lfs1 rcfb made rcfb please keep trash talk civil report comments violate lets talk,['rcfb'],"['arizonastate', 'northernarizona']",cant convince wont lose heart breaking fashion
17dhxtg,k5xkui8,arizona washington 1030,arizona location husky time 1030 watch tv fox sports 1lfs1 rcfb made rcfb please keep trash talk civil report comments violate lets talk,['rcfb'],"['arizonastate', 'northernarizona']",exactly want get burn timeouts way winning drive walk fg dramatic soul crushing
17dhxtg,k5xl2ju,arizona washington 1030,arizona location husky time 1030 watch tv fox sports 1lfs1 rcfb made rcfb please keep trash talk civil report comments violate lets talk,['rcfb'],"['northernarizona', 'arizonastate']",knew something coming still wild crazy watch
17lco7a,k7fnfsh,paul finebaum calls inexcusable big ten hasnt punished jim harbaugh,nan,"['ohiostate', 'toledo']","['arizonastate', 'northernarizona']",even rules outside lines college feels like ncaa toothless punishes admit guilt smaller schools nuts probably get little penalty one employees impersonating member another teams coaching staff trespassing things guy get fired probably get antonio pierce treatment get nfl job
1835err,kaniucn,tech 730,tech location texasftexas dkrtexas memorial time 730 watch tv abclabc rcfb made rcfb please keep trash talk civil report comments violate lets talk,['rcfb'],"['northernarizona', 'texas']",announcers talking like almost know theres still quarter left right lol
16en3pq,jzx3t55,arizona 1030,arizona location arizona mountain america time 1030 watch tv rcfb made rcfb please keep trash talk civil report comments violate lets talk,"['texas', 'harvard']","['arizonastate', 'northernarizona']",mean zero expectations im pleasantly surprised close late
16en3pq,jzx4k5n,arizona 1030,arizona location arizona mountain america time 1030 watch tv rcfb made rcfb please keep trash talk civil report comments violate lets talk,"['texas', 'harvard']","['arizonastate', 'northernarizona']",dagger 256 go yes fucking moron clearly dagger
188cbbp,kbjytqj,honest question fans teams perpetually bad keeps engaged,teams never seem make bowl finish couple wins decades still fans showing games,['georgia'],"['ucla', 'northernarizona']",beating usc super bowl beating us cals super bowl vicious circle mediocrity
16yu7qk,k3b5ulg,maryland unranked 50,hard time believing 50 sec team marylands schedule wouldnt top 25 lots speculation going try keep big 10 let 2 playoff teams know isnt committee past snuck teams like 75 miss st 24 25 give sec playoff contenders extra data point one could convince 50 sec team wouldnt ranked marylands schedule,"['ohiostate', 'arizona']","['georgia2', 'northernarizona']",idk towson charlotte uva iu demands top 25 nod theyre good enough theyll get come georgias played better schedule
189brft,kbqhgtm,400,location mercedesbenz time 400 watch tv cbslcbs odds spread uga 5 overunder 555 rcfb made rcfb please keep trash talk civil report comments violate lets talk,['rcfb'],"['arizona', 'northernarizona']",fruit peach reason cause theyre
17ijvxl,k6vf9rq,byu 330,byufbyubyu location texasftexas dkrtexas memorial time 330 watch tv rcfb made rcfb please keep trash talk civil report comments violate lets talk,['rcfb'],"['northernarizona', 'texas']",tuning finally kids birthday hows murphy looking
17t8utf,k8w50hz,arizona ucla 900,arizona uclafuclaucla location uclafucla rose bowl time 900 watch tv pac12 networklp12n odds spread ucla 17 overunder 475 rcfb made rcfb please keep trash talk civil report comments violate lets talk,['rcfb'],"['arizona', 'northernarizona']",ive watching sorry killed offense last week ucla
1694dym,jyzu61i,san jos 330,san jos jos location san jos cefcu time 330 watch tv cbslcbs odds spread orst 165 overunder 545 rcfb made rcfb please keep trash talk civil report comments violate lets talk,"['oregonstate', 'summertimelover']","['oregonstate', 'northernarizona']",season gonna way bittersweet ever couldve imagined
16ecyt5,jzuwww9,330,iowafiowaiowa location statefiowastate jack trice time 330 watch tv foxlfox rcfb made rcfb please keep trash talk civil report comments violate lets talk,['rcfb'],"['ohiostate', 'northernarizona']",fans lookin like showbiz pizza bear
16ecyt5,jzvd5a6,330,iowafiowaiowa location statefiowastate jack trice time 330 watch tv foxlfox rcfb made rcfb please keep trash talk civil report comments violate lets talk,['rcfb'],"['iowa', 'northernarizona']",hear announcer mispronounce ragaini imma stab ear
16ecyt5,jzvnoen,330,iowafiowaiowa location statefiowastate jack trice time 330 watch tv foxlfox rcfb made rcfb please keep trash talk civil report comments violate lets talk,['rcfb'],"['michigan', 'northernarizona']",huge gambling implications 5 players 3 net win players
166w2i8,jym9ekx,postgame minnesota defeats nebraska 1310,box score provided team 1 2 3 4 made rcfb,"['minnesota', 'delaware']","['michigan', 'northernarizona']",one deserved win usc ucla washington fans take note b1g
166pzdt,jylg4zt,florida utah 800,utahfutahutah location utahfutah riceeccles time 800 watch tv espnlespn odds spread utah 65 overunder 455 rcfb made rcfb please keep trash talk civil report comments violate lets talk,"['medal', 'oklahomastate2']","['northernarizona', 'floridastate2']",alright im dumbass two old dudes end got barry sanders two
166pzdt,jym017n,florida utah 800,utahfutahutah location utahfutah riceeccles time 800 watch tv espnlespn odds spread utah 65 overunder 455 rcfb made rcfb please keep trash talk civil report comments violate lets talk,"['medal', 'oklahomastate2']","['northernarizona', 'stanford']",man florida really fallen gonna like 5th sec east getting railed team whos 33rd talent composite last last year got railed 54th anyone less lately florida
16pnixi,k1sz0jo,nc virginia 730,nc statefncstatenc location scott time 730 watch tv espnlespn rcfb made rcfb please keep trash talk civil report comments violate lets talk,['rcfb'],"['northernarizona', 'floridastate2']",touchdown drive int 2 point conversion incoming
17yellt,k9tew4q,arizona 400,arizona location arizona mountain america time 400 watch tv foxlfox odds spread ore 24 overunder 535 rcfb made rcfb please keep trash talk civil report comments violate lets talk,['rcfb'],"['arizonastate', 'northernarizona']",throw 13 tds spite run make sure stat holds true
17yellt,k9tfg21,arizona 400,arizona location arizona mountain america time 400 watch tv foxlfox odds spread ore 24 overunder 535 rcfb made rcfb please keep trash talk civil report comments violate lets talk,['rcfb'],"['arizonastate', 'northernarizona']",hit wasnt bad damn fall sure looked awful
18a5prc,kbvm3y8,college playoffs unprecedented screw job florida,nan,"['army', 'fiesta']","['michigan', 'northernarizona']",gotta believe tabloids loving click generation utilize nothing like good controversy generate cash
18t5hhy,kfcc5at,poptarts bowl kansas nc 545,kansas nc statefncstatenc location camping world time 545 watch tv espnlespn espnlespn odds spread ksu 2 overunder 475 rcfb made rcfb please keep trash talk civil report comments violate lets talk,['rcfb'],"['northernarizona', 'fiu']",damn kstate avery johnson much athletic san antonio spurs avery johnson
1780tdz,k4xaod3,usc notre dame 730,uscfuscusc notre dame location notre damefnotredame notre dame time 730 watch tv nbclnbc peacocklpeacock odds spread nd 3 overunder 630 rcfb made rcfb please keep trash talk civil report comments violate lets talk,['rcfb'],"['michigan', 'northernarizona']",usc loses theyll transitive loss 24 pitt pittulndusc
1780tdz,k4xb9e3,usc notre dame 730,uscfuscusc notre dame location notre damefnotredame notre dame time 730 watch tv nbclnbc peacocklpeacock odds spread nd 3 overunder 630 rcfb made rcfb please keep trash talk civil report comments violate lets talk,['rcfb'],"['michigan', 'northernarizona']",notre dame transitive loss marshall year
16we4il,k2wrckc,nebraska 330,location memorial lincoln ne time 330 watch tv foxlfox rcfb made rcfb please keep trash talk civil report comments violate lets talk,['rcfb'],"['michigan', 'northernarizona']",qb didnt even start year best player
16rv5xx,k260r19,tank job week week four,tank job week award fbs team best job humiliating weekend whether blew large lead choked away spot limelight lost absolutely right losing completely screwed everything last second blunder tjotw winner sets gold standard college misery x200b previous winners 1 baylor bears lost 4231 2 nevada wolf pack lost idaho 336 3 cowboys lost south 337 x200b last week wasnt lopsided tjotw vote ever still pretty easy win inexplicable blowout south team got significant number votes cincy losing miamioh doesnt compare getting utterly flattened sun belt team oh well maybe particular sun belt team going win go 121 single week 1 loss tulane make new years six spoiler alert go 121 x200b onto week thing dont cosmic earthshattering level upset blown leads shocking turnof misfortunes defensive staffing issues huge games veritable feast nominees x200b note ease counting please use carats vote like team thank thanks participating x200b honorable mentions indiana needing four overtimes akron nebraska tied louisiana tech 77 entering fourth quarter jimbo fisher auburns best blocker scoop score denver broncos x200b nominees week 3 x200b appalachian mountaineers lost wyoming 2219 12 minutes go mountaineers picked andrew peasley pass returned touchdown go 197 cowboys instantly responded going 75 yards first play scrimmage thats fine said app proceeded go epic tenminute clock killing drive sputter kick goal go 8 wyoming blocked goal returned winning touchdown app one last chance already goal range got picked wyoming 6 eleven seconds go ice brutal crazy x200b clemson tigers lost florida 3124 oh tigers brought looooooooooowly scoop score finish blowing ten point lead check playing goal kicker drag back miss 29yard winner playcall 3rd 1 overtime hell way lose tigers x200b colorado buffaloes lost 426 okay maybe lot us saw coming dont think us thought colorados reality check going brutal one thing something like 5932 350 first half massacre plus holding buffs less 200 yards hype x200b hawkeyes lost penn 310 76 yards four turnovers 1433 possession nothing else need said x200b minnesota golden gophers lost northwestern 3734 3110 start fourth quarter team favored beat two touchdowns team whos claim worst power conference team heading virginia stanford exist northwestern rips 174 yards 21 straight points fourth quarter responded gophers fg firstplay touchdown overtime minnesota rowed boat right waterfall x200b nevada wolf pack lost 3524 pack something prove tjotwwinning domination idaho coming short plucky effort kansas came swinging san marcos seventeenpoint favored bobcats first half scored five times twenty minutes plunge unr 04 x200b notre dame fighting irish lost ohio 1714 didnt think id nominating irish instant classic saw notre dame rally ten ohio sneak across goal line literal last second take victory comes one biggest games year critical moment marcus freeman kindasorta forgot put eleventh defender two plays coaching staff fully aware x200b south jaguars lost central 3430 jaguars respond massive program elevating tjotwworthy win last week ripping early 140 lead chips cmu went 273 run south come back take lead fourth quarter central snapped final touchdown fourteen seconds left pull 17point upset,"['washington', 'centralwashington']","['northernarizona', 'texas']",hard choose minnesota least minnesota actually scored meltdown
15i05hc,jurdyjf,auerbach breaking washingtons exit pac12 big ten appears lost momentum overnight multiple sources tell theathletic,,['georgia2'],"['northernarizona', 'texas']",holy shit news needed today woke bummed headlines thought id reading like many others find compelling reason watch former pacs play new conferences especially b1g know everything still air gives hope west coast needs conference current pac9 great foundation add sdsu keep representation socal im even thrilled conference hope arizona staying well fit big12 well enough get still leave found getting excited see play austin remembering uts realignment haha
17807q1,k4wt84s,arizona washington 700,washington location washington gesa time 700 watch tv pac12 networklp12n odds spread wsu 8 overunder 620 rcfb made rcfb please keep trash talk civil report comments violate lets talk,['rcfb'],"['arizona', 'northernarizona']",solidly ok going far im burned wildcat games past much
17807q1,k4x6y34,arizona washington 700,washington location washington gesa time 700 watch tv pac12 networklp12n odds spread wsu 8 overunder 620 rcfb made rcfb please keep trash talk civil report comments violate lets talk,['rcfb'],"['arizona', 'northernarizona']",want 17 play 7 minute drive pull starters
1724orw,k3uxr28,espn college gameday show,want little ting tang tang discuss post anything related show signs screencaps videos etc,['rcfb'],"['arizonastate', 'northernarizona']",mean 100 heart want wsu flags next week 56 see right arent enough
1724orw,k3uyeqo,espn college gameday show,want little ting tang tang discuss post anything related show signs screencaps videos etc,['rcfb'],"['arizonastate', 'northernarizona']",cant tell mm acting wolf wall street
1724orw,k3uygfb,espn college gameday show,want little ting tang tang discuss post anything related show signs screencaps videos etc,['rcfb'],"['arizonastate', 'northernarizona']",oh shit guy looks like sherif fansville fuckin wild
1684oqg,jytzdko,ecu 1200,ecufecuecu location time 1200 watch tv peacocklpeacock odds spread mich 36 overunder 515 rcfb made rcfb please keep trash talk civil report comments violate lets talk,"['westernmichigan', 'michigan']","['michigan', 'northernarizona']",please tell wasnt one got spanish chevron commercial
1684oqg,jyu7dao,ecu 1200,ecufecuecu location time 1200 watch tv peacocklpeacock odds spread mich 36 overunder 515 rcfb made rcfb please keep trash talk civil report comments violate lets talk,"['westernmichigan', 'michigan']","['michigan', 'northernarizona']",sorry corum jj roman wilson winning heisman
17vtjqa,k9d04aj,players team year believe would belong schools alltime roster,something think going every season player good could one best school history south carolina year dont believe though many fans willwould say rattler talented qb weve ever hes still ways accomplishing achieving connor shaw wr xavier legette talented enough already put top 5 receiving season career compared great wrs lacking instance though brock bowers may te1 alltime roster,"['southcarolina', 'sec']","['arizona', 'northernarizona']",early tell young guys tmac good shot
16utw10,k2ncx53,temple tulsa 730,location tulsaftulsa chapman time 730 watch tv espnlespn rcfb made rcfb please keep trash talk civil report comments violate lets talk,['rcfb'],"['northernarizona', 'floridastate2']",chick fil could stop making commercials would
16wksgd,k2xell0,postgame baylor defeats ucf 3635,box score provided team 1 2 3 4 ucffucf2177035 made rcfb,['rcfb'],"['michigan', 'northernarizona']",know choked massive lead lost incredible 4th 5 ive ever saw life
178l3mf,k508jvk,ap poll 10152023,nan,"['minnesota', 'delaware']","['northernarizona', 'texas']",top 10 near perfect would switch washington fsu think got right otherwise
178l3mf,k50km9m,ap poll 10152023,nan,"['minnesota', 'delaware']","['ucla', 'northernarizona']",ucla ranked disrespect james madison palpable
16ys842,k3b60oy,blind side author michael lewis michael oher lawsuit watching change behavior happens players get hit head run problems violence aggression,lewis recalled oher shy young boy found hard square memory oher behind lawsuit watching change behaviour told happens players get hit head run problems violence aggression wouldnt surprise lewis said seeing confluence ohers history campaigns stoke claims lawsuits like perhaps lawyer ohers figured time ripe sue tuohys lewis speculated perhaps oher realised people would get behind makes accusations new interview guardian,"['notredame', 'buffalo']","['georgia2', 'northernarizona']",holy shit pulled cte card know would get ugly dear god low
15i1jr4,jurk4zb,exclusive florida university working jpmorgan chase explore schools athletic department could raise capital institutional funds private equity,trustees admins vocal financial disadvantage seminoles current spot acc raising money could help alleviate concerns possibly fund acc buyout,"['michigan', 'fau']","['northernarizona', 'texas']",sounds like terrible idea would even work institutions going want return university cant buy actual stake getting roi
17d92jq,k5w9ter,minnesota 330,iowafiowaiowa location iowafiowa kinnick time 330 watch tv rcfb made rcfb please keep trash talk civil report comments violate lets talk,['rcfb'],"['lsu', 'northernarizona']",got fucked big time refs horrible horrible call
16aczkc,jz6qp6d,postgame duke defeats clemson 287,box score provided team 1 2 3 4 made rcfb,"['stanford', 'presscorps']","['northernarizona', 'nebraska']",school hire new coaches team improves seriously please tell
16we4jg,k2x9le4,kansas 330,location texasftexas dkrtexas memorial time 330 watch tv abclabc rcfb made rcfb please keep trash talk civil report comments violate lets talk,['rcfb'],"['northernarizona', 'texas']",dread run second half arrives
171qe8n,k3sfr9a,college team favored city,clemson obviously clemson back home charleston area would say 5050 split clemson south carolina kid carolina definitely popular clemson might take course ohio fans dont like think makes sick,['clemson'],"['northernarizona', 'floridastate2']",phoenix area asu mix uofa byu big10 teams
15z8uel,jxh5mjs,hypothetical bet life one 10 schools reaching cfb national championship within next 10 years one would choose,assume life stake need one 10 schools reach cfb national championship within next 10 years continue living school going arizona kansas missouri north carolina purdue south carolina tech virginia tech wisconsin,['georgia'],"['arizonastate', 'northernarizona']",asu fan im quite accustom wanting die team years guess case could say im literally ride die
1953697,khk923h,sources deboer talks bama hc job,nan,"['alabama', 'floridastate']","['umass', 'northernarizona']",dont like zero ties sec recruiting grounds 84 wont suffice
1728eb3,k3vk9r9,1200,location cotton bowl time 1200 watch tv abclabc rcfb made rcfb please keep trash talk civil report comments violate lets talk,['rcfb'],"['northernarizona', 'texas']",also funny acceptable least acceptable us lose time
1728eb3,k3w3ji8,1200,location cotton bowl time 1200 watch tv abclabc rcfb made rcfb please keep trash talk civil report comments violate lets talk,['rcfb'],"['northernarizona', 'texas']",cannot believe one score behind still ou could put away
1728eb3,k3w6s41,1200,location cotton bowl time 1200 watch tv abclabc rcfb made rcfb please keep trash talk civil report comments violate lets talk,['rcfb'],"['northernarizona', 'texas']",theyve throwing ball well drive dont like run
16eiux6,jzvtfn0,tech 700,tech location techftexastech jones att time 700 watch tv foxlfox odds spread ore 3 overunder na rcfb made rcfb please keep trash talk civil report comments violate lets talk,['rcfb'],"['oregonstate', 'northernarizona']",tech somehow wins wyoming rankes higher transitive property
16o2a6c,k1ic5jm,whats painful loss teams history,2018 national championship rutgers every saturday,"['georgia', 'rutgers']","['ucla', 'northernarizona']",ucla 1998 miami kansas 1998
18alqyr,kbyxz60,would take stop watchcaring college,something ive thinking years sport grew watching basically gone continuing evolve ways could seen detrimental im curious people considered breaking points isnt much oh team bad structure sport examples transfer portal currently functions means players like incoming could well gone time juniors leaving little get know player see grow element existed sport nil means players often go highest bidder things like tvd miami threatened transfer nil folks didnt give money know players paid behind scenes removes former appearance players chose school school like alumnus might arent students like p5 soon 4 probably making upwards 7 figures attend school continued consolidation conferences continues ruin regional rivalries create massive power brokers basically dictate sport everyone else yesterday surmise means everyone else basically fucked moving forward unless join one two conferences wonder college moves worse version nfl point think go far stop caringwatching point would happen bleed team colors always,['miami'],"['georgia3', 'northernarizona']",honestly would take something makes ditching tradition look like nothing raised know frankly idk would fall saturdays ever get point
16wnezr,k2yc8yq,washington arizona 1000,location arizonafarizona arizona time 1000 watch tv pac12 networklp12n rcfb made rcfb please keep trash talk civil report comments violate lets talk,['rcfb'],"['arizona', 'northernarizona']",worst fucking rule sports universe ever positive play
16wnezr,k2yjcb6,washington arizona 1000,location arizonafarizona arizona time 1000 watch tv pac12 networklp12n rcfb made rcfb please keep trash talk civil report comments violate lets talk,['rcfb'],"['arizona', 'northernarizona']",man illegal substitution stings pretty much 14 point swing
16pms5i,k1sdsky,wisconsin purdue 700,location purduefpurdue rossade time 700 watch tv fox sports 1lfs1 rcfb made rcfb please keep trash talk civil report comments violate lets talk,['rcfb'],"['northernarizona', 'floridastate2']",internet went im watching phone like kind savage cox says estimated time repair another 3 12 hours get fuck cox
