post_id,comment_id,post_title,post_selftext,post_author_flairs,comment_author_flairs,comment_body
15wqekf,jx3499h,top 5 popular college teams cityarea,1 north carolina 2 nc 3 appalachian 4 wake forest 5 duke x200b,"['floridastate', 'northcarolinaat']","['oklahoma', 'northcentral']",chicagoland whole isnt big cfb 1 notre dame 23 wisconsin mostly suburban kids 45 whichever two illinois shitting bed least season folks even care beyond first three
189yis0,kbu6dpf,statement michael alford vice president athletics director florida university,nan,"['floridastate2', 'floridacup']","['oklahoma', 'northcentral']",well make playoff blackjack hookers ones committee focused last night made bullshit rankings
18a08nd,kbulklq,statement mike norvell cfb snub,nan,"['floridastate', 'usa']","['oklahoma', 'northcentral']",fsu deserve credit coming saying fuck earned dont recognize well take hope boatrace claim natty
189ma0p,kbs2ua5,phalen right answer cfp 1 2 washington 3 fsu 4 5 6 7 ohio 8 sorry sec losses matter,nan,[],"['oklahoma', 'northcentral']",precedent set undefeated champion ranked behind 1 loss champion never undefeated champion left favor nonundefeated one unlikely precedent changes tomorrow
183mtar,kaq11co,ohio 1200,ohio location time 1200 watch tv foxlfox rcfb made rcfb please keep trash talk civil report comments violate lets talk,['rcfb'],"['nebraska', 'northcentral']",five hours deorro 3rd hype song fucking baller sounded cool
189h6d9,kbr58kh,postgame defeats 2724,box score provided team 1 2 3 4 made rcfb,['rcfb'],"['oklahoma', 'northcentral']",assuming fsu wins going poison pill committee arguments fsu injury qb materially changes team counterpoint caradale jones 2014 ohio st materially different team version lost early season counter point written cfp guidelines regarding h2h conference championships bama loses matter beat reason schedule tough ooc games counterpoint win games schedule
