post_id,comment_id,post_title,post_selftext,post_author_flairs,comment_author_flairs,comment_body
15hep5j,juo4vbt,tell im wrong b1g sec payouts unsustainable conference realignment actually hurt long term revenue schools involved,way see espn fox going destroy sport know waving halfbillion dollar bills around air immediately go bankrupt 5 years cable tv dies streaming revenue underperforms expectations whole thing nothing cfb still make money next round media renegotiation mega conferences mouths feed fewer spoons feed,"['pittsburgh', 'chaos']","['arizona', 'northernarizona']",entirely wrong probably last great tv money drop consider espn financial drain disney cant make lost subscribers carrier rates cable streaming subscriptions plus expensive rights fees putting squeeze top players mlbs regional sports networks dying quickly going shape things come enterprise live sports longer profitable enough justify furthered large investment small medium players get streaming business model based blitzscaling means nutshell identify emerging tech market scale quickly dominate figure profitable later isnt compatible long term university budgets point rights revenues drop means schools get paid less theyll little choice take deal get
191zla4,kgzaosf,cfp final washington 730,location nrg time 730 watch tv espnlespn odds spread mich 55 overunder 555 rcfb made rcfb please keep trash talk civil report comments violate lets talk,['rcfb'],"['northernarizona', 'fiu']",really dont care wins uw rejected four times undergrad masters phd go blue
191zla4,kgzeqyw,cfp final washington 730,location nrg time 730 watch tv espnlespn odds spread mich 55 overunder 555 rcfb made rcfb please keep trash talk civil report comments violate lets talk,['rcfb'],"['northernarizona', 'fiu']",damni feel gutted dillon johnson miracle able play first place
16cspbp,jzlitjr,murray louisville 730,murray location cardinal time 730 watch tv acc networklaccn rcfb made rcfb please keep trash talk civil report comments violate lets talk,"['louisville', 'army']","['northernarizona', 'floridastate2']",got tomorrow going enjoy flipping nfl adult beverages order delivery wife going friends gonna great night peeps
17ycosh,k9ssjfy,utah arizona 230,utahfutahutah location arizonafarizona arizona time 230 watch tv pac12 networklp12n odds spread ariz 1 overunder 445 rcfb made rcfb please keep trash talk civil report comments violate lets talk,['rcfb'],"['arizona', 'northernarizona']",utah section entirely empty ive hung utah people games 2ot great memory
17ycosh,k9swead,utah arizona 230,utahfutahutah location arizonafarizona arizona time 230 watch tv pac12 networklp12n odds spread ariz 1 overunder 445 rcfb made rcfb please keep trash talk civil report comments violate lets talk,['rcfb'],"['arizona', 'northernarizona']",yeah late got away one thankfully many games pac12 refs
17ycosh,k9sxp5n,utah arizona 230,utahfutahutah location arizonafarizona arizona time 230 watch tv pac12 networklp12n odds spread ariz 1 overunder 445 rcfb made rcfb please keep trash talk civil report comments violate lets talk,['rcfb'],"['arizona', 'northernarizona']",mike wiley looking little slow far anyone else
17ycosh,k9tg952,utah arizona 230,utahfutahutah location arizonafarizona arizona time 230 watch tv pac12 networklp12n odds spread ariz 1 overunder 445 rcfb made rcfb please keep trash talk civil report comments violate lets talk,['rcfb'],"['arizona', 'northernarizona']",barnes holding onto really long hes sure get hit
17ycosh,k9tgn9p,utah arizona 230,utahfutahutah location arizonafarizona arizona time 230 watch tv pac12 networklp12n odds spread ariz 1 overunder 445 rcfb made rcfb please keep trash talk civil report comments violate lets talk,['rcfb'],"['arizona', 'northernarizona']",called pocket ball get los
17y9i5h,k9t13gy,maryland 1200,location secu time 1200 watch tv foxlfox odds spread mich 205 overunder 505 rcfb made rcfb please keep trash talk civil report comments violate lets talk,['rcfb'],"['northernarizona', 'valleycitystate']",wow fans shut league get
16eiwq4,jzvm0ik,arizona mississippi 730,mississippi location mississippi davis wade time 730 watch tv sec networklsecn rcfb made rcfb please keep trash talk civil report comments violate lets talk,"['southcarolina2', 'corndog']","['arizona', 'northernarizona']",really hope somehow win dont want first pac12 team lose
16eiwq4,jzw0ytw,arizona mississippi 730,mississippi location mississippi davis wade time 730 watch tv sec networklsecn rcfb made rcfb please keep trash talk civil report comments violate lets talk,"['southcarolina2', 'corndog']","['arizona', 'northernarizona']",smart move punt probably throw pick youll end even better position
16eiwq4,jzwe8qz,arizona mississippi 730,mississippi location mississippi davis wade time 730 watch tv sec networklsecn rcfb made rcfb please keep trash talk civil report comments violate lets talk,"['southcarolina2', 'corndog']","['arizona', 'northernarizona']",imagine actually knew play beginning instead like 45 way
17ikiis,k6vuoq4,usc california 400,uscfuscusc location california memorial time 400 watch tv pac12 networklp12n rcfb made rcfb please keep trash talk civil report comments violate lets talk,['rcfb'],"['oregonstate', 'northernarizona']",qbs love watching get sacked caleb williams one
17zp018,ka16kzq,worst loss teams history,watching auburn go new mexico weekend made think worse losses programs history bama fan would go loss northern illinois 2003 1916 mike shula first season sanctions mike price impropriety stripper something hotel room service poor something list cathartic,['alabama'],"['georgia2', 'northernarizona']",lifetime worst probably black helmet florida beat us 4114 kicked asses didnt pay attention much 2018 lsu angriest ive ever team called atlanta falcons dont care less year away one great teams 21st century future innercircle heisman qb 2 future nfl stars receiver absolutely pathetic made want james coleys head pike outside sanford
183mtar,kapv3n6,ohio 1200,ohio location time 1200 watch tv foxlfox rcfb made rcfb please keep trash talk civil report comments violate lets talk,['rcfb'],"['michigan', 'northernarizona']",ohio st scared wont even return kick
183mtar,kapvdsh,ohio 1200,ohio location time 1200 watch tv foxlfox rcfb made rcfb please keep trash talk civil report comments violate lets talk,['rcfb'],"['michigan', 'northernarizona']",egbuka 1st round pick btw hes even draft board
17xw6oo,k9qlv9g,colorado washington 1030,washington location washington gesa time 1030 watch tv fox sports 1lfs1 rcfb made rcfb please keep trash talk civil report comments violate lets talk,['rcfb'],"['arizona', 'northernarizona']",cu bowl eligibility dies wazzu letting monthsof pent rage
16prg48,k1tc9f4,boise san diego 1030,boise san diego diego location san diego snapdragon time 1030 watch tv cbs sports networklcbssn rcfb made rcfb please keep trash talk civil report comments violate lets talk,['rcfb'],"['northernarizona', 'stanford']",whats stake second half boise standards extremely slow start 12 loss puts 25 straight winning seasons jeopardy also interestingly h2h rivalry 44 also risk falling behind sdsu given trouble far among conference opponents
166svcz,jymf7db,southern utah arizona 1000,southern utah arizona location arizona mountain america time 1000 watch tv rcfb made rcfb please keep trash talk civil report comments violate lets talk,"['washingtonstate', 'oregonstate']","['arizonastate', 'northernarizona']",may get cancelled looks like pretty heavy rain 11pm lightning around least
166svcz,jymk70a,southern utah arizona 1000,southern utah arizona location arizona mountain america time 1000 watch tv rcfb made rcfb please keep trash talk civil report comments violate lets talk,"['washingtonstate', 'oregonstate']","['arizonastate', 'northernarizona']",alright going random question anyone remember black white childrens picture book mid90s chairs tables furniture etc would move around vague memories elementary school
166svcz,jymook2,southern utah arizona 1000,southern utah arizona location arizona mountain america time 1000 watch tv rcfb made rcfb please keep trash talk civil report comments violate lets talk,"['washingtonstate', 'oregonstate']","['arizonastate', 'northernarizona']",man watching news showing cars front end demolished intersection panned right suv partially top hood another car said everyone alright pretty crazy
166svcz,jympgba,southern utah arizona 1000,southern utah arizona location arizona mountain america time 1000 watch tv rcfb made rcfb please keep trash talk civil report comments violate lets talk,"['washingtonstate', 'oregonstate']","['arizonastate', 'northernarizona']",gods spoken called sun devil sponsorships
166svcz,jymqljl,southern utah arizona 1000,southern utah arizona location arizona mountain america time 1000 watch tv rcfb made rcfb please keep trash talk civil report comments violate lets talk,"['washingtonstate', 'oregonstate']","['arizonastate', 'northernarizona']",well southern utah really brought thunder tonight ill see
166svcz,jymrztk,southern utah arizona 1000,southern utah arizona location arizona mountain america time 1000 watch tv rcfb made rcfb please keep trash talk civil report comments violate lets talk,"['washingtonstate', 'oregonstate']","['arizonastate', 'northernarizona']",alright reddit like 69 degrees entire month 110 highs risk frostbite
166svcz,jymxr0n,southern utah arizona 1000,southern utah arizona location arizona mountain america time 1000 watch tv rcfb made rcfb please keep trash talk civil report comments violate lets talk,"['washingtonstate', 'oregonstate']","['arizonastate', 'northernarizona']",hahaha really going lose southern utah
166svcz,jymzs6y,southern utah arizona 1000,southern utah arizona location arizona mountain america time 1000 watch tv rcfb made rcfb please keep trash talk civil report comments violate lets talk,"['washingtonstate', 'oregonstate']","['arizonastate', 'northernarizona']",asu needing run clock secure 3 point win
16qbmz1,k1wg06u,colorado 330,location oregonforegon autzen time 330 watch tv abclabc rcfb made rcfb please keep trash talk civil report comments violate lets talk,['rcfb'],"['louisville', 'northernarizona']",colorado gettin cooked rn going 4th red zone absolutely shot deion ya love see
17is9rl,k6wxpof,arizona 1030,location arizonafarizona arizona time 1030 watch tv espnlespn rcfb made rcfb please keep trash talk civil report comments violate lets talk,['rcfb'],"['arizona', 'northernarizona']",love fifita throws int comes drives team gets points instead throwing int coming throwing 3 like someone else
17d0yj8,k5u8bw2,espn college gameday show,want little ting tang tang discuss post anything related show signs screencaps videos etc,['rcfb'],"['arizonastate', 'northernarizona']",lets cool magic story sob story great idea
17t1su5,k8u1dke,utah washington 330,utahfutahutah location husky time 330 watch tv foxlfox odds spread wash 9 overunder 545 rcfb made rcfb please keep trash talk civil report comments violate lets talk,['rcfb'],"['michigan', 'northernarizona']",holy shit new detroit tigers pbp guy jason benetti
17t1su5,k8uu6q3,utah washington 330,utahfutahutah location husky time 330 watch tv foxlfox odds spread wash 9 overunder 545 rcfb made rcfb please keep trash talk civil report comments violate lets talk,['rcfb'],"['northernarizona', 'arizonastate']",shouldnt touchback legs end zone touched ball matter ball end zone
15u6nal,jwo2pgw,nothing say would ever change opinion cfb opinion,opinion ironclad immovable collaboration worlds top minds say otherwise couldnt get move opinion god could appear irrefutable evidence stating otherwise still wouldnt change opinion,['georgia'],"['northernarizona', 'stanford']",many bowl games cheapens accomplishment making bowl postseason
1675cdu,jyo4zal,mcmurphy acc add stanford cal smu 2024 sources told leagues presidents got required 12 15 votes expand accs membership 17 schools smu receive media rights revenue 1st 7 years stanford cal receive reduced shares,,"['florida2', 'rutgers']","['northernarizona', 'stanford']",bruh time start getting full shares conference gonna implode
16a716p,jz6m5aj,clemson duke 800,dukefdukeduke location dukefduke wallace wade time 800 watch tv espnlespn odds spread clem 13 overunder 555 rcfb made rcfb please keep trash talk civil report comments violate lets talk,"['stanford', 'presscorps']","['oregonstate', 'northernarizona']",dabo seems like cousin jason garrett even clapping form similar
15jaosk,juytk2e,fans actually excited joining big 12,know watching conference blow suckswe big 12 fans almost went thing seems like many yall view big 12 beneath youthe least worst option fresh youre angry pac 12 leadershipthe situation truly attitude expect yall going forward really happy soon done dealing arrogance ut fans im starting worry went frying pan fire bringing yall far entitled negative nancies around go,[],"['northernarizona', 'texas']",ive seen last week four corner schools begging schools make jump big 12 mourning loss historic conference
183t14f,kaqtk4p,postgame defeats ohio 3024,box score provided team 1 2 3 4 ohio made rcfb,['rcfb'],"['umass', 'northernarizona']",day take ucla job wont get ridiculed 567 record knows navigate big ten already jarmond loves ohio guys anyway would poetic replacing oc unh
15wfg7n,jx0hq8y,whats news coming schools fall camp,team impressing fall camp group going improved bumps bruises might keep someone games whats word teams quarterback competition,"['texasam', 'meteor']","['georgia', 'northernarizona']",carson beck qb competition shock kendall miltons banged bit surprise either apparently julian humphrey awesome corner elite physicals high school sounds like rest clicked mean everyone knows questions theyll probably answer
17nxe0b,k7uy76t,purdue 730,location time 730 watch tv nbclnbc rcfb made rcfb please keep trash talk civil report comments violate lets talk,['rcfb'],"['michigan', 'northernarizona']",ryan walters spent half week teaching team new signal language get cooked 70 points
17nxe0b,k7v4ij5,purdue 730,location time 730 watch tv nbclnbc rcfb made rcfb please keep trash talk civil report comments violate lets talk,['rcfb'],"['michigan', 'northernarizona']",maybe walters taught team discipline instead new signal language
170h4sz,k3kpile,tier list every longhorns loss past 25 years,honor red river shootout weekend felt would fun activity go every single longhorn loss lifetime 1998present rank tier list subjective opinion feel free correct comments made egregious mistakes originally attempted pull data online database decided would far entertaining activity go manually taking trip memory lane basking light every glorious loss longhorns last 25 years 99 glorious losses time span luck sooners gods work make nice even 100 losses saturday well start quick easy tiers f c b see losses tiers case losing give immense joy belittle one unique special losses past 25 years putting stier would dishonest wrong however concede infinite sets size losses bring quite level catharsis therefore ranking wins within several subtiers within stier sc sb sa ss ss nbsp sc well start bottom stier losses actually seemed halfway respectable entirely forgettable mostly include games lost close good team like loss 2022 opponent mediocre loss brought bliss fell short delirium take kansas 2016 example dont enough time space discuss depth writing detailed summary games get higher tiers scoreopponent score 1999nebraska622 2000oregon3035 2003washington st2028 2011oklahoma st2638 2011kansas st1317 2012west virginia4548 2014ucla1720 2015oklahoma st2730 2016west virginia2024 2016kansas st2124 2021oklahoma st2432 2021baylor2431 2022alabama1920 nbsp sb next sbtier runofthemill losses stand tier include 724 loss ohio 2006 931 loss tcu 2016 also include losses enjoy losing one biggest rivals unfortunately also means aggies bummer scoreopponent score 1998ucla3149 1999texas aampm1620 1999kansas st1735 1999nc state2023 2006texas aampm712 2006ohio st724 2007texas aampm3038 2010texas aampm1724 2010oklahoma st1633 2010baylor2230 2011baylor2448 2012kansas st2442 2012tcu1320 2013oklahoma st1338 2013oregon730 2013ole miss2344 2013baylor1030 2013byu2140 2014kansas st023 2014baylor728 2015west virginia2038 2016tcu931 2016oklahoma st3149 2021west virginia2331 2022tcu1017 nbsp sa getting losses feel particularly notable either lopsided margin due particularly embarrassing circumstances mistakes made longhorns teams mediocre bad margin defeat humiliating specific games note tier include 41 point loss kansas 1998 fifth largest margin defeat last 25 years losing predeion colorado 2001 big 12 championship lopsided losses mediocre kansas teams 2007 2010 blown rival arkansas 731 2014 bowl losing cal 2015 one point missing extra point less two minutes losing 730 2021 fourth consecutive loss season scoreopponent score 1998kansas st748 1998texas tech3542 1999arkansas627 2002texas tech3842 2006kansas st4245 2007kansas st2141 2010kansas st1439 2010ucla1234 2010iowa st2128 2011missouri517 2014byu741 2014tcu1048 2014arkansas731 2015notre dame338 2015tcu750 2015iowa st024 2015texas tech4548 2017usc2427 2017tcu724 2021iowa st730 2022texas tech3437 2022oklahoma st3441 nbsp ss stier within stier every loss included tier higher well loss tom herman team automatically included tier yknow tom herman whole highlights tier include getting shutout 2004 deep strike got big man crabtree pulls free touchdown red raiders losing 1 point grier wvu mountaineers 2018 4ot loss 2020 getting demolished arkansas 2021 scoreopponent score 2004oklahoma012 2008texas tech3339 2017oklahoma st1013 2017texas tech2327 2018oklahoma st3538 2018west virginia4142 2019lsu3845 2019tcu2737 2019iowa st2123 2019baylor1024 2020tcu3133 2020iowa st2023 nbsp ss final tier ones know love true epitome longhorns misery past 25 years love every one losses unique way let us reminisce getting absolutely obliterated 2000 chris simms major applewhite cares theyd gotten flattened either way roy williams superman need say thought 2000 bad look 52 point demolition suffered 2003 ou largest loss margin entire 25 year span losing national championship 2009 end run success dawn dark days longhorn blowout losses 2011 1755 2012 2163 could forget pair losses kansas 2017 2021 ill leave losing big 12 championship 2018 featuring ridiculous catch grant calcaterra tre brown sacking sam ehlinger endzone safety ceedee lamb absolutely cooking defense 2019 en route 3427 victory course could forget fans wanted caleb delivered 2021 5548 victory scoreopponent score 2001oklahoma314 2009alabama2137 2016kansas2124 2021kansas5657 nbsp well rounds hope enjoyed trip memory lane heres hoping another loss gets added list weekend nbsp tldr boomer sooner sucks,['oklahoma'],"['ucla', 'northernarizona']",2014 bruins 30 got ball start halves botched opening coin toss ucla coin toss elected defer choice second half said wanted go defense referee turned microphone briefly said something longhorns players decision
1684ovh,jzuwn2s,utah 1200,utah iowafiowaiowa location iowafiowa kinnick time 1200 watch tv fox sports 1lfs1 odds spread 25 overunder 450 rcfb made rcfb please keep trash talk civil report comments violate lets talk,"['iowa', 'washington']","['ohiostate', 'northernarizona']",fans lookin like showbiz pizza bear
1684ovh,jytogwp,utah 1200,utah iowafiowaiowa location iowafiowa kinnick time 1200 watch tv fox sports 1lfs1 odds spread 25 overunder 450 rcfb made rcfb please keep trash talk civil report comments violate lets talk,"['iowa', 'washington']","['arizonastate', 'northernarizona']",allowed score fast
1684ovh,jytrie0,utah 1200,utah iowafiowaiowa location iowafiowa kinnick time 1200 watch tv fox sports 1lfs1 odds spread 25 overunder 450 rcfb made rcfb please keep trash talk civil report comments violate lets talk,"['iowa', 'washington']","['arizonastate', 'northernarizona']",mean yes utah looks reasonably competent offense
16whq5d,k2xxozp,lsu ole miss 600,lsuflsulsu ole missfolemissole miss location ole missfolemiss vaughthemingway time 600 watch tv espnlespn rcfb made rcfb please keep trash talk civil report comments violate lets talk,['rcfb'],"['northernarizona', 'pac12']",might see public execution lsus dc blow
16q2osp,k1v8d0q,espn college gameday show,want little ting tang tang discuss post anything related show signs screencaps videos etc,['rcfb'],"['arizonastate', 'northernarizona']",say every week every week becomes evident lee corso looks sounds lot better year
18jkcv4,kdkwfz4,say something sincerely good rival,holiday season lets spread love team washington rivals wsu moving forward reliably schedule traditional rival head coach balls 4th attempts us legit respected making call go regardless outcome outcome could gone either way schools made great hires year look forward rivalry watched talked whole country moving forward,['washington'],"['georgia3', 'northernarizona']",auburn perfectly respectable cow college literally theyre good ag school
18taa8w,kfdippd,alamo bowl arizona 915,location alamodome time 915 watch tv espnlespn espnlespn odds spread ariz 25 overunder 595 rcfb made rcfb please keep trash talk civil report comments violate lets talk,['rcfb'],"['arizona', 'northernarizona']",major bail refs maclachlan didnt touch anyone
18taa8w,kfdmr5v,alamo bowl arizona 915,location alamodome time 915 watch tv espnlespn espnlespn odds spread ariz 25 overunder 595 rcfb made rcfb please keep trash talk civil report comments violate lets talk,['rcfb'],"['northernarizona', 'fiu']",topic whats parents giving kids surnames forenames
17o13pm,k7vpf0z,ucla arizona 1030,uclafuclaucla location arizonafarizona arizona time 1030 watch tv fox sports 1lfs1 rcfb made rcfb please keep trash talk civil report comments violate lets talk,['rcfb'],"['arizona', 'northernarizona']",gronk paying refs autographs relatively quiet far see pays later close calls tho
17o13pm,k7vrf0t,ucla arizona 1030,uclafuclaucla location arizonafarizona arizona time 1030 watch tv fox sports 1lfs1 rcfb made rcfb please keep trash talk civil report comments violate lets talk,['rcfb'],"['arizona', 'northernarizona']",oh big hit quite time starting get pressure thats big
17o13pm,k7vvj6j,ucla arizona 1030,uclafuclaucla location arizonafarizona arizona time 1030 watch tv fox sports 1lfs1 rcfb made rcfb please keep trash talk civil report comments violate lets talk,['rcfb'],"['arizona', 'northernarizona']",wanna see take loss wanna see
17o13pm,k7vwwf2,ucla arizona 1030,uclafuclaucla location arizonafarizona arizona time 1030 watch tv fox sports 1lfs1 rcfb made rcfb please keep trash talk civil report comments violate lets talk,['rcfb'],"['arizona', 'northernarizona']",bounces chest hits ground dont see catch
17o13pm,k7vx22g,ucla arizona 1030,uclafuclaucla location arizonafarizona arizona time 1030 watch tv fox sports 1lfs1 rcfb made rcfb please keep trash talk civil report comments violate lets talk,['rcfb'],"['arizona', 'northernarizona']",gronk needs sign autographs get call review next time
17o13pm,k7w44j7,ucla arizona 1030,uclafuclaucla location arizonafarizona arizona time 1030 watch tv fox sports 1lfs1 rcfb made rcfb please keep trash talk civil report comments violate lets talk,['rcfb'],"['arizona', 'northernarizona']",say give gronk standing invitation come back every fuck around like dude killing
17o13pm,k7w4biy,ucla arizona 1030,uclafuclaucla location arizonafarizona arizona time 1030 watch tv fox sports 1lfs1 rcfb made rcfb please keep trash talk civil report comments violate lets talk,['rcfb'],"['arizona', 'northernarizona']",oh man cant put weight yikes
17ifk35,k6uwry4,indiana penn 1200,penn location penn statefpennstate beaver time 1200 watch tv cbslcbs rcfb made rcfb please keep trash talk civil report comments violate lets talk,['rcfb'],"['oregonstate', 'northernarizona']",conservative playcalling feels like put lightly jesus h christ big 10 hard watch outside osu
17ifk35,k6uxkja,indiana penn 1200,penn location penn statefpennstate beaver time 1200 watch tv cbslcbs rcfb made rcfb please keep trash talk civil report comments violate lets talk,['rcfb'],"['oregonstate', 'northernarizona']",lol nice job indiana ya bunch fucking losers fans yes head coach
17ifk35,k6uxrab,indiana penn 1200,penn location penn statefpennstate beaver time 1200 watch tv cbslcbs rcfb made rcfb please keep trash talk civil report comments violate lets talk,['rcfb'],"['oregonstate', 'northernarizona']",im entirely sure watching 2 best teams college
18u1f6v,kfi3liw,cotton bowl ohio missouri 800,ohio location att time 800 watch tv espnlespn espnlespn odds spread osu 5 overunder 495 rcfb made rcfb please keep trash talk civil report comments violate lets talk,['rcfb'],"['northernarizona', 'fiu']",devolving rugby union tactical kicking
162828r,jxwqgq0,umass new mexico 700,new mexico mexico location new mexico aggie memorial time 700 watch tv espnlespn odds spread nmsu 7 overunder 450 rcfb made rcfb please keep trash talk civil report comments violate lets talk,"['louisville', 'army']","['umass', 'northernarizona']",id like say wont find way blow absolutely
17dhxtg,k5xa7w9,arizona washington 1030,arizona location husky time 1030 watch tv fox sports 1lfs1 rcfb made rcfb please keep trash talk civil report comments violate lets talk,['rcfb'],"['arizonastate', 'northernarizona']",theres honestly reason throw two flags fumble vintage pac12 dark enjoy lasts yall
17dhxtg,k5xheti,arizona washington 1030,arizona location husky time 1030 watch tv fox sports 1lfs1 rcfb made rcfb please keep trash talk civil report comments violate lets talk,['rcfb'],"['arizonastate', 'northernarizona']",think ball point 4 territory unless inside 1520
17dhxtg,k5xhhhv,arizona washington 1030,arizona location husky time 1030 watch tv fox sports 1lfs1 rcfb made rcfb please keep trash talk civil report comments violate lets talk,['rcfb'],"['arizonastate', 'northernarizona']",glad didnt call calling rest
