post_id,comment_id,post_title,post_selftext,post_author_flairs,comment_author_flairs,comment_body
181eq61,kabs4oz,week 13 matchup preview 2 ohio buckeyes 4 wolverines,2 ohio statefohiostate 4 saturday november 25 1200 eastern ann arbor watch foxlfox odds 35 pts total points 475 alltime series ohio statefohiostate ohio statefohiostate met 117 times since 10161897 teams last met 361 days ago 11262022 series wins ohio statefohiostate 51660 longest streak continuous meetings 102 19182019 last 2 meetings 20212022 series last 5 meetings oh2345 arbor mi2742 ohio arbor mi5627 ohio oh6239 ohio arbor mi3120 series comparison data via week 12 weekohio statefohiostate 11080result 3817w 233ecufecu 2916w 303 2youngstown 7453w 357unlvfunlv 9261w 357 3wkufwku 6543w 6310bowling 6543w 316 4notre 8300w 6535w 317 5635w 457 6535w 5635w 5210 7purduefpurdue 3826w 3817w 527 8penn 9262w 2012michigan 4726w 490 6544w 2410byena 6535w 3826w 4113 11michigan 4726w 383penn 9262w 2415 5635w 6535w 3124 rankings reflect current rcfb ohio statefohiostate injury report data scraped 20231122 100012 devin brownqbearly dec ankletue nov 21brown sidelined right ankle sprain projected remain beginning december michael hall jrdtques sat undisclosedmon nov 20hall held previous due unknown issue air take saturday versus tommy sat undisclosedmon nov 20eichenberg missed past two contests undefined ailment unclear play saturdays tilt versus lathan ransomsques sat legmon nov 20ransom sat last three games due leg injury unknown suit saturday miyan williamsrbout season undisclosedtue oct 31williams sit remainder season unknown injury nolan baudowrout indefinitely undisclosedsat nov 4baudo idle undefined issue timetable recovery joop mitchellwrout indefinitely undisclosedsun oct 8mitchell commission due unrevealed ailment yet confirmed return kyion grayeswrout indefinitely undisclosedsun oct 8grayes sidelined due unspecified issue miss extended period jayden bonsusout indefinitely undisclosedsun oct 8bonsu lineup undefined issue unclear make season debut reis stocksdalewrout season kneetue oct 3stocksdale commission knee injury likely miss remainder season zak herbstreitteout season undisclosedthu sep 21herbstreit shut entire 2023 season unknown injury bennett christianteout season suspensionsun aug 27christian suspended entire 2023 season due violation ncaa rules tc caffeyrbout indefinitely kneesun oct 15caffey idle due knee injury unclear return injury data lifted injury report data scraped 20231122 100012 logan forbeswrout indefinitely undisclosedmon oct 2forbes away team due undivulged reasons without definitive timetable recovery cj stokesrbout indefinitely undisclosedsun oct 15stokes idle undefined injury timetable return karmello englishwrques sat undisclosedmon nov 20english held previous four games due unlisted issue unknown dress saturdays showdown ohio danny hughesrbques sat undisclosedmon nov 20hughes missed previous two contests due unknown injury undetermined face ohio saturday ladarius hendersonolques sat undisclosedmon nov 20henderson absent lineup last unreported ailment uncertain suit saturday versus ohio roman wilsonwrprob sat undisclosedmon nov 20wilson exited previous contest unreported injury expected impact status saturdays battle ohio davis warrenqbques sat undisclosedmon nov 20warren sat last three matches due unspecified ailment unclear line saturday versus ohio injury data lifted keys think wins think favorite cover spread players interested watch lets talk vote matchup win poll simply include name team think win enclosed part top level comment discussing matchup change vote edit initial comment bracket team change vote often like posted full listing accepted fbs team aliases found fcs teams need use full name appears post title listing links live vote totals matchup preview threads current week found like format generate matchup discussion matchup discussion please dm udupreesdiamond regarding template,"['oregonstate', 'cascadeclash']","['oregon2', 'pacificnorthwest']",win hands funniest outcome sorry buckeyes
17h2hhf,k6kjc0d,michigans signstealing scandal really big deal,nan,['georgia'],"['oregon2', 'pacificnorthwest']",huge deal unless turns thing
17ny5nn,k7vmaa8,postgame defeats 2724,box score provided team 1 2 3 4 made rcfb,['rcfb'],"['georgefox', 'pacificnorthwest']",d3 george fox bruins may lost since leon johnson iii cowboys get little bit second hand success
177ix9d,k4tbitu,postgame stanford defeats colorado 4643 2ot,box score provided team 1 2 3 4 ot made rcfb,['rcfb'],"['oregon', 'pacificnorthwest']",liked speech felt hated nothing given stanford bullshit
177ix9d,k4tbvko,postgame stanford defeats colorado 4643 2ot,box score provided team 1 2 3 4 ot made rcfb,['rcfb'],"['oregon', 'pacificnorthwest']",phone doesnt let uh eyes
17ijvyn,k6v6i7b,utah 330,utahfutahutah location utahfutah riceeccles time 330 watch tv foxlfox rcfb made rcfb please keep trash talk civil report comments violate lets talk,['rcfb'],"['oregon', 'pacificnorthwest']",moving stout love see hate see depleted utah team though 2nd favorite team
17ijvyn,k6vqcp2,utah 330,utahfutahutah location utahfutah riceeccles time 330 watch tv foxlfox rcfb made rcfb please keep trash talk civil report comments violate lets talk,['rcfb'],"['oregon', 'pacificnorthwest']",beating crippled utah team 2 years ago utah dominated bejesus team crippled cristobal twice circle cfb life really sad last year guaranteed face least occasionally love utah hope teams ooc games like past meet playoff go utes
15wqekf,jx2f30f,top 5 popular college teams cityarea,1 north carolina 2 nc 3 appalachian 4 wake forest 5 duke x200b,"['floridastate', 'northcarolinaat']","['oregon', 'pacificnorthwest']",washington 1a 1b huskies distant 3rd close behind live sw washington
17nng69,k7ty505,kansas 1200,kansas location texasftexas dkrtexas memorial time 1200 watch tv foxlfox odds spread tex 4 overunder 505 rcfb made rcfb please keep trash talk civil report comments violate lets talk,['rcfb'],"['oregon2', 'pacificnorthwest']",get going k st offense looked much worse compressed
17fejum,k69cmx0,fans react connor stalions report mean harbaugh,nan,"['michiganstate', 'otemongakuin']","['oregon2', 'pacificnorthwest']",going say whole everyone buy tickets stallions name cant catch us har har har thing cute half cute stupid get twitter people truly morons
15rxzeo,jwccp3a,whats goto name referring favorite school conversation,go abbreviation mascot full name maybe something else keep simple wvu curious fanbases say,"['westvirginia2', 'hateful8']","['oregonstate', 'pacificnorthwest']",beavers never say osu live far far away corvallis usually get explain ducks pronounced oregun orygone
18w6kt1,kfx0bu7,rose bowl 500,location rose bowl time 500 watch tv espnlespn odds spread mich 2 overunder 455 rcfb made rcfb please keep trash talk civil report comments violate lets talk,['rcfb'],"['auburn2', 'pacificnorthwest']",little advice rush 2 kid
191mhz7,kh0bczc,said ill say national championship shouldnt kicking damn late anymore,take work tomorrow able watch whole damn tonight least bump hour us people go work morning get reasonable amount sleep,"['auburn2', 'florida']","['oregon', 'pacificnorthwest']",fuck sleep move back extra half hour west coast actually get home see
15ry50a,jwbf48a,unpopular prediction 2023 involving team,made two award winning threads last year two years ago asking question probably yearly tradition point mine none new big 12 teams winning record conference play year despite people think bounce back year kansas goes back kansas misses bowl tennessee regresses losing 3 games regular season,"['auburn', 'uwf']","['oregon', 'pacificnorthwest']",utah reminds usc trojans foverver little brother
18fyi2w,kcxeo2o,tank job year,tank job week award fbs team best job humiliating weekend whether blew large lead choked away spot limelight lost absolutely right losing completely screwed everything last second blunder tjotw winner sets gold standard college misery x200b previous winners week 1 baylor bears lost 4231 2 nevada wolf pack lost idaho 336 3 cowboys lost south 337 4 minnesota golden gophers lost northwestern 3734 5 ucf knights lost baylor 3635 6 miamifl hurricanes lost tech 2320 7 boise broncos lost colorado 3130 8 north carolina tar heels lost virginia 3127 9 north carolina tar heels lost tech 4642 sam houston bearkats lost utep 3734 10 air force falcons lost army 233 11 cowboys lost ucf 453 12 auburn tigers lost new mexico 3110 13 auburn tigers lost 2724 14 college playoff committee lost everyones respect ducks lost washington 3431 last week knew guys going tried stop didnt work despite saying already win vote still overwhelmingly playoff committee guess thats hazard posting less 24 hours perhaps single infuriating thing thats ever happened college everyone mad hell think everyones still mad anyways actual stuff edged couple votes congrats dont worry ducks youre still undefeated eye test week tank job year time season long award isnt biggest screw ups like miami isnt even necessarily multitime winners like unc since ended decent seasons despite pratfalls nope teams managed put seasons dumpster fire pour gasoline mr incredible fullcolorblack white meme playing course fourteen glorious weeks x200b note ease counting please use carats vote like team thank thanks participating well see january 2 tank job bowls x200b nominees tank job year x200b air force falcons 84 im sure ive ever nominated 84 team tjoty certainly group five one might disappointing still respectable record falcons sat 80 ranked low teens sitting almost certainty become mountain wests first group five representative since 2014 got destroyed 213 lackluster army team 2713 lackluster hawaii team finished back back losses unlv boise take spotlight even making mountain west championship baylor bears 39 bears escaped nomination last year despite turning top 10 start dismal 67 finish dont escape time things went bad worse starting tjotwwinning meltdown things look promising played utah close even pulled miracle comeback beat ucf smackings tech kansas tcu plus overtime heartbreaker houston confined bears oblivion x200b cincinnati bearcats 39 bearcats brought appalachian coach scott satterfield replace departing coach luke fickell showed promise early including big win turned equally dismal pitt team everything went wrong bearcats could muster single conference win houston finishing dead last new big 12 conference x200b colorado buffaloes 48 without context colorado threewin improvement last year even though still 18 conference play much competitive complete doormat last year course theres additional context unwarranted hype machine buffs cultivated displayed first half season even realitycheck losses usc came stanford buffs blew 290 lead lost overtime colorado didnt win single finishing season six losing streak alone bottom pac12 standings ego arrogance pushed higher actually fall even reality hit x200b pittsburgh panthers 39 tough schedule also total bottom team spent much last years upper midcard acc panthers couldnt even beat fellow acc strugglers wake forest syracuse however beat louisivlle least going x200b tcu horned frogs 57 mean sure riding hypnotoad magic last year lost much production made national runners hype completely destroyed week 1 loss colorado still team started top 20 failed make bowl x200b usc trojans 75 missing playoff pac12 championship painted fingernail last year trojans returned heisman winner caleb williams bid finish job came close unfortunately even suspect defense also returned knocked usc top ten team team barely 500 conference play fairness none teams lost bad thats also failed win big games x200b washington cougars 57 hell happened cougs started hot including win wisconsin becoming triumphant epic showdown fellow pac12 left behind make 40 something happened bye week cougs werent losing next six row rally beat colorado played undefeated washington close little late bowl hopes,"['washington', 'centralwashington']","['oregon2', 'pacificnorthwest']",usc season could even worse barely escaped arizona cal colorado almost came way back much preseason hype take caleb team ceiling 48
17nuooq,k7uqsd5,california 530,location oregonforegon autzen time 530 watch tv pac12 networklp12n rcfb made rcfb please keep trash talk civil report comments violate lets talk,['rcfb'],"['oregon2', 'pacificnorthwest']",lol either going blow play offsides
17nuooq,k7v4y6b,california 530,location oregonforegon autzen time 530 watch tv pac12 networklp12n rcfb made rcfb please keep trash talk civil report comments violate lets talk,['rcfb'],"['oregon', 'pacificnorthwest']",might time ty thompson especially rough injury
17nuooq,k7v80f0,california 530,location oregonforegon autzen time 530 watch tv pac12 networklp12n rcfb made rcfb please keep trash talk civil report comments violate lets talk,['rcfb'],"['oregon', 'pacificnorthwest']",first fumble buckys entire 3 year career last week utah theyre really gonna stick 2nd career fumble basketball bounce damnit
17nuooq,k7v9dyv,california 530,location oregonforegon autzen time 530 watch tv pac12 networklp12n rcfb made rcfb please keep trash talk civil report comments violate lets talk,['rcfb'],"['oregon', 'pacificnorthwest']",hell yeah give traeshon earned td close last time
182v9ux,kalvfek,nebraska 1200,iowafiowaiowa location memorial lincoln ne time 1200 watch tv cbslcbs rcfb made rcfb please keep trash talk civil report comments violate lets talk,['rcfb'],"['platypus', 'pacificnorthwest']",forget nonsense good defense teams conference plain bad
15o68ro,jvqldxs,would 10year ago think told last decade gone favorite team,id shocked butch jones left bowl 2012 dantonio kelly done prior big east collapsed joined american conference 2013 season tell new head coach tommy tuberville would start backtoback 94 seasons go 1114 last two seasons manage piss entire fanbase way id confidence things would turn around soon tell next head coach luke fickell went 48 first season id dejected would absolutely lose mind think im lied hearing wed rattle seasons 112 113 91 131 94 going 48 2016 2017 backtoback ny6 bowls including first ever g5 team make cfp wouldve sounded impossible id certain lied tell 2013 first year american conference decade wed big 12,"['cincinnati', 'ohiostate']","['oregon', 'pacificnorthwest']",actually fired coach two coaches left coach florida youre high
17v67wr,k9a6ycm,jimbos buyout disgrace,think lot coaching carousel coverage missing obvious point outrageous public university pay 78 million someone coach team understand boosters come cash side doesnt come literally general budget people need understand cash fungible dollars donated could donated university outright b could used literally worthwhile purpose paying jimbo fisher strong suspicion boosters donation papered give tax deduction well effectively americans subsidizing 40 shitshow understand college sports headed insane direction decades really ripped overton window wide open point inflated broadcast money going start dry lot universities public private going find investing fbs cfb expense rest institution huge mistake,"['notredame', 'indiana']","['texasam2', 'pacificnorthwest']",lol cope perfect world live hell rich remind us every way
16z2cw9,k3ckeq7,people 12 team playoff,maybe im biased penn fan whose team would made 59 12 team playoffs far existed great way let teams get redeeming shot one two closequality losses youre best 4 teams still get bye road 4 team nfl less fun playoffs college basketball absolutely sport dont see downsides gives clear path 8 good compete still lets top 4 teams better chance getting championship,"['maryland', 'pennstate']","['oregon', 'pacificnorthwest']",best part 12 team playoff top 4 byes semifinals 4 team format mostly noncompetitive eliminate couple teams college sudden parity competitive games looking back past decade 512 611 matchups would fantastic watch games wouldnt gutted opt outs
15vwgdi,jwxvg1a,teams 4th biggest rival,bah gawd tell close start season let get one peak offseason question every school knows first second biggest rivalries majority know third fourth biggest rival auburn would think likely florida honest rivalry pretty dead days know used big back day,"['auburn', 'chattanooga']","['oregon', 'pacificnorthwest']",washington washington usc usc move list though
15ifj30,juuwtx2,say something nice washington,embarrassed florida washington took jg hands,['tennessee'],"['washington', 'pacificnorthwest']",grandfather season tickets growing went one osu year nice memories osu grandfather
188eaxn,kbk1qxn,longhorn livestock found dead outside frat house ahead big 12 championship,nan,['texas'],"['oregon2', 'pacificnorthwest']",good job frat losers made good guys
15ny6b2,jvr2dk4,fall team,curious guys became fans teams man first ever big house renovations hooked ever since,[],"['oregon', 'pacificnorthwest']",heartbroken knees walmart watching auburns kick go uprights time expired
17sxef4,k8t8vso,penn 1200,penn location penn statefpennstate beaver time 1200 watch tv foxlfox rcfb made rcfb please keep trash talk civil report comments violate lets talk,['rcfb'],"['oregon2', 'pacificnorthwest']",guy going hoover many yards today
17sxef4,k8tuzt7,penn 1200,penn location penn statefpennstate beaver time 1200 watch tv foxlfox rcfb made rcfb please keep trash talk civil report comments violate lets talk,['rcfb'],"['oregon2', 'pacificnorthwest']",watching im still convinced played anyone nittany lions offense ass
17sxef4,k8twy1p,penn 1200,penn location penn statefpennstate beaver time 1200 watch tv foxlfox rcfb made rcfb please keep trash talk civil report comments violate lets talk,['rcfb'],"['oregon2', 'pacificnorthwest']",literally think allar could make throw like
189it1b,kbu24tu,special edition ccg weekend cfp rankingscenario discussion,hot takes hypotheticals sos comparisons h2h arguments place home usergenerated cfp discussion wild conference championship week,['rcfb'],"['boisestate', 'pacificnorthwest']",bama 3rd string qb 130 record theyd lock let fsu
17mz4ce,k7o9yog,media gathering evidence private investigators links osu jim harbaugh extension,nan,"['michigan', 'westernmichigan']","['oregon2', 'pacificnorthwest']",discover ryan day personally initiated dozen private investigations every year change anything illegal unethical way literally one sour fans care cheating exposed
15i7791,juskvpz,sad day fellow beavs cougar brethren,first sportteam fell love kid took first trip reser next year magical fiesta bowl season growing pretty even mix beaver duck fans friend group grade school every fall carried usual banter among us point neither program clearly ahead shared history mediocrity occasional flashes great remember excitement pride mom bought first jersey immediately slipped pads next practice early 2000s exciting time teams saw success programs growing every thanksgiving looked forward civil wars years elated others cope eating leftovers team lost time moved forward help prolific alumni pulled ahead level beaver fans knew couldnt match shouldve seen writing wall know fans chime say always little brother reality prior phil going peers disappointing win loss total could okay long beat rival atleast bragging rights next year still pulled ahead rooted supported made trek reser support team one wed grown sporting obnoxiously bright orange weve grown love trudged end mike riley years beacon hope gary andersen promising first year things fell apart new lows didnt think possible became joke program days dark still us faithfully went reser supporting guys many losses hope one day wed turn around enter jonathan smith legendary qb fiest bowl team comes home take reigns first year rough saw going year things improved little reason excitement corvallis wasnt one faithful heading reser began fill reser rocking smith built good little program corvallis 10 wins last year heading anticipated season years dj pans legitimate shot compete pac12 championship todays news sucks wind sails immediate future questions impact recruiting keep coaching staff together longer term wonder ability smaller sports theyll able survive though single greatest tragedy seeing tradition grew dying knowing want able share kids like grandpa shared know many say happened youre right wasnt didnt get sucks way tv money tearing everything made us fall love college certainly feels like us getting cut canary coal mine think two things certain future foxespn continue shave teams theyve got top 32 short term teams benefit greatly financially truth im predicting comes fruition 90 programs cut youll end nfl lite many people wont care watch nfl always king second tier pro program isnt going support know interest disconnected league schools zero connection ill wait watch guys sundays saturdays keep watching beavs cougs beat piss blunt say way im glad grandpa wasnt alive day certainly wouldve killed spirits solidarity cougar brethren ive added secondary flair beaver nation till die,"['oregonstate', 'washingtonstate']","['oregon', 'pacificnorthwest']",really want calstanford come b1g traditional rivlaries scheduling reasons even want stay osuwsu schools dont settle 4m year mwc type money sure would work hink osuwsu much better financially stay attached bay area schools
15i7791,jussrt8,sad day fellow beavs cougar brethren,first sportteam fell love kid took first trip reser next year magical fiesta bowl season growing pretty even mix beaver duck fans friend group grade school every fall carried usual banter among us point neither program clearly ahead shared history mediocrity occasional flashes great remember excitement pride mom bought first jersey immediately slipped pads next practice early 2000s exciting time teams saw success programs growing every thanksgiving looked forward civil wars years elated others cope eating leftovers team lost time moved forward help prolific alumni pulled ahead level beaver fans knew couldnt match shouldve seen writing wall know fans chime say always little brother reality prior phil going peers disappointing win loss total could okay long beat rival atleast bragging rights next year still pulled ahead rooted supported made trek reser support team one wed grown sporting obnoxiously bright orange weve grown love trudged end mike riley years beacon hope gary andersen promising first year things fell apart new lows didnt think possible became joke program days dark still us faithfully went reser supporting guys many losses hope one day wed turn around enter jonathan smith legendary qb fiest bowl team comes home take reigns first year rough saw going year things improved little reason excitement corvallis wasnt one faithful heading reser began fill reser rocking smith built good little program corvallis 10 wins last year heading anticipated season years dj pans legitimate shot compete pac12 championship todays news sucks wind sails immediate future questions impact recruiting keep coaching staff together longer term wonder ability smaller sports theyll able survive though single greatest tragedy seeing tradition grew dying knowing want able share kids like grandpa shared know many say happened youre right wasnt didnt get sucks way tv money tearing everything made us fall love college certainly feels like us getting cut canary coal mine think two things certain future foxespn continue shave teams theyve got top 32 short term teams benefit greatly financially truth im predicting comes fruition 90 programs cut youll end nfl lite many people wont care watch nfl always king second tier pro program isnt going support know interest disconnected league schools zero connection ill wait watch guys sundays saturdays keep watching beavs cougs beat piss blunt say way im glad grandpa wasnt alive day certainly wouldve killed spirits solidarity cougar brethren ive added secondary flair beaver nation till die,"['oregonstate', 'washingtonstate']","['oregonstate', 'pacificnorthwest']",considering making wazubeav sympathy post think suffice
188qre7,kbmy8eu,washington 800,location allegiant time 800 watch tv abclabc odds spread ore 95 overunder 655 rcfb made rcfb please keep trash talk civil report comments violate lets talk,['rcfb'],"['oregon2', 'pacificnorthwest']",shifted video games started alan wake 2 depressed play opening scene
188qre7,kbn2cwy,washington 800,location allegiant time 800 watch tv abclabc odds spread ore 95 overunder 655 rcfb made rcfb please keep trash talk civil report comments violate lets talk,['rcfb'],"['oregon2', 'pacificnorthwest']",kirk would pick threw odunze
188qre7,kbn5pue,washington 800,location allegiant time 800 watch tv abclabc odds spread ore 95 overunder 655 rcfb made rcfb please keep trash talk civil report comments violate lets talk,['rcfb'],"['oregon2', 'pacificnorthwest']",neutrals crazy feels inside fan bubble
188qre7,kbn866y,washington 800,location allegiant time 800 watch tv abclabc odds spread ore 95 overunder 655 rcfb made rcfb please keep trash talk civil report comments violate lets talk,['rcfb'],"['oregon2', 'pacificnorthwest']",brutal im good pnw boy score holds begrudgingly root huskies play
169eu9x,jz1fesz,bestworst experience away fan,im wyoming fan wyomingtexas tech last night always try hospitable possible away fans many friendly conversations tech fans even im curious best worst experiences youve away fan,"['wyoming', 'nebraska']","['oregonstate', 'pacificnorthwest']",best tennessee blast ducks beaver volunteer gear guess thats really fair comparison everyone happy friendly tailgate sides worst drunk shitshow frat boys wasnt even team gear happened nearby work wanted see 2 guys try fight bar girl said hi army wanted show badass corps cadets really
