post_id,comment_id,post_title,post_selftext,post_author_flairs,comment_author_flairs,comment_body
17ggk5k,k6gonsk,ncaa probe began firm obtained evidence computers,nan,"['rutgers', 'tft']","['oregon2', 'pacificnorthwest']",want give big shout flairs stuck around taken dignity make fun loonies genuinely impressed people faced head honest honestly say shoes would throw every electronic device could get hands traffic never log
17n7n7x,k7pvjrq,university fired recruiting analyst connor stalions source tells yahoo sports previously suspended pay ncaa investigation inperson scouting,nan,"['ohiostate', 'illinois']","['oregon2', 'pacificnorthwest']",time spill beans connor find good agent get book deal
168jxt0,jywqoug,coastal carolina ucla 1030,coastal carolina uclafuclaucla location uclafucla rose bowl time 1030 watch tv espnlespn odds spread ucla 145 overunder 655 rcfb made rcfb please keep trash talk civil report comments violate lets talk,"['ohiostate3', 'georgia']","['oregon', 'pacificnorthwest']",dunno im watching arizona ucla games torture knowing tmac moore committed theyre special
183mtar,kapko4m,ohio 1200,ohio location time 1200 watch tv foxlfox rcfb made rcfb please keep trash talk civil report comments violate lets talk,['rcfb'],"['ohiostate3', 'pacificnorthwest']",could press button kick entire united states wouldnt even hesitate
183mtar,kapxvzt,ohio 1200,ohio location time 1200 watch tv foxlfox rcfb made rcfb please keep trash talk civil report comments violate lets talk,['rcfb'],"['oregon2', 'pacificnorthwest']",big teams going weirded new pac teams go 4th time
183mtar,kaqrjbh,ohio 1200,ohio location time 1200 watch tv foxlfox rcfb made rcfb please keep trash talk civil report comments violate lets talk,['rcfb'],"['platypus', 'pacificnorthwest']",obnoxious fan base ncaa melts
183mtar,kaqrv3w,ohio 1200,ohio location time 1200 watch tv foxlfox rcfb made rcfb please keep trash talk civil report comments violate lets talk,['rcfb'],"['oregon2', 'pacificnorthwest']",ohio st flairs going eat much shit long time
183mtar,kaqs1gr,ohio 1200,ohio location time 1200 watch tv foxlfox rcfb made rcfb please keep trash talk civil report comments violate lets talk,['rcfb'],"['oregon2', 'pacificnorthwest']",moore coached day half 5 stars
16qbmz1,k1wf5hk,colorado 330,location oregonforegon autzen time 330 watch tv abclabc rcfb made rcfb please keep trash talk civil report comments violate lets talk,['rcfb'],"['oregon', 'pacificnorthwest']",wellcolorado held lowest first quarter point total season theres
16qbmz1,k1wkxv4,colorado 330,location oregonforegon autzen time 330 watch tv abclabc rcfb made rcfb please keep trash talk civil report comments violate lets talk,['rcfb'],"['oregon', 'pacificnorthwest']",havent seen bucky irving play hes one weirdest runners ive ever seen hes gonna make hard awkward cuts somehow work hes gonna squirt sure tackleseven theres 4 guys batshit im glad minnesota didnt like going bucky thanks future conference bros
17is9rl,k6wtn62,arizona 1030,location arizonafarizona arizona time 1030 watch tv espnlespn rcfb made rcfb please keep trash talk civil report comments violate lets talk,['rcfb'],"['oregon', 'pacificnorthwest']",took bit find fake fg delay absolutely wasnt fishing personal foul masterclass
17is9rl,k6wutp0,arizona 1030,location arizonafarizona arizona time 1030 watch tv espnlespn rcfb made rcfb please keep trash talk civil report comments violate lets talk,['rcfb'],"['oregon', 'pacificnorthwest']",hell waste much time moseying line get beavs want opposite damn time least two tries
17is9rl,k6wvu5e,arizona 1030,location arizonafarizona arizona time 1030 watch tv espnlespn rcfb made rcfb please keep trash talk civil report comments violate lets talk,['rcfb'],"['oregon', 'pacificnorthwest']",someone check jonathan smith stroke hes usually coach drive best
17is9rl,k6wxfvi,arizona 1030,location arizonafarizona arizona time 1030 watch tv espnlespn rcfb made rcfb please keep trash talk civil report comments violate lets talk,['rcfb'],"['oregon', 'pacificnorthwest']",awesome job dude getting whole sync made play
18uiqbe,kfkwszi,peach bowl penn ole miss 1200,penn ole missfolemissole miss location mercedesbenz time 1200 watch tv espnlespn espnlespn odds spread psu 45 overunder 515 rcfb made rcfb please keep trash talk civil report comments violate lets talk,['rcfb'],"['oregon2', 'pacificnorthwest']",gee cant wait next commercial break 321
16a716p,jz6hwqr,clemson duke 800,dukefdukeduke location dukefduke wallace wade time 800 watch tv espnlespn odds spread clem 13 overunder 555 rcfb made rcfb please keep trash talk civil report comments violate lets talk,"['stanford', 'presscorps']","['oregonstate', 'pacificnorthwest']",duke wins may change secondary flair back team chaos
16a716p,jz6omy5,clemson duke 800,dukefdukeduke location dukefduke wallace wade time 800 watch tv espnlespn odds spread clem 13 overunder 555 rcfb made rcfb please keep trash talk civil report comments violate lets talk,"['stanford', 'presscorps']","['oregonstate', 'pacificnorthwest']",bet clemson wishes better qb right oh well guess well never know
177vtsq,k4w5ekx,washington 330,location husky time 330 watch tv abclabc odds spread wash 3 overunder 670 rcfb made rcfb please keep trash talk civil report comments violate lets talk,['rcfb'],"['platypus', 'pacificnorthwest']",washington doesnt even second best receiver lmao deadly
17nxe14,k7vfinf,washington usc 730,uscfuscusc location uscfusc los angeles memorial coliseum time 730 watch tv abclabc rcfb made rcfb please keep trash talk civil report comments violate lets talk,['rcfb'],"['oregon2', 'pacificnorthwest']",dont even need see sky know dark
17nxe14,k7vfx07,washington usc 730,uscfuscusc location uscfusc los angeles memorial coliseum time 730 watch tv abclabc rcfb made rcfb please keep trash talk civil report comments violate lets talk,['rcfb'],"['oregon2', 'pacificnorthwest']",theres 30 minute old post rcfb mocking williams draft status dude real sorry
15vykps,jwy4kkp,team want team play never seem play,auburn florida ole miss tennessee baylor,['ohiostate3'],"['oregon', 'pacificnorthwest']",want give lanning another year two build defense ready
18taa8w,kfcwakm,alamo bowl arizona 915,location alamodome time 915 watch tv espnlespn espnlespn odds spread ariz 25 overunder 595 rcfb made rcfb please keep trash talk civil report comments violate lets talk,['rcfb'],"['oregon', 'pacificnorthwest']",ive never sad recruit getting flipped tmac hes best receiver country took one look high school tape know would become
18taa8w,kfcxgp9,alamo bowl arizona 915,location alamodome time 915 watch tv espnlespn espnlespn odds spread ariz 25 overunder 595 rcfb made rcfb please keep trash talk civil report comments violate lets talk,['rcfb'],"['oregon', 'pacificnorthwest']",man arizona straight scary since got qb
18taa8w,kfdlag0,alamo bowl arizona 915,location alamodome time 915 watch tv espnlespn espnlespn odds spread ariz 25 overunder 595 rcfb made rcfb please keep trash talk civil report comments violate lets talk,['rcfb'],"['oregon', 'pacificnorthwest']",nice see actually called holds alamo bowl
17dk5de,k5x8ly4,postgame utah defeats usc 3432,box score provided team 1 2 3 4 uscfusc14031532 made rcfb,['rcfb'],"['oregon2', 'pacificnorthwest']",dont run 350 yards guys ill mad
18u1f6v,kfi2dzs,cotton bowl ohio missouri 800,ohio location att time 800 watch tv espnlespn espnlespn odds spread osu 5 overunder 495 rcfb made rcfb please keep trash talk civil report comments violate lets talk,['rcfb'],"['platypus', 'pacificnorthwest']",ohio fans upset mizzu ones theyre ahead lol
17dhxtg,k5xi23l,arizona washington 1030,arizona location husky time 1030 watch tv fox sports 1lfs1 rcfb made rcfb please keep trash talk civil report comments violate lets talk,['rcfb'],"['platypus', 'pacificnorthwest']",going every husky run like 3 yards lol
17dhxtg,k5xkoh1,arizona washington 1030,arizona location husky time 1030 watch tv fox sports 1lfs1 rcfb made rcfb please keep trash talk civil report comments violate lets talk,['rcfb'],"['platypus', 'pacificnorthwest']",pi calls much less consistent used
17dhxtg,k5xkzxp,arizona washington 1030,arizona location husky time 1030 watch tv fox sports 1lfs1 rcfb made rcfb please keep trash talk civil report comments violate lets talk,['rcfb'],"['platypus', 'pacificnorthwest']",sometimes watch enough feel like see things coming feeling like would happen drive
15hf8h8,juomtvv,two years ago big 12 seemingly deathbed hail mary moves pac12 make survive,remember news cycle rumor mill two years ago economic blood suddenly drained conference people written big 12 basically well everywhere looked people drafting big 10 would look like kansas kansas felt bad year later four new programs new director media deal worth 10 million last set effectively third conference totem poll may ceased exist move truck pac pull impossible lets hear theories even dont think happen could,"['iowastate', 'wartburg']","['washington', 'pacificnorthwest']",hindsight 2020 think proactively adding byu houston left b12 offering unequal revenue shares la schools whoever needed cough theres nothing left p5 schools join great expansion candidates b12 took best ones
17yj88b,k9uc91a,washington 730,location reser time 730 watch tv abclabc rcfb made rcfb please keep trash talk civil report comments violate lets talk,['rcfb'],"['ohiostate3', 'pacificnorthwest']",difficult find day
17yj88b,k9uif84,washington 730,location reser time 730 watch tv abclabc rcfb made rcfb please keep trash talk civil report comments violate lets talk,['rcfb'],"['oregon', 'pacificnorthwest']",bring osu utah b1g please dont ever want stop playing guys equal footing
17yj88b,k9ulqt4,washington 730,location reser time 730 watch tv abclabc rcfb made rcfb please keep trash talk civil report comments violate lets talk,['rcfb'],"['oregon', 'pacificnorthwest']",3rd conversion far opi fergusons get bo record
17yj88b,k9ulyv5,washington 730,location reser time 730 watch tv abclabc rcfb made rcfb please keep trash talk civil report comments violate lets talk,['rcfb'],"['oregon', 'pacificnorthwest']",two great teams would wanted see try win milked much clock mistake
1694dym,jyzs5l7,san jos 330,san jos jos location san jos cefcu time 330 watch tv cbslcbs odds spread orst 165 overunder 545 rcfb made rcfb please keep trash talk civil report comments violate lets talk,"['oregonstate', 'summertimelover']","['oregonstate', 'pacificnorthwest']",im support favorite team fucking toxic
1694dym,jz0i0g4,san jos 330,san jos jos location san jos cefcu time 330 watch tv cbslcbs odds spread orst 165 overunder 545 rcfb made rcfb please keep trash talk civil report comments violate lets talk,"['oregonstate', 'summertimelover']","['oregonstate', 'pacificnorthwest']",even though ended sack line suspect part edit jinx
1694dym,jz0l0yc,san jos 330,san jos jos location san jos cefcu time 330 watch tv cbslcbs odds spread orst 165 overunder 545 rcfb made rcfb please keep trash talk civil report comments violate lets talk,"['oregonstate', 'summertimelover']","['oregon', 'pacificnorthwest']",butterfield looking like potential nfl guy wish saw
15lx49r,jve7ru0,go cougs,probably get buried fuck wazzu alumni diehard coug fan say sub awesome fuck suits run college em fuck espn fox larry scott george kliavkoff especially eat bag dicks guys fine folks rcfb wildly convinced could run sport better wouldnt particularly close regardless team conference affiliation almost everyone seems vested interest tradition regional aspect college importantly time us beaver bros left every single expansion conversation damn welcoming refreshing every conversation ive anyone roots team major conference expressed theyd thrilled us join worrisome us worried town pullman residents corvallis osu helped least coug fan feel wanted even appreciated via wazzu memories shared opposing fanbases enough rambling thanks guys need pick right go cougs,['washingtonstate'],"['oregon', 'pacificnorthwest']",im wondering osu wsu keep bunch basketball money every played march madness yields 2m conference money stretched 6 years everybody else leaves first think money stays osu wsu 2021 conference earned 19 units think 3 years left total 19m 2022 conference earned 7 units think 4 years left total 93m 2023 conference earned 7 units think 5 years left total 116m hopefully get like 5 teams tourney year couple deep runs could extra 15m20m shared two schools next 6 years osu wsu could share 11m 15m per year 3 years season starts decrease
17yellt,k9t4vf4,arizona 400,arizona location arizona mountain america time 400 watch tv foxlfox odds spread ore 24 overunder 535 rcfb made rcfb please keep trash talk civil report comments violate lets talk,['rcfb'],"['oregon', 'pacificnorthwest']",alright ducks leave doubt last 3 games stay healthy gotta make sure hold michiganohio bamageorgia
17yellt,k9t6o2d,arizona 400,arizona location arizona mountain america time 400 watch tv foxlfox odds spread ore 24 overunder 535 rcfb made rcfb please keep trash talk civil report comments violate lets talk,['rcfb'],"['oregon', 'pacificnorthwest']",dang awful penalty though ill take giving 15
17yellt,k9t846t,arizona 400,arizona location arizona mountain america time 400 watch tv foxlfox odds spread ore 24 overunder 535 rcfb made rcfb please keep trash talk civil report comments violate lets talk,['rcfb'],"['oregon', 'pacificnorthwest']",okay glad see fergie little odd seeing baby herbert top receiver first 2 drives
17yellt,k9t8gbq,arizona 400,arizona location arizona mountain america time 400 watch tv foxlfox odds spread ore 24 overunder 535 rcfb made rcfb please keep trash talk civil report comments violate lets talk,['rcfb'],"['oregon2', 'pacificnorthwest']",definitely like 15 ducks play
17yellt,k9tbbch,arizona 400,arizona location arizona mountain america time 400 watch tv foxlfox odds spread ore 24 overunder 535 rcfb made rcfb please keep trash talk civil report comments violate lets talk,['rcfb'],"['oregon', 'pacificnorthwest']",3 tds pups asu quarter 1 lets take care business gonna eatin vegas
17yellt,k9tr6qs,arizona 400,arizona location arizona mountain america time 400 watch tv foxlfox odds spread ore 24 overunder 535 rcfb made rcfb please keep trash talk civil report comments violate lets talk,['rcfb'],"['oregon2', 'pacificnorthwest']",td sure great throw think ty going good playing last 2 minutes garbage time terrible way evaluate someone arent running real offense youre bleeding clock probably everyone else 2nd team etc hard get rhythm anyway throws look good
17yellt,k9trm9i,arizona 400,arizona location arizona mountain america time 400 watch tv foxlfox odds spread ore 24 overunder 535 rcfb made rcfb please keep trash talk civil report comments violate lets talk,['rcfb'],"['oregon2', 'pacificnorthwest']",cant believe final pac12 road ever play fitting brushing aside desert voodoo
17yellt,k9tsav7,arizona 400,arizona location arizona mountain america time 400 watch tv foxlfox odds spread ore 24 overunder 535 rcfb made rcfb please keep trash talk civil report comments violate lets talk,['rcfb'],"['oregon2', 'pacificnorthwest']",think asu got ground much end season going climb good future
17zyhsl,ka2hs7f,nonosuum flairs rooting,cfbs top drama reach crescendo week 2 osu 3 um country want see ohio win americas team pulling even youre holding nose,['ohiostate'],"['oregon2', 'pacificnorthwest']",answer chaos right want ugly without injuries sets teams excluded playoffs
189h6d9,kbr5350,postgame defeats 2724,box score provided team 1 2 3 4 made rcfb,['rcfb'],"['platypus', 'pacificnorthwest']",yesterday please lose fsu want get team sure today huge fsu fan best team history teams
18tt4l2,kfgu6m7,sun bowl notre dame 200,notre dame location sun bowl time 200 watch tv cbslcbs odds spread nd 6 overunder 405 rcfb made rcfb please keep trash talk civil report comments violate lets talk,['rcfb'],"['platypus', 'pacificnorthwest']",commentators came prepared excuses nd missing guys barely mention actually missing relevant players coaches getting banished g5 thanks espn fuck
167kgks,jyqquy9,central 700,central location spartan time 700 watch tv fox sports 1lfs1 odds spread msu 145 overunder 475 rcfb made rcfb please keep trash talk civil report comments violate lets talk,"['umass', 'michiganstate']","['michiganstate', 'pacificnorthwest']",1 msu defense looks okay pass looks crisp 2 carr guy proved athletic looks 3 carter far explosive berger carter rb1 easy 4 offense basically taken bunch plays various styles tried use completely ignored various concepts systems make plays good shotgun 4th 1 bubble screen wr cb 3 yards los identity 5 kim meh flashes
17vv3v6,k9d3u75,programs coaches lifetime consider successes consider failures,binary choice good bad coach remembers positively fans looks like stallings success dubose failure franchione failure shula failure saban success failures shula gets goodwill leading us sanctions tenure also anonymous anemic offense im curious see guys high highs low lows evaluated auburn fans feel gus lsu fans see orgeron era,['alabama'],"['oregon2', 'pacificnorthwest']",rich brooks success mike bellotti success chip kelly success mark helfrich failure taggert failure cristobol success lanning success rich brooks kept respectable many years went strong first rose bowl appearance since dinosaurs walked earth bellotti kelly need explanation entirely fair people cant get helfrichs final year half heads credit chips system macrus mariota title run still gave us arguably best ever season think calling failure harsh probably consensus taggert obvious cristobol stepped faults stabilized program big way give miami lots grief coming place jilted lover appreciate us im glad hes dream job lanning early trendline pretty good
17vv3v6,k9gsk7w,programs coaches lifetime consider successes consider failures,binary choice good bad coach remembers positively fans looks like stallings success dubose failure franchione failure shula failure saban success failures shula gets goodwill leading us sanctions tenure also anonymous anemic offense im curious see guys high highs low lows evaluated auburn fans feel gus lsu fans see orgeron era,['alabama'],"['boisestate', 'pacificnorthwest']",avalos first coach weve fired awhile dirk koetter success dan hawkins success chris peterson major success bryan harsin success auburn tho andy avalos failure
15ft9hn,juf20ja,washington fans seem want join big 12 scenario,based comment threads lot seem prefer anything else option guess id like open floor,"['michiganstate', 'georgia']","['oregon', 'pacificnorthwest']",giving 100 year old rivalries still sports second tier isnt worth mention without conference california schools playing random teams nobody west cares recruiting brand deteriorate better make 10 million year less pac least money doesnt really matter
15ft9hn,jug4uc4,washington fans seem want join big 12 scenario,based comment threads lot seem prefer anything else option guess id like open floor,"['michiganstate', 'georgia']","['platypus', 'pacificnorthwest']",sidegrade point dont get big12 fans always air superiority pac12 like even 5 years ago pac12 better overall athletic academic institutions would ever want give historic rivalries play houston wv lmao mention awful culture fit path playoffs probably going harder big12 well due higher number teams tier conference extra money tv deal could maybe boost program dont want see fan
17xirgp,k9ni9ti,rittenberg announces linebackers coach chris partridge fired reason given rick minter father defensive coordinator jesse minter longtime college coach serve linebackers coach going forward,,"['georgia2', 'awardfestival']","['oregon2', 'pacificnorthwest']",lol right got guarantee b1g would stop investigation might unload kinds shit
17pd4nl,k855ujh,excollege staffer shared docs showing big ten team wolverines signs,nan,['michigan'],"['michiganstate', 'pacificnorthwest']",bro connor stalions black flag operation chapter 4 manifesto keep people
16aczkc,jz6qay2,postgame duke defeats clemson 287,box score provided team 1 2 3 4 made rcfb,"['stanford', 'presscorps']","['oregonstate', 'pacificnorthwest']",fucking clemson dj haters eat fucking shit hes qb
17d4h6j,k5ujryw,penn ohio 1200,penn ohio location ohio statefohiostate ohio time 1200 watch tv foxlfox rcfb made rcfb please keep trash talk civil report comments violate lets talk,['rcfb'],"['oregon2', 'pacificnorthwest']",people hating camera smaller screens im watching bigger tv think great
17d4h6j,k5unf2k,penn ohio 1200,penn ohio location ohio statefohiostate ohio time 1200 watch tv foxlfox rcfb made rcfb please keep trash talk civil report comments violate lets talk,['rcfb'],"['oregon2', 'pacificnorthwest']",take away psu running ball passing less
16eiux6,jzvxifw,tech 700,tech location techftexastech jones att time 700 watch tv foxlfox odds spread ore 3 overunder na rcfb made rcfb please keep trash talk civil report comments violate lets talk,['rcfb'],"['platypus', 'pacificnorthwest']",sure going convert 3rd 18 giving huge conversions never happen
183mt2e,kaq5set,lsu 1200,amftexasamtexas lsuflsulsu location lsuflsu tiger la time 1200 watch tv espnlespn rcfb made rcfb please keep trash talk civil report comments violate lets talk,['rcfb'],"['oregon2', 'pacificnorthwest']",theyre right call theyll right pick
18alqyr,kbzdsxc,would take stop watchcaring college,something ive thinking years sport grew watching basically gone continuing evolve ways could seen detrimental im curious people considered breaking points isnt much oh team bad structure sport examples transfer portal currently functions means players like incoming could well gone time juniors leaving little get know player see grow element existed sport nil means players often go highest bidder things like tvd miami threatened transfer nil folks didnt give money know players paid behind scenes removes former appearance players chose school school like alumnus might arent students like p5 soon 4 probably making upwards 7 figures attend school continued consolidation conferences continues ruin regional rivalries create massive power brokers basically dictate sport everyone else yesterday surmise means everyone else basically fucked moving forward unless join one two conferences wonder college moves worse version nfl point think go far stop caringwatching point would happen bleed team colors always,['miami'],"['oregon', 'pacificnorthwest']",feel like drug addict espnfox pulling us gutter
16wnezr,k2yiwk9,washington arizona 1000,location arizonafarizona arizona time 1000 watch tv pac12 networklp12n rcfb made rcfb please keep trash talk civil report comments violate lets talk,['rcfb'],"['platypus', 'pacificnorthwest']",theyre literally advertising pac12 games fubo fucking fubo nowhere found
