post_id,comment_id,post_title,post_selftext,post_author_flairs,comment_author_flairs,comment_body
15zbewu,jxk03j9,ranking top 131 fbs programs last 40 years 2 ohio,main hub full 131 ohio university comes 2 confirmation whos 1 ohio deserves top 2 finishing top team big ten 2 overall last 40 years staggering 3941035 790 win record whats even crazier theyre 297653 818 win last 29 years averaging 2 losses season nearly 3 decades theyve least 6 games 39 40 seasons 8 games 33 39 noncovid seasons compared worst team list play 40 seasons 130 new mexico aggies 0 seasons 8 wins 39 years ohio strong case 1 list ultimately dropped 2 lack national titles continuing trend drooling stats ohio 19 seasons 11 wins last 29 yearsjust unreal theyve accomplished urban meyer jim tressel ryan day yes john cooper best seasons highlights 1 2014 1 ohio 141 60159 2 2019 2 ohio 131 59567 3 2002 1 ohio 140 57543 4 2017 3 ohio 122 48390 5 1996 3 ohio 111 48262 6 1998 2 ohio 111 47581 7 2006 3 ohio 121 46885 8 2016 3 ohio 112 46677 9 2015 3 ohio 121 46547 10 2010 4 ohio 121 45161 11 2018 4 ohio 131 44476 12 2021 4 ohio 112 42779 13 2022 3 ohio 112 42686 14 2012 5 ohio 120 42370 15 2009 6 ohio 112 41446 16 2020 2 ohio 71 38018 17 1995 6 ohio 112 37344 18 2013 10 ohio 122 36877 19 2007 8 ohio 112 36706 20 2003 6 ohio 112 36686 21 1993 7 ohio 1011 36417 22 2005 7 ohio 102 34964 23 2008 11 ohio 103 29872 24 1986 10 ohio 103 28378 25 1983 11 ohio 93 25919 26 1985 19 ohio 93 23863 27 1997 13 ohio 103 23713 28 1984 11 ohio 93 22452 29 1992 15 ohio 831 22173 30 1994 17 ohio 94 17755 31 2004 23 ohio 84 12692 32 2000 32 ohio 84 11562 33 1987 25 ohio 641 11105 34 1991 33 ohio 84 8633 35 1989 31 ohio 84 7203 36 1990 34 ohio 741 6371 37 2001 41 ohio 75 3702 38 2011 52 ohio 67 3450 39 1999 49 ohio 66 4218 40 1988 54 ohio 461 8969 overall score 49510 2nd 3941035 record 2 national titles 16 conference titles 1919 bowl record 45 consensus allamericans 240 nfl players drafted imagine 14th best season year went 120 16th best season year lost national championship since 2002 ohio states 11 big ten titles winning every year consensus allamericans wont look ol jim lachey 1984 rb keith byars 1984 big ten poty wr cris carter 1986 whos nfl hall famer p tom tupa 1987 averaged 470 yards per punt also starting qb lb chris spielman 1986 1987 finished top 10 heisman voting twice dt dan wilkinson 1993 1 overall pick draft ol korey stringer 1994 wr terry glenn 1995 biletnikoff award rb eddie george 1995 heisman lb andy katzenmoyer 1997 butkus award db antoine winfield 1998 thorpe award ol rob murphy 1998 c lecharles bentley 2001 rimington award great name db allen 2003 lb aj hawk 2004 2005 whos one best lbs bcs era qb troy smith 2006 heisman dl quinn pitcock 2006 db malcolm jenkins 2008 thorpe award lb james laurinaitis 2006 2007 2008 whos decorated player long line ohio lbs ot taylor decker 2015 malik hooker 2016 c pat elflein 2016 cb shaun wade 2020 ot paris johnson jr 2022 wr marvin harrison jr 2022 maybe best player country regardless position top nfl players include ot orlando pace wr cris carter dt cameron heyward de nick bosa de joey bosa c nick mangold rb eddie george lb chris spielman db malcolm jenkins cb marshon lattimore wr joey galloway rb ezekiel elliott wr michael thomas wr terry mclaurin cb denzel ward lb pepper johnson ot jim lachey wr terry glenn lb mike vrabel c corey linsley cb antoine winfield cb nate clements rb robert smith lb aj hawk wr ted ginn jr wr santonio holmes donte whitner lb ryan shazier de chase young wr garrett wilson wr chris olave top 5 seasons worst season 1988 461 overall 251 big ten listened ohio fans talk coach john cooper youd expect best season jokes aside rough sledding cooper first year buckeyes inheriting 641 team earle bruce also lost 8 starters nfl ohio hit miss throughout year usually missing rather hitting opening 269 win came dick macphersons syracuse team coming 4 1101 season would finish 13 102 1 2 losses buckeyes followed bya 1042 beating hands pitt 1 winning season previous 4 years followed bya 3633 win 7 lsu ohio scored 16 straight points last 4 minutes followed bya 741 loss indiana arguably embarrassing loss ohio history get idea ohio finished year 461 culminating 3134 loss 12 cooper would go finish 111434 13 years osu legacy marred 2101 record 38 record bowl games 5 1996 111 overall 71 big ten heres john cooper eye bleach 1988 season wait year ohio lost national title hands michiga cooper 9th season head coach osu lb andy katzenmoyer made headlines week 1 becoming first true freshman ever start lb ohio osu trumped owls 707 katzenmoyer would help lead one best defenses country holding teams 75 ppg first 4 beating 5 notre dame 2916 4 penn 387 month ohio moved 10 2 kept winning really took start november beating minnesota 450 illinois 480 improve 90 heading 100 2 ohio verge possible national title buckeyes went 90 halftime 21 home would score 13 unanswered points 2nd half win 139 one painful losses series ohio fell 4 beat 2 arizona rose bowl next day 1 florida would lose 3 florida sugar bowl meaning ohio missed national title loss still buckeyes finished 2 highest finish since 1973 qbs stanley jackson joe germaine combined 24 td 9 int rb pepe pearson ran nearly 1400 yards 17 td certainly helped legendary ot orlando pace dominant term pancake block exploded popularity due tendency put opposing defensive lineman ass lay top platonically pace finished 4th heisman voting big ten offensive poty 1 overall pick 1997 nfl draft selected sports illustrateds ncaa allcentury team 1900s one starting ots defense katzenmoyer 2nd team allamerican de future tennessee titans head coach mike vrabel also 2nd team allamerican allowing 109 ppg 1996 ohio 70th best team since 1983 4 2017 122 overall 71 big ten jt barretts 298354282th season ohio please clap reddit humor aside actually barretts 4th final season amazingly really play 4 seasons unfortunately team known 2 embarrassing losses outside team extremely good season opened 11 record thanks home loss 5 home punctuated midfield flag plant baker mayfield ohio dropped 2 8 next 5 games average 5311 chance get back playoff 2 penn front espn college gameday penn jumped 213 lead jt barrett played life completing 33 39 passes 328 yards 4 td 0 int 17 carries 95 yards leading ohio 3938 comeback win subsequent 2455 loss dominated headlines shouldve barrett throwing 4 ints 3 allamerican cb joshua jackson loss ohio may national title way played stretch 50 finish included 483 win 12 win 83 2721 win 4 wisconsin big ten championship 247 8 usc cotton bowl ohio finished 5 ap poll 3 rankings beating 131 wisconsin 113 usc 112 penn 103 including extras like 103 army jt barrett finished career 1st big ten history yards 12697 tds 147 throwing 3000 yards 35 td 9 int 800 rushing yards 12 td also 1st team allbig ten 3rd time freshman rb jk dobbins burst onto scene 1400 rushing yards 7 td 72 ypc taking starting role former 1000 yard rusher mike weber added 626 10 td c billy price consensus allamerican rimington award defense de nick bosa 1st team allamerican 85 sacks 75 tfl cb denzel ward consensus allamerican 15 pbu 2 int feels weird say ends urban meyers 2nd best team ohio 2017 ohio 67th best team since 1983 3 2002 140 overall 80 big ten first started 00 nobody really thought theyd win national title 70 nobody really thought theyd win title 130 nobody thought theyd win title finished 140 still dont think title 2002 ohio masterclass tresselball named coach jim tressels style coaching involved playing great defense working position scoring enough points win 30 start quality wins like 4521 tech 257 10 washington 3 wins get 60 included 2319 win cincinnati 2716 win eventual 39 northwestern win wisconsin ohio 80 still 6 rankings would unthinkable ohio today 2 straight wins 17 penn 23 minnesota put control national title destiny 2 3 games remaining tresselball full effect needing holy buckeye td pass 4th 1 beat purdue 106 beating illinois 2316 ot 2 ohio hosted 9 chance play national title chewing fingernails memories 1996 exciting ohio led 149 got osu 25 1 play left ohio intercepted john navarres pass goal line seal big ten title national championship appearance buckeyes 1 miami fl entered defending champions rocking 34 win streak still longest modern college history day youd expect 115 point favorites didnt give ohio much chance legendary buckeye performance produced many iconic plays perhaps notably maurice claretts stripfumble recovery miamis sean taylor right osu qb craig krenzel threw interception controversial overtime ending ohio got automatic first 4th pass interference call miami ultimately winning 3124 ot ohio states first national title since 1970 im sure noticed 24 points scored miami ohio gave season defense good lb matt wilhelm mike doss consensus allamericans leading defense allowed 131 ppg held opponents 17 points less 11 times including 10 points less 6 times special teams fantastic well k mike nugent earning consensus allamerican hitting 25 28 fgs p andy groom allamerican averaging 450 yards per punt offense freshman rb maurice clarett played 1 year college rushing 1237 yards 16 td qb craig krenzel one unheralded national titlewinning qbs ever throwing 2110 yards 12 td 7 int 350 rushing yards 3 td 2nd year ohio jim tressel led buckeyes national title bunch national coach year awards 2002 ohio one top 50 teams since 1983 full list revealed teams come 2 2019 131 overall 90 big ten seriously think people forget ridiculous team 1 ahead 2019 lsu late season even though could set watch lsu beating top 10 team every week subtle nonconference schedule included 4521 win 113 cusa champion fau 420 win 113 aac runnerup 21 cincinnati 765 win 86 mac champion miami oh actual big ten play wasnot even remotely close ohio gave scoring going 5110 indiana end 3rd espn college gameday attended 40 ohio 31 nebraska ohio held 480 lead 19 minutes left even 3410 win 25 ohio saw bucks outgain nearly 250 yards 13 wisconsin supposed something 3time allamerican nfl allpro rb jonathan taylor could muster 20 carries 52 yards 387 ohio win even need go maryland rutgers combined 12935 score wins 8 penn put good fight 2817 buckeye win wasnt close score suggested ohio outgained another team 200 yards yet heisman contender de chase young 3 sacks offense danced badly 5627 win michigans defense dropped 268 ypg allowed 294 ypg allowed even 8 wisconsin threw kitchen sink 1 ohio big ten championship 217 lead osu laughed said thats cute heres 270 2nd half shutout big ten title 3421 playoff semifinal 3 clemson ohio took 160 lead 2nd quarter chunk plays clemson controversial nofumble call refs trevor lawrence heroics got clemson 2923 win end one picks best team never win national title offense averaged 469 ppg allowed 137 ppg 5th ranked strength schedule country unfortunately didnt get see ohio lsu title qb justin fields one best statistical seasons ever throwing 3273 yards 41 td 3 int 10 rushing tds finishing 3rd heisman voting joe burrow split votes teammate chase young young star de consensus allamerican big defensive poty nagurski bednarik hendricks awards also finishing 2nd firstplace votes heisman voting og wyatt davis cb jeffrey okudah consensus allamericans well junior rb jk dobbins 1st team allamerican getting 2250 yards 23 td scrimmage 2019 ohio one top 50 teams since 1983 full list revealed teams come 1 2014 141 overall 80 big ten one time everyone excluding fans rooting ohio somehow taken underdog role 2014 mostly due loss allamerican qb braxton miller preseason early season home loss virginia tech dropping 22 rankings 11 backup qb jt barrett settled rhythm winning 4 straight beating penn 3124 road 2ot thanks 25 sack de joey bosa 71 ohio still underrated media ranked 14 71 big ten favorite 8 two met east lansing college gameday ohio came huge 4937 win thanks 386 yards 5 td jt barrett 154 rush yards 2 td rb ezekiel elliott focused winning big ten title osu held late surge 25 minnesota win 3124 beat indiana pulled away late 111 regular season one little problem jt barrett went seasonending injury ohio 3rd string qb cardale jones 5 ohio entered big ten championship outside looking playoff everyone expecting florida tcu make ohio beat 13 wisconsin wouldnt enough sothey beat 590 zeke elliott ran 220 yards cardale jones 2558 passer rating 17 attempts first ever start ohio snuck playoff 4 surprise many everyone thought nick saban would make quick work team 3rd string qb well cardale enough zeke ran 85 yards heart south ice winning 4235 1 semifinal national championship zeke mvp 246 rushing yards 4 td 4220 win 2 winning osus first national title since 2002 insane considering 3rd string qb ranked 22 one point jt barrett threw 2834 yards 34 td 10 int along 938 rush yards 11 td cardale jones threw 860 yards 7 td 2 int ran 300 yards 1 td ezekiel elliott rushed 1878 yards 18 td 69 ypc wouldve doak walker award year wr devin smith ultimate deep threat catching 33 passes 931 yards 12 td future nfl allpro wr michael thomas added 800 yards 9 td de joey bosa consensus allamerican winning big ten defensive poty 135 sacks 2014 ohio one top 50 teams since 1983 full list revealed teams come 5th quarter season fun 2002 2014 2015 ohio actually underachieve given finished 121 overrated 2019 ohio best team never win national title would beaten lsu championship best de joey bosa nick bosa chase young teams next appreciate effort please consider subscribing,"['usc', 'rose']","['southcarolina', 'presbyterian']",south carolina 20 ohio skill issue get gud
177vtws,k4vzmp3,florida south carolina 330,south carolina location south williamsbrice time 330 watch tv sec networklsecn odds spread sc 2 overunder 515 rcfb made rcfb please keep trash talk civil report comments violate lets talk,['rcfb'],"['southcarolina', 'presbyterian']",bad beamer didnt whiteboard pound job
177vtws,k4w4jwx,florida south carolina 330,south carolina location south williamsbrice time 330 watch tv sec networklsecn odds spread sc 2 overunder 515 rcfb made rcfb please keep trash talk civil report comments violate lets talk,['rcfb'],"['southcarolina', 'presbyterian']",feel bad joyner man anderson clearly better swear god every time give joyner ball someone completely unblocked play think still yards
16we4hf,k2xd4s9,auburn 330,location auburnfauburn jordanhare time 330 watch tv cbslcbs rcfb made rcfb please keep trash talk civil report comments violate lets talk,['rcfb'],"['southcarolina', 'presbyterian']",brock bowers brian kelly accent thing postgame interview
16w4zuc,k2vds09,espn college gameday show,want little ting tang tang discuss post anything related show signs screencaps videos etc,['rcfb'],"['southcarolina', 'presbyterian']",one time highlights like 15 years ago chris berman calling absolutely horrible nfl kick like easily worst professional kick ive ever seen said almost knocked makeawish kid third row permanently seared brain anyway thats kicking segment reminded
170jj8q,k3lbvfd,decision made school dumb time got worse time,every school seems make decision whether hire fire change conference change etc everyone knows going turn badly except ad boosters biggest bone headed move school,['rcfb'],"['presbyterian', 'miami']",probably insignificant compared everyone elses situation school presbyterian removed scholarships 2018 three ads since performance fcs pioneer league suffering tremendously player transition seeing around half teammates leave saddening say least decisions made board trustees still frustrates day
16kjdlb,k0x47gv,tennessee florida 700,location floridafflorida ben hill griffin time 700 watch tv espnlespn odds spread tenn 7 overunder na rcfb made rcfb please keep trash talk civil report comments violate lets talk,['rcfb'],"['southcarolina', 'presbyterian']",borderline call blindside block goddamn everyone watching saw hold
1689xvd,jyuva1w,boise washington 330,boise location husky time 330 watch tv abclabc odds spread wash 145 overunder 585 rcfb made rcfb please keep trash talk civil report comments violate lets talk,"['iowa', 'washington']","['southcarolina', 'presbyterian']",whats vibe sub rgiii tv think entertaining get little loose sometimes genuinely funny getting better timing fence eventually embraced hes basically playing ferrel character also thats shouldnt grounding world say didnt cross los first
1689xvd,jyuvpm6,boise washington 330,boise location husky time 330 watch tv abclabc odds spread wash 145 overunder 585 rcfb made rcfb please keep trash talk civil report comments violate lets talk,"['iowa', 'washington']","['southcarolina', 'presbyterian']",isnt mountain west crew seem recall ooc refs visitors conference
168lpkp,jyweg8h,postgame north carolina defeats south carolina 3117,box score provided team 1 2 3 4 north south made rcfb,['southcarolina'],"['southcarolina', 'presbyterian']",thought almost every position group fine tonight except nelson nickel especially considering injuries man cant anything line bad gave sack 3 man rush wasnt coverage sack 25 seconds 3 man rush
16bovd2,jzg2a7z,week 2 matchup preview nebraska cornhuskers colorado buffaloes,saturday september 9 1200 eastern folsom boulder watch foxlfox odds 30 pts total points 595 alltime series met 71 times since 11171898 teams last met 1460 days 4 years ago 09072019 series wins 49220 longest streak continuous meetings 63 19482010 last 2 meetings 20182019 series last 5 meetings co3134 ne2833 ne4517 co2820 ne4031 series comparison data via week 1 1000result 1010l 1013tcuftcu17 0100w 4542 rankings reflect current rcfb injury report data scraped 20230906 100014 anthony grantrbout indefinitely suspensionwed aug 2grant serving indefinite suspension due academic reasons brodie tagaloadlout season kneewed aug 2tagaloa idle knee injury expected miss entire 2023 season maverick noonanlbout season kneewed aug 9noonan expected miss entire 2023 season due substantial knee injury isaiah garcia castanedawrout season kneemon sep suffered torn acl miss rest season nick henrichlbques sat undisclosedmon sep 4henrich sat last unspecified issue uncertain play versus colorado saturday jimari butlerlbques sat undisclosedmon sep 4butler missed last contest unknown ailment yet confirmed available saturdays clash colorado arik gilbertteques sat eligibilitymon sep 4gilbert sat last due eligibility matter role offfield incident air whether suit saturday versus colorado injury data lifted injury report data scraped 20230906 100014 alton mccaskill ivrbques sat kneemon sep 4mccaskill sat previous recovering acl tear yet determined available saturdays showdown versus nebraska caleb fauriateques sat footmon sep 4fauria missed last foot injury leaving status nebraska saturday question louis passarelloteout indefinitely kneethu aug 17passarello sidelined knee injury timetable return yet established injury data lifted keys think wins think favorite cover spread players interested watch lets talk vote matchup win poll simply include name team think win enclosed part top level comment discussing matchup change vote edit initial comment bracket team change vote often like posted full listing accepted fbs team aliases found fcs teams need use full name appears post title listing links live vote totals matchup preview threads current week found like format generate matchup discussion matchup discussion please dm udupreesdiamond regarding template,"['marshall', 'allegheny']","['southcarolina', 'presbyterian']",think nebraska emotionally cathartic breakthrough moment narratives around absolute scenes lads
1680nks,jyteokt,espn college gameday show,want little ting tang tang discuss post anything related show signs screencaps videos etc,['rcfb'],"['southcarolina', 'presbyterian']",havent heard yet boys outkick obsessively posting bad new song im thinking pretty good
16rv5xx,k25ptzn,tank job week week four,tank job week award fbs team best job humiliating weekend whether blew large lead choked away spot limelight lost absolutely right losing completely screwed everything last second blunder tjotw winner sets gold standard college misery x200b previous winners 1 baylor bears lost 4231 2 nevada wolf pack lost idaho 336 3 cowboys lost south 337 x200b last week wasnt lopsided tjotw vote ever still pretty easy win inexplicable blowout south team got significant number votes cincy losing miamioh doesnt compare getting utterly flattened sun belt team oh well maybe particular sun belt team going win go 121 single week 1 loss tulane make new years six spoiler alert go 121 x200b onto week thing dont cosmic earthshattering level upset blown leads shocking turnof misfortunes defensive staffing issues huge games veritable feast nominees x200b note ease counting please use carats vote like team thank thanks participating x200b honorable mentions indiana needing four overtimes akron nebraska tied louisiana tech 77 entering fourth quarter jimbo fisher auburns best blocker scoop score denver broncos x200b nominees week 3 x200b appalachian mountaineers lost wyoming 2219 12 minutes go mountaineers picked andrew peasley pass returned touchdown go 197 cowboys instantly responded going 75 yards first play scrimmage thats fine said app proceeded go epic tenminute clock killing drive sputter kick goal go 8 wyoming blocked goal returned winning touchdown app one last chance already goal range got picked wyoming 6 eleven seconds go ice brutal crazy x200b clemson tigers lost florida 3124 oh tigers brought looooooooooowly scoop score finish blowing ten point lead check playing goal kicker drag back miss 29yard winner playcall 3rd 1 overtime hell way lose tigers x200b colorado buffaloes lost 426 okay maybe lot us saw coming dont think us thought colorados reality check going brutal one thing something like 5932 350 first half massacre plus holding buffs less 200 yards hype x200b hawkeyes lost penn 310 76 yards four turnovers 1433 possession nothing else need said x200b minnesota golden gophers lost northwestern 3734 3110 start fourth quarter team favored beat two touchdowns team whos claim worst power conference team heading virginia stanford exist northwestern rips 174 yards 21 straight points fourth quarter responded gophers fg firstplay touchdown overtime minnesota rowed boat right waterfall x200b nevada wolf pack lost 3524 pack something prove tjotwwinning domination idaho coming short plucky effort kansas came swinging san marcos seventeenpoint favored bobcats first half scored five times twenty minutes plunge unr 04 x200b notre dame fighting irish lost ohio 1714 didnt think id nominating irish instant classic saw notre dame rally ten ohio sneak across goal line literal last second take victory comes one biggest games year critical moment marcus freeman kindasorta forgot put eleventh defender two plays coaching staff fully aware x200b south jaguars lost central 3430 jaguars respond massive program elevating tjotwworthy win last week ripping early 140 lead chips cmu went 273 run south come back take lead fourth quarter central snapped final touchdown fourteen seconds left pull 17point upset,"['washington', 'centralwashington']","['southcarolina', 'presbyterian']",imo one leave fans maddest hawkeyes fan would beside contract situation kirk brian ridiculous kirks contract betrays ambition program may brians sets iowas offense national punchline im saying kirk shouldve fired 85 season good years structure contract removes accountability try build accountability brian ferentzs contract options limited kirk well protected end blunt every cfb sicko talks every week feel really bad fans situation would make blow gasket unless youre gazillionaire theres nothing unreal barta ad beyond like 2012 working kirk skirt nepotism rules season 2012 among things
16k9n4r,k0v0twi,southern wisconsin 1200,southern location camp randall time 1200 watch tv big ten networklbtn rcfb made rcfb please keep trash talk civil report comments violate lets talk,['rcfb'],"['presbyterian', 'georgia']",watching two teams throw ball making uncomfortable
15z8uel,jxing9t,hypothetical bet life one 10 schools reaching cfb national championship within next 10 years one would choose,assume life stake need one 10 schools reach cfb national championship within next 10 years continue living school going arizona kansas missouri north carolina purdue south carolina tech virginia tech wisconsin,['georgia'],"['southcarolina', 'presbyterian']",thats certainly feels outside looking longo oc hire shocking
1841j6i,kasvs7s,247sports mark stoops next hc,nan,['clemson'],"['southcarolina', 'presbyterian']",really fitting coach made big deal culture leaving join hated rival
17ifk70,k6uo9yz,south carolina 1200,south carolina amftexasamtexas location amftexasam kyle time 1200 watch tv espnlespn rcfb made rcfb please keep trash talk civil report comments violate lets talk,['rcfb'],"['southcarolina', 'presbyterian']",wtf man time start asking questions sc staff crazy like multiple standard deviations expected level injury attrition
