post_id,comment_id,post_title,post_selftext,post_author_flairs,comment_author_flairs,comment_body
16q6omx,k1vo8b5,florida clemson 1200,florida location clemsonfclemson memorial clemson sc time 1200 watch tv abclabc rcfb made rcfb please keep trash talk civil report comments violate lets talk,['rcfb'],"['southcarolina', 'presbyterian']",really say guy whos coming couch never kicked goal entire college career could hit 70 yard fg
16kk41j,k0xf8fv,tech ole miss 730,tech ole missfolemissole miss location ole missfolemiss vaughthemingway time 730 watch tv sec networklsecn rcfb made rcfb please keep trash talk civil report comments violate lets talk,['rcfb'],"['presbyterian', 'georgia']",else hit alma mater
166vqe9,jymbs1n,postgame utah defeats florida 2411,box score provided team 1 2 3 4 made rcfb,"['medal', 'oklahomastate2']",['presbyterian'],florida poor ol mediocre best skill position group bad qb atrocious coaching might win 4 games year given hard schedule next year napier basically digging grave utah played pretty well things considered missing lot starters made plays counted defense solid night dont know repeat pac champs good year
15tkpzp,jwkgyac,opinions rivalries around college affiliation,rivalry connection thats outside schools conference feel like actually root pretty strongly one team one absolutely wont miss even teams wont impact season arent contenders year example ive absolutely loved usc utah rivalry past 58 years love rooting utah games first usually wild late night action truly back forth rivalry recently competitive though always david goliath feel team less traditionally good team resources disposal dont anything usc fall 1030 damn fun root utes games,['georgia'],"['southcarolina', 'presbyterian']",theory egg bowl better tv person feel like inperson would spending half wondering hell happened refs huddle discuss getting personal fouls
15tkpzp,jwnvsb1,opinions rivalries around college affiliation,rivalry connection thats outside schools conference feel like actually root pretty strongly one team one absolutely wont miss even teams wont impact season arent contenders year example ive absolutely loved usc utah rivalry past 58 years love rooting utah games first usually wild late night action truly back forth rivalry recently competitive though always david goliath feel team less traditionally good team resources disposal dont anything usc fall 1030 damn fun root utes games,['georgia'],['presbyterian'],uncusc battle carolina
15wqekf,jx2gf0q,top 5 popular college teams cityarea,1 north carolina 2 nc 3 appalachian 4 wake forest 5 duke x200b,"['floridastate', 'northcarolinaat']","['southcarolina', 'presbyterian']",cincinnati 1 cincinnati 2 tosu big drop 3 kentucky 4 louisville 5 honestly kinda hard theres lot range see lot flags bumper stickers ohio u miami u others hard say
16apjlo,jz8mrgy,realize magic ran,remember like yesterday first clemson 2015 wake forest way national championship enrolled clemson next year seeing us win two national championships 4 years life changing always thought life would like run denial 2021 season still 10 games think clemson fans knew coming worse national tv thing cfb world talking question knew program longer top anymore know clemson death thousand cuts last night really puts perspective,[],"['southcarolina', 'presbyterian']",cant believe im defending clemson always going recruit highly reliant national recruiting blue chips high rate busts limited high hit rate elite dont back plan someone like ohio especially south carolina recruiting well stretch recruiting classes clemson 20132018 extraordinarily successful inconsistency acc schedule sometimes hide flaws someone else besides fsu good going show like last night say dabo open portal hes still killer recruiting trail clemson certainly elite cycle
16keh7j,k0vn2f4,south carolina 330,south carolina location georgiafgeorgia sanford time 330 watch tv cbslcbs rcfb made rcfb please keep trash talk civil report comments violate lets talk,['rcfb'],"['southcarolina', 'presbyterian']",whoa didnt realize carson beck homely fellow way guy beat sam hartman playoff
16keh7j,k0vqats,south carolina 330,south carolina location georgiafgeorgia sanford time 330 watch tv cbslcbs rcfb made rcfb please keep trash talk civil report comments violate lets talk,['rcfb'],"['southcarolina', 'presbyterian']",man hoping tuazama would ready one thats huge difference pass rush
16keh7j,k0w73v8,south carolina 330,south carolina location georgiafgeorgia sanford time 330 watch tv cbslcbs rcfb made rcfb please keep trash talk civil report comments violate lets talk,['rcfb'],"['southcarolina', 'presbyterian']",woke nap went holy fuck actually winning uga scored quickness sorry ruined boys im napped
16keh7j,k0wb0yq,south carolina 330,south carolina location georgiafgeorgia sanford time 330 watch tv cbslcbs rcfb made rcfb please keep trash talk civil report comments violate lets talk,['rcfb'],"['southcarolina', 'presbyterian']",catch hands like come man
16keh7j,k0wc422,south carolina 330,south carolina location georgiafgeorgia sanford time 330 watch tv cbslcbs rcfb made rcfb please keep trash talk civil report comments violate lets talk,['rcfb'],"['southcarolina', 'presbyterian']",weve got extended drive leads 7 even chance
169aftq,jz13dw8,florida lsu 730,florida lsuflsulsu location camping world time 730 watch tv abclabc odds spread lsu 25 overunder 580 rcfb made rcfb please keep trash talk civil report comments violate lets talk,['rcfb'],"['southcarolina', 'presbyterian']",everyone else getting commercial lady shaving pubes whats
1638uhj,jy1jf4k,colorado good scale 15,1 absolute garbage 2 win maybe two games lackluster performance 3 win games mediocre best 4 win 5 6 games better anticipated 5 actually really good shocking cfb world answer opinion comments,"['oregon', 'georgefox']","['southcarolina', 'presbyterian']",2 talk turning roster idk much better got outside like 2 position groups dont think theres much evidence deion knows takes win coach level lost biggest coached fcs coaching far talented team also schedule kinda tough colorado st arizona home seem like best bets much unknown wouldnt like totally blown away 4 wish jumped line opened like 5 wins still might take 35
15h82l2,junlohu,objectively bad call benefitted team,complain bad calls hurt team sometimes difference win loss championship line statistically speaking similar number calls help favorite team bad call helped team ill go first ohio 2ot win penn 2014 bad officiating go way couple times egregious vonn bell interception clearly touched ground upheld interception early ohio score td afterward tight crazy say might meaning dont even sniff playoff championship play season saved faulty replay equipment lmao,"['ohiostate2', 'utah']","['southcarolina', 'presbyterian']",ones think bad calls us set good play next snap call clowney hit obvious one also twice dj swearinger bad targeting call led interception next play preautomatic ejection targeting three things happened 2012 season lol
16eb4h6,jzuwral,charleston southern clemson 215,charleston southern location clemsonfclemson memorial clemson sc time 215 watch tv acc networklaccn rcfb made rcfb please keep trash talk civil report comments violate lets talk,"['clemson2', 'orange']","['southcarolina', 'presbyterian']",scares furman coming willy b half team injured shades 1982
16eb4h6,jzvcrgz,charleston southern clemson 215,charleston southern location clemsonfclemson memorial clemson sc time 215 watch tv acc networklaccn rcfb made rcfb please keep trash talk civil report comments violate lets talk,"['clemson2', 'orange']","['southcarolina', 'presbyterian']",lopsided yardswise first wise ive ever seen yet csu 17 points clemson guys nothing worry 101 going
15o68ro,jvq2261,would 10year ago think told last decade gone favorite team,id shocked butch jones left bowl 2012 dantonio kelly done prior big east collapsed joined american conference 2013 season tell new head coach tommy tuberville would start backtoback 94 seasons go 1114 last two seasons manage piss entire fanbase way id confidence things would turn around soon tell next head coach luke fickell went 48 first season id dejected would absolutely lose mind think im lied hearing wed rattle seasons 112 113 91 131 94 going 48 2016 2017 backtoback ny6 bowls including first ever g5 team make cfp wouldve sounded impossible id certain lied tell 2013 first year american conference decade wed big 12,"['cincinnati', 'ohiostate']","['southcarolina', 'presbyterian']",wouldnt even able tell clemson national championships much gut punch lad
15gi1h4,juj7ku8,anyone happy,fans perspective anyone happy cfb direction going general reading community would say one happy maybe im wrong could fans something ncaa power anymore politicians interested reelection power lies conferences beholden collective universities fans routinely cause change university level different measures end coaches ads getting fired know kumbaya pie sky feels like fans dont anything complicit death want cfb,"['kentucky', 'chaos']","['southcarolina', 'presbyterian']",team still playing games saturdays players finally able get compensation cream still going rise top dramatic games still going happen change college constant since beginning best look forward excitement new instead clinging past perfect particularly ncaa ultimately think things worth preserving find way preserved
17o0i1u,k7w049e,colorado 1000,location folsom time 1000 watch tv espnlespn rcfb made rcfb please keep trash talk civil report comments violate lets talk,['rcfb'],"['ucf', 'presbyterian']",almost certain sheduer playing hurt messing making
16s9nct,k28a9cu,honest scale one 10 satisfied teams current logo,penn 5 logo forever brand wish would branch experiment alternates except paw print dont talk paw print 8 love tigerhawk im fan variation gold tigerhawk black circle,"['pennstate2', 'iowa']","['southcarolina', 'presbyterian']",block c gamecock main logo 11 script carolina alternate 10 gamecock without block c alt 10 block c without gamecock 400000
17w30ir,k9gl5nl,classes athletes school like,sorry distract coaching drama offseason style discussion go ive seen plenty stories players goofy parties dorms around campus im curious acted classes specifically studious never show treated like gods among men normal students happened great shape,"['michigan3', 'american']","['clemson', 'presbyterian']",first school small d1 fcs players thought best thing ever happen hilarious considering went 319
183xgmh,karpy82,postgame defeats auburn 2724,box score provided team 1 2 3 4 made rcfb,['rcfb'],"['auburn', 'presbyterian']",hope bitch went assumed would got demolished zero hope progressed kept wasnt till last play started think maybe already told bil wasnt gonna get hopes said auburn locked seconds later muff punt ugh
172mpmi,k3ygg2z,arizona usc 1030,uscfuscusc location uscfusc los angeles memorial coliseum time 1030 watch tv espnlespn rcfb made rcfb please keep trash talk civil report comments violate lets talk,['rcfb'],"['presbyterian', 'georgia']",two worst 2 point play calls end
15vwgdi,jwygu2l,teams 4th biggest rival,bah gawd tell close start season let get one peak offseason question every school knows first second biggest rivalries majority know third fourth biggest rival auburn would think likely florida honest rivalry pretty dead days know used big back day,"['auburn', 'chattanooga']","['southcarolina', 'presbyterian']",likewise id say ut despite rarely playing high stakes though think weve kept national championship hunt last 15 years2013 us earlier season less obvious shocker last year sure couldve beaten miraculous ass auburn team seccg since ended uts dominant run exactly 99 since 2005 lot really close leaving everyone pissed lost shouldve ugly shouldve easily sides probably think least 126 span instead tied 4th seems like good slot less ancient temporary rivalries moment think perfect
15ifj30,juu0xaw,say something nice washington,embarrassed florida washington took jg hands,['tennessee'],"['southcarolina', 'presbyterian']",outside sports theyve done cool things agriculture namely berries osu dairy apples wsu
17etkag,k66wtfs,whats punishment,found guilty allegations punishment would receive level violations would,"['michigan', 'southcarolina']","['oklahoma', 'presbyterian']",probably nothing banned playoffs year
15ny6b2,jvpz364,fall team,curious guys became fans teams man first ever big house renovations hooked ever since,[],"['southcarolina', 'presbyterian']",grandpa dads side went primary flair dad went grad school born entire nuclear family 5 us went second flair undergrad choice wife moved cincinnati went back school uc started covid first semester campus playoff run could third flair would bearcats moms dad worked bunch different colleges minor affinity schools vt group plays big league vpi called since right wwii
177dn6h,k4szf3s,stanford colorado 1000,location folsom time 1000 watch tv espnlespn odds spread colo 115 overunder 590 rcfb made rcfb please keep trash talk civil report comments violate lets talk,['rcfb'],"['ucf', 'presbyterian']",hunter getting shit dude day lol
177dn6h,k4t0eeh,stanford colorado 1000,location folsom time 1000 watch tv espnlespn odds spread colo 115 overunder 590 rcfb made rcfb please keep trash talk civil report comments violate lets talk,['rcfb'],"['ucf', 'presbyterian']",told hunter best corner hes coming injury lol
16knfug,k0xer45,colorado colorado 1000,colorado location folsom time 1000 watch tv espnlespn rcfb made rcfb please keep trash talk civil report comments violate lets talk,['rcfb'],"['ucf', 'presbyterian']",holler damn huge lol dude looks like monster turf
16qh8ez,k1x2itc,mississippi south carolina 730,mississippi south carolina location south williamsbrice time 730 watch tv sec networklsecn rcfb made rcfb please keep trash talk civil report comments violate lets talk,['rcfb'],"['southcarolina', 'presbyterian']",go cocks score first get crowd
16qh8ez,k1xbhsz,mississippi south carolina 730,mississippi south carolina location south williamsbrice time 730 watch tv sec networklsecn rcfb made rcfb please keep trash talk civil report comments violate lets talk,['rcfb'],"['southcarolina', 'presbyterian']",someone doesnt take leggette first two rounds nfl collectively lost minds dude control
16qh8ez,k1xjmuh,mississippi south carolina 730,mississippi south carolina location south williamsbrice time 730 watch tv sec networklsecn rcfb made rcfb please keep trash talk civil report comments violate lets talk,['rcfb'],"['southcarolina', 'presbyterian']",well play worked sick recovery play ms st guy
16qh8ez,k1xs1e2,mississippi south carolina 730,mississippi south carolina location south williamsbrice time 730 watch tv sec networklsecn rcfb made rcfb please keep trash talk civil report comments violate lets talk,['rcfb'],"['southcarolina', 'presbyterian']",lose lose rattler throwing incompletion im going freak fuck
16qh8ez,k1xu2v1,mississippi south carolina 730,mississippi south carolina location south williamsbrice time 730 watch tv sec networklsecn rcfb made rcfb please keep trash talk civil report comments violate lets talk,['rcfb'],"['southcarolina', 'presbyterian']",closer thought first might coming hand goes forward
168fx9s,jyw7q1j,south carolina north carolina 730,south carolina north carolina location bank america time 730 watch tv abclabc odds spread unc 25 overunder 645 rcfb made rcfb please keep trash talk civil report comments violate lets talk,['southcarolina'],"['southcarolina', 'presbyterian']",expect leggett legit 1 receiver wells got hurt expect injury happen two seconds first
168fx9s,jyw89sf,south carolina north carolina 730,south carolina north carolina location bank america time 730 watch tv abclabc odds spread unc 25 overunder 645 rcfb made rcfb please keep trash talk civil report comments violate lets talk,['southcarolina'],"['southcarolina', 'presbyterian']",mean unc pass rush running free without even getting chipped nothing learn besides fact suck butt
168fx9s,jyw9juu,south carolina north carolina 730,south carolina north carolina location bank america time 730 watch tv abclabc odds spread unc 25 overunder 645 rcfb made rcfb please keep trash talk civil report comments violate lets talk,['southcarolina'],"['southcarolina', 'presbyterian']",cannot believe backup qb caught two passes trick plays
168fx9s,jywbli6,south carolina north carolina 730,south carolina north carolina location bank america time 730 watch tv abclabc odds spread unc 25 overunder 645 rcfb made rcfb please keep trash talk civil report comments violate lets talk,['southcarolina'],"['southcarolina', 'presbyterian']",arkansas lost 073 tonight gave 1 sack apples oranges know fuck man dont let guy back bus start freshmen
172j2qi,k3xrcmd,notre dame louisville 737,notre dame location cardinal time 737 watch tv abclabc odds spread nd 65 overunder 535 rcfb made rcfb please keep trash talk civil report comments violate lets talk,['rcfb'],"['southcarolina', 'presbyterian']",either travis kelce filmed 400 commercials week thing taylor swift work
172jjmy,k3y0b21,tech miami 800,tech location miamifmiami hard rock time 800 watch tv acc networklaccn rcfb made rcfb please keep trash talk civil report comments violate lets talk,['rcfb'],"['southcarolina', 'presbyterian']",unbelievable one unforgivable coaching mistakes ive ever seen
17yj8d1,k9uccpq,kentucky south carolina 730,south carolina location south williamsbrice time 730 watch tv sec networklsecn rcfb made rcfb please keep trash talk civil report comments violate lets talk,['rcfb'],"['southcarolina', 'presbyterian']",anyone hear bottle whiskey opened tomorrows birthday im going celebrate massive hangover
16eiwte,jzw4fq6,furman south carolina 730,south carolina location south williamsbrice time 730 watch tv espnlespn sec networklsecn rcfb made rcfb please keep trash talk civil report comments violate lets talk,"['southcarolina2', 'corndog']","['southcarolina', 'presbyterian']",im getting fucked cable company dropping espn im listen radio 1987
183mtar,kaq49j0,ohio 1200,ohio location time 1200 watch tv foxlfox rcfb made rcfb please keep trash talk civil report comments violate lets talk,['rcfb'],"['southcarolina', 'presbyterian']",call interception zero idea catch
183mtar,kaq90sa,ohio 1200,ohio location time 1200 watch tv foxlfox rcfb made rcfb please keep trash talk civil report comments violate lets talk,['rcfb'],"['southcarolina', 'presbyterian']",cameras used reviews standard definition used clear mistakes
166eu9p,jylcvce,college better good argument,see statement almost always former powers fallen miami usc great grew wouldnt college better teams like kansas rutgers vandy good dont want parity old powers regaining seat feels like cfb better little guys rise success,['pittsburgh'],"['southcarolina', 'presbyterian']",statement never agree sport team ever
16a716p,jz618vg,clemson duke 800,dukefdukeduke location dukefduke wallace wade time 800 watch tv espnlespn odds spread clem 13 overunder 555 rcfb made rcfb please keep trash talk civil report comments violate lets talk,"['stanford', 'presscorps']","['southcarolina', 'presbyterian']",sure gonna fuck duke review took long glad got right
16a716p,jz63b48,clemson duke 800,dukefdukeduke location dukefduke wallace wade time 800 watch tv espnlespn odds spread clem 13 overunder 555 rcfb made rcfb please keep trash talk civil report comments violate lets talk,"['stanford', 'presscorps']","['southcarolina', 'presbyterian']",whoever lineman end needs benched special teams bro didnt even try block end
16a716p,jz6mvfq,clemson duke 800,dukefdukeduke location dukefduke wallace wade time 800 watch tv espnlespn odds spread clem 13 overunder 555 rcfb made rcfb please keep trash talk civil report comments violate lets talk,"['stanford', 'presscorps']","['presbyterian', 'georgia']",shouldnt hitting player bounds dead ball foul play way never seen called way
183wpk5,karx6dp,clemson south carolina 730,south carolina location south williamsbrice time 730 watch tv sec networklsecn rcfb made rcfb please keep trash talk civil report comments violate lets talk,['rcfb'],"['southcarolina', 'presbyterian']",weird ass way score 1 foot
183wpk5,kas3usz,clemson south carolina 730,south carolina location south williamsbrice time 730 watch tv sec networklsecn rcfb made rcfb please keep trash talk civil report comments violate lets talk,['rcfb'],"['southcarolina', 'presbyterian']",know behind super mario joyner djay hes gotta grab bench get ball back dude shouldnt let alone getting ball 3 straight times
183wpk5,kas4fnb,clemson south carolina 730,south carolina location south williamsbrice time 730 watch tv sec networklsecn rcfb made rcfb please keep trash talk civil report comments violate lets talk,['rcfb'],"['southcarolina', 'presbyterian']",poor kicker got banished shadow realm stiff arm
183wpk5,kas5lf0,clemson south carolina 730,south carolina location south williamsbrice time 730 watch tv sec networklsecn rcfb made rcfb please keep trash talk civil report comments violate lets talk,['rcfb'],"['southcarolina', 'presbyterian']",heck play rattler brown wasnt catch
183wpk5,kasbn3m,clemson south carolina 730,south carolina location south williamsbrice time 730 watch tv sec networklsecn rcfb made rcfb please keep trash talk civil report comments violate lets talk,['rcfb'],"['southcarolina', 'presbyterian']",thats multiple times tonight camera work freaking terrible
183wpk5,kascha3,clemson south carolina 730,south carolina location south williamsbrice time 730 watch tv sec networklsecn rcfb made rcfb please keep trash talk civil report comments violate lets talk,['rcfb'],"['southcarolina', 'presbyterian']",lets keep feeding man concussion 2 scores instead throwing great idea
183wpk5,kasezqw,clemson south carolina 730,south carolina location south williamsbrice time 730 watch tv sec networklsecn rcfb made rcfb please keep trash talk civil report comments violate lets talk,['rcfb'],"['southcarolina', 'presbyterian']",lol checked espn overunder 485
197cspd,ki00do3,coaches think safe poached another program,saban retiring deboar going washington arizona needs coach harbaugh goes chargers set another chain events teams scrambling find coaches fill know hard compete sec b1g money top programs conferences outspend lot others conferences said coaches think safe poached wont leave current programs,['utah'],"['southcarolina', 'presbyterian']",hate say dabo wasnt interested jumping ship wont go anywhere else college dont see getting interest nfl
167l7hn,jyr27mf,tech louisville 730,tech location mercedesbenz time 730 watch tv espnlespn odds spread lou 8 overunder 485 rcfb made rcfb please keep trash talk civil report comments violate lets talk,['georgiatech'],"['southcarolina', 'presbyterian']",man plummer still threw way behind 4th nice play wr
167l7hn,jyr9dn3,tech louisville 730,tech location mercedesbenz time 730 watch tv espnlespn odds spread lou 8 overunder 485 rcfb made rcfb please keep trash talk civil report comments violate lets talk,['georgiatech'],"['southcarolina', 'presbyterian']",well plummer settled pretty well world tech start running middle 8 man box like 4 tds middle 3rd
17iov84,k6w9rk5,colorado ucla 730,uclafuclaucla location uclafucla rose bowl time 730 watch tv abclabc rcfb made rcfb please keep trash talk civil report comments violate lets talk,['rcfb'],"['ucf', 'presbyterian']",worst d1 fbs oline ive ever seen legit idk bad lol
16wjz00,k2xmto9,south carolina tennessee 730,south carolina location neyland time 730 watch tv sec networklsecn rcfb made rcfb please keep trash talk civil report comments violate lets talk,['rcfb'],"['southcarolina', 'presbyterian']",yall ready 2121 going overtime 3 tds ut 10 fgs carolina
16wjz00,k2xqq87,south carolina tennessee 730,south carolina location neyland time 730 watch tv sec networklsecn rcfb made rcfb please keep trash talk civil report comments violate lets talk,['rcfb'],"['southcarolina', 'presbyterian']",200 iq run hurry fake punt honestly really funny go offense punter rattler punt return personnel package good call ut player lay
16wjz00,k2y4dd1,south carolina tennessee 730,south carolina location neyland time 730 watch tv sec networklsecn rcfb made rcfb please keep trash talk civil report comments violate lets talk,['rcfb'],"['southcarolina', 'presbyterian']",tennessee bothering pass gap control horrendous
16wjz00,k2y6loi,south carolina tennessee 730,south carolina location neyland time 730 watch tv sec networklsecn rcfb made rcfb please keep trash talk civil report comments violate lets talk,['rcfb'],"['southcarolina', 'presbyterian']",running 3rd 15 insult carolina learn
16wjz00,k2y6ybj,south carolina tennessee 730,south carolina location neyland time 730 watch tv sec networklsecn rcfb made rcfb please keep trash talk civil report comments violate lets talk,['rcfb'],"['southcarolina', 'presbyterian']",man stinks uts offense real problems couldve shootout slightly average pass rush
