post_id,comment_id,post_title,post_selftext,post_author_flairs,comment_author_flairs,comment_body
177ix9d,k4t7vff,postgame stanford defeats colorado 4643 2ot,box score provided team 1 2 3 4 ot made rcfb,['rcfb'],"['floridastate', 'santarosajunior']",dont like dont like acc
17ikiis,k6vhpo0,usc california 400,uscfuscusc location california memorial time 400 watch tv pac12 networklp12n rcfb made rcfb please keep trash talk civil report comments violate lets talk,['rcfb'],"['ucla', 'santarosajunior']",cal want win keep close enough grinch still employed play usc
168jxt0,jywm0jl,coastal carolina ucla 1030,coastal carolina uclafuclaucla location uclafucla rose bowl time 1030 watch tv espnlespn odds spread ucla 145 overunder 655 rcfb made rcfb please keep trash talk civil report comments violate lets talk,"['ohiostate3', 'georgia']","['ucla', 'santarosajunior']",g5 stud quarterback getting lit line picks us apart win like 5th time happened last decade
16a716p,jz6nyl3,clemson duke 800,dukefdukeduke location dukefduke wallace wade time 800 watch tv espnlespn odds spread clem 13 overunder 555 rcfb made rcfb please keep trash talk civil report comments violate lets talk,"['stanford', 'presscorps']","['ucdavis', 'santarosajunior']",everyone mentioning clemsons wrs shipley rb even watch play
18u1f6v,kfidx5a,cotton bowl ohio missouri 800,ohio location att time 800 watch tv espnlespn espnlespn odds spread osu 5 overunder 495 rcfb made rcfb please keep trash talk civil report comments violate lets talk,['rcfb'],"['ucdavis', 'santarosajunior']",hella fans dunking osu hoping see energy osu bama claps cheeks
16e7v1g,jzu90xz,nebraska colorado 1200,location folsom time 1200 watch tv foxlfox odds spread neb 95 overunder na rcfb made rcfb please keep trash talk civil report comments violate lets talk,"['nebraska2', 'santamonica']","['ucdavis', 'santarosajunior']",gotta bench right surely thats rhule saying
16av8b7,jz9l2fl,week 2 ap poll,nan,['usc'],"['ucdavis', 'santarosajunior']",surprised didnt move 10 could label weeks top 10 matchup
