post_id,comment_id,post_title,post_selftext,post_author_flairs,comment_author_flairs,comment_body
16q6omx,k1vg9kq,florida clemson 1200,florida location clemsonfclemson memorial clemson sc time 1200 watch tv abclabc rcfb made rcfb please keep trash talk civil report comments violate lets talk,['rcfb'],"['southern', 'usf']",decade since rooted clemson feels weird
16q6omx,k1w82yu,florida clemson 1200,florida location clemsonfclemson memorial clemson sc time 1200 watch tv abclabc rcfb made rcfb please keep trash talk civil report comments violate lets talk,['rcfb'],"['southern', 'usf']",damn fsu lucky nothing soft acc schedule go
17t7o6c,k8w094r,duke north carolina 800,dukefdukeduke north carolina location north kenan time 800 watch tv acc networklaccn rcfb made rcfb please keep trash talk civil report comments violate lets talk,['rcfb'],"['lsu', 'southern']",come unc want play mayo bowl something actually decent year
17t7o6c,k8w0gw9,duke north carolina 800,dukefdukeduke north carolina location north kenan time 800 watch tv acc networklaccn rcfb made rcfb please keep trash talk civil report comments violate lets talk,['rcfb'],"['lsu', 'southern']",well unc could set
17t7o6c,k8w14lo,duke north carolina 800,dukefdukeduke north carolina location north kenan time 800 watch tv acc networklaccn rcfb made rcfb please keep trash talk civil report comments violate lets talk,['rcfb'],"['lsu', 'southern']",excuse fuck running double reverse passes ot
17t7o6c,k8w1ejd,duke north carolina 800,dukefdukeduke north carolina location north kenan time 800 watch tv acc networklaccn rcfb made rcfb please keep trash talk civil report comments violate lets talk,['rcfb'],"['lsu', 'southern']",3rd fuck least ostensible fg range
17t7o6c,k8w1i3l,duke north carolina 800,dukefdukeduke north carolina location north kenan time 800 watch tv acc networklaccn rcfb made rcfb please keep trash talk civil report comments violate lets talk,['rcfb'],"['lsu', 'southern']",damn pretty good stroke though might got 57ish
17t7o6c,k8w1o42,duke north carolina 800,dukefdukeduke north carolina location north kenan time 800 watch tv acc networklaccn rcfb made rcfb please keep trash talk civil report comments violate lets talk,['rcfb'],"['lsu', 'southern']",hrm 1stgoal team generally struggling apparently goaltogo
17t7o6c,k8w1sje,duke north carolina 800,dukefdukeduke north carolina location north kenan time 800 watch tv acc networklaccn rcfb made rcfb please keep trash talk civil report comments violate lets talk,['rcfb'],"['lsu', 'southern']",play call going 28 every handoff
15x72y0,jx4qtzz,teams biggest celebrity fan,im sure talked makes interesting conversation osu handful biggest probably lebron,['ohiostate3'],"['lsu', 'southern']",mean obvious would shaq ive seen vince vaughn keegan michael key quite games
17807o5,k4wtoy7,auburn lsu 700,lsuflsulsu location lsuflsu tiger la time 700 watch tv espnlespn odds spread lsu 11 overunder 620 rcfb made rcfb please keep trash talk civil report comments violate lets talk,['rcfb'],"['lsu', 'southern']",feels like td emery lsu absolutely clear refs say yes yes
177ix9d,k4u3mwy,postgame stanford defeats colorado 4643 2ot,box score provided team 1 2 3 4 ot made rcfb,['rcfb'],"['southern', 'usf']",wtf turned 290 wake
17sdfue,k8p32wm,big ten conference announces violation sportsmanship policy university program,nan,"['ohiostate2', 'pennstate']","['southern', 'usf']",stupid imo harbaugh personally punished allegations proved get two year bowl ban starting imo
17nng69,k7tobdo,kansas 1200,kansas location texasftexas dkrtexas memorial time 1200 watch tv foxlfox odds spread tex 4 overunder 505 rcfb made rcfb please keep trash talk civil report comments violate lets talk,['rcfb'],"['southern', 'usf']",sure ive ever seen 20 point lead disappear faster
16d8tr1,jzo3dzy,cant seem buy brian kelly,watching lsu lose way florida gut punch brian kelly doesnt seem like edge need top tier head coach sec disrespect bk im sure right man lsu watching games back coached nd crucial moments team justyou knowfolded seems like bk era lsu bringing vibe curious see others think situation,['lsu'],"['lsu', 'southern']",mean choice buy florida baffled basically ran exact team playcalling last year think friends talked coaches win sec west last year remove harold perkins defense team doesnt beat ole miss arkansas ill see rest season next season goes full feelings right im scratching head
16ecyqt,jzve4cj,ole miss tulane 330,ole missfolemissole miss location tulaneftulane yulman time 330 watch tv espn2lespn2 odds spread miss 75 overunder na rcfb made rcfb please keep trash talk civil report comments violate lets talk,"['tulane', 'tophat']","['southern', 'usf']",various scorebugs said ole miss cut score 1716 say still 1710 wha happened
18w6kt1,kfwf4sn,rose bowl 500,location rose bowl time 500 watch tv espnlespn odds spread mich 2 overunder 455 rcfb made rcfb please keep trash talk civil report comments violate lets talk,['rcfb'],"['lsu', 'southern']",may think im kidding reason loses
1621ag8,jxvggog,notre dame navy 230,notre dame navyfnavynavy location aviva time 230 watch tv nbclnbc odds spread nd 205 overunder 490 rcfb made rcfb please keep trash talk civil report comments violate lets talk,['usc'],"['southern', 'usf']",really matters fumble recovery notre dame
183u9y1,katvt36,axelrod youre still defending ryan days tenure ohio thats totally fine value wins northwestern maryland rivalry,nan,"['southcarolina', 'williammary']","['southern', 'usf']",get lot worse going 11 1 losing main rival whole whole lot worse
171e59y,k3qlqc9,since im sucker nostalgia schools team played,nebraska 1st place long time year kstate take 1 currently 1a 1b nebraska kstate 106 meetings 2 mizzou 104 meetings 3 kansas 102 meetings 4 89 meetings 5 70 meetings 6 colorado 65 meetings 7 58 meetings,"['iowastate', 'big8']","['lsu', 'southern']",think mississippi us thatll end next year cuz new schedules
17w30ir,k9fg8wj,classes athletes school like,sorry distract coaching drama offseason style discussion go ive seen plenty stories players goofy parties dorms around campus im curious acted classes specifically studious never show treated like gods among men normal students happened great shape,"['michigan3', 'american']","['lsu', 'southern']",class damone clark lesser known guys ive seen lot players campus favorite story party guy bumps says sorry bro rolling blunt look jamarr chase high kite ill never forget sharing blunt biletkinoff winner
1896p8u,kbpwg8y,1200,location att time 1200 watch tv abclabc odds spread tex 15 overunder 555 rcfb made rcfb please keep trash talk civil report comments violate lets talk,['rcfb'],"['southern', 'usf']",need beat fsu lose better fsu get even fsu wins
17ydyqe,k9t481w,ucla usc 330,uclafuclaucla uscfuscusc location uscfusc los angeles memorial coliseum time 330 watch tv abclabc odds spread usc 65 overunder 655 rcfb made rcfb please keep trash talk civil report comments violate lets talk,['rcfb'],"['southern', 'usf']",best color combination rivalry love aesthetics
189ma0p,kbs2lqr,phalen right answer cfp 1 2 washington 3 fsu 4 5 6 7 ohio 8 sorry sec losses matter,nan,[],"['southern', 'usf']",imo wouldve destroyed louisville today fsu would beaten florida left
189go15,kbrog10,800,iowafiowaiowa location lucas oil time 800 watch tv foxlfox odds spread mich 22 overunder 345 rcfb made rcfb please keep trash talk civil report comments violate lets talk,['rcfb'],"['southern', 'usf']",fancy thanks year different last 2 national championship actually table getting rude awakening cant score 3 star recruits aint gonna scoring much
193kpui,kh9wb6c,chris low clowespn x nick saban retiring sources tell espn six national titles,nan,"['rutgers', 'oregon']","['lsu', 'southern']",ive hated since 2007 doesnt mean dont respect great retirement
17d4h7c,k5vez4c,ucf 1200,ucffucfucf location memorial norman ok time 1200 watch tv abclabc rcfb made rcfb please keep trash talk civil report comments violate lets talk,['rcfb'],"['southern', 'usf']",great effort ucf imagine baylor shudder
1684osx,jytx7zh,colorado tcu 1200,tcuftcutcu location tcuftcu amon g carter time 1200 watch tv foxlfox odds spread tcu 205 overunder 645 rcfb made rcfb please keep trash talk civil report comments violate lets talk,"['texasam', 'ucla']","['southern', 'usf']",whats point making rule changes shorten youre gonna let replay review take long
1684osx,jyulhce,colorado tcu 1200,tcuftcutcu location tcuftcu amon g carter time 1200 watch tv foxlfox odds spread tcu 205 overunder 645 rcfb made rcfb please keep trash talk civil report comments violate lets talk,"['texasam', 'ucla']","['southern', 'usf']",thank god dont hear hypno toads tcu nonsense year
172zlcl,k3zqvvk,worst way ever seen cfb team lose,2020 marco wilson throwing shoe 2023 miami fumbling run 30 seconds left allow tech score gw td drive 2021 florida allows gamewinning hail mary versus jacksonville 2019 ole miss player costing team pat pissing dog td celebration 2022 going 4th last year territory washington 2015 michigans botched punt st,"['florida', 'sec']","['southern', 'usf']",imo topping situation kneeldown would amd dont even worse botching kneel least right idea
177218h,k4q44xl,rodak sec yet officially decide 8game schedule 7 rotating 1 permanent 9game 6 rotating 3 permanent 2025 beyond,nick saban radio show thursday night spoke solely 8game model saying way gonna 7 team rotation 1 team fixed think youre gonna play everybody every four years almost every guy school going play every team conference think great well link sabans comments around 59 minute mark,"['nebraska', 'northerniowa']","['southern', 'usf']",sec would add ninth unless disney ponies
17t727w,k8vvudv,florida lsu 730,lsuflsulsu location lsuflsu tiger la time 730 watch tv sec networklsecn odds spread lsu 135 overunder 635 rcfb made rcfb please keep trash talk civil report comments violate lets talk,['rcfb'],"['lsu', 'southern']",go throat dont give depleted defense chance botch
17t727w,k8vx8vz,florida lsu 730,lsuflsulsu location lsuflsu tiger la time 730 watch tv sec networklsecn odds spread lsu 135 overunder 635 rcfb made rcfb please keep trash talk civil report comments violate lets talk,['rcfb'],"['lsu', 'southern']",oh lord duke took lead blowouts earlier today east coast prime time games close
17t727w,k8vxbw6,florida lsu 730,lsuflsulsu location lsuflsu tiger la time 730 watch tv sec networklsecn odds spread lsu 135 overunder 635 rcfb made rcfb please keep trash talk civil report comments violate lets talk,['rcfb'],"['lsu', 'southern']",oh god block jesus christ made cringe im lsu fan
17t727w,k8vxr8f,florida lsu 730,lsuflsulsu location lsuflsu tiger la time 730 watch tv sec networklsecn odds spread lsu 135 overunder 635 rcfb made rcfb please keep trash talk civil report comments violate lets talk,['rcfb'],"['lsu', 'southern']",well result assured last 2 minutes relevant bettors lsu 165 whatever public line settled
17sxe7s,k8tc22k,kentucky 1200,location kroger time 1200 watch tv espnlespn rcfb made rcfb please keep trash talk civil report comments violate lets talk,['rcfb'],"['southern', 'usf']",cfp teams better hope loss keeps
16qh8h1,k1xxr54,ohio notre dame 730,ohio notre dame location notre damefnotredame notre dame time 730 watch tv nbclnbc odds spread osu 75 overunder na rcfb made rcfb please keep trash talk civil report comments violate lets talk,['rcfb'],"['lsu', 'southern']",tried overload offensive right side hb dive left better offensive call defense sucks lose think everything right man
1689xyu,jyusy0o,buffalo wisconsin 330,location camp randall time 330 watch tv fox sports 1lfs1 odds spread wis 28 overunder 545 rcfb made rcfb please keep trash talk civil report comments violate lets talk,['wisconsin'],"['southern', 'usf']",reviewing refs supposed ignore missed pass interference wisconsin db
17yfvzc,k9u2ics,ucf tech 500,ucffucfucf tech location techftexastech jones att time 500 watch tv fox sports 2lfs2 rcfb made rcfb please keep trash talk civil report comments violate lets talk,['rcfb'],"['southern', 'usf']",ucf actual big 12 team bowl eligible houston
15u6nal,jwo5ofj,nothing say would ever change opinion cfb opinion,opinion ironclad immovable collaboration worlds top minds say otherwise couldnt get move opinion god could appear irrefutable evidence stating otherwise still wouldnt change opinion,['georgia'],"['lsu', 'southern']",shouldve lsu bcs 2011
166eu9p,jyki2qu,college better good argument,see statement almost always former powers fallen miami usc great grew wouldnt college better teams like kansas rutgers vandy good dont want parity old powers regaining seat feels like cfb better little guys rise success,['pittsburgh'],"['lsu', 'southern']",kind wish years like 2007 want season unpredictable dog fight nearly every week teams get boring
16a716p,jz6q93i,clemson duke 800,dukefdukeduke location dukefduke wallace wade time 800 watch tv espnlespn odds spread clem 13 overunder 555 rcfb made rcfb please keep trash talk civil report comments violate lets talk,"['stanford', 'presscorps']","['southern', 'usf']",generated kinetic energy duke fans storming clemson fans storming exits
16keh8t,k0vqdco,usf 330,usffusfusf location usffusf raymond james time 330 watch tv abclabc rcfb made rcfb please keep trash talk civil report comments violate lets talk,['rcfb'],"['southern', 'usf']",doesnt quarterback throw ball astonishing
16keh8t,k0vv0y0,usf 330,usffusfusf location usffusf raymond james time 330 watch tv abclabc rcfb made rcfb please keep trash talk civil report comments violate lets talk,['rcfb'],"['southern', 'usf']",starting think shadow normal team arent much good
16q6opo,k1vfnwq,cincinnati 1200,location nippert time 1200 watch tv rcfb made rcfb please keep trash talk civil report comments violate lets talk,['rcfb'],"['southern', 'usf']",think wr bounds couldnt tell sure imo
165jjly,jygl7d4,week 1 matchup preview 5 lsu tigers 8 florida seminoles,5 lsuflsu 8 florida sunday september 3 0730 eastern camping world orlando watch abclabc odds lsuflsu 25 pts total points 560 alltime series lsuflsu florida lsuflsu florida met 10 times since 12301968 teams last met 360 days ago 09042022 series wins lsuflsu 208 florida longest streak continuous meetings 5 19791983 florida last 5 meetings 19832022 series last 5 meetings florida orleans la2324 florida rouge la1627 florida fl342 florida rouge la2131 florida rouge la3540 series comparison data via lsuflsu injury report data scraped 20230830 100011 maason smithdtelig sept 9 suspensionfri aug 25smith suspended ncaa due violating league rules likely make season debut sept 9 versus grambling logan diggsrbques sun hamstringmon aug 28diggs nursing hamstring injury remains seen available sundays showdown versus florida josh williamsrbprob sun undisclosedmon aug 28williams managing undetermined issue anticipated take florida sunday armoni goodwinrbdoub sun undisclosedmon aug 28goodwin tending unknown ailment unlikely face florida sunday landon ibietawrdoub sun undisclosedtue aug 29ibieta injury unlisted location leaving availability season opener versus florida doubt injury data lifted florida injury report data scraped 20230830 100011 darrell jackson jrdlout season eligibilitytue aug 8jackson jr hardship waiver request denied ncaa sit entire 2023 season ja khi douglaswrout indefinitely undisclosedmon aug 28douglas idle unspecified issue miss undetermined length time injury data lifted keys think wins think favorite cover spread players interested watch lets talk vote matchup win poll simply include name team think win enclosed part top level comment discussing matchup change vote edit initial comment bracket team change vote often like posted full listing accepted fbs team aliases found fcs teams need use full name appears post title listing links live vote totals matchup preview threads current week found like format generate matchup discussion matchup discussion please dm udupreesdiamond regarding template,"['cincinnati', 'oklahomastate']","['lsu', 'southern']",muffed 2 punts brand new coach lot transfers lost 1 itll smooth opinion tigerbait
176fwua,k4m4zlr,else eats rivals mascot tailgate,removed,['washington'],"['southern', 'usf']",lsu florida visits always tailgaters whole alligators roasting spit
17nng54,k7tatg3,notre dame clemson 1200,notre dame location clemsonfclemson memorial clemson sc time 1200 watch tv abclabc rcfb made rcfb please keep trash talk civil report comments violate lets talk,['rcfb'],"['southern', 'usf']",notre dame 21 yards trails 15 points settling fgs
1780tdz,k4xf60c,usc notre dame 730,uscfuscusc notre dame location notre damefnotredame notre dame time 730 watch tv nbclnbc peacocklpeacock odds spread nd 3 overunder 630 rcfb made rcfb please keep trash talk civil report comments violate lets talk,['rcfb'],"['lsu', 'southern']",4th9 keep championship hopes pristine get star qb absolutely decimated gfg usc notre dame absolutely deserves win margin
15vd1bk,jwvm76q,predictions favorite team,prediction 11 1 losing gets back order kicks crap everybody rest year right number two playoffs goes win probably big 10 school,[],"['lsu', 'southern']",long injury bug doesnt hit expect new years six bowl
189go22,kbr5vxz,florida louisville 800,florida location bank america time 800 watch tv abclabc odds spread fsu 15 overunder 465 rcfb made rcfb please keep trash talk civil report comments violate lets talk,['rcfb'],"['southern', 'usf']",fox talking heads saying fsu matter wins
189go22,kbrkgbl,florida louisville 800,florida location bank america time 800 watch tv abclabc odds spread fsu 15 overunder 465 rcfb made rcfb please keep trash talk civil report comments violate lets talk,['rcfb'],"['southern', 'usf']",fsu getting done need make famous halftime adjustments really start score second half winning way gonna convince committee dont think
189go22,kbrl5un,florida louisville 800,florida location bank america time 800 watch tv abclabc odds spread fsu 15 overunder 465 rcfb made rcfb please keep trash talk civil report comments violate lets talk,['rcfb'],"['southern', 'usf']",unless florida starts scoring touchdowns going playoffs going orange bowl
189go22,kbrlo5e,florida louisville 800,florida location bank america time 800 watch tv abclabc odds spread fsu 15 overunder 465 rcfb made rcfb please keep trash talk civil report comments violate lets talk,['rcfb'],"['southern', 'usf']",florida best team country half time adjustments trailing lsu half trailing florida last week half need make adjustments start scoring touchdowns
17auydh,k5g9mcz,week 8 matchup preview 7 penn nittany lions 4 ohio buckeyes,7 penn statefpennstate 4 ohio statefohiostate saturday october 21 1200 eastern ohio columbus watch foxlfox odds ohio statefohiostate 45 pts total points 455 alltime series penn statefpennstate ohio statefohiostate penn statefpennstate ohio statefohiostate met 37 times since 11161912 teams last met 354 days ago 10292022 series wins penn statefpennstate 14023 ohio statefohiostate longest streak continuous meetings 30 19932022 ohio statefohiostate last 6 meetings 20172022 series last 5 meetings ohio college pa3144 ohio oh2433 ohio college pa2538 ohio oh1728 ohio college pa2627 series comparison data via week 7 weekpenn statefpennstate 6030resultohio statefohiostate 6030result 1west 4221w 2403w 233 5120w 637youngstown 3312w 357 3413w 3013wkufwku 4220w 6310 4iowafiowa23 6131w 310notre 6200w 1714 3312w 4113byena 5222w 3717 7umassfumass 1700w 2513w 417 rankings reflect current rcfb penn statefpennstate injury report data scraped 20231018 100011 jan mahlertwrques sat undisclosedsun oct 15mahlert sat last three games due unspecified ailment availability saturdays showdown versus ohio cloudy mason stahlwrques sat undisclosedsun oct 15stahl missed previous contest undefined ailment yet determined face ohio saturday mason robinsondeout indefinitely undisclosedsat sep 30robinson idle injury unlisted location miss extended period dk kencyrbout indefinitely undisclosedsat sep 30kency idle undefined injury miss undetermined length time ian harvieolout indefinitely undisclosedsat sep 30harvie sidelined unreported ailment team officials yet provide exact return date alonzo ford jrdtout season undisclosedfri aug 11ford jr sidelined unspecified issue miss entire 2023 season jashuan greensout indefinitely undisclosedsat sep 30green commission unspecified ailment severity injury unknown karson indefinitely undisclosedsat sep 30kiesewetter lineup due unknown ailment timetable recovery tyler johnsonwrout indefinitely undisclosedsat sep 30johnson idle unannounced injury yet established make season debut injury data lifted ohio statefohiostate injury report data scraped 20231018 100011 cameron martinezsques sat undisclosedsun oct 15martinez missed last three games unspecified injury remains seen lace saturday penn miyan williamsrbques sat undisclosedsun oct 15williams sat last contest unknown injury unknown active saturdays versus penn emeka egbukawrques sat legsun oct 15egbuka missed previous due leg ailment air line saturdays showdown penn treveyon hendersonrbques sat undisclosedsun oct 15henderson held last two contests undefined issue undetermined take penn saturday chip trayanumrbques sat undisclosedsun oct 15trayanum exited last unknown issue unclear return penn saturday joe royerteques sat undisclosedsun oct 15royer held previous undefined issue remains seen lace penn saturday tc caffeyrbout indefinitely kneesun oct 15caffey idle due knee injury unclear return zak herbstreitteout season undisclosedthu sep 21herbstreit shut entire 2023 season unknown injury joop mitchellwrout indefinitely undisclosedsun oct 8mitchell commission due unrevealed ailment yet confirmed return kyion grayeswrout indefinitely undisclosedsun oct 8grayes sidelined due unspecified issue miss extended period jayden bonsusout indefinitely undisclosedsun oct 8bonsu lineup undefined issue unclear make season debut nolan baudowrout indefinitely undisclosedsat oct 7baudo idle undefined issue timetable recovery reis stocksdalewrout season kneetue oct 3stocksdale commission knee injury likely miss remainder season bennett christianteout season suspensionsun aug 27christian suspended entire 2023 season due violation ncaa rules arvell reeselbout indefinitely undisclosedsat oct 14reese commission unreported ailment timetable return injury data lifted keys think wins think favorite cover spread players interested watch lets talk vote matchup win poll simply include name team think win enclosed part top level comment discussing matchup change vote edit initial comment bracket team change vote often like posted full listing accepted fbs team aliases found fcs teams need use full name appears post title listing links live vote totals matchup preview threads current week found like format generate matchup discussion matchup discussion please dm udupreesdiamond regarding template,"['oregonstate', 'summertimelover']","['southern', 'usf']",think penn wins like qb physicality
15z2rv0,jxeyndc,teams embarrassing miserable worst result time,want answers,"['wichitastate', 'applecup']","['lsu', 'southern']",probably lot im forgetting losing troy 2017 crazy personal felt miserable watching mississippi threw 600 yards us covid season
17d92jq,k5wadb9,minnesota 330,iowafiowaiowa location iowafiowa kinnick time 330 watch tv rcfb made rcfb please keep trash talk civil report comments violate lets talk,['rcfb'],"['southern', 'usf']",turn saw return punt touchdown thought happened
16aczkc,jz6qfvb,postgame duke defeats clemson 287,box score provided team 1 2 3 4 made rcfb,"['stanford', 'presscorps']","['lsu', 'southern']",crazy neither team claims death valley im happy
17taiot,k8w6f76,usc 1030,uscfuscusc location oregonforegon autzen time 1030 watch tv foxlfox odds spread ore 15 overunder 735 rcfb made rcfb please keep trash talk civil report comments violate lets talk,['rcfb'],"['lsu', 'southern']",bo nix absolutely shredding usc defense yet usc 8 games ive seen tonight cant say even close bag
15z8uel,jxgjyw1,hypothetical bet life one 10 schools reaching cfb national championship within next 10 years one would choose,assume life stake need one 10 schools reach cfb national championship within next 10 years continue living school going arizona kansas missouri north carolina purdue south carolina tech virginia tech wisconsin,['georgia'],"['lsu', 'southern']",money wisconsin faith coach luke
