post_id,comment_id,post_title,post_selftext,post_author_flairs,comment_author_flairs,comment_body
166pzmw,jyltz7b,south dakota missouri 800,south dakota location memorial stadiumfaurot time 800 watch tv sec networklsecn rcfb made rcfb please keep trash talk civil report comments violate lets talk,"['iowastate', 'southdakotastate']","['iowa', 'southdakota']",wow actually closer thought would hope keep respectable halftime
17d92lf,k5w3pjf,northwestern nebraska 330,location memorial lincoln ne time 330 watch tv big ten networklbtn rcfb made rcfb please keep trash talk civil report comments violate lets talk,['rcfb'],"['nebraska', 'southdakota']",big 10 network ya sorry theres epic volleyball coming make
17ijw1m,k6vf3sm,purdue nebraska 330,location memorial lincoln ne time 330 watch tv fox sports 1lfs1 rcfb made rcfb please keep trash talk civil report comments violate lets talk,['rcfb'],"['southdakota', 'nebraska']",terrible last minute officials got caught watching punt purdue showed fake second punting missed clear kickcatch interference targeting one clearest ones could see picked flag
17ijw1m,k6vkjmb,purdue nebraska 330,location memorial lincoln ne time 330 watch tv fox sports 1lfs1 rcfb made rcfb please keep trash talk civil report comments violate lets talk,['rcfb'],"['southdakota', 'nebraska']",talking lot 21 taking much gave hit
16a716p,jz65u5o,clemson duke 800,dukefdukeduke location dukefduke wallace wade time 800 watch tv espnlespn odds spread clem 13 overunder 555 rcfb made rcfb please keep trash talk civil report comments violate lets talk,"['stanford', 'presscorps']","['floridastate', 'southdakota']",least b1g sec games theres excuse commercials since big tv payouts
16a716p,jz6fd1h,clemson duke 800,dukefdukeduke location dukefduke wallace wade time 800 watch tv espnlespn odds spread clem 13 overunder 555 rcfb made rcfb please keep trash talk civil report comments violate lets talk,"['stanford', 'presscorps']","['oregonstate', 'southdakota']",thought leonard made mistake cutting outside blocker inside bro knew jet impressive
16a716p,jz6gh0e,clemson duke 800,dukefdukeduke location dukefduke wallace wade time 800 watch tv espnlespn odds spread clem 13 overunder 555 rcfb made rcfb please keep trash talk civil report comments violate lets talk,"['stanford', 'presscorps']","['floridastate', 'southdakota']",lmao apparently north carolina mad south carolina weekend
172cjmf,k3wo9il,washington ucla 300,washington uclafuclaucla location uclafucla rose bowl time 300 watch tv pac12 networklp12n rcfb made rcfb please keep trash talk civil report comments violate lets talk,['rcfb'],"['stanford', 'southdakota']",wildly differing takes whether targeting amusing
172cjmf,k3wxdp0,washington ucla 300,washington uclafuclaucla location uclafucla rose bowl time 300 watch tv pac12 networklp12n rcfb made rcfb please keep trash talk civil report comments violate lets talk,['rcfb'],"['stanford', 'southdakota']",slow developing run shotgun formation brilliant wsu
17myplv,k7omu7e,team watchcheer zero connection,dad tennessee alum thats obviously main team talking day mentioned surfs rice message boards fun kind surprising know rice message boards also watches service academies whenever served personally love kansas even leipold liked logo uniforms liked rooting underdog white helmet favorite,"['mississippistate', 'santamonica']","['auburn', 'southdakota']",love west virginia always pull real reason go eers
15j9e42,juyxwwp,maybe asked utah fans seem adamant theyll run big 12,maybe im getting wrapped utah twitter fan base worst part every fan base exactly utah done thats impressive people think big 12 suddenly runs slc sure theyve bunch g5 conference championships couple pac 12 championships team ever dominated big 12 put bluntly utah isnt ou think theyre good team absolutely compete conference champion spots theres nothing ive seen makes think theyll come dominate missing,['kansasstate'],"['nebraska', 'southdakota']",big 12 deeper league top bottom past 2 years top pac 12 stronger big 12 utah still
16kjdqm,k0wp572,northern illinois nebraska 700,northern illinois location memorial lincoln ne time 700 watch tv fox sports 1lfs1 rcfb made rcfb please keep trash talk civil report comments violate lets talk,['rcfb'],"['nebraska', 'southdakota']",2023 huskers great value brand version 2009 team
16kjdqm,k0wvvd4,northern illinois nebraska 700,northern illinois location memorial lincoln ne time 700 watch tv fox sports 1lfs1 rcfb made rcfb please keep trash talk civil report comments violate lets talk,['rcfb'],"['southdakota', 'nebraska']",yeah dean thats sideline ref called incomplete lucked tip ball hitting ground
15y76an,jx9xc5w,whats schools embarrassing record,ugas zeke bratowski threw 68 interceptions 734 pass attempts 19511953 honestly feels like unbreakable bad record,[],"['kansas', 'southdakota']",jayhawk fan couldnt possibly even know begin answering question rock chalk
176fwua,k4m684l,else eats rivals mascot tailgate,removed,['washington'],"['southdakota', 'nebraska']",usd used throw taxidermied rabbits sdsu threw taxidermied coyotes play regardless sport
16w4zuc,k2vgc48,espn college gameday show,want little ting tang tang discuss post anything related show signs screencaps videos etc,['rcfb'],"['nebraska', 'southdakota']",steves 4 pack guy would better luck gambling flipped coin
16nnrmg,k1gcyp9,team happy see succeed,team see winning games think know like theyre winning washington theyre brand good fans top25 makes sense,['miami'],"['nebraska', 'southdakota']",ive always affinity utah tough team region easy recruit earned way power conference competitive whole damn thing multiple times
165rm7h,jygven0,honest still mentally team,go 2019 fiesta bowl clemson top controversial targeting fumble call wont even go one dagger probably took 10 years life arguably best osu team talent wise ive seen lifetime even make championship make argument 2015 team well dont know could beat insane lsu team hoping would play season barely came short however definitely made mistakes well shout trevor lawrence insane 67 yard run td,['ohiostate3'],"['oregon', 'southdakota']",quack attack stanford 2001 autzen cardinals blocked two punts second ended winning ending long string home wins ducks ruining rose bowl dreams great team
171qilp,k3t02z1,nebraska illinois 800,location memorial champaign il time 800 watch tv fox sports 1lfs1 rcfb made rcfb please keep trash talk civil report comments violate lets talk,['rcfb'],"['nebraska', 'southdakota']",illinois trying beat nebraska wont let
171qilp,k3t3jy2,nebraska illinois 800,location memorial champaign il time 800 watch tv fox sports 1lfs1 rcfb made rcfb please keep trash talk civil report comments violate lets talk,['rcfb'],"['nebraska', 'southdakota']",hate tv networks theyve destroyed conferences rivalries 100s years old money cram many damn commercials games greedy fucks general said big 10 give money back airing
189brft,kbqtvbx,400,location mercedesbenz time 400 watch tv cbslcbs odds spread uga 5 overunder 555 rcfb made rcfb please keep trash talk civil report comments violate lets talk,['rcfb'],"['stanford', 'southdakota']",lol really might sec teams playoff
189brft,kbqy3ne,400,location mercedesbenz time 400 watch tv cbslcbs odds spread uga 5 overunder 555 rcfb made rcfb please keep trash talk civil report comments violate lets talk,['rcfb'],"['stanford', 'southdakota']",playoff committee start rooting hard louisville win tonight
189brft,kbr0fly,400,location mercedesbenz time 400 watch tv cbslcbs odds spread uga 5 overunder 555 rcfb made rcfb please keep trash talk civil report comments violate lets talk,['rcfb'],"['stanford', 'southdakota']",may literally first time ive rooted
17yj88b,k9u2tyr,washington 730,location reser time 730 watch tv abclabc rcfb made rcfb please keep trash talk civil report comments violate lets talk,['rcfb'],"['oregonstate', 'southdakota']",calling holding penix runs dju
17yj88b,k9u4h5c,washington 730,location reser time 730 watch tv abclabc rcfb made rcfb please keep trash talk civil report comments violate lets talk,['rcfb'],"['oregonstate', 'southdakota']",guys cannot keep aidan chiles thing big games
17yj88b,k9u6zqk,washington 730,location reser time 730 watch tv abclabc rcfb made rcfb please keep trash talk civil report comments violate lets talk,['rcfb'],"['oregonstate', 'southdakota']",looked like hold goulds jersey guess gonna ignore
17yj88b,k9u73g6,washington 730,location reser time 730 watch tv abclabc rcfb made rcfb please keep trash talk civil report comments violate lets talk,['rcfb'],"['oregonstate', 'southdakota']",damien literally gets like 50 yards drive still decide go away drive
1694dym,jyzy3wk,san jos 330,san jos jos location san jos cefcu time 330 watch tv cbslcbs odds spread orst 165 overunder 545 rcfb made rcfb please keep trash talk civil report comments violate lets talk,"['oregonstate', 'summertimelover']","['oregonstate', 'southdakota']",really nice move sjsu qb tho
1694dym,jyzyp0d,san jos 330,san jos jos location san jos cefcu time 330 watch tv cbslcbs odds spread orst 165 overunder 545 rcfb made rcfb please keep trash talk civil report comments violate lets talk,"['oregonstate', 'summertimelover']","['oregonstate', 'southdakota']",dont understand espn app says timeouts sjsu tv using three call first one
1694dym,jyzzcq1,san jos 330,san jos jos location san jos cefcu time 330 watch tv cbslcbs odds spread orst 165 overunder 545 rcfb made rcfb please keep trash talk civil report comments violate lets talk,"['oregonstate', 'summertimelover']","['oregonstate', 'southdakota']",see florida kick fgs end avoid shut
1694dym,jz005da,san jos 330,san jos jos location san jos cefcu time 330 watch tv cbslcbs odds spread orst 165 overunder 545 rcfb made rcfb please keep trash talk civil report comments violate lets talk,"['oregonstate', 'summertimelover']","['oregonstate', 'southdakota']",guys hear mwc commish said playing well season
1694dym,jz00dzp,san jos 330,san jos jos location san jos cefcu time 330 watch tv cbslcbs odds spread orst 165 overunder 545 rcfb made rcfb please keep trash talk civil report comments violate lets talk,"['oregonstate', 'summertimelover']","['oregonstate', 'southdakota']",remember way back months ago talking adding teams pac12
1694dym,jz037lg,san jos 330,san jos jos location san jos cefcu time 330 watch tv cbslcbs odds spread orst 165 overunder 545 rcfb made rcfb please keep trash talk civil report comments violate lets talk,"['oregonstate', 'summertimelover']","['oregonstate', 'southdakota']",damien da beast weve stretch really good rbs
1694dym,jz09gp9,san jos 330,san jos jos location san jos cefcu time 330 watch tv cbslcbs odds spread orst 165 overunder 545 rcfb made rcfb please keep trash talk civil report comments violate lets talk,"['oregonstate', 'summertimelover']","['oregonstate', 'southdakota']",gotta get marker route throw
1694dym,jz0ce1z,san jos 330,san jos jos location san jos cefcu time 330 watch tv cbslcbs odds spread orst 165 overunder 545 rcfb made rcfb please keep trash talk civil report comments violate lets talk,"['oregonstate', 'summertimelover']","['oregonstate', 'southdakota']",first season without colletto sad fun watch
1694dym,jz0jc4c,san jos 330,san jos jos location san jos cefcu time 330 watch tv cbslcbs odds spread orst 165 overunder 545 rcfb made rcfb please keep trash talk civil report comments violate lets talk,"['oregonstate', 'summertimelover']","['oregonstate', 'southdakota']",riley sharpe rssr time flies switch te last year year
166w2i8,jypa89x,postgame minnesota defeats nebraska 1310,box score provided team 1 2 3 4 made rcfb,"['minnesota', 'delaware']","['southdakota', 'nebraska']",honestly thought fans would worst wrong carolina panthers fans knew fans one irrelevant nfl teams could salty rhule wasnt good thats reasons team sucks pathetic think otherwise
16we4il,k2wwbma,nebraska 330,location memorial lincoln ne time 330 watch tv foxlfox rcfb made rcfb please keep trash talk civil report comments violate lets talk,['rcfb'],"['southdakota', 'nebraska']",well least yotes went fargo beat ndsu
17zyhsl,ka3op8y,nonosuum flairs rooting,cfbs top drama reach crescendo week 2 osu 3 um country want see ohio win americas team pulling even youre holding nose,['ohiostate'],['southdakota'],theyre success still new im sick yet
16eiwlx,jzw59fi,wisconsin washington 730,washington location washington martin time 730 watch tv abclabc rcfb made rcfb please keep trash talk civil report comments violate lets talk,"['washingtonstate', 'oregonstate']","['stanford', 'southdakota']",youre telling theres receiver named andre dollar hes white
162rw9j,jxzbwgi,college gameday discussion whats consensus pat mcafee,hes getting torched social media people seem frustrated david pollack got cut whats consensus,['oklahomastate'],"['southdakota', 'nebraska']",jean ralphio sports talk best small doses easy get sick used much
18at0mc,kc6cs28,cfp discussion pt 2 discussioning,home hypotheticals questions comments angry outbursts anything else covered previous options unknown reason seems particularly popular topic week please keep mind discussions remain civil adhere,['rcfb'],"['southdakota', 'augustanasd']",cancelled disney put reason cfp selection corruption
15vd1bk,jwvfupz,predictions favorite team,prediction 11 1 losing gets back order kicks crap everybody rest year right number two playoffs goes win probably big 10 school,[],"['nebraska', 'southdakota']",first flair actually win back forth 1 score fanbase confused celebrate 2nd flair upset missouri week 1 causes get death penalty stumble 38 finish
167lxjl,jyqj5mu,missouri kansas 800,missouri location kansasfkansas david booth kansas memorial time 800 watch tv big 12lbig12 rcfb made rcfb please keep trash talk civil report comments violate lets talk,"['kansas', 'washington']","['stanford', 'southdakota']",didnt realize border war played year thats greaoh
189go22,kbrf3dw,florida louisville 800,florida location bank america time 800 watch tv abclabc odds spread fsu 15 overunder 465 rcfb made rcfb please keep trash talk civil report comments violate lets talk,['rcfb'],"['stanford', 'southdakota']",fsu making easier committee far
17vv3v6,k9e7tjp,programs coaches lifetime consider successes consider failures,binary choice good bad coach remembers positively fans looks like stallings success dubose failure franchione failure shula failure saban success failures shula gets goodwill leading us sanctions tenure also anonymous anemic offense im curious see guys high highs low lows evaluated auburn fans feel gus lsu fans see orgeron era,['alabama'],"['nebraska', 'southdakota']",frost failure riley failure pelini successful callahan failure solich successful osborne successful devaney successful jennings failure
