post_id,comment_id,post_title,post_selftext,post_author_flairs,comment_author_flairs,comment_body
17ifk69,k6v7bk9,kansas 1200,location kansasfkansas david booth kansas memorial time 1200 watch tv foxlfox rcfb made rcfb please keep trash talk civil report comments violate lets talk,['rcfb'],"['independencecc', 'sterling']",fact didnt bean run td run fireable offense
189it1b,kbu6c0p,special edition ccg weekend cfp rankingscenario discussion,hot takes hypotheticals sos comparisons h2h arguments place home usergenerated cfp discussion wild conference championship week,['rcfb'],"['independencecc', 'sterling']",dont understand argument fsu qb last two weeks wont games logic lets hammer miracle rescuing auburn
18rnjff,kf34znc,guaranteed rate bowl unlv kansas 900,unlvfunlvunlv location chase time 900 watch tv espnlespn espnlespn odds spread ku 125 overunder 675 rcfb made rcfb please keep trash talk civil report comments violate lets talk,['rcfb'],"['sickos', 'sterling']",comment flagged defensive pass internevermind ku defense makes stand bad overthrow
18rnjff,kf368rq,guaranteed rate bowl unlv kansas 900,unlvfunlvunlv location chase time 900 watch tv espnlespn espnlespn odds spread ku 125 overunder 675 rcfb made rcfb please keep trash talk civil report comments violate lets talk,['rcfb'],"['sickos', 'sterling']",devolved fk chuck teams
18rnjff,kf36h2j,guaranteed rate bowl unlv kansas 900,unlvfunlvunlv location chase time 900 watch tv espnlespn espnlespn odds spread ku 125 overunder 675 rcfb made rcfb please keep trash talk civil report comments violate lets talk,['rcfb'],"['sickos', 'sterling']",charmin soft insult toilet paper describing defenses tonight
18t5hhy,kfclofk,poptarts bowl kansas nc 545,kansas nc statefncstatenc location camping world time 545 watch tv espnlespn espnlespn odds spread ksu 2 overunder 475 rcfb made rcfb please keep trash talk civil report comments violate lets talk,['rcfb'],"['independencecc', 'sterling']",often fake punt score td feel like ive probably seen happen cant think time
17807q1,k4x9cf1,arizona washington 700,washington location washington gesa time 700 watch tv pac12 networklp12n odds spread wsu 8 overunder 620 rcfb made rcfb please keep trash talk civil report comments violate lets talk,['rcfb'],"['independencecc', 'sterling']",serious question someone hasnt seen much happened washington st last couple weeks
