post_id,comment_id,post_title,post_selftext,post_author_flairs,comment_author_flairs,comment_body
16eiww4,jzwk1er,eastern minnesota 730,eastern location huntington bank time 730 watch tv big ten networklbtn rcfb made rcfb please keep trash talk civil report comments violate lets talk,"['minnesota', 'grandvalleystate']","['minnesota', 'stolaf']",could wrong get rodney vibes taylor mo
16a716p,jz6ozt0,clemson duke 800,dukefdukeduke location dukefduke wallace wade time 800 watch tv espnlespn odds spread clem 13 overunder 555 rcfb made rcfb please keep trash talk civil report comments violate lets talk,"['stanford', 'presscorps']","['nebraska', 'stolaf']",duke fans chanting want bama lmfao college culture alive well
17sxe9k,k8thezf,indiana illinois 1200,location memorial champaign il time 1200 watch tv big ten networklbtn odds spread ill 65 overunder 435 rcfb made rcfb please keep trash talk civil report comments violate lets talk,['rcfb'],"['minnesota', 'stolaf']",illini bros today last week wasnt paddock starting year wa sit matter going younger guy
16ecyt5,jzvha0u,330,iowafiowaiowa location statefiowastate jack trice time 330 watch tv foxlfox rcfb made rcfb please keep trash talk civil report comments violate lets talk,['rcfb'],"['iowa', 'stolaf']",dont love 1 yard run 3rd 14 dont love
16ecyt5,jzvl9rq,330,iowafiowaiowa location statefiowastate jack trice time 330 watch tv foxlfox rcfb made rcfb please keep trash talk civil report comments violate lets talk,['rcfb'],"['iowa', 'stolaf']",im starting feel good prospect targeting penalty onside kick
166w2i8,jym9r6b,postgame minnesota defeats nebraska 1310,box score provided team 1 2 3 4 made rcfb,"['minnesota', 'delaware']","['minnesota', 'stolaf']",take great defense shitty greek quarterback
16e7v1g,jzu7x1n,nebraska colorado 1200,location folsom time 1200 watch tv foxlfox odds spread neb 95 overunder na rcfb made rcfb please keep trash talk civil report comments violate lets talk,"['nebraska2', 'santamonica']","['minnesota', 'stolaf']",genuine question husker fans bench simms 5 already season
18wi2m2,kfxyz3d,postgame washington defeats 3731,box score provided team 1 2 3 4 made rcfb,['rcfb'],"['northwestern', 'stolaf']",winnable absolutely beat today 2 unforced turnovers 10 penalties sloppy running backs averaged 7 ypc establish run hold onto win
