post_id,comment_id,post_title,post_selftext,post_author_flairs,comment_author_flairs,comment_body
16ktcfe,k0y2kqq,postgame colorado defeats colorado 4335 2ot,box score provided team 1 2 3 4 ot colorado made rcfb,['rcfb'],"['arizona', 'territorialcup']",think agree hit hunter dirty af
16qadvo,k1ys20i,deal historically mediocre program,wondering always purdue fan hope could start build momentum last couple years nope back square one ryan walters deal fan mediocre program got people around ohio alabamamichigan etc fans,"['purdue', 'easttennesseestate']","['arizona', 'territorialcup']",hopium summer copium fall shootyhoops weather gets nice
16qadvo,k1ysfse,deal historically mediocre program,wondering always purdue fan hope could start build momentum last couple years nope back square one ryan walters deal fan mediocre program got people around ohio alabamamichigan etc fans,"['purdue', 'easttennesseestate']","['arizona', 'territorialcup']",cant complain affordable ticket prices compared longhorn family members pay
16qzss2,k21jmjy,complain team,vent friendly place,['rcfb'],"['arizona', 'territorialcup']",jdl run town rape stuff came lost us msu hadnt sprained ankle last night would lost us stanford maldonado start next week jedd lasso going questions answer
16npqej,k1g5815,week 4 matchup preview 20 colorado buffaloes 10 ducks,20 10 oregonforegon saturday september 23 0330 eastern autzen eugene watch abclabc odds oregonforegon 210 pts total points 705 alltime series oregonforegon oregonforegon met 24 times since 10151949 teams last met 319 days ago 11052022 series wins 9015 oregonforegon longest streak continuous meetings 6 20112016 oregonforegon last 3 meetings 20192022 series last 5 meetings co1049 or2952 or345 or4138 co2441 series comparison data via week 3 3000result 1tcuftcu 2110w 4542portland 1200w 817 1201w 3614texas techftexastech 1200w 3830 3colorado 0200w 1300w 5510 rankings reflect current rcfb injury report data scraped 20230920 100014 alton mccaskill ivrbques sat kneemon sep 18mccaskill sat previous three games recovering acl tear availability saturday known javon antoniowrques sat shouldermon sep 18antonio sat last two contests shoulder injury unclear lace saturday myles slushersques sat undisclosedmon sep 18slusher missed last two matches undefined injury yet determined face saturday louis passarelloteout indefinitely kneethu aug 17passarello sidelined knee injury timetable return yet established van wellscques sat legmon sep 18wells sat previous contest leg injury status saturdays battle versus known travis huntercbmid oct undisclosedmon sep 18hunter idle unspecified injury expected remain shut sometime october earliest cormani mcclaincbques sat undisclosedmon sep 18mcclain held last three games unspecified ailment remains seen take saturdays matchup injury data lifted oregonforegon injury report data scraped 20230920 100014 josh delgadowrques sat undisclosedmon sep 18delgado missed last three contests unknown injury unknown play colorado saturday injury data lifted keys think wins think favorite cover spread players interested watch lets talk vote matchup win poll simply include name team think win enclosed part top level comment discussing matchup change vote edit initial comment bracket team change vote often like posted full listing accepted fbs team aliases found fcs teams need use full name appears post title listing links live vote totals matchup preview threads current week found like format generate matchup discussion matchup discussion please dm udupreesdiamond regarding template,"['oregonstate', 'summertimelover']","['arizona', 'territorialcup']",better team ive got sneaking suspicion magic isnt quite yet colorado
17adji1,k5cssof,fit schools fanbase stereotypes,involved greek life never done cocaine religious im certainly minority among tcu alumsfans fan doesnt golf fan doesnt love world war ii history duke fan doesnt care basketball stanford fan bad math wisconsin fan doesnt drink alcohol,['tcu'],"['arizona', 'territorialcup']",three stereotypes 1 care basketball ignore sports fact senior year actually prize zonazoo attending mbbwbb volleyball gymnastics baseball softball take arizona sports seriously 2 party hard kind didnt party much school still dont far social life school 3 devote 90 existence hating asu fuck yes fuck asu
1785w9p,k50s6mp,postgame notre dame defeats usc 4820,box score provided team 1 2 3 4 uscfusc337720 notre made rcfb,['rcfb'],"['arizona', 'territorialcup']",genuinely hate seeing notre dame win good god almighty satisfying see uc riley shit bed
177ix9d,k4t7olo,postgame stanford defeats colorado 4643 2ot,box score provided team 1 2 3 4 ot made rcfb,['rcfb'],"['arizona', 'territorialcup']",apology poor english colorado buffalo dies
177ix9d,k4t81e8,postgame stanford defeats colorado 4643 2ot,box score provided team 1 2 3 4 ot made rcfb,['rcfb'],"['arizona', 'territorialcup']",huh well pretty unexpected wish watched one
177ix9d,k4tbcor,postgame stanford defeats colorado 4643 2ot,box score provided team 1 2 3 4 ot made rcfb,['rcfb'],"['arizona', 'territorialcup']",alright missed unfortunately watched almost hours worth highlights youtube first dont dislike deion think overall hes great hire colorado great character seeing wheels come real time coach things like heard preseason deion getting mad everyone got involved fight whatever pay shit goes sideways pass fourth quarter far side stanford player broke coverage safety think got caught chewing corner think directional mic colorado still 10 point blame already played secondly colorado relying travis hunter much forget recruit replacement wr montana lemonious craig watch sped highlights mode glaringly obvious doesnt legs go 4 quarters production falls cliff
18akxkb,kc08c89,star qb dillon gabriel enter transfer portal,,['lsu'],"['arizona', 'territorialcup']",go right fsu maybe playoff
188vvkf,kbnah4d,postgame washington defeats 3431,box score provided team 1 2 3 4 made rcfb,['rcfb'],"['arizona', 'territorialcup']",fans lot talking prediction
173vhag,k46wev5,tank job week week six,tank job week award fbs team best job humiliating weekend whether blew large lead choked away spot limelight lost absolutely right losing completely screwed everything last second blunder tjotw winner sets gold standard college misery x200b previous winners 1 baylor bears lost 4231 2 nevada wolf pack lost idaho 336 3 cowboys lost south 337 4 minnesota golden gophers lost northwestern 3734 5 ucf knights lost baylor 3635 x200b last week thought going two horse race ucf tech knights hoo boy knights fact calling declare meltdown baylor ultimate tank job year done probably want take back x200b onto week yes still gonna vote yes theres nominees yes completely formality yes happened exactly 831 pacific saturday night kind moment tjotw normally dream fact could say knelt reverence gods hath delivered glorious bounty x200b note ease counting please use carats vote like miamifl thank thanks participating x200b honorable mentions saw usc everybody saw also jimbo fishers intestinal fortitude x200b nominees week 6 x200b arizona wildcats lost usc 4341 hate zona followed plucky finish washington even pluckier effort usc 170 guys steve kerr skipping press conference watch drink margaritas couldnt hang also shoulda gone two first overtime burned colorado burned x200b fresno bulldogs lost wyoming 2419 50 two power 5 scalps belt bulldogs rolled laramie clear frontrunner race coveted group five ny6 berth leave teeth broken limping back california last minute interception halted desperate comeback big boy bowl hopes dashed yet took major hit x200b miamifl hurricanes lost tech 2320 youve least heard canes didnt kneel fumbled gave winning touchdown two seconds left incredible might sound description doesnt even begin justice theres absolutely nothing type havent seen yet need probably need see many times mind youre going watching every college youtube compilation rest life moderation key x200b notre dame fighting irish lost louisville 3320 1713 cards entering fourth quarter notre dames fourth quarter drive chart turnover downs 35 first play interception fumble 26 gonna turnover downs anyways touchdown recovered onside kick ending interception considering offensive meltdown absolute gifts position handed louisville miracle cards got 16 points x200b rice owls lost connecticut 3831 owls 10 point home faves winless huskies outgained uconn 160 yards one two three turnovers put owls 2814 claw back 3128 huskies ripped 59 yard td attempted rice counter resulted turnover 4 rice manage goal pull one score onside kick recovered huskies walk houston first win year x200b san jose spartans lost boise 3527 277 one point smurf voodoo kicked broncos rallied 28 straight could kickstarted sjsus floundering season probably beginning end bowl hopes x200b ucf knights lost kansas 5122 one overused terms sports boatraced people dont use correctly proper boatracing team racing insurmountable lead even though team gets going theres hope possibly catch since actual boat racing lose lane need make pass said ucf got boatraced jayhawks maybe busraced whatever fact end baylor first 31 minutes kansas knights outscored 670 yeesh,"['washington', 'centralwashington']","['arizona', 'territorialcup']",mean tank job also 22 point underdogs hard give us one play going differently would put sc list miamifl
17d9q9a,k5wbqsr,houston 400,location houstonfhouston tdecu time 400 watch tv foxlfox rcfb made rcfb please keep trash talk civil report comments violate lets talk,['rcfb'],"['arizonastate', 'territorialcup']",damn gotta hand ncaa inclusive add blind refs product
18uo86j,kfm1zle,orange bowl florida 400,florida location hard rock time 400 watch tv espnlespn espnlespn odds spread uga 20 overunder 455 rcfb made rcfb please keep trash talk civil report comments violate lets talk,['rcfb'],"['arizonastate', 'territorialcup']",tell fsu belongs playoff committee espn vindicated
18uo86j,kfm42bk,orange bowl florida 400,florida location hard rock time 400 watch tv espnlespn espnlespn odds spread uga 20 overunder 455 rcfb made rcfb please keep trash talk civil report comments violate lets talk,['rcfb'],"['arizonastate', 'territorialcup']",wow players like uga well sitting doesnt matter thought fsu hanging banner
18uo86j,kfmknab,orange bowl florida 400,florida location hard rock time 400 watch tv espnlespn espnlespn odds spread uga 20 overunder 455 rcfb made rcfb please keep trash talk civil report comments violate lets talk,['rcfb'],"['arizona', 'territorialcup']",annoying account know twitter going day
15q1cwp,jw11j6v,teams worst season personally lived,im fairly lucky 22 didnt live 1990s however gene chiziks 2 year tenure 200708 comes mind chizik pretty universally hated fans rarely ever happens bad years usually bright spots paul rhoads didnt produce results would usually get one upset win year dan mccarney seneca wallace years got us bowl win first time almost 30 years gene chizik years pure despair 2008 first two games south dakota kent losing final 10 games finish season 210 among 119 division fbs teams team ranked 111th total defense 115th passing defense 95th rushing defense following 2008 season chizik fired two assistant coaches demoted offensive defensive coordinators left auburn immediately national championship,"['iowastate', 'summertimelover']","['arizona', 'territorialcup']",went school mackovic sat 2020 2021 seasons
168bu91,jyumehf,postgame colorado defeats tcu 4542,box score provided team 1 2 3 4 made rcfb,"['texasam', 'ucla']","['arizonastate', 'territorialcup']",maybe year tops 2007 terms chaos says man 16th year row
168bu91,jyw2r6f,postgame colorado defeats tcu 4542,box score provided team 1 2 3 4 made rcfb,"['texasam', 'ucla']","['arizona', 'territorialcup']",man postgame temper tantrum sure mature christ thin skin
16e7uxq,jzup2zj,utah baylor 1200,utahfutahutah location baylorfbaylor mclane time 1200 watch tv espnlespn rcfb made rcfb please keep trash talk civil report comments violate lets talk,['rcfb'],"['arizonastate', 'territorialcup']",utah overrated program cant wait see drop top 25 pathetic display regardless w l
15rxzeo,jwbp6sx,whats goto name referring favorite school conversation,go abbreviation mascot full name maybe something else keep simple wvu curious fanbases say,"['westvirginia2', 'hateful8']","['arizona', 'territorialcup']",uofa arizona somehow still gets follow
18w6kt1,kfwcayh,rose bowl 500,location rose bowl time 500 watch tv espnlespn odds spread mich 2 overunder 455 rcfb made rcfb please keep trash talk civil report comments violate lets talk,['rcfb'],"['arizonastate', 'territorialcup']",went tompkins high milroe always good quiet kid growing one incident thats pretty well known stray cat baby oil cool see balling big stage
18w6kt1,kfwcnqq,rose bowl 500,location rose bowl time 500 watch tv espnlespn odds spread mich 2 overunder 455 rcfb made rcfb please keep trash talk civil report comments violate lets talk,['rcfb'],"['arizonastate', 'territorialcup']",went tompkins high milroe always weird nice kid growing one incident thats pretty well known stray cat lubed baby oil cool see balling big stage
18w6kt1,kfwczeu,rose bowl 500,location rose bowl time 500 watch tv espnlespn odds spread mich 2 overunder 455 rcfb made rcfb please keep trash talk civil report comments violate lets talk,['rcfb'],"['arizonastate', 'territorialcup']",live town jj mccarthys parents illinois parents mom especially pretty prominent swingers community surprised reporters dont look tbh
18w6kt1,kfwdgo7,rose bowl 500,location rose bowl time 500 watch tv espnlespn odds spread mich 2 overunder 455 rcfb made rcfb please keep trash talk civil report comments violate lets talk,['rcfb'],"['arizonastate', 'territorialcup']",fsu would looking like nipton caesars legion took rn playing
16ko1lm,k0xgm6l,fresno arizona 1030,fresno arizona location arizona mountain america time 1030 watch tv fox sports 1lfs1 odds spread fres 3 overunder 515 rcfb made rcfb please keep trash talk civil report comments violate lets talk,['rcfb'],"['arizonastate', 'territorialcup']",ncaa accept bowl ban still return good grief
172s434,k3yhm6p,postgame usc defeats arizona 4341 3ot,box score provided team 1 2 3 4 ot made rcfb,['rcfb'],"['arizona', 'territorialcup']",playcalling cost us huge end regulation ot penalties ass pretty much obviously us damn one stings btfd
172s434,k3yi64u,postgame usc defeats arizona 4341 3ot,box score provided team 1 2 3 4 ot made rcfb,['rcfb'],"['arizona', 'territorialcup']",emotional rollercoaster loved hated every second weve lost two top 10 teams backtoback weeks combined 9 points im sick moral victories weve gotta win one eventuallyright
17szvco,k8tpnfb,arizona colorado 200,location folsom time 200 watch tv pac12 networklp12n odds spread ariz 10 overunder 555 rcfb made rcfb please keep trash talk civil report comments violate lets talk,['rcfb'],"['arizona', 'territorialcup']",open tackle cant remember last time decent tackling like
17szvco,k8ttt0v,arizona colorado 200,location folsom time 200 watch tv pac12 networklp12n odds spread ariz 10 overunder 555 rcfb made rcfb please keep trash talk civil report comments violate lets talk,['rcfb'],"['arizona', 'territorialcup']",get elevation passes arent even close
17szvco,k8ulnef,arizona colorado 200,location folsom time 200 watch tv pac12 networklp12n odds spread ariz 10 overunder 555 rcfb made rcfb please keep trash talk civil report comments violate lets talk,['rcfb'],"['arizona', 'territorialcup']",well sadly see deion colorado big 12
171e59y,k3qafpb,since im sucker nostalgia schools team played,nebraska 1st place long time year kstate take 1 currently 1a 1b nebraska kstate 106 meetings 2 mizzou 104 meetings 3 kansas 102 meetings 4 89 meetings 5 70 meetings 6 colorado 65 meetings 7 58 meetings,"['iowastate', 'big8']","['arizona', 'territorialcup']",top 3 make sense us since started border conference wac asu 96 new mexico 67 utep 53 surprisingly utah 47 forgot wac us followed pac schools
16ql0u1,k1xygic,usc arizona 1030,uscfuscusc arizona location arizona mountain america time 1030 watch tv foxlfox odds spread usc 34 overunder 615 rcfb made rcfb please keep trash talk civil report comments violate lets talk,['rcfb'],"['arizonastate', 'territorialcup']",second tiny sparkle hope would one weirdass asu upsets oh well
16ql0u1,k1yc57y,usc arizona 1030,uscfuscusc arizona location arizona mountain america time 1030 watch tv foxlfox odds spread usc 34 overunder 615 rcfb made rcfb please keep trash talk civil report comments violate lets talk,['rcfb'],"['arizonastate', 'territorialcup']",score williams good touchdown good
16ql0u1,k1yenyx,usc arizona 1030,uscfuscusc arizona location arizona mountain america time 1030 watch tv foxlfox odds spread usc 34 overunder 615 rcfb made rcfb please keep trash talk civil report comments violate lets talk,['rcfb'],"['arizonastate', 'territorialcup']",im stands legit worried saw williams collapse found replay couldnt see nut shot lol
16ql0u1,k1yhdmq,usc arizona 1030,uscfuscusc arizona location arizona mountain america time 1030 watch tv foxlfox odds spread usc 34 overunder 615 rcfb made rcfb please keep trash talk civil report comments violate lets talk,['rcfb'],"['arizona', 'territorialcup']",usc skill position players enter mach 3 collide defenders
16ql0u1,k1yhwoz,usc arizona 1030,uscfuscusc arizona location arizona mountain america time 1030 watch tv foxlfox odds spread usc 34 overunder 615 rcfb made rcfb please keep trash talk civil report comments violate lets talk,['rcfb'],"['arizona', 'territorialcup']",naive caleb usc team replace average qb enough pieces support
16ql0u1,k1yi4cv,usc arizona 1030,uscfuscusc arizona location arizona mountain america time 1030 watch tv foxlfox odds spread usc 34 overunder 615 rcfb made rcfb please keep trash talk civil report comments violate lets talk,['rcfb'],"['arizona', 'territorialcup']",name actually pronounced skateeboo bo without elongated end
17nq022,k7tlmat,arizona utah 200,arizona utahfutahutah location utahfutah riceeccles time 200 watch tv pac12 networklp12n rcfb made rcfb please keep trash talk civil report comments violate lets talk,['rcfb'],"['arizona', 'territorialcup']",conover typically play see graphic said hes typically qb 3 year old running interference
17ifk69,k6v28gh,kansas 1200,location kansasfkansas david booth kansas memorial time 1200 watch tv foxlfox rcfb made rcfb please keep trash talk civil report comments violate lets talk,['rcfb'],"['arizona', 'territorialcup']",either big brained shit ive ever seen hes actually idiot
169aftq,jz0qjar,florida lsu 730,florida lsuflsulsu location camping world time 730 watch tv abclabc odds spread lsu 25 overunder 580 rcfb made rcfb please keep trash talk civil report comments violate lets talk,['rcfb'],"['arizonastate', 'territorialcup']",like watching ex sex new boyfriend front millions
169aftq,jz1f08z,florida lsu 730,florida lsuflsulsu location camping world time 730 watch tv abclabc odds spread lsu 25 overunder 580 rcfb made rcfb please keep trash talk civil report comments violate lets talk,['rcfb'],"['arizonastate', 'territorialcup']",cousin enrolled im thinking officially making lsu secondary rooting interest ive always kinda liked actual connection figured also jayden daniels moment
1638uhj,jy1m9hz,colorado good scale 15,1 absolute garbage 2 win maybe two games lackluster performance 3 win games mediocre best 4 win 5 6 games better anticipated 5 actually really good shocking cfb world answer opinion comments,"['oregon', 'georgefox']","['arizona', 'territorialcup']",impossible say really force guess would say 2 heres similar rebuild coach really good recruiting prima donna brought multiple good recruits good transfers still taken couple years coach isnt actively encouraging bad sportsmanship things go south colorado theyre going go south hard yeah could shock world think predicting 34 wins realistic
16eokoj,jzwm4j2,postgame defeats 3424,box score provided team 1 2 3 4 made rcfb,['rcfb'],"['arizona', 'territorialcup']",isnt sec school yet therefore counts sec school losing ooc therefore victory america
1836rhr,kan5udo,830,location oregonforegon autzen time 830 watch tv foxlfox rcfb made rcfb please keep trash talk civil report comments violate lets talk,['rcfb'],"['arizona', 'territorialcup']",guys end come beavs
1836rhr,kana7ay,830,location oregonforegon autzen time 830 watch tv foxlfox rcfb made rcfb please keep trash talk civil report comments violate lets talk,['rcfb'],"['arizona', 'territorialcup']",announcers couldnt gobble duck dick tried
17df8ox,k5watla,postgame minnesota defeats 1210,box score provided team 1 2 3 4 iowafiowa370010 made rcfb,['rcfb'],"['arizona', 'territorialcup']",didnt think could entertained neither team could hit 13
1735e54,k43gn4h,ap poll 1082023,nan,"['minnesota', 'delaware']","['arizona', 'territorialcup']",weve played 2 top ten teams within score one road didnt receive single vote washington coming pullman angry
16f0i4a,jzypnzt,time move saban,saban great coach gave bama great run seems past prime program falling apart 2 straight mediocre seasons looks disaster seasons think time part ways hire new coach,['alabama'],"['arizona', 'territorialcup']",conclusion deserve true mediocre season hope leaves goes auburn dont know mediocre season pal
15gi1h4,jujzsuu,anyone happy,fans perspective anyone happy cfb direction going general reading community would say one happy maybe im wrong could fans something ncaa power anymore politicians interested reelection power lies conferences beholden collective universities fans routinely cause change university level different measures end coaches ads getting fired know kumbaya pie sky feels like fans dont anything complicit death want cfb,"['kentucky', 'chaos']","['arizona', 'territorialcup']",fun center college first last time past days buuuuuut overall hate heading
1625rls,jxvwgeg,utep jacksonville 530,utepfuteputep jacksonville location jacksonville burgesssnow time 530 watch tv cbs sports networklcbssn odds spread utep 2 overunder 540 rcfb made rcfb please keep trash talk civil report comments violate lets talk,"['georgia', 'georgiastate']","['arizonastate', 'territorialcup']",rich rod sweaty like get hot youve coached az youre sweating like sean miller
16g9ukn,k07eei9,trivial cfb things drive nuts,puzzled inconsequential things guess charming distinctive also mildly irritating bugaboos 1 university colorado use cu abbreviation shouldnt uc 2 miami fl put u helmet rather mean schools universities right 3 uclas logo first letter capitalized 4 lsu always rocking boat weird goalposts always wears white home numbers 5yard increments instead 10 5 florida typographical freeforall script helmet block lettering jersey nascar fast talics end zone 6 reserve final annoyance alma mater unpopular opinion get rid green bays g sufficient history tradition warrant unique logo know borrows logos others pop warner teams,"['georgia', 'wku']","['arizona', 'territorialcup']",teams wearing many alternates colors arent school colors get wear green yellow white gives 27 different combinations thats almost enough two full seasons postseasons also pick one shade green stick
16npqrq,k1g52j8,week 4 matchup preview pac2 championship 14 beavers 21 washington cougars,14 21 washington saturday september 23 0700 eastern martin pullman watch foxlfox odds 30 pts total points 575 alltime series washington washington met 107 times since 11111903 teams last met 340 days ago 10152022 series wins 48356 washington longest streak continuous meetings 42 19451986 recent meeting 2022 series last 5 meetings or2410 washington wa2431 washington or2838 washington wa5354 washington or3756 series comparison data via week 3 weekoregon 3000result 1san jose 1300w 4217colorado 0200w 5024 2uc davisfucdavis 2100w 2100w 3122 3san diego 2200w 269northern 0300w 6421 rankings reflect current rcfb injury report data scraped 20230920 100014 jesiah irishwrques sat undisclosedmon sep 18irish absent previous matchup unknown ailment remains seen face washington saturday tastean reddickswrques sat undisclosedmon sep 18reddicks missed last three contests due injury unlisted location leaving availability saturday washington air injury data lifted washington injury report data scraped 20230920 100014 lawrence falateadeout season kneemon aug 21falatea suffered torn acl miss entire 2023 season quinn roffdeout indefinitely armwed sep 13roff idle due arm injury unclear long debilitated leyton smithsonwrques sat undisclosedmon sep 18smithson sat past three games due unknown ailment status tilt saturday clouded injury data lifted keys think wins think favorite cover spread players interested watch lets talk vote matchup win poll simply include name team think win enclosed part top level comment discussing matchup change vote edit initial comment bracket team change vote often like posted full listing accepted fbs team aliases found fcs teams need use full name appears post title listing links live vote totals matchup preview threads current week found like format generate matchup discussion matchup discussion please dm udupreesdiamond regarding template,"['oregonstate', 'summertimelover']","['arizona', 'territorialcup']",feels like osu complete team
16z2cw9,k3ctltm,people 12 team playoff,maybe im biased penn fan whose team would made 59 12 team playoffs far existed great way let teams get redeeming shot one two closequality losses youre best 4 teams still get bye road 4 team nfl less fun playoffs college basketball absolutely sport dont see downsides gives clear path 8 good compete still lets top 4 teams better chance getting championship,"['maryland', 'pennstate']","['arizona', 'territorialcup']",theyre fans blue bloods dont want chances lose sec fans way theyd prevent nonsec schools qualified
