post_id,comment_id,post_title,post_selftext,post_author_flairs,comment_author_flairs,comment_body
17iov6h,k6wl9wi,ohio wisconsin 730,ohio location camp randall time 730 watch tv nbclnbc rcfb made rcfb please keep trash talk civil report comments violate lets talk,['rcfb'],"['wisconsin', 'uic']",meltdown destined happen story old time
17iov6h,k6wliht,ohio wisconsin 730,ohio location camp randall time 730 watch tv nbclnbc rcfb made rcfb please keep trash talk civil report comments violate lets talk,['rcfb'],"['wisconsin', 'uic']",man hate ohio man always number
16ql0u1,k1ye40g,usc arizona 1030,uscfuscusc arizona location arizona mountain america time 1030 watch tv foxlfox odds spread usc 34 overunder 615 rcfb made rcfb please keep trash talk civil report comments violate lets talk,['rcfb'],"['uic', 'oklahoma']",imagine seeing lincoln rileys run thinking hes good hire looks familiar wait yall play team talent
16eokoj,jzwljb8,postgame defeats 3424,box score provided team 1 2 3 4 made rcfb,['rcfb'],"['uic', 'oklahoma']",guys im sure ou ut going make sec
17t6f94,k8vt1oj,west virginia 700,west virginia location memorial norman ok time 700 watch tv foxlfox odds spread ou 125 overunder 585 rcfb made rcfb please keep trash talk civil report comments violate lets talk,['rcfb'],"['uic', 'oklahoma']",seems sorta classless second string yet going fourth
17glplv,k6hp5hc,walker via footballscoop michigans cheating top helped teams cheat might dirtiest team college history,,"['ohiostate2', 'ncaa']","['wisconsin', 'uic']",ohio fans pushing stupid fucking scandal im getting sick
17sxef4,k8txfzm,penn 1200,penn location penn statefpennstate beaver time 1200 watch tv foxlfox rcfb made rcfb please keep trash talk civil report comments violate lets talk,['rcfb'],"['uic', 'oklahoma']",figured punishment franklin hc ferentz oc grinch dc
16knfug,k0xxc8r,colorado colorado 1000,colorado location folsom time 1000 watch tv espnlespn rcfb made rcfb please keep trash talk civil report comments violate lets talk,['rcfb'],"['uic', 'oklahoma']",amazing much impact travis hunter team
189go15,kbrusks,800,iowafiowaiowa location lucas oil time 800 watch tv foxlfox odds spread mich 22 overunder 345 rcfb made rcfb please keep trash talk civil report comments violate lets talk,['rcfb'],"['uic', 'oklahoma']",isnt fumble turnover based previous calls
17d4h7c,k5uojic,ucf 1200,ucffucfucf location memorial norman ok time 1200 watch tv abclabc rcfb made rcfb please keep trash talk civil report comments violate lets talk,['rcfb'],"['uic', 'oklahoma']",wonder ea sports going bake media time outs ncaa 24
17d4h7c,k5v61sc,ucf 1200,ucffucfucf location memorial norman ok time 1200 watch tv abclabc rcfb made rcfb please keep trash talk civil report comments violate lets talk,['rcfb'],"['uic', 'oklahoma']",maybe shouldnt tried cute stuff first couple drives set us wrong path early never recovered
17nrxh5,k7uqz47,330,location boone pickens time 330 watch tv abclabc rcfb made rcfb please keep trash talk civil report comments violate lets talk,['rcfb'],"['uic', 'oklahoma']",im hearing boomer sooner nearly enough get pride
17nrxh5,k7url06,330,location boone pickens time 330 watch tv abclabc rcfb made rcfb please keep trash talk civil report comments violate lets talk,['rcfb'],"['uic', 'oklahoma']",congrats stillwater getting twentieth win 118 rivalry
1684osx,jyult9e,colorado tcu 1200,tcuftcutcu location tcuftcu amon g carter time 1200 watch tv foxlfox odds spread tcu 205 overunder 645 rcfb made rcfb please keep trash talk civil report comments violate lets talk,"['texasam', 'ucla']","['uic', 'oklahoma']",least nebraska isnt going one possession loss next week
15i50ve,just1gu,washington join big ten leave pac12,nan,['georgia2'],"['wisconsin', 'uic']",usc ucla uw wherever fuck
172jjmy,k3xzmv7,tech miami 800,tech location miamifmiami hard rock time 800 watch tv acc networklaccn rcfb made rcfb please keep trash talk civil report comments violate lets talk,['rcfb'],"['uic', 'oklahoma']",leave someone tarmac home
16ddi8y,jzs5hnd,whats weirdest crowd atmosphere youve ever,2017 stanford beat biblical proportions cardinal ducks biggest cheer home crowd fucking rabbit took ran around 20 minutes bryce love ran 147 yards 2 scores stanford crowd barely made peep rabbit comes 30 everyone goes wild,"['michigan2', 'bowlinggreen']","['uic', 'oklahoma']",high school played away september 13 2001 remarkably large turnout short period normalcy surreal period
15jaosk,juzmwzf,fans actually excited joining big 12,know watching conference blow suckswe big 12 fans almost went thing seems like many yall view big 12 beneath youthe least worst option fresh youre angry pac 12 leadershipthe situation truly attitude expect yall going forward really happy soon done dealing arrogance ut fans im starting worry went frying pan fire bringing yall far entitled negative nancies around go,[],"['wisconsin', 'uic']",truly think anyone happy moves fucking cowards
16w91ub,k2wk3hl,usc colorado 1200,uscfuscusc location folsom time 1200 watch tv foxlfox rcfb made rcfb please keep trash talk civil report comments violate lets talk,['rcfb'],"['uic', 'oklahoma']",imagine covering spread horrific offensive play calling
16w91ub,k2wkkzc,usc colorado 1200,uscfuscusc location folsom time 1200 watch tv foxlfox rcfb made rcfb please keep trash talk civil report comments violate lets talk,['rcfb'],"['uic', 'oklahoma']",guys dont know usc going make b1g
16q6opo,k1vghf7,cincinnati 1200,location nippert time 1200 watch tv rcfb made rcfb please keep trash talk civil report comments violate lets talk,['rcfb'],"['uic', 'oklahoma']",like fumble bad call pissed offense
16q6opo,k1w16l0,cincinnati 1200,location nippert time 1200 watch tv rcfb made rcfb please keep trash talk civil report comments violate lets talk,['rcfb'],"['uic', 'oklahoma']",go back clowning cincys db flexing giving first
171qilp,k3t32rb,nebraska illinois 800,location memorial champaign il time 800 watch tv fox sports 1lfs1 rcfb made rcfb please keep trash talk civil report comments violate lets talk,['rcfb'],"['uic', 'oklahoma']",first flair day uiuc loses good day america second flair day nebraska loses good day america
17nng89,k7ttvoy,wisconsin indiana 1200,location indianafindiana memorial bloomington time 1200 watch tv big ten networklbtn rcfb made rcfb please keep trash talk civil report comments violate lets talk,['rcfb'],"['wisconsin', 'uic']",locke sucks man know hes young moment doesnt
16zrwgs,k3ggjqt,week 6 matchup preview red river shootout 10 sooners 1 longhorns,10 1 texasftexas saturday october 7 1200 eastern cotton bowl dallas watch abclabc odds texasftexas 65 pts total points 600 alltime series red river shootout texasftexas texasftexas met 118 times since 10101900 teams last met 361 days ago 10082022 series wins 50563 texasftexas longest streak continuous meetings 94 19292022 texasftexas recent meeting 2022 series last 5 meetings tx049 tx5548 tx5345 tx3427 tx3927big 12 championship series comparison data via week 5 5020result 1arkansas 3210w 730ricefrice 3211w 3710 2smufsmu 3210w 4120w 3424 3tulsaftulsa 3210w 4110w 3110 2302w 2311w 386 5iowa statefiowastate 2311w 4111w 4014 rankings reflect current rcfb injury report data scraped 20231004 100011 dj graham iiwrout indefinitely undisclosedtue sep 5graham idle surgery repair unknown issue air return lineup phil picciottilbout season undisclosedwed sep 20picciotti sit rest 2023 season unspecified ailment jayden rowedbout season undisclosedwed sep 20rowe miss remainder season unknown injury kaden helmsteout indefinitely kneemon oct 2helms miss extended period recovering meniscus surgery davis bevilleqbques sat kneemon oct 2beville held previous four games mcl injury uncertain whether take saturday versus kade mcintyreteques sat undisclosedmon oct 2mcintyre absent past four matches uncertain ailment air face saturdays tilt justin harringtondbout season kneetue oct 3harrington shut remainder 2023 season acl injury injury data lifted texasftexas injury report data scraped 20231004 100011 kristopher rossdllate oct undisclosedwed sep 20ross expected miss three four weeks unspecified injury ryan wattsdbques sat lower bodytue oct 3watts removed previous lowerbody issue unclear suit saturday versus ja tavion sandersteques sat undisclosedmon oct 2sanders exited last unspecified injury unknown take saturdays tilt cole hutsonollate oct kneetue oct 3hutson sidelined knee injury projected miss three four weeks injury data lifted keys think wins think favorite cover spread players interested watch lets talk vote matchup win poll simply include name team think win enclosed part top level comment discussing matchup change vote edit initial comment bracket team change vote often like posted full listing accepted fbs team aliases found fcs teams need use full name appears post title listing links live vote totals matchup preview threads current week found like format generate matchup discussion matchup discussion please dm udupreesdiamond regarding template,"['georgia3', 'northgeorgia']","['uic', 'oklahoma']",couple possessions feels closer stat sheet
17d4h6j,k5uug8i,penn ohio 1200,penn ohio location ohio statefohiostate ohio time 1200 watch tv foxlfox rcfb made rcfb please keep trash talk civil report comments violate lets talk,['rcfb'],"['wisconsin', 'uic']",bullshit holding call ive seen literally got stripped play
17d4h6j,k5uy92n,penn ohio 1200,penn ohio location ohio statefohiostate ohio time 1200 watch tv foxlfox rcfb made rcfb please keep trash talk civil report comments violate lets talk,['rcfb'],"['wisconsin', 'uic']",type moves make think ryan day canned point
1728eb3,k3w5ff3,1200,location cotton bowl time 1200 watch tv abclabc rcfb made rcfb please keep trash talk civil report comments violate lets talk,['rcfb'],"['uic', 'oklahoma']",third fourth missed quick near side sideline
