post_id,comment_id,post_title,post_selftext,post_author_flairs,comment_author_flairs,comment_body
169aftq,jz1ft9l,florida lsu 730,florida lsuflsulsu location camping world time 730 watch tv abclabc odds spread lsu 25 overunder 580 rcfb made rcfb please keep trash talk civil report comments violate lets talk,['rcfb'],['uottawa'],5 day literally rest life
169aftq,jz1i257,florida lsu 730,florida lsuflsulsu location camping world time 730 watch tv abclabc odds spread lsu 25 overunder 580 rcfb made rcfb please keep trash talk civil report comments violate lets talk,['rcfb'],"['lsu2', 'uottawa']",remember time long ago defense one toughest feared entire country need 3 guys make easy tackles open space problem last year happened dbu
183mtar,kaq4ftb,ohio 1200,ohio location time 1200 watch tv foxlfox rcfb made rcfb please keep trash talk civil report comments violate lets talk,['rcfb'],"['michigan', 'uottawa']",literally every flair except osu flairs saying td stfu
166pzdt,jym5pmu,florida utah 800,utahfutahutah location utahfutah riceeccles time 800 watch tv espnlespn odds spread utah 65 overunder 455 rcfb made rcfb please keep trash talk civil report comments violate lets talk,"['medal', 'oklahomastate2']",['uottawa'],florida chewing unreasonable amount clock two scores terrible coaching performance
16e7v1g,jzuj8k1,nebraska colorado 1200,location folsom time 1200 watch tv foxlfox odds spread neb 95 overunder na rcfb made rcfb please keep trash talk civil report comments violate lets talk,"['nebraska2', 'santamonica']",['uottawa'],ref 1 gonna call running punter ref 2 nah coach prime cool call penalties
