post_id,comment_id,post_title,post_selftext,post_author_flairs,comment_author_flairs,comment_body
18wbuu4,kfxut15,sugar bowl washington 845,location caesars superdome time 845 watch tv espnlespn odds spread tex 35 overunder 625 rcfb made rcfb please keep trash talk civil report comments violate lets talk,['rcfb'],['waynestatemi'],penix going make carolina panthers happy two
18wbuu4,kfxwuvy,sugar bowl washington 845,location caesars superdome time 845 watch tv espnlespn odds spread tex 35 overunder 625 rcfb made rcfb please keep trash talk civil report comments violate lets talk,['rcfb'],"['michigan2', 'waynestatemi']",washington bby dont ghost houston
16ecz62,jzvbyxe,unlv 330,unlvfunlvunlv location time 330 watch tv cbslcbs rcfb made rcfb please keep trash talk civil report comments violate lets talk,"['michigan2', 'cfp']","['michigan', 'waynestatemi']",cant believe reliable jj roman wilson year felt like roman stone hands last year plus jj wasnt accurate beyond ten yards totally different story year
16ecz62,jzvl7d0,unlv 330,unlvfunlvunlv location time 330 watch tv cbslcbs rcfb made rcfb please keep trash talk civil report comments violate lets talk,"['michigan2', 'cfp']","['michigan', 'waynestatemi']",ryan day asks wife cut save new marmaduke strip every day
16ecz62,jzvm3jo,unlv 330,unlvfunlvunlv location time 330 watch tv cbslcbs rcfb made rcfb please keep trash talk civil report comments violate lets talk,"['michigan2', 'cfp']","['michigan', 'waynestatemi']",ryan day likes avoid shut doesnt want make team feel bad
16ecz62,jzvmhtb,unlv 330,unlvfunlvunlv location time 330 watch tv cbslcbs rcfb made rcfb please keep trash talk civil report comments violate lets talk,"['michigan2', 'cfp']","['michigan', 'waynestatemi']",ryan day considers weird crust mustard cap delicacy
16qzss2,k22hhnj,complain team,vent friendly place,['rcfb'],"['michiganstate', 'waynestatemi']",bad going 100 rebuild coaches players gonna rough rest season probably rough season next year
1728e91,k3v6tk6,maryland ohio 1200,ohio location ohio statefohiostate ohio time 1200 watch tv foxlfox rcfb made rcfb please keep trash talk civil report comments violate lets talk,['rcfb'],"['michigan', 'waynestatemi']",1st quarter maryland goes 014 tradition 2nd quarter maryland mounts comeback 1424 half 3rd quarter might get really close 2124 entire begins melting osu begins run away though making 3821 end 3rd 4th quarter osu wins 4524
1728e91,k3vgkrx,maryland ohio 1200,ohio location ohio statefohiostate ohio time 1200 watch tv foxlfox rcfb made rcfb please keep trash talk civil report comments violate lets talk,['rcfb'],"['michigan', 'waynestatemi']",maryland pounding osu run sentence never thought id write
1728e91,k3vm4mf,maryland ohio 1200,ohio location ohio statefohiostate ohio time 1200 watch tv foxlfox rcfb made rcfb please keep trash talk civil report comments violate lets talk,['rcfb'],"['ohiostate2', 'waynestatemi']",somebody tell stop dressing ohio halloween
15knp1o,jv6l5a1,rumor big ten likely move 10 conference schedule following recent expansion,nan,"['michigan3', 'tulane']","['michigan', 'waynestatemi']",see b1g 10 commissioner conference leadership absolutely huffing glue right going destroy teams abilities play ooc rivalry games iowaiowa uscnd washingtonwazzu many others b1g 10 teams run gauntlet 10 conference schedule possibility 11 games teams p4 ec sitting pretty 8 conference schedule automatically gives teams much easier road 12 team playoff would take 93 73 penn 102 71 lsu playoffs
15wqekf,jx4ybk2,top 5 popular college teams cityarea,1 north carolina 2 nc 3 appalachian 4 wake forest 5 duke x200b,"['floridastate', 'northcarolinaat']","['michigan', 'waynestatemi']",1 2 3 ohio 4 notre dame 5 national title last year
16qmian,k21bjm1,postgame penn defeats 310,box score provided team 1 2 3 4 iowafiowa00000 penn made rcfb,['rcfb'],"['michigan', 'waynestatemi']",definitely rock bottom ive seen anemic offense like towards end hoke era frustrating watch elite defense slowly break pressure offense lays egg inexcusable even unacceptable talent move ball thing notre dame 2014 final turning point needed fire everyone program
16jq8ru,k0rpb5f,virginia maryland 700,location secu time 700 watch tv fox sports 1lfs1 rcfb made rcfb please keep trash talk civil report comments violate lets talk,['rcfb'],"['michigan', 'waynestatemi']",step 1 go 14 step 2 chaos breaks loose step 3 either lose 50 win 20 maryland baby
17sdfue,k8p2vav,big ten conference announces violation sportsmanship policy university program,nan,"['ohiostate2', 'pennstate']","['michiganstate', 'waynestatemi']",wow thats cant imagine anyones happy guess means good compromise
17sdfue,k8p49z7,big ten conference announces violation sportsmanship policy university program,nan,"['ohiostate2', 'pennstate']","['michigan', 'waynestatemi']",pettiti fired releasing friday afternoon day inexcusable negligence wait 15 hours suspend head coach shouldve done monday taken effect penn
17nng69,k7tt98u,kansas 1200,kansas location texasftexas dkrtexas memorial time 1200 watch tv foxlfox odds spread tex 4 overunder 505 rcfb made rcfb please keep trash talk civil report comments violate lets talk,['rcfb'],"['paperbag', 'waynestatemi']",k scores blocks point scores goal overtime baby
15q1cwp,jw0qrnl,teams worst season personally lived,im fairly lucky 22 didnt live 1990s however gene chiziks 2 year tenure 200708 comes mind chizik pretty universally hated fans rarely ever happens bad years usually bright spots paul rhoads didnt produce results would usually get one upset win year dan mccarney seneca wallace years got us bowl win first time almost 30 years gene chizik years pure despair 2008 first two games south dakota kent losing final 10 games finish season 210 among 119 division fbs teams team ranked 111th total defense 115th passing defense 95th rushing defense following 2008 season chizik fired two assistant coaches demoted offensive defensive coordinators left auburn immediately national championship,"['iowastate', 'summertimelover']","['michigan', 'waynestatemi']",young remember much rich rod years know certain 2008 near top worst one actively saw 2014 went 57 including m00n 031 shutout notre dame 1235 loss msu ass whooping minnesota home inevitable loss osu lone bright moment season beating penn big house gardner put life line win
16apjlo,jzak1bt,realize magic ran,remember like yesterday first clemson 2015 wake forest way national championship enrolled clemson next year seeing us win two national championships 4 years life changing always thought life would like run denial 2021 season still 10 games think clemson fans knew coming worse national tv thing cfb world talking question knew program longer top anymore know clemson death thousand cuts last night really puts perspective,[],"['michigan', 'waynestatemi']",0 notre dame 31 2014 naive back legitimately believed brady hoke could turn around 2014 reelevate us back 2011 type season instead got shutout finished 57 everyone fired fell black hole 20152020
16keh7j,k0vyni9,south carolina 330,south carolina location georgiafgeorgia sanford time 330 watch tv cbslcbs rcfb made rcfb please keep trash talk civil report comments violate lets talk,['rcfb'],"['michigan', 'waynestatemi']",lions drunk kool aid right cant wait witness record setting disappointment
18w6kt1,kfw9yg0,rose bowl 500,location rose bowl time 500 watch tv espnlespn odds spread mich 2 overunder 455 rcfb made rcfb please keep trash talk civil report comments violate lets talk,['rcfb'],"['michigan2', 'waynestatemi']",obviously flag also dont like theyll probably get makeup call
18w6kt1,kfwahiy,rose bowl 500,location rose bowl time 500 watch tv espnlespn odds spread mich 2 overunder 455 rcfb made rcfb please keep trash talk civil report comments violate lets talk,['rcfb'],"['michigan', 'waynestatemi']",michigans entire sideline needs chew 44 dumb shit
18w6kt1,kfwdkbr,rose bowl 500,location rose bowl time 500 watch tv espnlespn odds spread mich 2 overunder 455 rcfb made rcfb please keep trash talk civil report comments violate lets talk,['rcfb'],"['michigan', 'waynestatemi']",cant let get way amazing commercials
18w6kt1,kfwnwqc,rose bowl 500,location rose bowl time 500 watch tv espnlespn odds spread mich 2 overunder 455 rcfb made rcfb please keep trash talk civil report comments violate lets talk,['rcfb'],"['michigan', 'waynestatemi']",bama running motion versuses passing players believe better discipline space athletes cover trying maintain presnap alignments
18w6kt1,kfwr7iw,rose bowl 500,location rose bowl time 500 watch tv espnlespn odds spread mich 2 overunder 455 rcfb made rcfb please keep trash talk civil report comments violate lets talk,['rcfb'],"['michigan', 'waynestatemi']",well happens offense cant catch fuckin ball defense gassed
18w6kt1,kfwrl1a,rose bowl 500,location rose bowl time 500 watch tv espnlespn odds spread mich 2 overunder 455 rcfb made rcfb please keep trash talk civil report comments violate lets talk,['rcfb'],"['michigan', 'waynestatemi']",always bridesmaid never bride life wolverine fan
1621ag8,jxvbja2,notre dame navy 230,notre dame navyfnavynavy location aviva time 230 watch tv nbclnbc odds spread nd 205 overunder 490 rcfb made rcfb please keep trash talk civil report comments violate lets talk,['usc'],"['michigan', 'waynestatemi']",sure would attempt fg 021 end 8 minute drive get need points way come back defense playing like go td score
1621ag8,jxvi564,notre dame navy 230,notre dame navyfnavynavy location aviva time 230 watch tv nbclnbc odds spread nd 205 overunder 490 rcfb made rcfb please keep trash talk civil report comments violate lets talk,['usc'],"['michigan', 'waynestatemi']",maybe navy made fg couldve made 283 let demon cage
17cih4k,k5qpdk3,mandel suspended connor stalions analyst named reports mastermind alleged signstealing scheme,,"['nebraska', 'northerniowa']","['michigan', 'waynestatemi']",chess move weekend else would sent penn ohio matchup weekend calls mastermind
17sd1ye,k8ozv5b,sources big ten expected discipline inperson scouting ongoing sign stealing investigation prohibit jim harbaugh sideline conclusion regular season allowed coach week,,"['georgia', 'cfp']","['michiganstate', 'waynestatemi']",gonna watching basement like stefansky browns covid
17sd1ye,k8p2fdf,sources big ten expected discipline inperson scouting ongoing sign stealing investigation prohibit jim harbaugh sideline conclusion regular season allowed coach week,,"['georgia', 'cfp']","['michigan', 'waynestatemi']",left b1g effective november 12th 2023 1200
17ifk69,k6va7wd,kansas 1200,location kansasfkansas david booth kansas memorial time 1200 watch tv foxlfox rcfb made rcfb please keep trash talk civil report comments violate lets talk,['rcfb'],"['michigan', 'waynestatemi']",thought second going bounce ku guy ou guy
169aftq,jz0u1cz,florida lsu 730,florida lsuflsulsu location camping world time 730 watch tv abclabc odds spread lsu 25 overunder 580 rcfb made rcfb please keep trash talk civil report comments violate lets talk,['rcfb'],"['michigan', 'waynestatemi']",7 plays move 5 yards couldnt sure thinking youre 06 thinking 7th play fix
169aftq,jz0wlx4,florida lsu 730,florida lsuflsulsu location camping world time 730 watch tv abclabc odds spread lsu 25 overunder 580 rcfb made rcfb please keep trash talk civil report comments violate lets talk,['rcfb'],"['michigan', 'waynestatemi']",add advertisements behind fg post
16eokoj,jzwn1rm,postgame defeats 3424,box score provided team 1 2 3 4 made rcfb,['rcfb'],"['michigan', 'waynestatemi']",notice teams good shifting quickly schools pay playersstrange disturbances force say
17nng42,k7sz1tg,ohio rutgers 1200,ohio location rutgersfrutgers shi time 1200 watch tv cbslcbs rcfb made rcfb please keep trash talk civil report comments violate lets talk,['rcfb'],"['michigan2', 'waynestatemi']",sec fans watching b1g games cbs laugh wonder cbs wanted television rights bad teams looked week week
17nng42,k7t5wa9,ohio rutgers 1200,ohio location rutgersfrutgers shi time 1200 watch tv cbslcbs rcfb made rcfb please keep trash talk civil report comments violate lets talk,['rcfb'],"['paperbag', 'waynestatemi']",dont start going 4th rutgers isnt going score today
17nng42,k7tbzo4,ohio rutgers 1200,ohio location rutgersfrutgers shi time 1200 watch tv cbslcbs rcfb made rcfb please keep trash talk civil report comments violate lets talk,['rcfb'],"['michigan2', 'waynestatemi']",glad see schiano turning things around rutgers good college
17nng42,k7tdbjt,ohio rutgers 1200,ohio location rutgersfrutgers shi time 1200 watch tv cbslcbs rcfb made rcfb please keep trash talk civil report comments violate lets talk,['rcfb'],"['michigan', 'waynestatemi']",definitely looks like number 1 team country
17nng42,k7tdw5q,ohio rutgers 1200,ohio location rutgersfrutgers shi time 1200 watch tv cbslcbs rcfb made rcfb please keep trash talk civil report comments violate lets talk,['rcfb'],"['michigan', 'waynestatemi']",rutgers left much board marvin harrison jr mhj things half end like wasnt even close
16qh8i7,k1xetp0,penn 730,iowafiowaiowa penn location penn statefpennstate beaver time 730 watch tv cbslcbs odds spread psu 105 overunder na rcfb made rcfb please keep trash talk civil report comments violate lets talk,['rcfb'],"['michigan', 'waynestatemi']",brian ferentz kill home seeing 1 yard gains phone ring brian ferentz kill
16qh8i7,k1xw403,penn 730,iowafiowaiowa penn location penn statefpennstate beaver time 730 watch tv cbslcbs odds spread psu 105 overunder na rcfb made rcfb please keep trash talk civil report comments violate lets talk,['rcfb'],"['michigan', 'waynestatemi']",91 28 plays 4300 1100 310 genuinely dont know one fields offense bad
16qh8i7,k1xwncx,penn 730,iowafiowaiowa penn location penn statefpennstate beaver time 730 watch tv cbslcbs odds spread psu 105 overunder na rcfb made rcfb please keep trash talk civil report comments violate lets talk,['rcfb'],"['michigan', 'waynestatemi']",negative yardage play got blown due bad oline blocking followed fumble absolute masterclass offense
17yelku,k9t7fim,minnesota ohio 400,ohio location ohio statefohiostate ohio time 400 watch tv big ten networklbtn odds spread osu 285 overunder 495 rcfb made rcfb please keep trash talk civil report comments violate lets talk,['rcfb'],"['ohiostate2', 'waynestatemi']",rally house damn thats gonna head
17yelku,k9tbfea,minnesota ohio 400,ohio location ohio statefohiostate ohio time 400 watch tv big ten networklbtn odds spread osu 285 overunder 495 rcfb made rcfb please keep trash talk civil report comments violate lets talk,['rcfb'],"['michigan2', 'waynestatemi']",im trying talk shit cant commercials pissing
182v9ux,kalaawk,nebraska 1200,iowafiowaiowa location memorial lincoln ne time 1200 watch tv cbslcbs rcfb made rcfb please keep trash talk civil report comments violate lets talk,['rcfb'],"['michigan', 'waynestatemi']",pac teams join b1g entire b1g west sent basement conference defenses wont able prey terrible offenses anymore head scratching bad every offense west
17b5b0w,k5hw4yy,new mexico utep 900,new mexico mexico utepfuteputep location utepfutep sun bowl time 900 watch tv espn2lespn2 rcfb made rcfb please keep trash talk civil report comments violate lets talk,['rcfb'],"['michiganstate', 'waynestatemi']",realized schools mascots pete pistol pete paydirt pete
17b5b0w,k5i4fz2,new mexico utep 900,new mexico mexico utepfuteputep location utepfutep sun bowl time 900 watch tv espn2lespn2 rcfb made rcfb please keep trash talk civil report comments violate lets talk,['rcfb'],"['michiganstate', 'waynestatemi']",hey sickos quick question hey anyone link ranking teams three divisions saw day earlier cant find
16zsk9o,k3iy9wc,schools considers team rival way around,talking onesided rivalries mean team thinks fullfledged rivalry team b doesnt care team slightest,['kansas'],"['michigan', 'waynestatemi']",rutgers fans happy 780 520 chris ash harbaugh didnt like eachother plus 2014 2020 games extremely close made slight rivalry however fans dont see rutgers rivalry occasionally michiganindiana heat fan bases teams remember 2018 indiana cheap shotted couple players got people hurt right osu people pissed weeks tom allen iu
177rgum,k4v9io8,rutgers 1200,location rutgersfrutgers shi time 1200 watch tv big ten networklbtn odds spread rutg 55 overunder 405 rcfb made rcfb please keep trash talk civil report comments violate lets talk,['rcfb'],"['michiganstate', 'waynestatemi']",legit thankful whichever alumni paid refs still suck bad though doesnt seem help much
1754xes,k4fgois,washington somehow hyped enough,cfb fans back east understand biggest history series dates 1900 430 first time teams ranked ap 10 victor arguably significant win fbs season far whats problem theres actual trophy generally accepted name applied contest,"['oregon', 'willamette']","['michiganstate', 'waynestatemi']",going channel actually watch thats stopped watching quite pac pac games year
17debjw,k5wh71g,730,location spartan time 730 watch tv nbclnbc rcfb made rcfb please keep trash talk civil report comments violate lets talk,['rcfb'],"['michigan', 'waynestatemi']",funny thing msu going sidelines play calls slowing things generally better tempo normally struggle
17debjw,k5whe9i,730,location spartan time 730 watch tv nbclnbc rcfb made rcfb please keep trash talk civil report comments violate lets talk,['rcfb'],"['michiganstate', 'waynestatemi']",truly worst msu team ive seen since john l smith era
17debjw,k5wk2s8,730,location spartan time 730 watch tv nbclnbc rcfb made rcfb please keep trash talk civil report comments violate lets talk,['rcfb'],"['michigan', 'waynestatemi']",wasnt false start 52 defense doesnt matter since got td immediately thought free play
17debjw,k5wl55e,730,location spartan time 730 watch tv nbclnbc rcfb made rcfb please keep trash talk civil report comments violate lets talk,['rcfb'],"['michigan', 'waynestatemi']",someone explain wasnt dpi sainristil
17debjw,k5wpzzv,730,location spartan time 730 watch tv nbclnbc rcfb made rcfb please keep trash talk civil report comments violate lets talk,['rcfb'],"['michigan', 'waynestatemi']",msu friend mine come playing tough fired maybe shot msu proceeds roll immediately go 021 sums far
17debjw,k5wsgnz,730,location spartan time 730 watch tv nbclnbc rcfb made rcfb please keep trash talk civil report comments violate lets talk,['rcfb'],"['michigan', 'waynestatemi']",ryan day laments unable find sitcom based geico cavemen syndication
17debjw,k5wxsv3,730,location spartan time 730 watch tv nbclnbc rcfb made rcfb please keep trash talk civil report comments violate lets talk,['rcfb'],"['michigan2', 'waynestatemi']",less ferret situation bug squishin
15z0t05,jxfd9gu,states flagship university race closest,occasionally concept flagship university comes always clear means usually university university probably public probably highest enrollment etc states pretty easy eg ohio university flagship ohio states flagship tag hardest apply clearly,"['ohio', 'ohiostate']","['michigan', 'waynestatemi']",think arizona arizona close indiana iu purdue probably prestigious ucla calagain spilting hairs probably admit students point
177wgao,k4wl51y,wisconsin 400,iowafiowaiowa location camp randall time 400 watch tv foxlfox odds spread wis 10 overunder 360 rcfb made rcfb please keep trash talk civil report comments violate lets talk,['rcfb'],"['michigan', 'waynestatemi']",kirk ferentz playing 4d chess win b1g west 1713 normal low scoring must safeties goals offense nepotism ends 156 reason
16q6owk,k1vazmb,rutgers 1200,location time 1200 watch tv rcfb made rcfb please keep trash talk civil report comments violate lets talk,['rcfb'],"['michigan', 'waynestatemi']",jj much fucking time start running stuck around guy damn heels
16q6owk,k1vrubd,rutgers 1200,location time 1200 watch tv rcfb made rcfb please keep trash talk civil report comments violate lets talk,['rcfb'],"['michigan', 'waynestatemi']",8 minute ground pound drives back menu boys
16q6owk,k1vw70n,rutgers 1200,location time 1200 watch tv rcfb made rcfb please keep trash talk civil report comments violate lets talk,['rcfb'],"['michigan', 'waynestatemi']",sure edwards last season
16q6owk,k1vwy5i,rutgers 1200,location time 1200 watch tv rcfb made rcfb please keep trash talk civil report comments violate lets talk,['rcfb'],"['michigan', 'waynestatemi']",dangerous throw could easily picked even slightly overthrown
16q6owk,k1vzkx9,rutgers 1200,location time 1200 watch tv rcfb made rcfb please keep trash talk civil report comments violate lets talk,['rcfb'],"['michigan', 'waynestatemi']",ryan day thinks lifebuoy nice piquant afterdinner taste
16q6owk,k1w0aqr,rutgers 1200,location time 1200 watch tv rcfb made rcfb please keep trash talk civil report comments violate lets talk,['rcfb'],"['michigan', 'waynestatemi']",ryan day suggests commercial breaks throughout
1896p8u,kbpkn83,1200,location att time 1200 watch tv abclabc odds spread tex 15 overunder 555 rcfb made rcfb please keep trash talk civil report comments violate lets talk,['rcfb'],"['michigan', 'waynestatemi']",feel like deacon hill going throw 300 yds 3 tds tonight
1896p8u,kbpq43l,1200,location att time 1200 watch tv abclabc odds spread tex 15 overunder 555 rcfb made rcfb please keep trash talk civil report comments violate lets talk,['rcfb'],"['michigan', 'waynestatemi']",deflate footballs come 2nd half wearing patriots uniforms
183xgmh,karov6o,postgame defeats auburn 2724,box score provided team 1 2 3 4 made rcfb,['rcfb'],"['michiganstate', 'waynestatemi']",auburn simply gave last plays sad ending really great watch
16wjz1a,k2ya9nr,notre dame duke 730,notre dame dukefdukeduke location dukefduke wallace wade time 730 watch tv abclabc rcfb made rcfb please keep trash talk civil report comments violate lets talk,['rcfb'],"['michigan', 'waynestatemi']",duke deciding play conservative cost fucking
16wjz1a,k2yb0i8,notre dame duke 730,notre dame dukefdukeduke location dukefduke wallace wade time 730 watch tv abclabc rcfb made rcfb please keep trash talk civil report comments violate lets talk,['rcfb'],"['michigan', 'waynestatemi']",fuckin hell dude everything could team win tonight coaches fuck hes injured
172iula,k3xc0vf,minnesota 730,location huntington bank time 730 watch tv nbclnbc peacocklpeacock rcfb made rcfb please keep trash talk civil report comments violate lets talk,['rcfb'],"['michigan', 'waynestatemi']",count two touchdowns since times
172iula,k3xfwlr,minnesota 730,location huntington bank time 730 watch tv nbclnbc peacocklpeacock rcfb made rcfb please keep trash talk civil report comments violate lets talk,['rcfb'],"['michigan', 'waynestatemi']",fuck pj moving damn ball change
18yekk4,kgbe7hs,cfp national championship pres att matchup preview 2 washington huskies 1 wolverines,2 1 monday january 8 0730 eastern nrg houston watch espnlespn odds 45 pts total points 555 alltime series met 13 times since 09261953 teams last met 845 days 2 years ago 09112021 series wins 508 longest streak continuous meetings 2 20012002 last 2 meetings 20022021 series last 5 meetings arbor mi1031 arbor mi2931 wa2318 ca3138rose bowl ca3414rose bowl series comparison data via week 16 130100result 1boise 8672w 5619ecufecu 21017w 303 2tulsaftulsa 4826w 4310unlvfunlv 9563w 357 3michigan 4827w 417bowling 7653w 316 6745w 7636w 317 10372w 5736w 457 6736w 5210 7oregonforegon8 11282w 3918w 527 8arizona 3927w 157michigan 4827w 490 3927w 4233byena 10uscfusc 8554w 4836w 4113 11utahfutah 8554w 3528penn 10272w 2415 12oregon 8554w 7545w 3124 13washington 5727w 2421ohio 11281w 3024 11282w 3431iowafiowa19 10373w 260 15byenabyena 16byenabyena rankings reflect current rcfb injury report data scraped 20240103 200010 dillon johnsonrbprob mon lower bodytue jan 2johnson nursing lowerbody ailment projected face national championship sam adams iirbques mon undisclosedtue jan 2adams dealing unspecified injury unclear suit national championship gaard memmelaarolout season undisclosedtue aug 22memmelar idle unspecified ailment shut 2023 season cameron davisrbout season lower bodytue aug 22davis miss entire 2023 season lowerbody injury injury data lifted injury report data scraped 20240103 200010 logan forbeswrout indefinitely undisclosedmon jan 1forbes away team due undivulged reasons without definitive timetable recovery cj stokesrbout indefinitely undisclosedmon jan 1stokes idle undefined injury timetable return davis warrenqbout indefinitely undisclosedmon jan 1warren sidelined unspecified ailment team officials yet provide exact return date karmello englishwrout indefinitely undisclosedmon jan 1english commission due unlisted issue timetable return zak zinterolout season legmon jan 1zinter miss rest season undergoing surgery repair fractured tibia fibula injury data lifted keys think wins think favorite cover spread players interested watch lets talk vote matchup win poll simply include name team think win enclosed part top level comment discussing matchup change vote edit initial comment bracket team change vote often like posted full listing accepted fbs team aliases found fcs teams need use full name appears post title listing links live vote totals matchup preview threads current week found like format generate matchup discussion matchup discussion please dm udupreesdiamond regarding template,"['missouri', 'illinois']","['michigan', 'waynestatemi']",teams largely underrated year washingtons offense definitely toughest well faced year feel sidebyside michigans offense good enough grind win trust defense enough keep score manageable
16kk406,k0ws3s7,bowling green 730,bowling green location time 730 watch tv big ten networklbtn rcfb made rcfb please keep trash talk civil report comments violate lets talk,['rcfb'],"['michigan', 'waynestatemi']",oh johnson still due injury exactly like said earlier season everyone told tentative would back 2
