post_id,comment_id,post_title,post_selftext,post_author_flairs,comment_author_flairs,comment_body
16kgis7,k0wff5j,washington 500,location spartan time 500 watch tv peacocklpeacock odds spread wash 115 overunder na rcfb made rcfb please keep trash talk civil report comments violate lets talk,['rcfb'],"['michigan', 'waynestatemi']",refs trying hard keep becoming snooze fest
183mtar,kapu9kn,ohio 1200,ohio location time 1200 watch tv foxlfox rcfb made rcfb please keep trash talk civil report comments violate lets talk,['rcfb'],"['michigan', 'waynestatemi']",hope everyone lead suits sure going radioactive toxic chernobyl
183mtar,kapuyob,ohio 1200,ohio location time 1200 watch tv foxlfox rcfb made rcfb please keep trash talk civil report comments violate lets talk,['rcfb'],"['ohiostate2', 'waynestatemi']",damn day hopefully lou holtz 1000 mile radius
183mtar,kapvjz8,ohio 1200,ohio location time 1200 watch tv foxlfox rcfb made rcfb please keep trash talk civil report comments violate lets talk,['rcfb'],"['michigan2', 'waynestatemi']",two osu fans walked bar immediately got booed go blue
183mtar,kaq0xsc,ohio 1200,ohio location time 1200 watch tv foxlfox rcfb made rcfb please keep trash talk civil report comments violate lets talk,['rcfb'],"['michiganstate', 'waynestatemi']",mccord yips plenty time still pressure chucked nowhere
183mtar,kaq1sww,ohio 1200,ohio location time 1200 watch tv foxlfox rcfb made rcfb please keep trash talk civil report comments violate lets talk,['rcfb'],"['waynestatemi', 'michigan']",anyone ever terrified ryan day currently
183mtar,kaq5x58,ohio 1200,ohio location time 1200 watch tv foxlfox rcfb made rcfb please keep trash talk civil report comments violate lets talk,['rcfb'],"['ohiostate2', 'waynestatemi']",refs im surprise didnt call safety
183mtar,kaqhvzu,ohio 1200,ohio location time 1200 watch tv foxlfox rcfb made rcfb please keep trash talk civil report comments violate lets talk,['rcfb'],"['ohiostate2', 'waynestatemi']",teams physically beating shit
183mtar,kaqkfx3,ohio 1200,ohio location time 1200 watch tv foxlfox rcfb made rcfb please keep trash talk civil report comments violate lets talk,['rcfb'],"['waynestatemi', 'michigan']",egbuka looked good year curious draft lions probably wouldnt wr anyway wondering since hear marv
183mtar,kaqlcdn,ohio 1200,ohio location time 1200 watch tv foxlfox rcfb made rcfb please keep trash talk civil report comments violate lets talk,['rcfb'],"['michigan', 'waynestatemi']",sold hard would run fake screen go vertical would show run first
183mtar,kaqlcx9,ohio 1200,ohio location time 1200 watch tv foxlfox rcfb made rcfb please keep trash talk civil report comments violate lets talk,['rcfb'],"['waynestatemi', 'michigan']",running screen nobody block db dumb lol
183mtar,kaqn7g2,ohio 1200,ohio location time 1200 watch tv foxlfox rcfb made rcfb please keep trash talk civil report comments violate lets talk,['rcfb'],"['michigan2', 'waynestatemi']",cant win goals need td
183mtar,kaqrtbm,ohio 1200,ohio location time 1200 watch tv foxlfox rcfb made rcfb please keep trash talk civil report comments violate lets talk,['rcfb'],"['michigan', 'waynestatemi']",take hate toxicity great props ohio
183mtar,kaqrw2h,ohio 1200,ohio location time 1200 watch tv foxlfox rcfb made rcfb please keep trash talk civil report comments violate lets talk,['rcfb'],"['michigan', 'waynestatemi']",plus reason cheated
183mtar,kaqryqj,ohio 1200,ohio location time 1200 watch tv foxlfox rcfb made rcfb please keep trash talk civil report comments violate lets talk,['rcfb'],"['michigan', 'waynestatemi']",haha hope jj comes back underrate ohio whats excuse
183mtar,kaqsxq0,ohio 1200,ohio location time 1200 watch tv foxlfox rcfb made rcfb please keep trash talk civil report comments violate lets talk,['rcfb'],"['michigan2', 'waynestatemi']",gg buckeyes one best renditions time
183mtar,kaqt4sf,ohio 1200,ohio location time 1200 watch tv foxlfox rcfb made rcfb please keep trash talk civil report comments violate lets talk,['rcfb'],"['michigan', 'waynestatemi']",team come long way since beat notre dame 4514 2019 considered harbaughs greatest win pre 2021
17xw6oo,k9qb3x7,colorado washington 1030,washington location washington gesa time 1030 watch tv fox sports 1lfs1 rcfb made rcfb please keep trash talk civil report comments violate lets talk,['rcfb'],"['waynestatemi', 'oregon']",hall dancing top shedur crowd chants overrated happening travis hunter table slammed wazzu player im going miss pac12
16qbmz1,k1wq9se,colorado 330,location oregonforegon autzen time 330 watch tv abclabc rcfb made rcfb please keep trash talk civil report comments violate lets talk,['rcfb'],"['michigan', 'waynestatemi']",deion hate honestly incredible man took 111 team used transfer portal turn program completely around everyone types games time time especially rebuild im shocked getting blown result doesnt make deion automatic fail coach
16qbmz1,k1x2bpb,colorado 330,location oregonforegon autzen time 330 watch tv abclabc rcfb made rcfb please keep trash talk civil report comments violate lets talk,['rcfb'],"['michigan', 'waynestatemi']",fucking celebrity endorsements dont win games jesus christ espn cannot get cu throats
18ulfw9,kflvo5b,music city bowl maryland auburn 200,location nissan time 200 watch tv abclabc espnlespn odds spread aub 45 overunder 475 rcfb made rcfb please keep trash talk civil report comments violate lets talk,['rcfb'],"['michigan', 'waynestatemi']",man weird season maryland 50 open season september fall 54 look like bowl might happen october go tear november nearly beat destroying auburn bowl wtf wrong october maryland
18vzm3k,kfunrxf,reliaquest bowl lsu wisconsin 1200,lsuflsulsu location raymond james time 1200 watch tv espn2lespn2 odds spread lsu 85 overunder 575 rcfb made rcfb please keep trash talk civil report comments violate lets talk,['rcfb'],"['waynestatemi', 'bigten']",glad dont listen bs espn anymore one gives shit usflxfl
18vzm3k,kfvliar,reliaquest bowl lsu wisconsin 1200,lsuflsulsu location raymond james time 1200 watch tv espn2lespn2 odds spread lsu 85 overunder 575 rcfb made rcfb please keep trash talk civil report comments violate lets talk,['rcfb'],"['waynestatemi', 'bigten']",companies think musical style commercial good marketing strategy
15u6nal,jwobnzy,nothing say would ever change opinion cfb opinion,opinion ironclad immovable collaboration worlds top minds say otherwise couldnt get move opinion god could appear irrefutable evidence stating otherwise still wouldnt change opinion,['georgia'],"['michigan', 'waynestatemi']",im huge fan nebraska would smoked us 1997
16a716p,jz6olzl,clemson duke 800,dukefdukeduke location dukefduke wallace wade time 800 watch tv espnlespn odds spread clem 13 overunder 555 rcfb made rcfb please keep trash talk civil report comments violate lets talk,"['stanford', 'presscorps']","['michigan', 'waynestatemi']",nonnative living upstate scthis fucking amazing cant wait get good giggle every fucking paw sticker every car around tomorrow
16a716p,jz6oued,clemson duke 800,dukefdukeduke location dukefduke wallace wade time 800 watch tv espnlespn odds spread clem 13 overunder 555 rcfb made rcfb please keep trash talk civil report comments violate lets talk,"['stanford', 'presscorps']","['michigan', 'waynestatemi']",duke wants ball let clemson get red zone
16a716p,jz6pee9,clemson duke 800,dukefdukeduke location dukefduke wallace wade time 800 watch tv espnlespn odds spread clem 13 overunder 555 rcfb made rcfb please keep trash talk civil report comments violate lets talk,"['stanford', 'presscorps']","['michigan', 'waynestatemi']",clemson looks really really bad dont think team makes bowl play like season
16keh8t,k0w0m22,usf 330,usffusfusf location usffusf raymond james time 330 watch tv abclabc rcfb made rcfb please keep trash talk civil report comments violate lets talk,['rcfb'],"['michigan', 'waynestatemi']",good teams college year
16keh8t,k0wovyv,usf 330,usffusfusf location usffusf raymond james time 330 watch tv abclabc rcfb made rcfb please keep trash talk civil report comments violate lets talk,['rcfb'],"['ohiostate', 'waynestatemi']",bama actually drop rankings tough usf team theyll beat
17e5lz6,k61ow1n,anyone ever torpedoed program like mel tucker,think paid someone purposely ruin program wouldve hard time getting suck bad short period time preached accountability ball security proceeded approximately 12000 turnovers first never fired worst fucking coordinators world ever seen course idea develop talent would able judge anybody elses also sounded like traumatic brain injury survivor front microphone say traumatic brain injury survivor fact scrambled partially nonexistent right frontal lobe put together sentences way better numb nuts thank god narcissistic masturbation complex blank slate starting instead deal bullshit next year go green unless mel tucker wearing green fuck,['michiganstate'],"['michigan', 'waynestatemi']",chris ash tried far damage rutgers tucker msu msu needs coach rally team develop young team talent work accomplish 66 least rutgers stuck 111 season hell ash even went 078 span 5 years
177vtsq,k4wlrxi,washington 330,location husky time 330 watch tv abclabc odds spread wash 3 overunder 670 rcfb made rcfb please keep trash talk civil report comments violate lets talk,['rcfb'],"['michigan', 'waynestatemi']",sneak 2nd hated play calls
177vtsq,k4wyg9k,washington 330,location husky time 330 watch tv abclabc odds spread wash 3 overunder 670 rcfb made rcfb please keep trash talk civil report comments violate lets talk,['rcfb'],"['michigan', 'waynestatemi']",great questionable coaching taking couple goals especially one halftime also wtf prevent defense washington end thought sure going ot
17nxe0b,k7ux98p,purdue 730,location time 730 watch tv nbclnbc rcfb made rcfb please keep trash talk civil report comments violate lets talk,['rcfb'],"['michigan', 'waynestatemi']",man signs would scored first 10 seconds instead beat osu 2 tds instead 3
17nxe0b,k7v0w19,purdue 730,location time 730 watch tv nbclnbc rcfb made rcfb please keep trash talk civil report comments violate lets talk,['rcfb'],"['michigan2', 'waynestatemi']",damn mustve signs else would guessed theyd run 3rd 1 stuffed
17nxe0b,k7v4isq,purdue 730,location time 730 watch tv nbclnbc rcfb made rcfb please keep trash talk civil report comments violate lets talk,['rcfb'],"['michigan', 'waynestatemi']",might one worst penalty calls ive ever seen
17nxe0b,k7v7iqz,purdue 730,location time 730 watch tv nbclnbc rcfb made rcfb please keep trash talk civil report comments violate lets talk,['rcfb'],"['michigan2', 'waynestatemi']",something discover commercial bothers think cuz us rarely see little card scanners diners like
17nxe0b,k7v7s9p,purdue 730,location time 730 watch tv nbclnbc rcfb made rcfb please keep trash talk civil report comments violate lets talk,['rcfb'],"['michigan2', 'waynestatemi']",jj youre gonna gunning balls gotta accurate
17nxe0b,k7v8fao,purdue 730,location time 730 watch tv nbclnbc rcfb made rcfb please keep trash talk civil report comments violate lets talk,['rcfb'],"['michigan2', 'waynestatemi']",oh might 206 half instead 203
17nxe0b,k7v961s,purdue 730,location time 730 watch tv nbclnbc rcfb made rcfb please keep trash talk civil report comments violate lets talk,['rcfb'],"['michigan2', 'waynestatemi']",mean come purdue gotta go 203 206 morale standpoint means nothing
17nxe0b,k7vbq2z,purdue 730,location time 730 watch tv nbclnbc rcfb made rcfb please keep trash talk civil report comments violate lets talk,['rcfb'],"['michigan', 'waynestatemi']",ryan day goes ethnic restaurant orders chicken strip basket
17nxe0b,k7vd9em,purdue 730,location time 730 watch tv nbclnbc rcfb made rcfb please keep trash talk civil report comments violate lets talk,['rcfb'],"['michigan2', 'waynestatemi']",jj making catches difficult
17nxe0b,k7vf9ai,purdue 730,location time 730 watch tv nbclnbc rcfb made rcfb please keep trash talk civil report comments violate lets talk,['rcfb'],"['michigan2', 'waynestatemi']",im bored go also jj missing left day today
17nxe0b,k7vg2xa,purdue 730,location time 730 watch tv nbclnbc rcfb made rcfb please keep trash talk civil report comments violate lets talk,['rcfb'],"['michigan2', 'waynestatemi']",nfl teams cant expect caleb williams scramble like right right
17nxe0b,k7vggul,purdue 730,location time 730 watch tv nbclnbc rcfb made rcfb please keep trash talk civil report comments violate lets talk,['rcfb'],"['michigan2', 'waynestatemi']",commentators tried make completion way exciting
17nxe0b,k7vjccx,purdue 730,location time 730 watch tv nbclnbc rcfb made rcfb please keep trash talk civil report comments violate lets talk,['rcfb'],"['michigan2', 'waynestatemi']",ok since brian kelly went lsu consider lsu southern notre dame good notre dame
17nxe0b,k7vjnyt,purdue 730,location time 730 watch tv nbclnbc rcfb made rcfb please keep trash talk civil report comments violate lets talk,['rcfb'],"['michigan', 'waynestatemi']",ryan day likes song used university michigans promotional ad
17nxe0b,k7vkau3,purdue 730,location time 730 watch tv nbclnbc rcfb made rcfb please keep trash talk civil report comments violate lets talk,['rcfb'],"['michigan2', 'waynestatemi']",still starters 11 minutes 4th bottom dweller ohio pathetic
17nxe0b,k7vmilk,purdue 730,location time 730 watch tv nbclnbc rcfb made rcfb please keep trash talk civil report comments violate lets talk,['rcfb'],"['michigan', 'waynestatemi']",dominant team college year theyre dominant team cfb year one dominant teams history sport cope
16wkoxx,k2ydx73,west virginia tcu 800,west virginia tcuftcutcu location tcuftcu amon g carter time 800 watch tv espn2lespn2 rcfb made rcfb please keep trash talk civil report comments violate lets talk,['rcfb'],"['michigan', 'waynestatemi']",wow way put kick team shit position coach
15vykps,jwzndlu,team want team play never seem play,auburn florida ole miss tennessee baylor,['ohiostate3'],"['michigan', 'waynestatemi']",nd protected rivalry onagainoffagain nonsense
