post_id,comment_id,post_title,post_selftext,post_author_flairs,comment_author_flairs,comment_body
16kk406,k0wud61,bowling green 730,bowling green location time 730 watch tv big ten networklbtn rcfb made rcfb please keep trash talk civil report comments violate lets talk,['rcfb'],"['michigan', 'waynestatemi']",gonna bloodbath people go
16kk406,k0ww0z4,bowling green 730,bowling green location time 730 watch tv big ten networklbtn rcfb made rcfb please keep trash talk civil report comments violate lets talk,['rcfb'],"['michigan', 'waynestatemi']",worst commercials university wtf awful song
16kk406,k0wxlec,bowling green 730,bowling green location time 730 watch tv big ten networklbtn rcfb made rcfb please keep trash talk civil report comments violate lets talk,['rcfb'],"['michigan', 'waynestatemi']",late take back september heisman human turnover machine
16kk406,k0wxwfj,bowling green 730,bowling green location time 730 watch tv big ten networklbtn rcfb made rcfb please keep trash talk civil report comments violate lets talk,['rcfb'],"['michigan', 'waynestatemi']",happened everyone saying would bloodbath
17ydyqe,k9tgb3j,ucla usc 330,uclafuclaucla uscfuscusc location uscfusc los angeles memorial coliseum time 330 watch tv abclabc odds spread usc 65 overunder 655 rcfb made rcfb please keep trash talk civil report comments violate lets talk,['rcfb'],"['michigan', 'waynestatemi']",week next week
177rgng,k4v9rtj,indiana 1200,location time 1200 watch tv foxlfox odds spread mich 335 overunder 465 rcfb made rcfb please keep trash talk civil report comments violate lets talk,['rcfb'],"['michigan', 'waynestatemi']",eh mccarthy kind sold def cant tbat
17sxef4,k8t2f4d,penn 1200,penn location penn statefpennstate beaver time 1200 watch tv foxlfox rcfb made rcfb please keep trash talk civil report comments violate lets talk,['rcfb'],"['waynestatemi', 'michigan']",hilarious theres ohio flairs penn lmao respect
17sxef4,k8tbeck,penn 1200,penn location penn statefpennstate beaver time 1200 watch tv foxlfox rcfb made rcfb please keep trash talk civil report comments violate lets talk,['rcfb'],"['michigan', 'waynestatemi']",james franklins favorite song university ad music
17sxef4,k8tcjkq,penn 1200,penn location penn statefpennstate beaver time 1200 watch tv foxlfox rcfb made rcfb please keep trash talk civil report comments violate lets talk,['rcfb'],"['michigan', 'waynestatemi']",looks like stole penn states sign dont tackle donovan edwards
17sxef4,k8tjj2w,penn 1200,penn location penn statefpennstate beaver time 1200 watch tv foxlfox rcfb made rcfb please keep trash talk civil report comments violate lets talk,['rcfb'],"['michigan', 'waynestatemi']",see stole fumble ball right sign
17sxef4,k8tjvmv,penn 1200,penn location penn statefpennstate beaver time 1200 watch tv foxlfox rcfb made rcfb please keep trash talk civil report comments violate lets talk,['rcfb'],"['michigan2', 'waynestatemi']",respect penn best service academy interpretation veterans day running wishbone qb run qb run
17sxef4,k8tsdo1,penn 1200,penn location penn statefpennstate beaver time 1200 watch tv foxlfox rcfb made rcfb please keep trash talk civil report comments violate lets talk,['rcfb'],"['michigan', 'waynestatemi']",big ten punish us brian ferentz call plays
17sxef4,k8ttzb6,penn 1200,penn location penn statefpennstate beaver time 1200 watch tv foxlfox rcfb made rcfb please keep trash talk civil report comments violate lets talk,['rcfb'],"['michigan', 'waynestatemi']",timeout corum run middle ok
17sxef4,k8twlbr,penn 1200,penn location penn statefpennstate beaver time 1200 watch tv foxlfox rcfb made rcfb please keep trash talk civil report comments violate lets talk,['rcfb'],"['michigan', 'waynestatemi']",much player safety refs try fix pettit corrupt fucker
17t6f87,k8vo8df,ole miss 700,ole missfolemissole miss location georgiafgeorgia sanford time 700 watch tv espnlespn odds spread uga 115 overunder 585 rcfb made rcfb please keep trash talk civil report comments violate lets talk,['rcfb'],"['michigan', 'waynestatemi']",needs 12 team playoff watch one real life stretch quarter final showdowns sec title pac 12 title
177dn6h,k4su5gz,stanford colorado 1000,location folsom time 1000 watch tv espnlespn odds spread colo 115 overunder 590 rcfb made rcfb please keep trash talk civil report comments violate lets talk,['rcfb'],"['michiganstate', 'waynestatemi']",damn glad theres someone else getting embarrassed get beat rutgers tomorrow
16qbn6k,k1wgo3y,maryland 330,location spartan time 330 watch tv rcfb made rcfb please keep trash talk civil report comments violate lets talk,['rcfb'],"['michigan', 'waynestatemi']",even trolling im starting doubt msu wins another nebraska indiana 2 could see possibility happening current
189ma0p,kbt1w78,phalen right answer cfp 1 2 washington 3 fsu 4 5 6 7 ohio 8 sorry sec losses matter,nan,[],"['michigan', 'waynestatemi']",cant keep fsu lost qb gonna pretend ohio didnt win inaugural college playoff thirdstring qb granted cardale jones played lights big ten championship year still body work small enough voters could left wouldnt right
189go15,kbr8vqs,800,iowafiowaiowa location lucas oil time 800 watch tv foxlfox odds spread mich 22 overunder 345 rcfb made rcfb please keep trash talk civil report comments violate lets talk,['rcfb'],"['michigan2', 'waynestatemi']",bravia fox sports app available airplay
189go15,kbrbtkr,800,iowafiowaiowa location lucas oil time 800 watch tv foxlfox odds spread mich 22 overunder 345 rcfb made rcfb please keep trash talk civil report comments violate lets talk,['rcfb'],"['michigan', 'waynestatemi']",head ref jeff servinski used ref high school basketball games kind cool see reffing
189go15,kbrulo8,800,iowafiowaiowa location lucas oil time 800 watch tv foxlfox odds spread mich 22 overunder 345 rcfb made rcfb please keep trash talk civil report comments violate lets talk,['rcfb'],"['michigan2', 'waynestatemi']",wow um fsu got turnovers time
189go15,kbrywvr,800,iowafiowaiowa location lucas oil time 800 watch tv foxlfox odds spread mich 22 overunder 345 rcfb made rcfb please keep trash talk civil report comments violate lets talk,['rcfb'],"['michigan2', 'waynestatemi']",gg hawkeye bros happy guys getting new oc
193kpui,kh9vd26,chris low clowespn x nick saban retiring sources tell espn six national titles,nan,"['rutgers', 'oregon']","['michigan', 'waynestatemi']",manifesto pushed greatest dynasty cfb ot rose bowl thoroughly crushed connor stallions isnt one wanted defeat evil empire rather one deserved
193kpui,khalobp,chris low clowespn x nick saban retiring sources tell espn six national titles,nan,"['rutgers', 'oregon']","['michigan', 'waynestatemi']",dabo sweeny listplayed bama rose clemson poweror think doesnt
1659z6r,jydkarw,whats hardest hit youve ever seen person,title says whats hardest hit youve ever seen person includes dirty hits targeting ejections ill start baylor 2013 blackout thursday night kj morton sterling shepard,"['baylor', 'sickos']","['virginiatech', 'waynestatemi']",cant recall anything specific moment got watch kam chancellor year theres probably bomb somewhere 2009 mixtape
1684osx,jytq5b4,colorado tcu 1200,tcuftcutcu location tcuftcu amon g carter time 1200 watch tv foxlfox odds spread tcu 205 overunder 645 rcfb made rcfb please keep trash talk civil report comments violate lets talk,"['texasam', 'ucla']","['michiganstate', 'waynestatemi']",let record show ive always coach prime cu making bowl year
18w0xqp,kfvd0i1,fiesta bowl liberty 100,location farm time 100 watch tv espnlespn odds spread ore 18 overunder 685 rcfb made rcfb please keep trash talk civil report comments violate lets talk,['rcfb'],"['waynestatemi', 'oregon']",mean yeah incomplete liberty really dont care bad calls
18jsz2a,kdmrgim,ohio southern 1100,ohiofohioohio southern location brooks sc time 1100 watch tv espnlespn espnlespn odds spread gaso 35 overunder 485 rcfb made rcfb please keep trash talk civil report comments violate lets talk,['rcfb'],"['waynestatemi', 'bigten']",need ohio 15 isnt going hit
17mz4ce,k7puuor,media gathering evidence private investigators links osu jim harbaugh extension,nan,"['michigan', 'westernmichigan']","['virginiatech', 'waynestatemi']",literally every single thing saga stupid im tired readinghearing yet still cant look away
191n0mf,kgwmg6f,washington fans tonights mean,1 team since born ive app loss rich rod hoke trouble snap losses ohio dad difficult relationship one thing always ever since could remember passed 2020 wish couldve last years know tonights wouldve meant world um uw fans new old national championship appearance mean,"['michigan', 'westernmichigan']","['michigan', 'waynestatemi']",life ive fandom towards um wasnt went um really became fan senior year college 2006 campus working night osuum 12 bo schembechler died almost heartbreak since became fan didnt actually go graduated first attended person app second went toledo following year watching um next 15 years heartbreak heartbreak losing ugly osu 2007 devin gardner coming short upset trouble snap jt barrett 4th getting torched osu msu repeatedly honestly felt like never going win meaningful ever mention basketball team coming short title twice hockey team coming short finals minnesotaduluth shawn hunwicks birthday hard insane doomer lot bad luck heartbreak weve hoping end tonight fingers crossed
18ekefp,kcodzgv,navy army 300,navyfnavynavy armyfarmyarmy location gillette time 300 watch tv cbslcbs odds spread army 3 overunder 275 rcfb made rcfb please keep trash talk civil report comments violate lets talk,['rcfb'],"['michigan', 'waynestatemi']",army navy still make bowl depending wins right
188qre7,kbmjv5h,washington 800,location allegiant time 800 watch tv abclabc odds spread ore 95 overunder 655 rcfb made rcfb please keep trash talk civil report comments violate lets talk,['rcfb'],"['michigan', 'waynestatemi']",8 mean 8 oclock kick 820 bullshit
188qre7,kbmko8t,washington 800,location allegiant time 800 watch tv abclabc odds spread ore 95 overunder 655 rcfb made rcfb please keep trash talk civil report comments violate lets talk,['rcfb'],"['michigan2', 'waynestatemi']",ik play games undeafeated teams playing conference championship games weekend little gain actually playing like washington florida say covid outbreak would 100 make playoff risk injury
188qre7,kbmlpgf,washington 800,location allegiant time 800 watch tv abclabc odds spread ore 95 overunder 655 rcfb made rcfb please keep trash talk civil report comments violate lets talk,['rcfb'],"['michigan', 'waynestatemi']",ticker least limited one type space
188qre7,kbmm78j,washington 800,location allegiant time 800 watch tv abclabc odds spread ore 95 overunder 655 rcfb made rcfb please keep trash talk civil report comments violate lets talk,['rcfb'],"['michigan2', 'waynestatemi']",alright pac 12 bros without looking imma try pac 12 teams grass fields ucla usc stanford asu colorado wanna say wsu get
188qre7,kbmrhgj,washington 800,location allegiant time 800 watch tv abclabc odds spread ore 95 overunder 655 rcfb made rcfb please keep trash talk civil report comments violate lets talk,['rcfb'],"['michigan2', 'waynestatemi']",maybe gave offensive magic weekend gave offensive anemia
188qre7,kbn3d3d,washington 800,location allegiant time 800 watch tv abclabc odds spread ore 95 overunder 655 rcfb made rcfb please keep trash talk civil report comments violate lets talk,['rcfb'],"['michigan', 'waynestatemi']",wash needs slow drive pound rock
188qre7,kbn8h0m,washington 800,location allegiant time 800 watch tv abclabc odds spread ore 95 overunder 655 rcfb made rcfb please keep trash talk civil report comments violate lets talk,['rcfb'],"['michigan', 'waynestatemi']",probably worst prevent defense ever seen
188qre7,kbna99n,washington 800,location allegiant time 800 watch tv abclabc odds spread ore 95 overunder 655 rcfb made rcfb please keep trash talk civil report comments violate lets talk,['rcfb'],"['michigan2', 'waynestatemi']",ill miss pac12 hell go ggs
172755e,k3v27k8,whats yalls favorite rivalry doesnt involve school,every year tune red river rivalry matter great years rendition feels special two teams leaving sec every play matters exciting matchup two college footballs premier programs hands favorite rivalry involve uga also enjoy iron bowl civil war yall,['rcfb'],"['michigan', 'waynestatemi']",probably ndusc theres something special original rivalry
191zla4,kgzjgng,cfp final washington 730,location nrg time 730 watch tv espnlespn odds spread mich 55 overunder 555 rcfb made rcfb please keep trash talk civil report comments violate lets talk,['rcfb'],"['michigan4', 'waynestatemi']",osu board nothing hate much wanted get blown theyll boards talking much better played
191zla4,kgzltxu,cfp final washington 730,location nrg time 730 watch tv espnlespn odds spread mich 55 overunder 555 rcfb made rcfb please keep trash talk civil report comments violate lets talk,['rcfb'],"['michiganstate', 'waynestatemi']",crowd absolutely lifeless sides given stakes
191zla4,kgzmrvs,cfp final washington 730,location nrg time 730 watch tv espnlespn odds spread mich 55 overunder 555 rcfb made rcfb please keep trash talk civil report comments violate lets talk,['rcfb'],"['ohiostate2', 'waynestatemi']",washington hasnt lit bad since war 1812
191zla4,kgzztyi,cfp final washington 730,location nrg time 730 watch tv espnlespn odds spread mich 55 overunder 555 rcfb made rcfb please keep trash talk civil report comments violate lets talk,['rcfb'],"['michigan', 'waynestatemi']",arent throwing ball theyre crowding line scrimmage
191zla4,kh020yo,cfp final washington 730,location nrg time 730 watch tv espnlespn odds spread mich 55 overunder 555 rcfb made rcfb please keep trash talk civil report comments violate lets talk,['rcfb'],"['waynestatemi', 'bigten']",millionth time hear jj touching goal post enough already
191zla4,kh02kkx,cfp final washington 730,location nrg time 730 watch tv espnlespn odds spread mich 55 overunder 555 rcfb made rcfb please keep trash talk civil report comments violate lets talk,['rcfb'],"['michigan', 'waynestatemi']",really enjoying fact washington full embraced b1g style
191zla4,kh05hkm,cfp final washington 730,location nrg time 730 watch tv espnlespn odds spread mich 55 overunder 555 rcfb made rcfb please keep trash talk civil report comments violate lets talk,['rcfb'],"['michigan', 'waynestatemi']",real question many tds would beaten either teams
191zla4,kh05mu0,cfp final washington 730,location nrg time 730 watch tv espnlespn odds spread mich 55 overunder 555 rcfb made rcfb please keep trash talk civil report comments violate lets talk,['rcfb'],"['michigan2', 'waynestatemi']",like graham coated bacon grease something cant get touched
191zla4,kh0606r,cfp final washington 730,location nrg time 730 watch tv espnlespn odds spread mich 55 overunder 555 rcfb made rcfb please keep trash talk civil report comments violate lets talk,['rcfb'],"['michigan2', 'waynestatemi']",reason penix alive right hold 73
191zla4,kh07cji,cfp final washington 730,location nrg time 730 watch tv espnlespn odds spread mich 55 overunder 555 rcfb made rcfb please keep trash talk civil report comments violate lets talk,['rcfb'],"['michigan', 'waynestatemi']",wow clear targeting black cloud hanging refs
191zla4,kh08hdy,cfp final washington 730,location nrg time 730 watch tv espnlespn odds spread mich 55 overunder 555 rcfb made rcfb please keep trash talk civil report comments violate lets talk,['rcfb'],"['michigan2', 'waynestatemi']",gg huskies see months excited b1g
17y9i5h,k9s0vkk,maryland 1200,location secu time 1200 watch tv foxlfox odds spread mich 205 overunder 505 rcfb made rcfb please keep trash talk civil report comments violate lets talk,['rcfb'],"['michigan2', 'waynestatemi']",lets see nearly twoyearold toddler agree go nap kickoff wonder vegas say
17y9i5h,k9scfdv,maryland 1200,location secu time 1200 watch tv foxlfox odds spread mich 205 overunder 505 rcfb made rcfb please keep trash talk civil report comments violate lets talk,['rcfb'],"['michigan', 'waynestatemi']",thats good play yeah letter law targeting defender realistically supposed
17y9i5h,k9slsph,maryland 1200,location secu time 1200 watch tv foxlfox odds spread mich 205 overunder 505 rcfb made rcfb please keep trash talk civil report comments violate lets talk,['rcfb'],"['michigan2', 'waynestatemi']",dont get downvoted earlier saying jj forces stuff much
17y9i5h,k9ssbv2,maryland 1200,location secu time 1200 watch tv foxlfox odds spread mich 205 overunder 505 rcfb made rcfb please keep trash talk civil report comments violate lets talk,['rcfb'],"['michigan2', 'waynestatemi']",secondary next year gonna bad mikey johnson gone
17y9i5h,k9ssvqw,maryland 1200,location secu time 1200 watch tv foxlfox odds spread mich 205 overunder 505 rcfb made rcfb please keep trash talk civil report comments violate lets talk,['rcfb'],"['michigan2', 'waynestatemi']",damn gust wind brought edwards run
17y9i5h,k9st3r2,maryland 1200,location secu time 1200 watch tv foxlfox odds spread mich 205 overunder 505 rcfb made rcfb please keep trash talk civil report comments violate lets talk,['rcfb'],"['michigan2', 'waynestatemi']",route combo 33 run fucking slants crosses
17y9i5h,k9stop3,maryland 1200,location secu time 1200 watch tv foxlfox odds spread mich 205 overunder 505 rcfb made rcfb please keep trash talk civil report comments violate lets talk,['rcfb'],"['michigan', 'waynestatemi']",really hoping would salted away could get back moving stuff new house
17y9i5h,k9swbjq,maryland 1200,location secu time 1200 watch tv foxlfox odds spread mich 205 overunder 505 rcfb made rcfb please keep trash talk civil report comments violate lets talk,['rcfb'],"['michigan2', 'waynestatemi']",also big fuck fox 12 oclock games halfway 4th havent even started 4th yet
17y9i5h,k9sx86r,maryland 1200,location secu time 1200 watch tv foxlfox odds spread mich 205 overunder 505 rcfb made rcfb please keep trash talk civil report comments violate lets talk,['rcfb'],"['michigan2', 'waynestatemi']",lets take bets fox still go commercial punt say yes
17y9i5h,k9syhhz,maryland 1200,location secu time 1200 watch tv foxlfox odds spread mich 205 overunder 505 rcfb made rcfb please keep trash talk civil report comments violate lets talk,['rcfb'],"['michigan', 'waynestatemi']",fox evil network already another commercial break
17y9i5h,k9t0cuq,maryland 1200,location secu time 1200 watch tv foxlfox odds spread mich 205 overunder 505 rcfb made rcfb please keep trash talk civil report comments violate lets talk,['rcfb'],"['ohiostate2', 'waynestatemi']",yup id like see punter suspended next week prove hes definitely cheating take word
17y9i5h,k9t0jcb,maryland 1200,location secu time 1200 watch tv foxlfox odds spread mich 205 overunder 505 rcfb made rcfb please keep trash talk civil report comments violate lets talk,['rcfb'],"['michigan2', 'waynestatemi']",jj midcarthy guy guns passes disappointing hes back old bad habit
17y9i5h,k9t0qlj,maryland 1200,location secu time 1200 watch tv foxlfox odds spread mich 205 overunder 505 rcfb made rcfb please keep trash talk civil report comments violate lets talk,['rcfb'],"['michigan', 'waynestatemi']",play calling conservative today geared towards pounding middle 20172019 playcalling complete inability move ball unless broken play
17y9i5h,k9t1ki5,maryland 1200,location secu time 1200 watch tv foxlfox odds spread mich 205 overunder 505 rcfb made rcfb please keep trash talk civil report comments violate lets talk,['rcfb'],"['michigan', 'waynestatemi']",even chance put away offensive playcalling put together
17latt0,k7d8dp9,surveyed 50 fbs coaches asked assess seriousness michigans alleged actions rates wide spectrum dubious behavior sport view wolverines recent success much,1how serious almost half coaches surveyed 46 percent rated 5 average score among 50 coaches 42 two ranked 3 easy call plays know defense said pac12 head coach huge deal someone went another filmed signals thats spygate stuff flying around country crazy 2 punished complicated question easy answer coaches ninetyfour percent believe punished theres proof offcampus opponent scouting steal signals agreed serious integrity issue big ten struggled determining fitting punishment given lack recent precedent think fired stuff one group 5 head coach said stuff like violate ethics sportsmanship thats horrible 3 jim harbaugh plausible deniability day big ten confirmed ncaa investigation underway harbaugh issued statement pledging full cooperation denied knowledge illegal signal stealing denied directing anyone engage offcampus scouting coaching peers buying seventy percent coaches surveyed among 13 head coaches polled eight believe harbaugh plausible deniability staffer whose official role working recruiting department involved wolverines coordinators sidelines red flag 4 michigans success since 2021 owed part illegal signal stealing seventyfour percent believe illegal signal stealing played role michigans rise one coach pointed wolverines utilizing intel turn powerhouse also enabled recruit better bluechip high school recruits transfers program atop big ten factually true look record changed since started said aac head coach hell coincidence isnt said pac12 quarterbacks coach chuckle quick summary article poll numbers want read,['ohiostate'],"['waynestatemi', 'michigan2']",ways held accountable sheer stupidity official stance matter
17latt0,k7dc2bt,surveyed 50 fbs coaches asked assess seriousness michigans alleged actions rates wide spectrum dubious behavior sport view wolverines recent success much,1how serious almost half coaches surveyed 46 percent rated 5 average score among 50 coaches 42 two ranked 3 easy call plays know defense said pac12 head coach huge deal someone went another filmed signals thats spygate stuff flying around country crazy 2 punished complicated question easy answer coaches ninetyfour percent believe punished theres proof offcampus opponent scouting steal signals agreed serious integrity issue big ten struggled determining fitting punishment given lack recent precedent think fired stuff one group 5 head coach said stuff like violate ethics sportsmanship thats horrible 3 jim harbaugh plausible deniability day big ten confirmed ncaa investigation underway harbaugh issued statement pledging full cooperation denied knowledge illegal signal stealing denied directing anyone engage offcampus scouting coaching peers buying seventy percent coaches surveyed among 13 head coaches polled eight believe harbaugh plausible deniability staffer whose official role working recruiting department involved wolverines coordinators sidelines red flag 4 michigans success since 2021 owed part illegal signal stealing seventyfour percent believe illegal signal stealing played role michigans rise one coach pointed wolverines utilizing intel turn powerhouse also enabled recruit better bluechip high school recruits transfers program atop big ten factually true look record changed since started said aac head coach hell coincidence isnt said pac12 quarterbacks coach chuckle quick summary article poll numbers want read,['ohiostate'],"['michigan', 'waynestatemi']",dont understand cant use helmet mics radio comms coaches cant try change signals suspect someone stealing signals change connor stallions idiot shouldnt using stone age level signals solution available circumvent prevent happening
16qh8h1,k1xnj68,ohio notre dame 730,ohio notre dame location notre damefnotredame notre dame time 730 watch tv nbclnbc odds spread osu 75 overunder na rcfb made rcfb please keep trash talk civil report comments violate lets talk,['rcfb'],"['michigan', 'waynestatemi']",nd nobody blame right theyve put together good drives throughout completely fall apart end buckeyes taken advantage irish miscues
16qh8h1,k1xsn6q,ohio notre dame 730,ohio notre dame location notre damefnotredame notre dame time 730 watch tv nbclnbc odds spread osu 75 overunder na rcfb made rcfb please keep trash talk civil report comments violate lets talk,['rcfb'],"['michigan', 'waynestatemi']",ok nd builds team beat osu osu builds team win national titles
16qh8h1,k1xx37j,ohio notre dame 730,ohio notre dame location notre damefnotredame notre dame time 730 watch tv nbclnbc odds spread osu 75 overunder na rcfb made rcfb please keep trash talk civil report comments violate lets talk,['rcfb'],"['michigan', 'waynestatemi']",prevent defense always comes back bite defense ass
17zp018,ka17699,worst loss teams history,watching auburn go new mexico weekend made think worse losses programs history bama fan would go loss northern illinois 2003 1916 mike shula first season sanctions mike price impropriety stripper something hotel room service poor something list cathartic,['alabama'],"['michigan', 'waynestatemi']",didnt go games time student first two games went fan app 2007 toledo 2008 oops
16kgis7,k0w46mi,washington 500,location spartan time 500 watch tv peacocklpeacock odds spread wash 115 overunder na rcfb made rcfb please keep trash talk civil report comments violate lets talk,['rcfb'],"['michigan', 'waynestatemi']",msu gotta something otherwise get hand quick
16kgis7,k0w54yk,washington 500,location spartan time 500 watch tv peacocklpeacock odds spread wash 115 overunder na rcfb made rcfb please keep trash talk civil report comments violate lets talk,['rcfb'],"['michigan', 'waynestatemi']",first review 5 yard pass penalty negated said pass incompletion 3rd tuck cummin sequence
16kgis7,k0wdkhm,washington 500,location spartan time 500 watch tv peacocklpeacock odds spread wash 115 overunder na rcfb made rcfb please keep trash talk civil report comments violate lets talk,['rcfb'],"['michigan', 'waynestatemi']",reminds penn statemaryland 2019 hyped 1 team highly ranked huge question mark penn proceeded scorch maryland offense marylands offense looked completely hopeless got hand extremely quick either way 280 second quarter bad
